"location","source","target","id","fuzzy","context","translator_comments","developer_comments"
"Scripts/Content/Story/Missions/DIA_MIL_122_Arenamaster.d:768","Malgar hält souverän den zweiten Platz. Niemand kämpft gegen den Champion, ohne ihn zu besiegen.","Malgar ocupa el segundo lugar. Nadie lucha contra el campeón sin derrotarlo.","","True","MIL_122_GLADIATOR_MALGAR_12_06","",""
"Scripts/Content/Story/Missions/DIA_MIL_122_Arenamaster.d:773","Malgar war schon immer ein fantastischer Kämfper,	heute liegt	er sogar auf Platz 1 und ist damit der neue	Champion.","Malgar siempre ha sido un guerrero fantástico. Hoy está en el primer puesto, y es el nuevo campeón.","","True","MIL_122_GLADIATOR_MALGAR_12_07","",""
"Scripts/Content/Story/Missions/DIA_MIL_122_Arenamaster.d:782","Wie bewertest du Thora?","¿Qué opinas de Thora?","","True","MIL_122_GLADIATOR_THORA_15_01","",""
"Scripts/Content/Story/Missions/DIA_MIL_122_Arenamaster.d:784","Thora ist hoffnungslos	abgesackt. Einst der Champion, ist sie heute kein Silberstück mehr wert.","Thora ha perdido la esperanza. Una vez campeona, ahora no vale ni una moneda de plata.","","True","MIL_122_GLADIATOR_THORA_12_02","",""
"Scripts/Content/Story/Missions/DIA_MIL_122_Arenamaster.d:789","Thora ist am Ende.	Wie	konnte der einstige	Champion auf den vorletzten	Platz sinken?","Thora ha acabado. ¿Cómo pudo el antiguo campeón bajar a la última posición?","","True","MIL_122_GLADIATOR_THORA_12_03","",""
"Scripts/Content/Story/Missions/DIA_MIL_122_Arenamaster.d:794","Thora ist gewaltig	abgesackt. Einst der Champion, heute nur noch Mittelmass auf Platz 4.","Thora está muy asquerosa. Antes era campeona, ahora sólo ocupa el cuarto lugar.","","True","MIL_122_GLADIATOR_THORA_12_04","",""
"Scripts/Content/Story/Missions/DIA_MIL_122_Arenamaster.d:799","Thora ist schon lange nicht mehr der Champion.	Heute liegt	sie	nur	noch auf Platz 3.","Thora ha pasado mucho tiempo sin ser campeona. Ahora solo ocupa el tercer puesto.","","True","MIL_122_GLADIATOR_THORA_12_05","",""
"Scripts/Content/Story/Missions/DIA_MIL_122_Arenamaster.d:804","Thora ist nicht mehr der Champion.	Wahrscheinlich sind	ihre grössten Tage als Gladiator gezählt.","Thora ya no es la campeona. Probablemente sus mejores días como gladiadora ya están contados.","","True","MIL_122_GLADIATOR_THORA_12_06","",""
"Scripts/Content/Story/Missions/DIA_MIL_122_Arenamaster.d:809","Thora ist und bleibt der Champion.	Ihre exotischen	Waffenkünste mit dem Kampfstab suchen ihresgleichen.","Thora es y sigue siendo la campeona. Sus artes de armas exóticas con el bastón de combate son incomparables.","","True","MIL_122_GLADIATOR_THORA_12_07","",""
"Scripts/Content/Story/Missions/DIA_MIL_122_Arenamaster.d:825","Welche	Regeln gibt	es in der Arena?","¿Qué reglas hay en la arena?","","True","MIL_122_Arenamaster_RULES.description","",""
"Scripts/Content/Story/Missions/DIA_MIL_122_Arenamaster.d:839","Welche Regeln gibt es in der Arena?","¿Qué reglas hay en la arena?","","True","MIL_122_RULES_Info_15_01","",""
"Scripts/Content/Story/Missions/DIA_MIL_122_Arenamaster.d:840","Regel Nummer 1 ...","Regla número 1...","","True","MIL_122_RULES_Info_12_02","",""
"Scripts/Content/Story/Missions/DIA_MIL_122_Arenamaster.d:841","KEIN Töten in der Arena!","¡NO hay muertos en la arena!","","True","MIL_122_RULES_Info_12_03","",""
"Scripts/Content/Story/Missions/DIA_MIL_122_Arenamaster.d:842","Umhauen	ja,	Töten nein!","¡No matar, no golpear!","","True","MIL_122_RULES_Info_12_04","",""
"Scripts/Content/Story/Missions/DIA_MIL_122_Arenamaster.d:843","Regel Nummer 2 ...","Regla número 2...","","True","MIL_122_RULES_Info_12_05","",""
"Scripts/Content/Story/Missions/DIA_MIL_122_Arenamaster.d:843","Weder Bögen, noch Armbrüste	noch Magie in der Arena!","¡Ni arcos, ni ballesta, ni magia en la arena!","","True","MIL_122_RULES_Info_12_06","",""
"Scripts/Content/Story/Missions/DIA_MIL_122_Arenamaster.d:845","Es wird	nur	mit	Nahkampfwaffen gekämpft!","¡Solo se combate con armas de combate cercano!","","True","MIL_122_RULES_Info_12_07","",""
"Scripts/Content/Story/Missions/DIA_MIL_122_Arenamaster.d:846","Regel Nummer 3 ...","Regla número 3...","","True","MIL_122_RULES_Info_12_08","",""
"Scripts/Content/Story/Missions/DIA_MIL_122_Arenamaster.d:846","Jeder behält seine eigenen Waffen! Solltest	du deinen Gegner umhauen, ist seine	Waffe tabu für dich, ist das klar!","¡Cada uno tiene sus propias armas! ¡Si golpeas a tu oponente, su arma es un tabú para ti, ¡lo sé!","","True","MIL_122_RULES_Info_12_09","",""
"Scripts/Content/Story/Missions/DIA_MIL_122_Arenamaster.d:847","Was	passiert, wenn es die Gladiatoren mit den Regeln nicht so genau	nehmen?","¿Qué ocurre si los gladiadores no siguen las reglas con tanta precisión?","","True","MIL_122_RULES_Info_15_10","",""
"Scripts/Content/Story/Missions/DIA_MIL_122_Arenamaster.d:848","Regel Nummer 4 : Wer die Regeln	verletzt, verliert den Kampf und das Preisgeld!","Regla número 4: ¡El que infringe las reglas pierde la pelea y el dinero del premio!","","True","MIL_122_RULES_Info_12_11","",""
"Scripts/Content/Story/Missions/DIA_MIL_122_Arenamaster.d:865","Wie läuft so	ein	Kampf ab?","¿Cómo va una pelea así?","","True","MIL_122_Arenamaster_FLOWCHART.description","",""
"Scripts/Content/Story/Missions/DIA_MIL_122_Arenamaster.d:879","Wie	läuft so ein Kampf ab?","¿Cómo va una pelea así?","","True","MIL_122_FLOWCHART_Info_15_01","",""
"Scripts/Content/Story/Missions/DIA_MIL_122_Arenamaster.d:879","Es wird	solange	gekämpft, bis einer	zu Boden geht!","¡Se pelea hasta que uno se cae!","","True","MIL_122_FLOWCHART_Info_12_02","",""
"Scripts/Content/Story/Missions/DIA_MIL_122_Arenamaster.d:880","Wer	den	anderen	umhaut,	gewinnt	einen Punkt.","Quien se abrace a otro obtiene un punto.","","True","MIL_122_FLOWCHART_Info_12_03","",""
"Scripts/Content/Story/Missions/DIA_MIL_122_Arenamaster.d:881","Es wird	mindestens gekämpft, bis einer 5 Punkte hat, manchmal aber	auch länger.","Se pelea hasta que uno consigue 5 puntos, a veces más.","","True","MIL_122_FLOWCHART_Info_12_04","",""
"Scripts/Content/Story/Missions/DIA_MIL_122_Arenamaster.d:883","Wovon hängt	das	ab?","¿De qué depende?","","True","MIL_122_FLOWCHART_Info_15_05","",""
"Scripts/Content/Story/Missions/DIA_MIL_122_Arenamaster.d:884","Davon, ob der Kampf	mir	gefällt	oder nicht.","De si me gusta o no la pelea.","","True","MIL_122_FLOWCHART_Info_12_06","",""
"Scripts/Content/Story/Missions/DIA_MIL_122_Arenamaster.d:885","Verstehe!","¡Ya comprendo!","","True","MIL_122_FLOWCHART_Info_15_07","",""
"Scripts/Content/Story/Missions/DIA_MIL_122_Arenamaster.d:885","Werden bis zum Ende	der	Kampfzeit keine	5 Punkte erreicht,	verlieren beide	und	ich	behalte	alle Preisgelder.","Si no consigues 5 puntos antes de que termine el tiempo de batalla, ambos perderán y me quedaré con el dinero.","","True","MIL_122_FLOWCHART_Info_12_08","",""
"Scripts/Content/Story/Missions/DIA_MIL_122_Arenamaster.d:919","DU HAST	REGEL NUMMER 3 VERLETZT.","Has violado la regla número 3.","","True","MIL_122_PLAYERCHEATED_Info_12_09","",""
"Scripts/Content/Story/Missions/DIA_MIL_122_Arenamaster.d:919","Finger weg,	von	den	Waffen der anderen Gladiatoren!","¡Aparta las manos de las armas de los demás gladiadores!","","True","MIL_122_PLAYERCHEATED_Info_12_10","",""
"Scripts/Content/Story/Missions/DIA_MIL_122_Arenamaster.d:925","DU HAST	REGEL NUMMER 2 VERLETZT.","HABES VIOLADO EL RIGLÓN NUMERO 2.","","True","MIL_122_PLAYERCHEATED_Info_12_11","",""
"Scripts/Content/Story/Missions/DIA_MIL_122_Arenamaster.d:925","Weder Fernkampfwaffen noch Magie in	der	Arena!","¡Ni armas de combate a distancia ni magia en la arena!","","True","MIL_122_PLAYERCHEATED_Info_12_12","",""
"Scripts/Content/Story/Missions/DIA_MIL_122_Arenamaster.d:931","DU HAST	REGEL NUMMER 1 VERLETZT.","HABES VIOLADO la regla número uno.","","True","MIL_122_PLAYERCHEATED_Info_12_13","",""
"Scripts/Content/Story/Missions/DIA_MIL_122_Arenamaster.d:934","Kein Töten in der Arena!","¡No hay muertos en la arena!","","True","MIL_122_PLAYERCHEATED_Info_12_14","",""
"Scripts/Content/Story/Missions/DIA_MIL_122_Arenamaster.d:934","HIERMIT	ERKLÄRE	ICH	DICH ZUM VERLIERER UND VERBANNE	DICH AUS DEN REIHEN	DER	GLADIATOREN.","AQUÍ TE EXPLARÉ YO TÚ PERDIDORES Y TE EXCLUIRÉ DE LOS RADOS DE LOS GLADIADORES.","","True","MIL_122_PLAYERCHEATED_Info_12_15","",""
"Scripts/Content/Story/Missions/DIA_MIL_122_Arenamaster.d:936","Aber...","Pero...","","True","MIL_122_PLAYERCHEATED_Info_15_16","",""
"Scripts/Content/Story/Missions/DIA_MIL_122_Arenamaster.d:937","Nichts aber! Wer bescheisst	verliert.","¡Nada! ¡Todo el que sea estúpido pierde!","","True","MIL_122_PLAYERCHEATED_Info_12_17","",""
"Scripts/Content/Story/Missions/DIA_MIL_122_Arenamaster.d:938","REGEL NUMMER 4 !!!","RIGUELA NUMERO 4!!!","","True","MIL_122_PLAYERCHEATED_Info_12_18","",""
"Scripts/Content/Story/Missions/DIA_MIL_122_Arenamaster.d:960","Ich will mein Preisgeld abzuholen!","¡Quiero recoger mi dinero!","","True","MIL_122_Arenamaster_GETPRIZE.description","",""
"Scripts/Content/Story/Missions/DIA_MIL_122_Arenamaster.d:974","Ich will	mein Preisgeld abzuholen","Quiero recoger mi dinero.","","True","MIL_122_GETPRIZE_Info_15_01","",""
"Scripts/Content/Story/Missions/DIA_MIL_122_Arenamaster.d:975","Du hast gut gekämpft!","¡Has luchado bien!","","True","MIL_122_GETPRIZE_Info_12_02","",""
"Scripts/Content/Story/Missions/DIA_MIL_122_Arenamaster.d:975","Hier	ist	dein Preisgeld.	Die	anderthalbfache	Summe, die du gesetzt hast.","Aquí tienes tu dinero. La suma que apostaste es una y media veces mayor.","","True","MIL_122_GETPRIZE_Info_12_03","",""
"Scripts/Content/Story/Missions/DIA_MIL_122_Arenamaster.d:981","Du bekommst doch	von	beiden Kämpfern	die	gleiche	Summe!","¡Todos dos guerreros te dan la misma cantidad!","","True","MIL_122_GETPRIZE_Info_15_04","",""
"Scripts/Content/Story/Missions/DIA_MIL_122_Arenamaster.d:983","Richtig!","¡Eso es cierto!","","True","MIL_122_GETPRIZE_Info_12_05","",""
"Scripts/Content/Story/Missions/DIA_MIL_122_Arenamaster.d:983","Warum bekomme ich dann nicht	den	doppelten Einsatz zurück?","Entonces, ¿por qué no me devuelves la doble apuesta?","","True","MIL_122_GETPRIZE_Info_15_06","",""
"Scripts/Content/Story/Missions/DIA_MIL_122_Arenamaster.d:984","Was glaubst du eigentlich, warum	ich	mir	hier den ganzen	Tag	die	Füsse in den Bauch stehe?","¿Por qué crees que estoy aquí todo el día con mis pies en el vientre?","","True","MIL_122_GETPRIZE_Info_12_07","",""
"Scripts/Content/Story/Missions/DIA_MIL_122_Arenamaster.d:985","Die Hälfte der Preisgelder wandert in meine Tasche. Davon muss ich auch noch	den	ganzen Arenabetrieb	hier organisieren!","La mitad del precio va a mis bolsillos. ¡También tengo que organizar todo el negocio de la arena!","","True","MIL_122_GETPRIZE_Info_12_08","",""
"Scripts/Content/Story/Missions/DIA_MIL_122_Arenamaster.d:1110","Ich habe Grim herausgefordert!","¡He desafiado a Grim!","","True","Info_Arenamaster_CHALLENGEDGRIM.description","",""
"Scripts/Content/Story/Missions/DIA_MIL_122_Arenamaster.d:1126","Ich	habe Grim herausgefordert!","¡He desafiado a Grim!","","True","Info_Arenamaster_CHALLENGEDGRIM_15_01","",""
"Scripts/Content/Story/Missions/DIA_MIL_122_Arenamaster.d:1135","OK,	wieviel	Preisgeld möchtest du setzen?","Vale, ¿cuánto dinero quieres apostar?","","True","Info_Arenamaster_CHALLENGEDGRIM_12_03","",""
"Scripts/Content/Story/Missions/DIA_MIL_122_Arenamaster.d:1578","Du kommst zu spät. Der heutige Kampf wurde bereits angesetzt. Melde dich morgen rechtzeitig, wenn du kämpfen willst.","Has llegado tarde. La pelea de hoy ya está prevista. Si quieres pelear, ve mañana a tiempo.","","True","OUMULTI_FIGHTSELECTED_12_00","",""
"Scripts/Content/Story/Missions/DIA_MIL_122_Arenamaster.d:1583","Falls es dir noch nicht aufgefallen ist, es läuft gerade ein Kampf! Komm morgen an meinem Stand vorbei!","¡Si no te has dado cuenta, hay una pelea en marcha! ¡Ven por mi puesto mañana!","","True","OUMULTI_FIGHTRUNNING_12_00","",""
"Scripts/Content/Story/Missions/DIA_MIL_122_Arenamaster.d:1592","Der heutige Kampf ist bereits gelaufen, komm morgen zu	meinem Stand!","La pelea de hoy ya ha terminado. ¡Ven a mi puesto mañana!","","True","OUMULTI_FIGHTOVER_12_00","",""
"Scripts/Content/Story/Missions/DIA_MIL_122_Arenamaster.d:1167","Gut, du trittst also heute abend gegen Grim an!","¡Bien, esta noche te enfrentarás a Grim!","","True","Info_Arenamaster_CHALLENGEDGRIM_PRIZE_12_01","",""
"Scripts/Content/Story/Missions/DIA_MIL_122_Arenamaster.d:1168","Finde	dich bei Beginn	des	Vorprogramms in	der	linken Arenakammer ein.","Cuando empiece el programa, entra en la sala de arena de la izquierda.","","True","Info_Arenamaster_CHALLENGEDGRIM_PRIZE_12_02","",""
"Scripts/Content/Story/Missions/DIA_MIL_122_Arenamaster.d:1182","Besorge dir erst	mal	ausreichend	Silber.	Ohne Preisgeld gibt	es keinen Kampf!","Primero consigue suficiente plata. ¡Sin dinero de recompensa no hay combate!","","True","Info_Arenamaster_CHALLENGEDGRIM_PRIZE_12_03","",""
"Scripts/Content/Story/Missions/DIA_MIL_122_Arenamaster.d:1216","Ich habe	Goliath	herausgefordert!","¡He desafiado a Goliat!","","True","Info_Arenamaster_CHALLENGEDGOLIATH.description","",""
"Scripts/Content/Story/Missions/DIA_MIL_122_Arenamaster.d:1232","Ich habe	Goliath	herausgefordert!","¡He desafiado a Goliat!","","True","Info_Arenamaster_CHALLENGEDGOLIATH_15_01","",""
"Scripts/Content/Story/Missions/DIA_MIL_122_Arenamaster.d:1239","Wieviel Silber möchtest du als Preisgeld	setzen?","¿Cuánto plata quieres apostar en el dinero del premio?","","True","Info_Arenamaster_CHALLENGEDGOLIATH_12_03","",""
"Scripts/Content/Story/Missions/DIA_MIL_122_Arenamaster.d:1274","Schön,	schön. Du und Goliath also!","¡Bien, bien! ¡Entonces tú y Goliat!","","True","Info_Arenamaster_CHALLENGEDGOLIATH_PRIZE_12_01","",""
"Scripts/Content/Story/Missions/DIA_MIL_122_Arenamaster.d:1274","Gehe bei Beginn des Vorprogramms in die rechte	Arenakammer	und	sei	bereit wenn	der	Kampf beginnt.","En cuanto empiece el programa prepártil, entra en la sala derecha del patio y prepárate para el combate.","","True","Info_Arenamaster_CHALLENGEDGOLIATH_PRIZE_12_02","",""
"Scripts/Content/Story/Missions/DIA_MIL_122_Arenamaster.d:1282","Kein Silber, kein	Kampf! Komm	wieder,	wenn du	genug davon	hast.","¡Sin plata, sin pelea! Vuelve cuando tengas suficiente.","","True","Info_Arenamaster_CHALLENGEDGOLIATH_PRIZE_12_03","",""
"Scripts/Content/Story/Missions/DIA_MIL_122_Arenamaster.d:1316","Brutus wird gegen mich antreten!","¡Brutus se enfrentará a mí!","","True","Info_Arenamaster_CHALLENGEDBRUTUS.description","",""
"Scripts/Content/Story/Missions/DIA_MIL_122_Arenamaster.d:1332","Brutus wird gegen	mich antreten!","¡Brutus se enfrentará a mí!","","True","Info_Arenamaster_CHALLENGEDBRUTUS_15_01","",""
"Scripts/Content/Story/Missions/DIA_MIL_122_Arenamaster.d:1342","Du bist in kurzer Zeit sehr gut geworden!","¡Te has hecho muy bueno en poco tiempo!","","True","Info_Arenamaster_CHALLENGEDBRUTUS_12_03","",""
"Scripts/Content/Story/Missions/DIA_MIL_122_Arenamaster.d:1342","Brutus ist normalerweise	sehr wählerisch, wenn es um	neue Gladiatoren geht!","Brutus suele ser muy selectivo cuando se trata de nuevos gladiadores.","","True","Info_Arenamaster_CHALLENGEDBRUTUS_12_04","",""
"Scripts/Content/Story/Missions/DIA_MIL_122_Arenamaster.d:1343","Aber	sei	vorsichtig.	Du bist	bisher noch	nicht gegen	einen Gegner dieser	Brutalität angetreten.","Pero ten cuidado. Hasta ahora no has enfrentado a ningún enemigo de esa brutalidad.","","True","Info_Arenamaster_CHALLENGEDBRUTUS_12_05","",""
"Scripts/Content/Story/Missions/DIA_MIL_122_Arenamaster.d:1349","Wie hoch	ist	dein Preisgeld gegen Brutus?","¿Cuánto es tu recompensa contra Brutus?","","True","Info_Arenamaster_CHALLENGEDBRUTUS_12_06","",""
"Scripts/Content/Story/Missions/DIA_MIL_122_Arenamaster.d:1382","Dann wirst du heute	abend also gegen Brutus	kämpfen!","¡Entonces esta noche lucharás contra Brutus!","","True","Info_Arenamaster_CHALLENGEDBRUTUS_PRIZE_12_01","",""
"Scripts/Content/Story/Missions/DIA_MIL_122_Arenamaster.d:1383","Ich	wünsch dir viel	Glück, du wirst	es brauchen!","¡Te deseo buena suerte, vas a necesitarla!","","True","Info_Arenamaster_CHALLENGEDBRUTUS_PRIZE_12_02","",""
"Scripts/Content/Story/Missions/DIA_MIL_122_Arenamaster.d:1383","Benutze	die	linke Arenavorkammer für deine Kampfvorbereitung!","¡Usa la cámara delantera izquierda de la arena para prepararte para el combate!","","True","Info_Arenamaster_CHALLENGEDBRUTUS_PRIZE_12_03","",""
"Scripts/Content/Story/Missions/DIA_MIL_122_Arenamaster.d:1391","Ich kann dich nur kämpfen lassen, wenn	du genug Silber	für	das	Preisgeld hast!","¡Solo puedo dejarte luchar si tienes suficiente plata para el dinero del premio!","","True","Info_Arenamaster_CHALLENGEDBRUTUS_PRIZE_12_04","",""
"Scripts/Content/Story/Missions/DIA_MIL_122_Arenamaster.d:1425","Ich werde gegen Malgar kämpfen!","¡Me voy a pelear con Malgar!","","True","Info_Arenamaster_CHALLENGEDMALGAR.description","",""
"Scripts/Content/Story/Missions/DIA_MIL_122_Arenamaster.d:1441","Ich werde	gegen Malgar kämpfen!","¡Me voy a pelear con Malgar!","","True","Info_Arenamaster_CHALLENGEDMALGAR_15_01","",""
"Scripts/Content/Story/Missions/DIA_MIL_122_Arenamaster.d:1451","Oho.... Ich hoffe du	weist, worauf du dich da einlässt.","Ooh... Espero que sepas a qué te dedicas.","","True","Info_Arenamaster_CHALLENGEDMALGAR_12_03","",""
"Scripts/Content/Story/Missions/DIA_MIL_122_Arenamaster.d:1452","Malgar ist einer	der	gefährlichsten Männer die ich kenne.","Malgar es uno de los hombres más peligrosos que conozco.","","True","Info_Arenamaster_CHALLENGEDMALGAR_12_04","",""
"Scripts/Content/Story/Missions/DIA_MIL_122_Arenamaster.d:1453","Er redet	zwar nicht viel, aber er ist blitzschnell und tödlich.","No habla mucho, pero es rápido y mortal.","","True","Info_Arenamaster_CHALLENGEDMALGAR_12_05","",""
"Scripts/Content/Story/Missions/DIA_MIL_122_Arenamaster.d:1458","Nun gut,	wieviel	Preisgeld möchtest du setzen?","De acuerdo, ¿cuánto dinero quieres apostar?","","True","Info_Arenamaster_CHALLENGEDMALGAR_12_06","",""
"Scripts/Content/Story/Missions/DIA_MIL_122_Arenamaster.d:1490","Wie	du willst. Dann	findet der heutige Kampf zwischen dir und Malgar statt","Como quieras. Entonces hoy tendrás que pelear con Malgar.","","True","Info_Arenamaster_CHALLENGEDMALGAR_PRIZE_12_01","",""
"Scripts/Content/Story/Missions/DIA_MIL_122_Arenamaster.d:1493","Diesmal	ist	die	rechte Arenavorkammer deine.","Esta vez, la cámara delantera derecha es tuya.","","True","Info_Arenamaster_CHALLENGEDMALGAR_PRIZE_12_02","",""
"Scripts/Content/Story/Missions/DIA_MIL_122_Arenamaster.d:1499","Hör zu, du	musst das Silber für das Preisgeld schon dabeihaben, sonst kann	ich	dich für heute abend nicht aufstellen!","Escucha, tienes que llevar la plata para el dinero del premio, o no puedo prepararte para esta noche.","","True","Info_Arenamaster_CHALLENGEDMALGAR_PRIZE_12_03","",""
"Scripts/Content/Story/Missions/DIA_MIL_122_Arenamaster.d:1533","Thora hat meine Herausforderung angenommen!","¡Thora ha aceptado mi desafío!","","True","Info_Arenamaster_CHALLENGEDTHORA.description","",""
"Scripts/Content/Story/Missions/DIA_MIL_122_Arenamaster.d:1549","Thora hat meine Herausforderung angenommen!","¡Thora ha aceptado mi desafío!","","True","Info_Arenamaster_CHALLENGEDTHORA_15_01","",""
"Scripts/Content/Story/Missions/DIA_MIL_122_Arenamaster.d:1559","Lass dich	von	ihr	nicht täuschen.","No te engañe.","","True","Info_Arenamaster_CHALLENGEDTHORA_12_03","",""
"Scripts/Content/Story/Missions/DIA_MIL_122_Arenamaster.d:1559","In der Arena kennt sie kein Erbarmen und sie ist viel	stärker, als sie aussieht.","En la arena no tiene piedad y es mucho más fuerte de lo que parece.","","True","Info_Arenamaster_CHALLENGEDTHORA_12_04","",""
"Scripts/Content/Story/Missions/DIA_MIL_122_Arenamaster.d:1560","Dann spürst du nur noch die harten Enden ihres Kampfstabes überall auf deinem	Körper.","Entonces solo sentirás las puntas duras de su bastón de combate por todo tu cuerpo.","","True","Info_Arenamaster_CHALLENGEDTHORA_12_05","",""
"Scripts/Content/Story/Missions/DIA_MIL_122_Arenamaster.d:1565","Denk daran: Thora	ist	der	ungeschlagene Champion.	Nimm den Kampf nicht auf die leichte Schulter!","Recuerda: Thora es la campeona invicta. ¡No te tomes la pelea a la ligera!","","True","Info_Arenamaster_CHALLENGEDTHORA_12_06","",""
"Scripts/Content/Story/Missions/DIA_MIL_122_Arenamaster.d:1570","Wie hoch soll	dein Einsatz sein?","¿Cuánto quieres apostar?","","True","Info_Arenamaster_CHALLENGEDTHORA_12_07","",""
"Scripts/Content/Story/Missions/DIA_MIL_122_Arenamaster.d:1606","Du hast dich	entschieden! Heute abend trittst du	gegen den Champion an!","¡Has tomado la decisión! ¡Esta noche te enfrentarás al campeón!","","True","Info_Arenamaster_CHALLENGEDTHORA_PRIZE_12_01","",""
"Scripts/Content/Story/Missions/DIA_MIL_122_Arenamaster.d:1611","hast	dich entschieden! Heute	abend kämpfst du gegen Thora!","¡Has tomado tu decisión! ¡Esta noche lucharás contra Thora!","","True","Info_Arenamaster_CHALLENGEDTHORA_PRIZE_12_02","",""
"Scripts/Content/Story/Missions/DIA_MIL_122_Arenamaster.d:1612","Nimm	die	linke Arenavorkammer, und lass Thora in	der	Vorbereitungszeit in Ruhe.","Ve a la cámara delantera de la arena, a la izquierda, y deja a Thora en paz durante la preparación.","","True","Info_Arenamaster_CHALLENGEDTHORA_PRIZE_12_03","",""
"Scripts/Content/Story/Missions/DIA_MIL_122_Arenamaster.d:1614","Auf Störungen in	dieser Zeit	reagiert sie äusserst ungehalten.","En estos momentos, su reacción es muy impaciente.","","True","Info_Arenamaster_CHALLENGEDTHORA_PRIZE_12_04","",""
"Scripts/Content/Story/Missions/DIA_MIL_122_Arenamaster.d:1620","Zu wenig Silber! Ohne Preisgeld	werde ich dich nicht aufstellen. Champion-Kampf	hin	oder her!","¡No tengo suficiente plata! ¡No te conseguiré sin dinero de premio. ¡Luchado campeón, o algo así!","","True","Info_Arenamaster_CHALLENGEDTHORA_PRIZE_12_05","",""
"Scripts/Content/Story/Missions/DIA_MIL_122_Arenamaster.d:1667","CHAMPION, ich grüsse dich!","¡Champion, ¡te saludo!","","True","MIL_122_GREETCHAMPION_12_01","",""
"Scripts/Content/Story/Missions/DIA_MIL_123_Osbert.d:49","Halt! Was hast du hier zu suchen?","¡Permítete! ¿Qué haces aquí?","","True","MIL_123_GOTCHA_00_01","",""
"Scripts/Content/Story/Missions/DIA_MIL_123_Osbert.d:50","Ich seh mich nur mal um.","Solo echaré un vistazo.","","True","MIL_123_GOTCHA_15_02","",""
"Scripts/Content/Story/Missions/DIA_MIL_123_Osbert.d:51","Umsehen- okay. Aber halt die Flossen still. Wenn du versuchst irgendwas mitgehen zu lassen, dann bekommst du Ärger.","Mira por ahí, vale. Pero mantén la boca quieta. Si intentas dejar que algo se vaya contigo, te meterás en líos.","","True","MIL_123_GOTCHA_00_03","",""
"Scripts/Content/Story/Missions/DIA_MIL_123_Osbert.d:52","Kein Problem, ich steck schon nichts ein...","No hay problema, no tengo nada que ver...","","True","MIL_123_GOTCHA_15_04","",""
"Scripts/Content/Story/Missions/DIA_MIL_123_Osbert.d:54","(halblaut) ...und wenn, dann würdest du es sowieso nicht mitkriegen...","(en medio azul) ...y si, de todas maneras, no te enterarías...","","True","MIL_123_GOTCHA_15_05","",""
"Scripts/Content/Story/Missions/DIA_MIL_123_Osbert.d:83","Hab ich dich erwischt! Du hast doch bestimmt was mitgenommen!","¡Te he cogido! ¡Debo haberte llevado algo!","","True","MIL_123_THIEF_00_01","",""
"Scripts/Content/Story/Missions/DIA_MIL_123_Osbert.d:85","Aha! Der Kerkerschlüssel, wußte ich es doch! Der bleibt hier! Und du verschwindest jetzt besser!","¡Ah, ¡lo sabía! ¡La llave del calabozo se queda aquí! ¡Y ahora será mejor que te largues!","","True","MIL_123_THIEF_00_02","",""
"Scripts/Content/Story/Missions/DIA_MIL_123_Osbert.d:102","Was gibt's Neues?","¿Qué hay de nuevo?","","True","MIL_123_Osbert_HI.description","",""
"Scripts/Content/Story/Missions/DIA_MIL_123_Osbert.d:112","Was gibt's Neues?","¿Qué hay de nuevo?","","True","MIL_123_HI_15_01","",""
"Scripts/Content/Story/Missions/DIA_MIL_123_Osbert.d:113","Pass auf Bürschchen, mag ja sein das du ein Freund von Diego bist,...","Cuidado, amigo. Puede que seas amigo de Diego...","","True","MIL_123_HI_07_02","",""
"Scripts/Content/Story/Missions/DIA_MIL_123_Osbert.d:114","...aber wenn ich dich beim Rumschnüffeln erwische, dann bist du dran!","...pero si te pego con tu ronquillo, ¡te acabaré!","","True","MIL_123_HI_07_03","",""
"Scripts/Content/Story/Missions/DIA_MIL_129_Militia.d:33","HALT! Du betrittst jetzt das Viertel der Kranken!","¡ALTO! ¡Entras en el barrio de enfermos!","","True","MIL_129_STOP_00_01","",""
"Scripts/Content/Story/Missions/DIA_MIL_129_Militia.d:34","Ja und?","¿Y qué?","","True","MIL_129_STOP_15_02","",""
"Scripts/Content/Story/Missions/DIA_MIL_129_Militia.d:35","Niemand weiß, was es mit der Krankheit auf sich hat. Besser du hälst dich fern von diesen Gestalten!","Nadie sabe qué hay de la enfermedad. ¡Será mejor que te mantengas alejado de esas figuras!","","True","MIL_129_STOP_00_03","",""
"Scripts/Content/Story/Missions/DIA_MIL_129_Militia.d:36","Ich bin vorsichtig.","Soy cuidadoso.","","True","MIL_129_STOP_15_04","",""
"Scripts/Content/Story/Missions/DIA_MIL_130_Militia.d:33","HALT! Du betrittst jetzt das Viertel der Kranken!","¡ALTO! ¡Entras en el barrio de enfermos!","","True","MIL_130_STOP_00_01","",""
"Scripts/Content/Story/Missions/DIA_MIL_130_Militia.d:34","Ja und?","¿Y qué?","","True","MIL_130_STOP_15_02","",""
