"location","source","target","id","fuzzy","context","translator_comments","developer_comments"
"Scripts/Content/Story/Log_Constants.d:14","Wissen der Tierverwertung","Využití zvěře","","","GE_AnimalTrophies","",""
"Scripts/Content/Story/Log_Constants.d:15","Wissen vom Waffenschmieden","Kování zbraní","","","GE_SmithWeapons","",""
"Scripts/Content/Story/Log_Constants.d:16","KURZSCHWERT: Eine kurze Klinge eine Elle lang und doppelschneidig. Die Parierstange ist kurz und rundlich. Die Waffe selbst ist bei Dieben und Mördern sehr beliebt, da sie leicht zu verbergen ist und auch im dichtesten Handgemenge nicht behindert.","KRÁTKÝ MEČ: Krátká čepel, dlouhá zhruba jeden loket, s ostřím na obou stranách. Záštita je krátká a zakulacená. Tato zbraň je velice oblíbená u zlodějů a vrahů, protože je možné ji snadno skrýt a neomezuje ani při té nejhustší rvačce.","","","GE_SmithWeapons_1","",""
"Scripts/Content/Story/Log_Constants.d:17","LANGSCHWERT: Die ideale Waffe für die Verteidigung des Heims ebenso wie für den fahrenden Wanderer. Die drei Fuß messende, doppelschneidige Klinge wird mit einem Quereisen als Parierstange sowie einem Lederumwickelten Griff abgesetzt. Mit wenig Kraft zu schwingen, kann diese Waffe doch heftige Wunden in Mensch wie Tier reissen.","DLOUHÝ MEČ: Ideální zbraň pro ochranu domova a majetku, stejně tak jako pro pocestné. Tři stopy měřící oboustranná čepel je osazena diagonální záštitou a kůží potaženou rukojetí. S docela malou silou dokáže tato zbraň napáchat veliké škody lidským i zvířecím protivníkům","","","GE_SmithWeapons_2","",""
"Scripts/Content/Story/Log_Constants.d:18","BREITSCHWERT: Drei Fuß messender Stahl, dessen gewaltige Wucht von der breiten doppelschneidigen Klinge herrührt. Dies ist die Waffe von Kriegern und Söldnern und nichts für Anfänger. Die ein Fuß messende Parierstange kann auch die stärksten Attacken abwehren und der Griff aus kreuzweise umwundenen Draht gibt der Hand, die diese schwere Waffe in den Kampf führt, optimalen Halt.","ŠIROKÝ MEČ: Tři stopy měřící zbraň, jejíž síla vychází ze široké dvoubřité čepele. Toto je zbraň válečníků a vojáků a ne pro začátečníky. Stopu široká záštita dokáže odrazit ty nejsilnější útoky a rukojeť s křížovým drátěným vinutím umožňuje pohodlné držení této těžké zbraně.","","","GE_SmithWeapons_3","",""
"Scripts/Content/Story/Log_Constants.d:19","BASTARDSCHWERT: Wer diese vier Fuß lange, gewaltige Klinge einhändig in den Kampf führen kann, gehört zur Elite unter den Schwertkämpfern. Die Verbindung von Klinge, Parierstange und Griff muß besonders robust ausgeführt werden, um die Wucht der Schläge auch dauerhaft unbeschadet zu überstehen.","MEČ BASTARD: Ten, kdo dokáže tuto čtyři stopy dlouhou zbraň vést jednou rukou, patří mezi šermířskou elitu. Spojení čepele, záštity a rukojeti musí být obzvláště robustní, aby vydrželo sílu úderů a zabránilo tak trvalému poškození.","","","GE_SmithWeapons_4","",""
"Scripts/Content/Story/Log_Constants.d:20","ZWEIHÄNDER: Dies ist die Köngisklasse unter den Schwertern. die fast fünf Fuß messende, zweischneidige Klinge muß auch von den stärksten Kriegern beidhändig geführt werden. Trifft sie dann aber ihr Ziel, so läßt sie meist nur den Tod zurück. Während das obere Ende der Klinge mit herausgeschliffenen Wellen versehen ist, um mehr Schaden anzurichten, so wurde das  Ende vor der Parierstange mit wehrhaften Stacheln versehen, um auch im Handgemenge den Gegner verletzen zu können.","OBOURUČÁK: Král mezi meči. Skoro pět stop dlouhou čepel musí oběma rukama ovládat i ti nejsilnější bojovníci. Zasáhne-li však svůj cíl, nezanechá za sebou zpravidla pouze smrt. Zatímco je horní konec čepele opatřen vybroušenými vlnkami, aby způsobil co nejvyšší poškození, konec čepele před záštitou je osazen hroty, které je možné použít ke zranění protivníka ve rvačce.","","","GE_SmithWeapons_5","",""
"Scripts/Content/Story/Log_Constants.d:21","KRUSH VARROK: Diese Orkwaffe ein Schwert zu nennen wäre Ketzerei. Es ist ein Vernichter. Diese fünf Fuß lange, axtförmig gebogene Schwertklinge, wird an einer Griffstange geführt, die hinter der Schneide auf fast der gesamten Waffenlänge verläuft. Dieses Schwert muß aus dem seltenen Bluterz gefertig werden und ist zwar die leichteste Orkwaffe, aber dennoch tödlicher, als jede von Menschen hergestellte Klinge.","KRUSH VARROK: Nazvat tuto skřetí zbraň mečem by bylo kacířství. Je to ničitel. Tato pět stop dlouhá zbraň má ostří ve tvaru obrovské sekery, které zakrývajícím rukojeť zbraně. Tato čepel musí být vyrobena ze vzácné krvavé rudy a je nejlehčí skřetí zbraní, ale stále smrtelnější, než jakákoliv zbraň vyrobená lidmi.","","","GE_SmithWeapons_6","",""
"Scripts/Content/Story/Log_Constants.d:22","BEIL: Ein kleines Axtblatt und ein anderthalb Fuß messender Schaft bilden das ideale Werkzeug des Waldläufers. Ob Brennholz geschlagen oder die kleineren Raubtiere des Waldes abgewehrt werden sollen, das Beil ist ein zuverlässiger Begleiter.","SEKERA: Malá sekera a stopu a půl dlouhé topůrko tvoří tento ideální nástroj pro dobrodruhy. Ať už potřebujete připravit dřevo na oheň, nebo odhánět malá divoká  lesní zvířata, sekera je spolehlivým společníkem.","","","GE_SmithWeapons_7","",""
"Scripts/Content/Story/Log_Constants.d:23","STREITAXT: Die Waffe für den ungestümen Krieger. Das wuchtige Axtblatt kann von starken Kämpfern noch einhändig geführt werden und so sowohl Mensch wie auch Tier schmerzhafte Wunden zufügen.","BOJOVÁ SEKYRA: Zbraň pro temperamentní válečníky. Mohutné ostří sekyry mohou silní bojovníci ovládat jednou rukou a způsobit tak bolestivá zranění lidem a zvířatům.","","","GE_SmithWeapons_8","",""
"Scripts/Content/Story/Log_Constants.d:24","DOPPELBLATT-AXT: Der zwei Fuß durchmessende, zweischneidige  Axtkopf sitzt auf einem mit Metallringen verstärktem extralangen Schaft der es erlaubt, diese verherende Waffe mit beiden Händen zu führen. Falls der Kämpfer über ausreichend Kraft verfügt, so kann er mit diesem Werkzeug der Zerstörung nicht nur Bäume fällen... .","DVOUBŘITÁ SEKYRA: Dvoubřitá sekyra s ostřím o průměru téměř dvou stop je zasazena do topůrka vyztuženého kovovými kroužky. Váha zbraně omezuje bojovníka na používání zbraně v obou rukou. Pokud je bojovník obdařen velikou silou, může tento nástroj ničení použít nejen na kácení stromů...","","","GE_SmithWeapons_9","",""
"Scripts/Content/Story/Log_Constants.d:25","BERSERKERAXT: Noch größer und wuchtiger als die Doppelblättrige Axt ist diese Waffe schon kaum mehr als Axt zu bezeichnen. Ein einzelner Krieger kann mit diesem Monster aus Stahl Breschen in ganze Infantrieformationen schlagen. Sollte bei keinem Feldzug fehlen!","SEKYRA BERSERKERA: Tato zbraň je mnohem větší a mohutnější, než dvoubřitá sekyra, stěží ji můžeme nazývat sekyrou. Jediný válečník se může tímto ocelovým monstrem prosekávat skrze celé formace nepřátelských vojáků. Neměla by chybět při žádném válečném tažení.","","","GE_SmithWeapons_10","",""
"Scripts/Content/Story/Log_Constants.d:26","KRUSH BROKDAR: Endlich ist klar, wie die Orks ihre menschlichen Wiedersacher in derart vernichtenden Schlachten immer wieder in die Flucht schlagen konnten. Nur aus dem seltenen Bluterz herzustellen ist diese orkische Axt der Gipfel der Vernichtung. Sie kann nur von den allerstärksten Menschen geführt werden kann, mäht aber Gegner nieder wie die Sense das Gras. Eine hässliche Waffe, die hässliche Wunden schlägt.","KRUSH BROKDAR: Konečně je jasné, jak se mohlo skřetům v ničivých bitvách podařit zahnat své lidské protivníky na útěk. Tato skřetí sekyra, vyráběna jedině ze vzácné krvavé rudy, je vrcholem ničení. Dokáží ji nosit jen ti nejsilnější z lidských bojovníků, ale potom poráží své protivníky jako trávu kosou. Ošklivá zbraň, která pusobí ošklivá poškození.","","","GE_SmithWeapons_11","",""
"Scripts/Content/Story/Log_Constants.d:27","EISENKEULE: Ein eiserner Schaft, der an seinem Ende etwas verdickt ist, um mehr Wucht hinter den Schlag zu setzen. Diese metallene Variante des Holzknüppels ist die ideale Ergänzung für eine Kneipenschlägerei und das blose Tragen eines solchen Gegenstandes vermeidet oft unangenehme nächtliche Begegnungen.","ŽELEZNÝ KYJ: Železná tyč se na konci mírně rozšiřuje, aby při úderu způsobila větší poškození. Tato železná varianta dřevěné hole je ideální nástroj pro hospodskou rvačku. Nošením této zbraně se člověk často vyhne nepříjemným nočním setkáním.","","","GE_SmithWeapons_12","",""
"Scripts/Content/Story/Log_Constants.d:28","STREITKOLBEN: Auf einem metallenen Waffenstumpf sitzt ein etwa kindskopfgroßes Gebilde aus pilzartig angeordneten Eisenlamellen. Diese wehrhafte Waffe ist schnell und besitzt doch ausreichend Wucht, um auch schwere Rüstungen ordentlich zu verbeulen. Sehr beliebt bei religiösen Fanatikern und als Zweitwaffe auch bei königlichen Paladinen stark im Kommen.","PALCÁT: Na kovovém válci sedí útvar velikosti dětské hlavy pokrytý kovovými lamelami. Tato zbraň je rychlá a přesto má dostatek síly na to, aby prorazila i těžké brnění. Zbraň je velice oblíbená u náboženských fanatiků a jako druhá zbraň královských paladinů.","","","GE_SmithWeapons_13","",""
"Scripts/Content/Story/Log_Constants.d:29","MORGENSTERN: Dies ist die unhöfliche Variante des Streitkolbens. Ein massiver, mit hässlichen Dornen gespickter Eisenkopf sitzt auf einem verstärkten Schaft. Diese Waffe ist nicht nur bei Rittern weithin gefürchtet, sondern kann auch gut geschützte Monsterpanzer mit Leichtigkeit knacken.","KROPÁČ: Jedná se o hrubou variantu krumpáče. Masivní hlavice s ošklivými trny sendí na zesílené rukojeti. Této zbraně se nebojí pouze rytíři, ale také krunýři chránená zvířata.","","","GE_SmithWeapons_14","",""
"Scripts/Content/Story/Log_Constants.d:30","KRIEGSHAMMER: Was aus einem glühenden Stück Eisen ein Schwertklinge formen kann, zermalmt auch den härtesten Gegner. Der große Bruder des Schmiedehammers muß allerdings beidhändig geführt werden, wiegt doch alleine der massive Hammerkopf mehr als ein ganzer Kochkessel. Die größte Genugtung bereitet aber immer noch das Zerbersten der Steingolems, die das Unglück haben, mit diesem Erdbeben von Waffe Bekanntschaft zu machen.","VÁLEČNÉ KLADIVO: To, co dokáže ze žhnoucího železa vytvarovat čepel, rozdrtí i toho nejtvrdšího protivníka. Velký bratr kovářského kladiva však musí být používán oběma rukama, protože celá hlavice váží víc, než velký kotel na vaření. Největším uspokojením je roztříštění kamenných golemů, kteří mají tu smůlu, že se měli šanci seznámit s touto mohutnou zbraní.","","","GE_SmithWeapons_15","",""
"Scripts/Content/Story/Log_Constants.d:31","KRUSH KARROK: Bisher war nicht bekannt, daß Orks auch mit riesigen Hämmern kämpfen, doch scheint dies vor vielen Jahrhunderten tatsächlich der Fall gewesen zu sein. Diese Apokalypse von Waffe besteht aus einem mannsgroßen Eisenschaft, der von einem enorm wuchtigen und doch sehr scharfkantigen Hammerkopf gekrönt wird. Wo dieses Monstrum aufschlägt, wächst kein Gras mehr. Mit einer solchen Waffe werden die meisten gegnerischen Rüstungen reine Formsache.","KRUSH KARROK: Dříve nebylo známo, že skřeti také používají válečná kladiva, ale zdá se, že tomu tak je už po mnohá staletí. Tato apokalyptická zbraň se skládá z ze železného topůrka délky dospělého člověka, které je korunováno těžkou, ale velice ostrou hlavou kladiva. Kde toto monstrum udeří, tam už tráva neroste. S takovouto zbraní nejsou nepřátelská brnění překážkou.","","","GE_SmithWeapons_16","",""
"Scripts/Content/Story/Log_Constants.d:34","Wissen über Kochrezepte","Kuchařské recepty","","","GE_CookingRecipies","",""
"Scripts/Content/Story/Log_Constants.d:36","Wissen über Alchemieformeln","Alchymistické formule","","","GE_AlchemieRecipies","",""
"Scripts/Content/Story/Log_Constants.d:37","Wissen vom Bogenmachen","Výroba luků","","","GE_BowMaker","",""
"Scripts/Content/Story/Log_Constants.d:37","Wissen über Pflanzen","Herbář","","","GE_Plants","",""
"Scripts/Content/Story/Log_Constants.d:37","WALDBEEREN mögen kein helles Licht. Sie wachsen bevorzugt unter kleineren Büschen, aber manchmal auch in dichterem Wald.","BORŮVKY nemají rády jasné světlo. Nejradši rostou pod menšími keříky, ale někdy i v hustých lesích.","","","GE_Plants_1","",""
"Scripts/Content/Story/Log_Constants.d:38","FLAMMBEEREN sind eng mit den Waldbeeren verwandt, aber weitaus seltener. Auch sie wachsen im Dunkel von kleineren Büschen und im Wald. Häufig findet man Flammbeeren einzeln in einer grösseren Gruppe von Waldbeeren.","OHNIVÉ TRNY jsou příbuzné borůvkám, ale vyskytují se méně často. Také ony rostou ve stínu menších keřů a v lesích. Ohnivé trny se většinou vyskytují jednotlivé mezi velkými skupinami borůvek.","","","GE_Plants_2","",""
"Scripts/Content/Story/Log_Constants.d:39","TROLLKIRSCHEN sind eine extrem seltene Unterart der Waldbeeren. Sie scheinen im Gegensatz zu ihren Verwandten äusserst giftig zu sein und wachsen ausschliesslich in Trollhorten.","TROLLÍ BOBULE jsou extrémně vzácný poddruh borůvek. Na rozdíl od jejich příbuzných jsou trollí bobule velice jedovaté a rostou pouze v trollím trusu.","","","GE_Plants_3","",""
"Scripts/Content/Story/Log_Constants.d:40","HÖHLENPILZE brauchen die feuchte Dunkelheit. In alten muffigen Kellern und Verliessen aber auch in vielen natürlichen Höhlen stolpert man oft über ganze Teppiche dieser Pflanzen.","PEKELNÉ HOUBY potřebují vlhko a tmu. Na celé trsy těchto hub je možné narazit ve vlhkých kobkách a sklepeních, ale také v mnoha přírodních jeskyních.","","","GE_Plants_4","",""
"Scripts/Content/Story/Log_Constants.d:41","BERGMOOS mag die dünne Luft hoch in den Bergen oder Felsen. Oft muss ein Fundort mühevoll erklettert werden.","HORSKÝ MECH má rád řídký horský vzduch. Roste vysoko ve skalách a na horách. Často se do těchto míst musí vyšplhat.","","","GE_Plants_5","",""
"Scripts/Content/Story/Log_Constants.d:42","Die STEINWURZEL bevorzugt erdige Böden, man findet sie am Waldrand und  auf erdigen Feldern. Oft wachsen sie dort auf kleinen Felsfindlingen.","KAMENNÝ KOŘEN preferuje pro svůj růst kamenitou půdu, je možné jej najít na okrajích lesa a na kamenitých polích. Často rostou u velkých balvanů.","","","GE_Plants_6","",""
"Scripts/Content/Story/Log_Constants.d:43","Die BLUTDISTEL mag das Ufer von Seen und Flüssen. Sie wächst häufig in ganzen Gruppen und ist oft in der Nähe von grossen Schilfpflanzen zu finden.","KRVAVÝ BODLÁK má rád břehy jezer a řek. Roste v početných skupinách, často v blízkosti rákosí.","","","GE_Plants_7","",""
"Scripts/Content/Story/Log_Constants.d:45","ORKBLATT wächss bevorzugt auf niedrigen Felsvorsprüngen, oder direkt am Fusse von Felsen und Bergen.","SKŘETÍ LIST dává přednost růstu na nízkých skalních římsách nebo přímo na úpatí hor a skalních stěn.","","","GE_Plants_8","",""
"Scripts/Content/Story/Log_Constants.d:46","RABENKRAUT mag die Nachbarschaft zum Wasser, sei es Meer oder ein Binnengewässer.","HAVRANÍ BYLINY rády rostou poblíž vodních ploch, ať už se jedná o moře nebo o sladkovodní jezera.","","","GE_Plants_9","",""
"Scripts/Content/Story/Log_Constants.d:46","NACHTSCHATTEN sucht, wie der Name schon andeutet, die Dunkelheit. Er sollte in Höhlen und Räumen oder den finstersten Ecken des Waldes zu finden sein.","POTMĚCHUŤ vyhledává, jak už název napovídá, tmu. Měl by být k nalezení v jeskyních a sklepeních nebo v nejtemnějších zákoutích lesů.","","","GE_Plants_10","",""
"Scripts/Content/Story/Log_Constants.d:52","Händler im Alten Lager","Obchodníci ve Starém táboře","","","GE_TraderOC","",""
"Scripts/Content/Story/Log_Constants.d:53","Einer der Bettler mit Namen Lakarus verkauft SUMPFKRAUT auf dem Arenaplatz.","Jeden z žebráků, Lakarus, prodává poblíž arény TRÁVU Z BAŽIN.","","","GE_TraderOC_1","",""
"Scripts/Content/Story/Log_Constants.d:54","Isgar, einer der Heiler verkauft TRÄNKE aller Art, im Händlerviertel.","Isgar, jeden z léčitelů, prodává LEKTVARY všeho druhu v obchodní čtvrti.","","","GE_TraderOC_2","",""
"Scripts/Content/Story/Log_Constants.d:55","Halvor betreibt die Burgküche. Er scheint sich auf FLEISCHEINTOPF 'spezialisiert' zu haben.","Halvor má na starosti hradní kuchyň. Vypadá to, že se 'specializoval' na MASNÝ VÝVAR.","","","GE_TraderOC_3","",""
"Scripts/Content/Story/Log_Constants.d:56","Helvegor, der Bogenmacher verkauft seine Waren am Marktplatz","Helvegor, výrobce luků, prodává své zboží na tržišti.","","","GE_TraderOC_4","",""
"Scripts/Content/Story/Log_Constants.d:57","Gerion kauft HEHLERWARE aller Art ab. Er treibt sich am hinteren Tor herum.","Gerion kupuje KRADENÉ ZBOŽÍ všeho druhu. Zdržuje se kolem zadní brány.","","","GE_TraderOC_5","",""
"Scripts/Content/Story/Log_Constants.d:58","Gotmar der Schmied verkauft allerlei SCHMIEDEZUBEHÖR. Er hat seine Schmiede direkt neben dem Haupttor.","Kovář Gotmar prodává KOVÁŘSKÉ POTŘEBY. Kovárnu má přímo vedle hlavní brány.","","","GE_TraderOC_6","",""
"Scripts/Content/Story/Log_Constants.d:58","Helvegor stellt BÖGEN her und verkauft sie zusammen mit den PFEILEN von Osric. Dieses seltsame 'Paar' hat seinen Stand im Händlerviertel.","Helvegor vyrábí LUKY a prodává je společně s Osricovými šípy. Tato podivná 'dvojice' má svůj stánek v obchodní čtvrti.","","","GE_TraderOC_7","",""
"Scripts/Content/Story/Log_Constants.d:60","Ruga verkauft RÜSTUNGEN. Er hat sein Geschäft im Händlerviertel.","Ruga prodává ZBROJE. Má svůj obchod v obchodní čtvrti.","","","GE_TraderOC_8","",""
"Scripts/Content/Story/Log_Constants.d:62","Agon prahlt damit, ALLES besorgen zu können, was man sucht. Er hat einen Stand im Händlerviertel.","Agon se chvástá, že dovede obstarat cokoliv, po čem se člověk jen shání. K sehnání je ve čtvrti obchodníků.","","","GE_TraderOC_9","",""
"Scripts/Content/Story/Log_Constants.d:64","Händler im Neuen Lager","Obchodníci v Novém táboře","","","GE_TraderNC","",""
"Scripts/Content/Story/Log_Constants.d:66","Händler im Sumpflager","Obchodníci v táboře v bažinách","","","GE_TraderPSI","",""
"Scripts/Content/Story/Log_Constants.d:67","Händler ausserhalb der Lager","Obchodníci ve vnějším světě","","","GE_TraderOW","",""
"Scripts/Content/Story/Log_Constants.d:67","Lehrer im Alten Lager","Učitelé ve Starém táboře","","","GE_TeacherOC","",""
"Scripts/Content/Story/Log_Constants.d:68","Diego wird mir helfen, meine GESCHICKLICHKEIT und BOGENTALENTE zu trainieren. Ich kann ihn im Erzbaronhaus finden.","Diego mi pomůže zlepšit moji OBRATNOST a STŘELBU Z LUKU. Najdu ho v domě rudobaronů.","","","GE_TeacheroC_1","",""
"Scripts/Content/Story/Log_Constants.d:68","Lester wird mir helfen, meine MANA zu verbessern und neue ZAUBERSPRÜCHE zu erlernen. Er ist im alten Magierhaus in der Burg zu finden.","Lester mi pomůže zvýšit moji MANU a naučí mě nová KOUZLA. Vyskytuje se ve bývalém sídle mágů na hradě.","","","GE_TeacheroC_2","",""
"Scripts/Content/Story/Log_Constants.d:70","Cassian wird mir helfen, meine STÄRKE sowie das Kampftalent EINHÄNDER zu trainieren. Er trainiert tagsüber Soldaten im Burginnenhof.","Cassian mi pomůže zvýšit moji SÍLU a zrovna BOJ S JEDNORUČNÍM MEČEM. Během dne trénuje s vojáky na vnitřním nádvoří.","","","GE_TeacheroC_3","",""
"Scripts/Content/Story/Log_Constants.d:71","Gerion kann mir die Talente SCHLEICHEN, SCHLÖSSER KNACKEN und TASCHENDIEBSTAHL beibringen. Er hält sich irgendwo am hinteren Tor auf.","Gerion mi může pomoci s dovednostmi PLÍŽENÍ, PÁČENÍ ZÁMKŮ a KAPSÁŘSTVÍ. Zdržuje se někde u zadní brány.","","","GE_TeacheroC_4","",""
"Scripts/Content/Story/Log_Constants.d:71","Gerion hat kann mir alles beigebracht, was er über die Diebeskünste weiss. Wenn ich noch mehr lernen will, muss ich mir einen anderen Lehrer suchen.","Gerion mě naučil vše, co o zlodějských dovednostech ví. Pokud se chci naučit víc, musím najít zkušenějšího učitele.","","","GE_TeacheroC_5","",""
"Scripts/Content/Story/Log_Constants.d:77","Lehrer im Neuen Lager","Učitelé v Novém táboře","","","GE_TeacherNC","",""
"Scripts/Content/Story/Log_Constants.d:77","Lehrer im Sumpflager","Učitelé v táboře v bažinách","","","GE_TeacherPSI","",""
"Scripts/Content/Story/Log_Constants.d:79","Lehrer ausserhalb der Lager","Učitelé ve vnějším světě","","","GE_TeacherOW","",""
"Scripts/Content/Story/Log_Constants.d:81","Dämonische Bedrohung","Démonické nebezpečí","","","CH1_DemonThreat","",""
"Scripts/Content/Story/Log_Constants.d:81","Ich konnte Thora dazu bringen, mich zur Bergfestung zu führen. Allerdings wird sie mich nur an den ersten Wachen vorbeibringen. Danach bin ich auf mich allein gestellt.","Dokázal jsem Thoru přesvědčit, aby mě vzala do Horské pevnosti. Každopádně mě dostane jen přes první strážné. Potom se už musím spolehnout na sebe.","","","CH1_DemonThreat_1","",""
"Scripts/Content/Story/Log_Constants.d:83","Sollte wir auf dem Weg in die Bergfestung getrennt werden, treffen wir uns an der Arena im Alten Lager wieder.","Kdybychom se na cestě do Skalní pevnosti rozdělili, potkáme se znovu u arény ve Starém táboře..","","","CH1_DemonThreat_2","",""
"Scripts/Content/Story/Log_Constants.d:83","Der Schläfer versucht aus der Dämonenwelt in unsere Welt zurückzukommen. Er muss unter allen Umständen aufgehalten werden, sonst waren alle meine Bemühungen umsonst.","Spáč se pokouší dostat ze světa démonů do našeho světa. Musí být za každou cenu zastaven, jinak bylo veškeré mé úsilí zbytečné.","","","CH1_DemonThreat_3","",""
"Scripts/Content/Story/Log_Constants.d:84","Bevor ich der dämonischen Bedrohung begegnen kann, muss ich meine verlernten Fähigkeiten zurückerlernen und wieder in Form kommen. Das Alte Lager ist der geeignete Ort dafür.","Před tím, než budu moci čelit démonům, musím získat zpět své ztracené schopnosti a dovednosti a dostat se zpět do formy. Starý tábor je pro tento účel to správné místo.","","","CH1_DemonThreat_4","",""
"Scripts/Content/Story/Log_Constants.d:85","Xardas gab mir eine Botschaft für Diego. Mein alter Weggefährte ist mittlerweile der Anführer des Alten Lagers. Er wird mich beraten und weiss was zu tun ist.","Xardas mi dal zprávu pro Diega. Můj starý společník se během mé absence stal vůdcem Starého tábora. Poradí mi a bude vědět, co dělat dál.","","","CH1_DemonThreat_5","",""
"Scripts/Content/Story/Log_Constants.d:87","Diego hält mich noch nicht wieder für überlebensfähig. Ich muss im Lager meine Fähigkeiten trainiere und wieder fit werden.","Diego mě ještě nemá schopného přežití. Musím si v táboře rozvinou svoje dovednosti a dostat se do kondice.","","","CH1_DemonThreat_6","",""
"Scripts/Content/Story/Log_Constants.d:87","Nach ausreichend Training werde ich nun zu Milten, meinem Weggefährten von früher, aufbrechen. Er ist einer der Feuermagier in der Bergfestung. Diego braucht seine Hilfe gegen die dämonische Bedrohung.","Po dostatečném výcviku se teď vydám za Miltenem, mým starým známým. Je teď mágem ohně ve Skalní pevnosti. Diego potřebuje jeho pomoc proti hrozbě démonů.","","","CH1_DemonThreat_7","",""
"Scripts/Content/Story/Log_Constants.d:88","Die Bergfestung wird von den Paladinen des Königs abgeschottet. Thora arbeitet als Kundschafterin für die Paladine. Sie ist der einzige Weg für mich, in die Festung zu gelangen.","Skalní pevnost je uzavřená paladiny. Thora pracuje jako zvěd pro paladiny. Je pro mě jedinou cestou do pevnosti.","","","CH1_DemonThreat_8","",""
"Scripts/Content/Story/Log_Constants.d:91","Huldrych's Lektion","Dát Huldrychovi lekci","","","CH1_Train1h","",""
"Scripts/Content/Story/Log_Constants.d:91","Huldrych hat den Händler Agon bestohlen. Cassian hat mich nun beauftragt, zum einen Huldrych eine Lektion zu erteilen und zum anderen Agon sein Eigentum wiederzubringen. Dabei wäre es unklug, Huldrych zu töten!","Huldrych okradl obchodníka Agona. Cassian mě zaúkoloval abych Huldrychovi udělil lekci a přiměl ho vrátit ukradené zboží. Nebylo by moudré při tom Huldrycha zabít!","","","CH1_Train1h_1","",""
"Scripts/Content/Story/Log_Constants.d:93","Vielleicht ist es besser, erst mit Agon zu reden, bevor ich zu Huldrych gehe, um einen besseren Überblick der Situation zu bekommen.","Možná bude lepší si nejprve promluvit s Agonem, abych získal lepší přehled o situaci, a až pak jít za Huldrychem.","","","CH1_Train1h_2","",""
"Scripts/Content/Story/Log_Constants.d:94","Ich habe die Aufgabe zu Cassian's Zufriedenheit erledigt. Huldrych hat seine Lektion erhalten.","Splnil jsem úkol k Cassianově spokojenosti. Huldrych dostal svou lekci.","","","CH1_Train1h_3","",""
"Scripts/Content/Story/Log_Constants.d:95","Es wäre besser gewesen, ich hätte Huldrych nicht umgebracht. In Zukunft sollte ich vorsichtig sein, Mord wird von allen sehr ernst genommen","Bylo by lepší, kdybych byl Huldrycha nezabil. Příště bych si měl dát pozor, vražda se tu nebere na lehkou váhu","","","CH1_Train1h_4","",""
