"location","source","target","id","fuzzy","context","translator_comments","developer_comments"
"Scripts/Content/Story/B/B_AssignAmbientInfos_MIL_6.d:208","Wer hat hier das Sagen?","Хто тут за головного?","","False","Infos_Mil_6_BOSS.description","",""
"Scripts/Content/Story/B/B_AssignAmbientInfos_MIL_6.d:228","Wer hat hier das Sagen?","Хто тут за головного?","","False","Infos_Mil_6_BOSS_Info_15_01","",""
"Scripts/Content/Story/B/B_AssignAmbientInfos_MIL_6.d:229","Hauptmann Berengar. Aber halt dich fern von ihm. Er mag keine aufdringlichen Typen! Leutnant Cassian ist für Typen wie dich zuständig!","Капітан Беренгар. Та ти краще не лізь до нього — він ненавидить настирливих. З такими, як ти, розбирається лейтенант Касіян.","","False","Infos_Mil_6_BOSS_Info_01_02","",""
"Scripts/Content/Story/B/B_AssignAmbientInfos_MIL_7.d:32","Wie läufts?","Як справи?","","False","Infos_Mil_7_HI.description","",""
"Scripts/Content/Story/B/B_AssignAmbientInfos_MIL_7.d:42","Wie läufts?","Як справи?","","False","Infos_Mil_7_HI_Info_15_01","",""
"Scripts/Content/Story/B/B_AssignAmbientInfos_MIL_7.d:43","(ärgerlich) Wie läuft was? Hast du nichts zu tun? Dann such dir Arbeit! Es gibt mehr als genug zu tun!","(роздратовано) Як справи? Нема чим себе зайняти? Іди працюй! Роботи повно!","","False","Infos_Mil_7_HI_Info_07_02","",""
"Scripts/Content/Story/B/B_AssignAmbientInfos_MIL_7.d:57","Du bist sicher, dass du Halvor's Frass hier essen willst?","Ти справді збираєшся жерти оці помиї Халвора?","","False","Info_Mil_7_FOODGOOD.description","",""
"Scripts/Content/Story/B/B_AssignAmbientInfos_MIL_7.d:74","Du bist sicher, dass du Halvor's Frass hier essen willst?","Ти справді збираєшся жерти оці помиї Халвора?","","False","Info_Mil_7_FOODGOOD_15_01","",""
"Scripts/Content/Story/B/B_AssignAmbientInfos_MIL_7.d:75","Ähh... warum, was ist damit!","Е-е-е... чому, що з ним не так!","","False","Info_Mil_7_FOODGOOD_07_02","",""
"Scripts/Content/Story/B/B_AssignAmbientInfos_MIL_7.d:76","(konspirativ) Was meinst du wohl WAS für ein Fleisch in diesem Eintopf ist?","(Таємничо) А ти як думаєш? Що за м’ясо в цьому рагу?","","False","Info_Mil_7_FOODGOOD_15_03","",""
"Scripts/Content/Story/B/B_AssignAmbientInfos_MIL_7.d:77","(irritiert) Ich habe nie danach gefragt?","(роздратовано) Я ж про це не питав?","","False","Info_Mil_7_FOODGOOD_07_04","",""
"Scripts/Content/Story/B/B_AssignAmbientInfos_MIL_7.d:78","(konspirativ) HAST Du dich jemals gefragt, warum im Aussätzigenlager zwar immer neue Leute ankommen, ab es dort trotzdem nicht voller wird?","(Таємничо) ЧИ ТИ коли-небудь замислювався, чому у квартал прокажених постійно надходять нові люди, а народу там не більшає?","","False","Info_Mil_7_FOODGOOD_15_05","",""
"Scripts/Content/Story/B/B_AssignAmbientInfos_MIL_7.d:79","Du meinst doch nicht etwa....","Ти ж не гадаєш… що…","","False","Info_Mil_7_FOODGOOD_07_06","",""
"Scripts/Content/Story/B/B_AssignAmbientInfos_MIL_7.d:80","(unschuldig) Ich habe nichts gesagt! Aber bei Snaf, kann dir sowas nicht passieren!","(Невинно) Я ж ані слова! Просто кажу… в Снафа тобі таке не загрожує.","","False","Info_Mil_7_FOODGOOD_15_07","",""
"Scripts/Content/Story/B/B_AssignAmbientInfos_MIL_7.d:81","Was für eine Sauerei! Hätte ich Halvor nicht zugetraut. Bei ihm esse ich jedenfalls nicht mehr!","От же ж паскудство! Не думав, що Халвор на таке здатен. В нього більше й ні крихти не візьму!","","False","Info_Mil_7_FOODGOOD_07_08","",""
"Scripts/Content/Story/B/B_AssignAmbientInfos_MIL_7.d:101","Könnt ihr noch einen Mann gebrauchen?","Вам потрібна ще одна людина?","","False","Infos_Mil_7_JOIN.description","",""
"Scripts/Content/Story/B/B_AssignAmbientInfos_MIL_7.d:112","Du willst zur Miliz? Das kannst du direkt vergessen! Wir nehmen nur fähige Kämpfer auf.","До варти зібрався? Забудь. Ми приймаємо лиш тих, хто справді вміє битися.","","False","Infos_Mil_4_JOIN_Info_07_02","",""
"Scripts/Content/Story/B/B_AssignAmbientInfos_MIL_7.d:124","Erzähl mir was über die Orks","Розкажи мені щось про орків","","False","Infos_Mil_7_STORY.description","",""
"Scripts/Content/Story/B/B_AssignAmbientInfos_MIL_7.d:134","Erzähl mir was über die Orks.","Розкажи мені щось про орків.","","False","Infos_Mil_7_STORY_ORK_Info_15_01","",""
"Scripts/Content/Story/B/B_AssignAmbientInfos_MIL_7.d:135","Die Orks haben alle Armeen des Königs aufgrieben. Sie haben alles niedergewalzt was ihnen im Weg stand.","Орки розгромили всі королівські війська. Вони нищили все, що ставало перед ними — без жалю, без зупину, без пощади.","","False","Infos_Mil_7_STORY_ORK_Info_07_02","",""
"Scripts/Content/Story/B/B_AssignAmbientInfos_MIL_7.d:136","Jetzt lassen sie uns noch ein wenig zappeln und dann sind auch wir dran!","Вони лиш дають нам кілька зайвих днів… а далі й за нами прийдуть.","","False","Infos_Mil_7_STORY_ORK_Info_07_03","",""
"Scripts/Content/Story/B/B_AssignAmbientInfos_MIL_7.d:148","Wer hat bei euch das Sagen?","Хто у вас головний?","","False","Infos_Mil_7_BOSS.description","",""
"Scripts/Content/Story/B/B_AssignAmbientInfos_MIL_7.d:168","Wer hat bei euch  das Sagen?","Хто у вас головний?","","False","Infos_Mil_7_BOSS_Info_15_01","",""
"Scripts/Content/Story/B/B_AssignAmbientInfos_MIL_7.d:169","Berengar, der Hauptmann. Aber mit jemanden wie dir wird er nicht reden. Ihm untersteht Leutnant Brutus.","Беренгар — капітан. Але з таким, як ти, він говорити не буде. За це відповідає лейтенант Брут.","","False","Infos_Mil_7_BOSS_Info_07_02","",""
"Scripts/Content/Story/B/B_AssignAmbientInfos_MIL_9.d:32","Wie läufts?","Як справи?","","False","Infos_Mil_9_HI.description","",""
"Scripts/Content/Story/B/B_AssignAmbientInfos_MIL_9.d:42","Wie läufts?","Як справи?","","False","Infos_Mil_9_HI_Info_15_01","",""
"Scripts/Content/Story/B/B_AssignAmbientInfos_MIL_9.d:43","(brummig) jaja, läuft gut.","(буркнувши) Так, так, все добре.","","False","Infos_Mil_9_HI_Info_06_02","",""
"Scripts/Content/Story/B/B_AssignAmbientInfos_MIL_9.d:55","Übles Essen hier! Willst du dir etwas Silber verdienen?","Жратва тут — чиста гидота! Хочеш підробити трохи срібла?","","False","Info_Mil_9_FOODGOOD.description","",""
"Scripts/Content/Story/B/B_AssignAmbientInfos_MIL_9.d:72","Übles Essen hier! Willst du dir etwas Silber verdienen?","Жратва тут — чиста гидота! Хочеш підробити трохи срібла?","","False","Info_Mil_9_FOODGOOD_15_01","",""
"Scripts/Content/Story/B/B_AssignAmbientInfos_MIL_9.d:76","Was muss ich dafür machen?","Що треба зробити?","","False","Info_Mil_9_FOODGOOD_09_03","",""
"Scripts/Content/Story/B/B_AssignAmbientInfos_MIL_9.d:77","Kauf dein Mittagessen ab morgen bei Snaf im Aussenring!","Завтра бери свій обід у Снафа, в Зовнішньому кільці!","","False","Info_Mil_9_FOODGOOD_15_04","",""
"Scripts/Content/Story/B/B_AssignAmbientInfos_MIL_9.d:78","Warum nicht, dort schmeckt es zwar nicht ganz so gut, aber Silber ist Silber!","А чому б і ні? Там, може, й не так смачно, але срібло є срібло!","","False","Info_Mil_9_FOODGOOD_09_05","",""
"Scripts/Content/Story/B/B_AssignAmbientInfos_MIL_9.d:104","Könnt ihr noch einen Mann gebrauchen?","Вам потрібна ще одна людина?","","False","Infos_Mil_9_JOIN.description","",""
"Scripts/Content/Story/B/B_AssignAmbientInfos_MIL_9.d:114","Könnt ihr noch einen Mann gebrauchen?","Вам потрібна ще одна людина?","","False","Infos_Mil_9_JOIN_Info_15_01","",""
"Scripts/Content/Story/B/B_AssignAmbientInfos_MIL_9.d:116","Das solltest du dir gut überlegen. Bei uns ist Disziplin gefordert.","Добре зваж це рішення. Тут вимагають суворої дисципліни.","","False","Infos_Mil_9_JOIN_Info_06_02","",""
"Scripts/Content/Story/B/B_AssignAmbientInfos_MIL_9.d:117","Selbst wenn du keine Aufgaben hast, hast du Aufgaben. Jeden Tag musst du dich einmal melden.","Навіть коли в тебе немає роботи — робота є. Щодня мусиш бодай раз з’явитися.","","False","Infos_Mil_9_JOIN_Info_06_03","",""
"Scripts/Content/Story/B/B_AssignAmbientInfos_MIL_9.d:118","Wenn du das wirklich willst, dann sprich mal mit Cassian. Er ist Leutnant und kümmert sich um die Neuen.","Якщо ти справді цього хочеш, поговори з Касіаном. Він лейтенант і опікується новачками.","","False","Infos_Mil_9_JOIN_Info_06_04","",""
"Scripts/Content/Story/B/B_AssignAmbientInfos_MIL_9.d:131","Erzähl mir was über die Orks","Розкажи мені щось про орків","","False","Infos_Mil_9_STORY.description","",""
"Scripts/Content/Story/B/B_AssignAmbientInfos_MIL_9.d:141","Erzähl mir was über die Orks.","Розкажи мені про Орків.","","False","Infos_Mil_9_STORY_Info_15_01","",""
"Scripts/Content/Story/B/B_AssignAmbientInfos_MIL_9.d:142","Man darf nicht den Fehler machen, sie zu unterschätzen. Es sind keine Wilden, gegen die wir da kämpfen.","Не можна робити помилку, недооцінюючи їх. Ми боремося не з дикунами.","","False","Infos_Mil_9_STORY_Info_09_02","",""
"Scripts/Content/Story/B/B_AssignAmbientInfos_MIL_9.d:143","Sie haben eine Kultur die wahrscheinlich älter ist, als die der Menschen.","У них культура, що, певно, старша за нашу.","","False","Infos_Mil_9_STORY_Info_09_03","",""
"Scripts/Content/Story/B/B_AssignAmbientInfos_MIL_9.d:144","Aber das gefährliche ist, das sie leben um zu kämpfen. Und sie kämpfen um zu sterben.","Найгірше те, що вони живуть, щоб битися. А б’ються — щоб померти.","","False","Infos_Mil_9_STORY_Info_09_04","",""
"Scripts/Content/Story/B/B_AssignAmbientInfos_MIL_9.d:156","Wer hat hier das Sagen?","Хто тут головний?","","False","Infos_Mil_9_BOSS.description","",""
"Scripts/Content/Story/B/B_AssignAmbientInfos_MIL_9.d:179","Wer hat hier das Sagen?","Хто тут головний?","","False","Infos_Mil_9_BOSS_Info_15_01","",""
"Scripts/Content/Story/B/B_AssignAmbientInfos_MIL_9.d:180","Hauptmann Berengar führt das Kommando. Er hat zwei Leutnants die seine Befehle weitergeben, Cassian und Brutus.","Командує капітан Беренгар. Під ним два лейтенанти, що передають його накази — Касіан і Брут.","","False","Infos_Mil_9_BOSS_Info_09_02","",""
"Scripts/Content/Story/B/B_AssignAmbientInfos_THF_10.d:26","Wie läufts?","Як справи?","","False","Infos_Thf_10_HI.description","",""
"Scripts/Content/Story/B/B_AssignAmbientInfos_THF_10.d:36","Wie läufts?","Як справи?","","False","Infos_Thf_10_HI_Info_15_01","",""
"Scripts/Content/Story/B/B_AssignAmbientInfos_THF_10.d:37","Wenn du überleben willst, dann verlasse nicht das Lager. Draussen gibt es nichts, was es wert wäre sein Leben dafür aufs Spiel zu setzen!","Якщо хочеш вижити — не виходь із табору. Ззовні немає нічого, заради чого варто ризикувати життям!","","False","Infos_Thf_10_HI_Info_01_02","",""
"Scripts/Content/Story/B/B_AssignAmbientInfos_THF_10.d:73","Wie siehts im Lager aus?","Як справи в таборі?","","False","Infos_Thf_10_CAMP.description","",""
"Scripts/Content/Story/B/B_AssignAmbientInfos_THF_10.d:83","Wie siehts im Lager aus?","Як справи в таборі?","","False","Infos_Thf_10_CAMP_Info_15_01","",""
"Scripts/Content/Story/B/B_AssignAmbientInfos_THF_10.d:84","Wenn du dich mit Snaf dem Koch gutstellst, dann kriegst du eine warme Mahlzeit am Tag.","Якщо порозумієшся зі Снафом, кухарем, — матимеш одну теплу страву на день.","","False","Infos_Thf_10_CAMP_Info_01_02","",""
"Scripts/Content/Story/B/B_AssignAmbientInfos_THF_10.d:85","Ansonsten gilt, verhalte dich ruhig und mache keinen Ärger!","В іншому випадку поводься спокійно і не створюй проблем!","","False","Infos_Thf_10_CAMP_Info_01_03","",""
"Scripts/Content/Story/B/B_AssignAmbientInfos_THF_10.d:96","Wer hat hier das Sagen?","Хто тут за головного?","","False","Infos_Thf_10_BOSS.description","",""
"Scripts/Content/Story/B/B_AssignAmbientInfos_THF_10.d:106","Wer hat hier das Sagen?","Хто тут за головного?","","False","Infos_Thf_10_BOSS_Info_15_01","",""
"Scripts/Content/Story/B/B_AssignAmbientInfos_THF_10.d:107","Niemand hat mir etwas zu sagen.","Ніхто не має права мені наказувати.","","False","Infos_Thf_10_BOSS_Info_01_02","",""
"Scripts/Content/Story/B/B_AssignAmbientInfos_THF_11.d:26","Wie läufts?","Як справи?","","False","Infos_Thf_11_HI.description","",""
"Scripts/Content/Story/B/B_AssignAmbientInfos_THF_11.d:36","Wie läufts?","Як справи?","","False","Infos_Thf_11_HI_Info_15_01","",""
"Scripts/Content/Story/B/B_AssignAmbientInfos_THF_11.d:37","Ich sage dir wie es läuft. Jeder für sich und du für dich. Pass auf dich auf, denn sonst tut es keiner!","Слухай уважно: тут кожен сам за себе. І ти теж. Дивись за собою — інакше ніхто не подбає!","","False","Infos_Thf_11_HI_Info_01_02","",""
"Scripts/Content/Story/B/B_AssignAmbientInfos_THF_11.d:71","Wie siehts im Lager aus?","Як в таборі справи?","","False","Infos_Thf_11_CAMP.description","",""
"Scripts/Content/Story/B/B_AssignAmbientInfos_THF_11.d:81","Wie siehts im Lager aus?","Як в таборі справи?","","False","Infos_Thf_11_CAMP_Info_15_01","",""
"Scripts/Content/Story/B/B_AssignAmbientInfos_THF_11.d:82","Halte dich fern von den Arbeitern und den Kranken. Da gibt es nichts zu holen.","Тримайся якомога далі від робітників і хворих. Там тобі ловити нема чого.","","False","Infos_Thf_11_CAMP_Info_01_02","",""
"Scripts/Content/Story/B/B_AssignAmbientInfos_THF_11.d:83","Geh der Miliz aus dem Weg, wenn einer von ihnen in der Nähe ist, verhalte dich ruhig und provoziere sie nicht!","Оминай варту. Якщо хтось із них поблизу — поводься тихо й не провокуй!","","False","Infos_Thf_11_CAMP_Info_01_03","",""
"Scripts/Content/Story/B/B_AssignAmbientInfos_THF_11.d:91","Wer hat hier das Sagen?","Хто тут за головного?","","False","Infos_Thf_11_BOSS.description","",""
"Scripts/Content/Story/B/B_AssignAmbientInfos_THF_11.d:101","Wer hat hier das Sagen?","Хто тут за головного?","","False","Infos_Thf_11_BOSS_Info_15_01","",""
"Scripts/Content/Story/B/B_AssignAmbientInfos_THF_11.d:102","Diego ist der Anführer des Lagers. Auf sein Wort hören jeder im Lager.","Дієго — лідер табору. Його слово тут важить для кожного.","","False","Infos_Thf_11_BOSS_Info_01_02","",""
"Scripts/Content/Story/B/B_AssignAmbientInfos_THF_5.d:26","Wie läufts?","Як справи?","","False","Infos_Thf_5_HI.description","",""
"Scripts/Content/Story/B/B_AssignAmbientInfos_THF_5.d:36","Wie läufts?","Як справи?","","False","Infos_Thf_5_HI_Info_15_01","",""
"Scripts/Content/Story/B/B_AssignAmbientInfos_THF_5.d:37","Mach es wie ich, lebe in den Tag!","Роби як я — живи тим, що маєш зараз!","","False","Infos_Thf_5_HI_Info_01_02","",""
"Scripts/Content/Story/B/B_AssignAmbientInfos_THF_5.d:38","Du scheinst ja richtig gut drauf zu sein.","Бачу, ти сьогодні в доброму гуморі.","","False","Infos_Thf_5_HI_Info_15_03","",""
"Scripts/Content/Story/B/B_AssignAmbientInfos_THF_5.d:39","Denn jeder Tag könnte dein letzter sein! Wer weiß ob nicht morgen schon die Orks angreifen?","Бо кожен день може виявитися останнім. Хто знає — може, орки нападуть уже завтра?","","False","Infos_Thf_5_HI_Info_01_04","",""
"Scripts/Content/Story/B/B_AssignAmbientInfos_THF_5.d:77","Wie siehts im Lager aus?","Як справи в таборі?","","False","Infos_Thf_5_CAMP.description","",""
"Scripts/Content/Story/B/B_AssignAmbientInfos_THF_5.d:87","Wie siehts im Lager aus?","Як справи в таборі?","","False","Infos_Thf_5_CAMP_Info_15_01","",""
"Scripts/Content/Story/B/B_AssignAmbientInfos_THF_5.d:88","Die einzige Abwechslung die es hier gibt sind die abendlichen Arenakämpfe.","Розвага тут одна: ввечері дивишся бої на арені — і все.","","False","Infos_Thf_5_CAMP_Info_01_02","",""
"Scripts/Content/Story/B/B_AssignAmbientInfos_THF_5.d:89","Den Rest wirst du schon mit der Zeit selber rausfinden.","А про решту з часом ти й сам дізнаєшся.","","False","Infos_Thf_5_CAMP_Info_01_03","",""
"Scripts/Content/Story/B/B_AssignAmbientInfos_THF_5.d:100","Wer hat hier das Sagen?","Хто тут за головного?","","False","Infos_Thf_5_BOSS.description","",""
"Scripts/Content/Story/B/B_AssignAmbientInfos_THF_5.d:110","Wer hat hier das Sagen?","Хто тут за головного?","","False","Infos_Thf_5_BOSS_Info_15_01","",""
"Scripts/Content/Story/B/B_AssignAmbientInfos_THF_5.d:111","Unterschiedlich. Die Arbeiter lassen sich nur was vom Baumeister sagen, die Miliz von ihrem Hauptmann, und der Rest lässt sich von keinem was sagen.","По-різному. Робітники слухають тільки будівничого, варта — лише свого капітана, а вся решта взагалі нікого не слухає.","","False","Infos_Thf_5_BOSS_Info_01_02","",""
"Scripts/Content/Story/B/B_AssignAmbientInfos_WRK_1.d:48","Pass auf, das du nicht runterfällst!","Гляди, не зірвись!","","False","Wrk_207_Worker_STEP_Info_15_01","",""
"Scripts/Content/Story/B/B_AssignAmbientInfos_WRK_1.d:60","Wie läufts?","Як справи?","","False","Infos_Wrk_1_HI.description","",""
"Scripts/Content/Story/B/B_AssignAmbientInfos_WRK_1.d:70","Wie läufts?","Як справи?","","False","Infos_Wrk_1_HI_Info_15_01","",""
"Scripts/Content/Story/B/B_AssignAmbientInfos_WRK_1.d:71","Es gibt viel zu tun. Wir müssen vorbereitet sein, falls die Orks kommen.","Роботи не бракує. Ми маємо бути готові, якщо прийдуть орки.","","False","Infos_Wrk_1_HI_Info_01_02","",""
"Scripts/Content/Story/B/B_AssignAmbientInfos_WRK_1.d:72","Was meinst du mit Vorbereiten?","Що ти маєш на увазі під ""підготовкою""?","","False","Infos_Wrk_1_HI_Info_15_03","",""
"Scripts/Content/Story/B/B_AssignAmbientInfos_WRK_1.d:73","Einen stabilen Wallschutz aufbauen, Waffen schmieden und Vorräte anlegen. Wir müssen in jeder Hinsicht vorbereitet sein. Jeder von uns. Du solltest dich auch vorbereiten.","Звести міцний захисний вал, кувати зброю, зробити запаси. Ми маємо бути готові в усьому. Кожен із нас. І тобі теж варто підготуватися.","","False","Infos_Wrk_1_HI_Info_01_04","",""
"Scripts/Content/Story/B/B_AssignAmbientInfos_WRK_1.d:85","Wie siehts im Lager aus?","Як справи в таборі?","","False","Infos_Wrk_1_CAMP.description","",""
"Scripts/Content/Story/B/B_AssignAmbientInfos_WRK_1.d:95","Wie siehts im Lager aus?","Як справи в таборі?","","False","Infos_Wrk_1_CAMP_Info_15_01","",""
"Scripts/Content/Story/B/B_AssignAmbientInfos_WRK_1.d:96","Es könnte besser laufen, wenn mehr Leute arbeiten würden.  Es gibt einfach zuviel Gesindel.","Все йшло б куди краще, якби люди працювали. А так — самі виродки тиняються.","","False","Infos_Wrk_1_CAMP_Info_01_02","",""
"Scripts/Content/Story/B/B_AssignAmbientInfos_WRK_1.d:97","Das sie faul sind ist eine Sache, aber die sind auch feige. Und damit werden sie für uns völlig wertlos.","Ледарі — то півбіди. Але вони ще й боягузи. А від боягузів нам жодної користі.","","False","Infos_Wrk_1_CAMP_Info_01_03","",""
"Scripts/Content/Story/B/B_AssignAmbientInfos_WRK_1.d:98","Verstehe. Gerade jetzt ist jeder Mann wichtig.","Розумію. Зараз кожен чоловік на вагу золота.","","False","Infos_Wrk_1_CAMP_Info_15_04","",""
"Scripts/Content/Story/B/B_AssignAmbientInfos_WRK_1.d:99","Die nicht! Dieses Diebespack, diese faulen Hunde, soll Beliar sie alle holen!","Та ні, тільки не вони! Це злодійська наволоч, ледачі пси… хай Беліар їх забере!","","False","Infos_Wrk_1_CAMP_Info_01_05","",""
"Scripts/Content/Story/B/B_AssignAmbientInfos_WRK_1.d:135","Wer hat hier das Sagen?","Хто тут головний?","","False","Infos_Wrk_1_BOSS.description","",""
"Scripts/Content/Story/B/B_AssignAmbientInfos_WRK_1.d:151","Wer hat hier das Sagen?","Хто тут головний?","","False","Infos_Wrk_1_BOSS_Info_15_01","",""
"Scripts/Content/Story/B/B_AssignAmbientInfos_WRK_1.d:152","Bromor. Er ist der Baumeister. Sprich mit ihm, wenn du was willst.","Бромор. Він будівничий. Якщо щось треба — звертайся до нього.","","False","Infos_Wrk_1_BOSS_Info_01_02","",""
"Scripts/Content/Story/B/B_AssignAmbientInfos_WRK_11.d:29","Wie läufts?","Як справи?","","False","Infos_Wrk_11_HI.description","",""
"Scripts/Content/Story/B/B_AssignAmbientInfos_WRK_11.d:39","Wie läufts?","Як справи?","","False","Infos_Wrk_11_HI_Info_15_01","",""
"Scripts/Content/Story/B/B_AssignAmbientInfos_WRK_11.d:40","Gut. Es gibt zwar noch genug Arbeit, aber wir haben schon eine starke Verteidigung.","Добре. Справ ще хоч греблю гати, але оборона в нас уже сильна.","","False","Infos_Wrk_11_HI_Info_11_02","",""
"Scripts/Content/Story/B/B_AssignAmbientInfos_WRK_11.d:41","Das gibt den Männern Mut. Und den werden sie brauchen, falls die Orks angreifen.","Це додає людям відваги. А вона їм знадобиться, якщо орки нападуть.","","False","Infos_Wrk_11_HI_Info_11_03","",""
"Scripts/Content/Story/B/B_AssignAmbientInfos_WRK_11.d:42","Und werden die Orks angreifen?","А орки нападуть?","","False","Infos_Wrk_11_HI_Info_15_04","",""
"Scripts/Content/Story/B/B_AssignAmbientInfos_WRK_11.d:43","Wenn es soweit ist, werden wir es wissen.","Коли настане час — ми про це дізнаємося.","","False","Infos_Wrk_11_HI_Info_11_05","",""
"Scripts/Content/Story/B/B_AssignAmbientInfos_WRK_11.d:55","Wie siehts im Lager aus?","Як справи в таборі?","","False","Infos_Wrk_11_CAMP.description","",""
"Scripts/Content/Story/B/B_AssignAmbientInfos_WRK_11.d:65","Wie siehts im Lager aus?","Як справи в таборі?","","False","Infos_Wrk_11_CAMP_Info_15_01","",""
"Scripts/Content/Story/B/B_AssignAmbientInfos_WRK_11.d:66","Seit unserer Ankunft hier sind wir damit beschäftigt das Lager wieder aufzubauen.","Відтоді як ми тут, ми без упину відбудовуємо табір.","","False","Infos_Wrk_11_CAMP_Info_11_02","",""
"Scripts/Content/Story/B/B_AssignAmbientInfos_WRK_11.d:67","Und die Arbeit geht voran. Die Orks werden sich ihre Schädel am Wall einrennen!","Робота йде, а орки поб'ють чоли об наш вал!","","False","Infos_Wrk_11_CAMP_Info_11_03","",""
"Scripts/Content/Story/B/B_AssignAmbientInfos_WRK_11.d:68","Glaubst du, sie werden bald angreifen?","Як гадаєш, вони скоро нападуть?","","False","Infos_Wrk_11_CAMP_Info_15_04","",""
"Scripts/Content/Story/B/B_AssignAmbientInfos_WRK_11.d:69","Natürlich. Wozu machen wir uns sonst die ganze Arbeit?","Звичайно. Інакше навіщо ми все це робимо?","","False","Infos_Wrk_11_CAMP_Info_11_05","",""
"Scripts/Content/Story/B/B_AssignAmbientInfos_WRK_11.d:105","Wer hat hier das Sagen?","Хто тут головний?","","False","Infos_Wrk_11_BOSS.description","",""
"Scripts/Content/Story/B/B_AssignAmbientInfos_WRK_11.d:124","Wer hat hier das Sagen?","Хто тут головний?","","False","Infos_Wrk_11_BOSS_Info_15_01","",""
"Scripts/Content/Story/B/B_AssignAmbientInfos_WRK_11.d:125","Gotmar der Schmied und Bromor der Baumeister. Die beiden haben das Kommando.","Ґотмар — ковалівський майстер, Бромор — будівничий. Ці двоє тут командують.","","False","Infos_Wrk_11_BOSS_Info_11_02","",""
