"location","source","target","id","fuzzy","context","translator_comments","developer_comments"
"Scripts/Content/Story/Chapters/B_FindNpc_MIL.d:11","Wo finde ich...","Де я можу знайти...","","False","Info_FindNPC_MIL.description","",""
"Scripts/Content/Story/Chapters/B_FindNpc_MIL.d:35","...Berengar?","...Беренгар?","","False","Info_FindNPC_MIL_Info.Info_FindNPC_MIL.Info_FindNPC_MIL_Berengar","AI_AddChoice",""
"Scripts/Content/Story/Chapters/B_FindNpc_MIL.d:41","...Brutus?","...Брутус?","","False","Info_FindNPC_MIL_Info.Info_FindNPC_MIL.Info_FindNPC_MIL_Brutus","AI_AddChoice",""
"Scripts/Content/Story/Chapters/B_FindNpc_MIL.d:47","...Halvor?","...Халвор?","","False","Info_FindNPC_MIL_Info.Info_FindNPC_MIL.Info_FindNPC_MIL_Halvor","AI_AddChoice",""
"Scripts/Content/Story/Chapters/B_FindNpc_MIL.d:53","...Cassian?","...Касіан?","","False","Info_FindNPC_MIL_Info.Info_FindNPC_MIL.Info_FindNPC_MIL_Cassian","AI_AddChoice",""
"Scripts/Content/Story/Chapters/B_FindNpc_MIL.d:68","Wo finde ich Berengar?","Де я можу знайти Беренгара?","","False","Info_FindNPC_Berengar_15_00","",""
"Scripts/Content/Story/Chapters/B_FindNpc_MIL.d:77","Tagsüber im Burginnenhof. Allerdings solltest du ihm lieber fernbleiben. Er ist leicht reizbar!","Вдень у внутрішньому дворі замка. Однак краще триматися від нього подалі. Він дуже дратівливий!","","False","Info_FindNPC_MIL_Berengar_04_01","",""
"Scripts/Content/Story/Chapters/B_FindNpc_MIL.d:81","Tagsüber im Burginnenhof. Allerdings solltest du ihm lieber fernbleiben. Er ist leicht reizbar!","Вдень у внутрішньому дворі замка. Однак краще триматися від нього подалі. Він дуже дратівливий!","","False","Info_FindNPC_MIL_Berengar_06_01","",""
"Scripts/Content/Story/Chapters/B_FindNpc_MIL.d:85","Tagsüber im Burginnenhof. Allerdings solltest du ihm lieber fernbleiben. Er ist leicht reizbar!","Вдень у внутрішньому дворі замка. Однак краще триматися від нього подалі. Він дуже дратівливий!","","False","Info_FindNPC_MIL_Berengar_07_01","",""
"Scripts/Content/Story/Chapters/B_FindNpc_MIL.d:89","Tagsüber im Burginnenhof. Allerdings solltest du ihm lieber fernbleiben. Er ist leicht reizbar!","Вдень у внутрішньому дворі замка. Однак краще триматися від нього подалі. Він дуже дратівливий!","","False","Info_FindNPC_MIL_Berengar_09_01","",""
"Scripts/Content/Story/Chapters/B_FindNpc_MIL.d:98","Wo finde ich Brutus?","Де я можу знайти Брутуса?","","False","Info_FindNPC_Brutus_15_00","",""
"Scripts/Content/Story/Chapters/B_FindNpc_MIL.d:107","Er hängt die meiste Zeit bei der Arena rum. Er trägt auch Kämpfe aus.","Більшу частину часу він біля арени. Також він бере участь у боях.","","False","Info_FindNPC_MIL_Brutus_04_01","",""
"Scripts/Content/Story/Chapters/B_FindNpc_MIL.d:111","Er hängt die meiste Zeit bei der Arena rum. Er trägt auch Kämpfe aus.","Більшу частину часу він біля арени. Також він бере участь у боях.","","False","Info_FindNPC_MIL_Brutus_06_01","",""
"Scripts/Content/Story/Chapters/B_FindNpc_MIL.d:115","Er hängt die meiste Zeit bei der Arena rum. Er trägt auch Kämpfe aus.","Більшу частину часу він біля арени. Також він бере участь у боях.","","False","Info_FindNPC_MIL_Brutus_07_01","",""
"Scripts/Content/Story/Chapters/B_FindNpc_MIL.d:119","Er hängt die meiste Zeit bei der Arena rum. Er trägt auch Kämpfe aus.","Більшу частину часу він біля арени. Також він бере участь у боях.","","False","Info_FindNPC_MIL_Brutus_09_01","",""
"Scripts/Content/Story/Chapters/B_FindNpc_MIL.d:128","Wo finde ich Halvor?","Де я можу знайти Халвора?","","False","Info_FindNPC_Halvor_15_00","",""
"Scripts/Content/Story/Chapters/B_FindNpc_MIL.d:137","Im Burghof ganz rechts ist die Küche. Das ist sein Reich.","У правій частині внутрішнього двора знаходиться кухня. Це його царина.","","False","Info_FindNPC_MIL_Halvor_04_01","",""
"Scripts/Content/Story/Chapters/B_FindNpc_MIL.d:141","Im Burghof ganz rechts ist die Küche. Das ist sein Reich.","У правій частині внутрішнього двора знаходиться кухня. Це його царина.","","False","Info_FindNPC_MIL_Halvor_06_01","",""
"Scripts/Content/Story/Chapters/B_FindNpc_MIL.d:145","Im Burghof ganz rechts ist die Küche. Das ist sein Reich.","У правій частині внутрішнього двора знаходиться кухня. Це його царина.","","False","Info_FindNPC_MIL_Halvor_07_01","",""
"Scripts/Content/Story/Chapters/B_FindNpc_MIL.d:149","Im Burghof ganz rechts ist die Küche. Das ist sein Reich.","У правій частині внутрішнього двора знаходиться кухня. Це його царина.","","False","Info_FindNPC_MIL_Halvor_09_01","",""
"Scripts/Content/Story/Chapters/B_FindNpc_MIL.d:158","Wo finde ich Cassian?","Де я можу знайти Кассіана?","","False","Info_FindNPC_Cassian_15_00","",""
"Scripts/Content/Story/Chapters/B_FindNpc_MIL.d:167","Tagsüber trainiert er im Burghof.","Вдень він тренується у дворі замка.","","False","Info_FindNPC_MIL_Cassian_04_01","",""
"Scripts/Content/Story/Chapters/B_FindNpc_MIL.d:171","Tagsüber trainiert er im Burghof.","Вдень він тренується у дворі замка.","","False","Info_FindNPC_MIL_Cassian_06_01","",""
"Scripts/Content/Story/Chapters/B_FindNpc_MIL.d:175","Tagsüber trainiert er im Burghof.","Вдень він тренується у дворі замка.","","False","Info_FindNPC_MIL_Cassian_07_01","",""
"Scripts/Content/Story/Chapters/B_FindNpc_MIL.d:180","Tagsüber trainiert er im Burghof.","Вдень він тренується у дворі замка.","","False","Info_FindNPC_MIL_Cassian_09_01","",""
"Scripts/Content/Story/Chapters/B_FindNpc_WRK.d:11","Wo finde ich...","Де я можу знайти...","","False","Info_FindNPC_WRK.description","",""
"Scripts/Content/Story/Chapters/B_FindNpc_WRK.d:34","...Bromor?","...Бромора?","","False","Info_FindNPC_WRK_Info.Info_FindNPC_WRK.Info_FindNPC_WRK_Bromor","AI_AddChoice",""
"Scripts/Content/Story/Chapters/B_FindNpc_WRK.d:40","...Gotmar?","...Готмара?","","False","Info_FindNPC_WRK_Info.Info_FindNPC_WRK.Info_FindNPC_WRK_Gotmar","AI_AddChoice",""
"Scripts/Content/Story/Chapters/B_FindNpc_WRK.d:55","Wo finde ich Bromor?","Де я можу знайти Бромора?","","False","Info_FindNPC_Bromor_15_00","",""
"Scripts/Content/Story/Chapters/B_FindNpc_WRK.d:64","Dort wo gearbeitet wird. Er steht tagsüber in der Nähe der Bühne.","Там, де ведуть роботи. Вдень він стоїть біля сцени.","","False","Info_FindNPC_WRK_Bromor_01_01","",""
"Scripts/Content/Story/Chapters/B_FindNpc_WRK.d:69","Dort wo gearbeitet wird. Er steht tagsüber in der Nähe der Bühne.","Там, де ведуть роботи. Вдень він стоїть біля сцени.","","False","Info_FindNPC_WRK_Bromor_02_01","",""
"Scripts/Content/Story/Chapters/B_FindNpc_WRK.d:74","Dort wo gearbeitet wird. Er steht tagsüber in der Nähe der Bühne.","Там, де ведуть роботи. Вдень він стоїть біля сцени.","","False","Info_FindNPC_WRK_Bromor_06_01","",""
"Scripts/Content/Story/Chapters/B_FindNpc_WRK.d:79","Dort wo gearbeitet wird. Er steht tagsüber in der Nähe der Bühne.","Там, де ведуть роботи. Вдень він стоїть біля сцени.","","False","Info_FindNPC_WRK_Bromor_11_01","",""
"Scripts/Content/Story/Chapters/B_FindNpc_WRK.d:88","Wo finde ich Gotmar?","Де я можу знайти Готмара?","","False","Info_FindNPC_Gotmar_15_00","",""
"Scripts/Content/Story/Chapters/B_FindNpc_WRK.d:97","Wenn du ins Lager reinkommst, ist auf der rechten Seite die Schmiede. Gotmar ist dort den ganzen Tag beschäftigt.","Як тільки ввійдеш до складу, одразу праворуч побачиш кузню. Готмар там цілий день.","","False","Info_FindNPC_WRK_Gotmar_01_01","",""
"Scripts/Content/Story/Chapters/B_FindNpc_WRK.d:102","Wenn du ins Lager reinkommst, ist auf der rechten Seite die Schmiede. Gotmar ist dort den ganzen Tag beschäftigt.","Як тільки ввійдеш до складу, одразу праворуч побачиш кузню. Готмар там цілий день.","","False","Info_FindNPC_WRK_Gotmar_02_01","",""
"Scripts/Content/Story/Chapters/B_FindNpc_WRK.d:107","Vorne am Lagereingang steht die Schmiede. Folge einfach dem Lärm.","Кузня розташована прямо біля входу в табір. Просто слідуй за шумом.","","False","Info_FindNPC_WRK_Gotmar_06_01","",""
"Scripts/Content/Story/Chapters/B_FindNpc_WRK.d:112","Neben dem Haupteingang ist die Schmiede. Und wo die Schmiede ist, ist der Schmied nicht fern.","Біля головного входу — кузня. А де кузня димить до зорі — десь поряд коваль бурчить угорі.","","False","Info_FindNPC_WRK_Gotmar_11_01","",""
"Scripts/Content/Story/B/B_AssignAmbientInfos_MIL_4.d:32","Wie läufts?","Як справи?","","False","Infos_Mil_4_HI.description","",""
"Scripts/Content/Story/B/B_AssignAmbientInfos_MIL_4.d:42","Wie läufts?","Як справи?","","False","Infos_Mil_4_HI_Info_15_01","",""
"Scripts/Content/Story/B/B_AssignAmbientInfos_MIL_4.d:43","Es ist immer dasselbe Spiel Jungchen. Auf der einen Seite stehen wir, auf der anderen der Feind.","Знову те саме, хлопче. Ми — отут. Ворог — там. Як завжди.","","False","Infos_Mil_4_HI_Info_04_02","",""
"Scripts/Content/Story/B/B_AssignAmbientInfos_MIL_4.d:44","Manchmal verlieren wir, manchmal gewinnen wir.","Іноді ми програємо, іноді виграємо.","","False","Infos_Mil_4_HI_Info_04_03","",""
"Scripts/Content/Story/B/B_AssignAmbientInfos_MIL_4.d:56","Wie schmeckt das Essen hier?","Як тут їжа на смак?","","False","Info_Mil_4_FOODGOOD.description","",""
"Scripts/Content/Story/B/B_AssignAmbientInfos_MIL_4.d:73","Wie schmeckt das Essen hier?","Як тут їжа на смак?","","False","Info_Mil_4_FOODGOOD_15_01","",""
"Scripts/Content/Story/B/B_AssignAmbientInfos_MIL_4.d:74","Halvors Frass kann man wirklich essen.","Халворове вариво — й справді їстівне.","","False","Info_Mil_4_FOODGOOD_04_02","",""
"Scripts/Content/Story/B/B_AssignAmbientInfos_MIL_4.d:75","Aber nur, wenn nicht wieder einer der Jungs hier sich den üblichen Spass erlaubt!","Тільки якщо знову хтось із хлопців не влаштує свій звичний глуз!","","False","Info_Mil_4_FOODGOOD_04_03","",""
"Scripts/Content/Story/B/B_AssignAmbientInfos_MIL_4.d:76","Was für einen Spass?","Який ще глуз?","","False","Info_Mil_4_FOODGOOD_15_04","",""
"Scripts/Content/Story/B/B_AssignAmbientInfos_MIL_4.d:77","Sie gehen zu Talamon, dem Alchemiesten und besorgen sich Müffelsalz.","Забіжи до Таламона, алхіміка, та візьми в нього ту їхню затхлу сіль.","","False","Info_Mil_4_FOODGOOD_04_05","",""
"Scripts/Content/Story/B/B_AssignAmbientInfos_MIL_4.d:78","Dann wenn Halvor nicht hinsieht, ab damit in den Kochkessel, und rein zufällig hat dann der Witzbold am diesem Tag überhaupt keinen Hunger!","А потім, коли Халвор не дивиться, трошки того в казан — і жартівник раптом цілий день ""не голодний""!","","False","Info_Mil_4_FOODGOOD_04_06","",""
"Scripts/Content/Story/B/B_AssignAmbientInfos_MIL_4.d:94","Könnt ihr noch einen Mann gebrauchen?","Вам потрібна ще одна людина?","","False","Infos_Mil_4_JOIN.description","",""
"Scripts/Content/Story/B/B_AssignAmbientInfos_MIL_7.d:111","Könnt ihr noch einen Mann gebrauchen?","Вам потрібна ще одна людина?","","False","Infos_Mil_4_JOIN_Info_15_01","",""
"Scripts/Content/Story/B/B_AssignAmbientInfos_MIL_4.d:105","Das obliegt nicht meiner Entscheidung, Jungchen.","Не від мене це залежить, хлопче.","","False","Infos_Mil_4_JOIN_Info_04_02","",""
"Scripts/Content/Story/B/B_AssignAmbientInfos_MIL_4.d:106","Unser Hauptmann Berengar entscheidet das. Aber ich kann dir sagen, was die Bedingungen für eine Aufnahme sind.","Вирішує наш капітан — Беренгар. А я можу підказати, що треба, щоб тебе взяли.","","False","Infos_Mil_4_JOIN_Info_04_03","",""
"Scripts/Content/Story/B/B_AssignAmbientInfos_MIL_4.d:112","Was sind die Bedingungen?","Що треба?","","False","Infos_Mil_4_JOIN_Info.Infos_Mil_4_JOIN.Infos_Mil_4_JOIN_CONDI","AI_AddChoice",""
"Scripts/Content/Story/B/B_AssignAmbientInfos_MIL_4.d:122","Was sind die Bedingungen?","Що треба?","","False","Infos_Mil_4_JOIN_CONDI_Info_15_01","",""
"Scripts/Content/Story/B/B_AssignAmbientInfos_MIL_4.d:123","Es gibt drei Bedingungen, die ein Mann erfüllen muss, um Rekrut bei der Miliz zu werden.","Є три речі, які ти мусиш виконати, щоб тебе взяли до варти.","","False","Infos_Mil_4_JOIN_CONDI_Info_04_02","",""
"Scripts/Content/Story/B/B_AssignAmbientInfos_MIL_4.d:124","Zunächst musst den Umgang mit einer Waffe beherrschen und einen kräftigen Arm haben. Vorher brauchst du nicht mal mit jemanden darüber sprechen.","Спершу ти маєш уміти поводитися зі зброєю й мати міцну руку. Інакше немає сенсу навіть заїкатися про розмову.","","False","Infos_Mil_4_JOIN_CONDI_Info_04_03","",""
"Scripts/Content/Story/B/B_AssignAmbientInfos_MIL_4.d:125","Wenn du dich dann zur Miliz meldest, wirst du zur Wache eingeteilt. Das kann alles mögliche bedeuten.","Коли подасися до варти, тебе поставлять на якийсь пост. І що це буде — хто його знає.","","False","Infos_Mil_4_JOIN_CONDI_Info_04_04","",""
"Scripts/Content/Story/B/B_AssignAmbientInfos_MIL_4.d:126","Entweder ein Tor bewachen, Patrouillie gehen, auf der Pallisade stehen, es gibt einen ganzen Haufen Arbeit mit der du beschäftigt werden kannst.","Можуть поставити стерегти браму, можуть погнати в патруль, можуть виставити на палісаду — роботи вистачає, тебе є куди притулити.","","False","Infos_Mil_4_JOIN_CONDI_Info_04_05","",""
"Scripts/Content/Story/B/B_AssignAmbientInfos_MIL_4.d:127","Schlägt dein Herz danach immer noch für die Miliz, dann darfst du gegen einen von uns antreten. Wenn du danach noch stehst, bist du dabei.","Як після всього в тебе й далі буде свербіти стати до варти — матимеш право вийти проти когось із нас. Вистоїш після бою — будеш у справі.","","False","Infos_Mil_4_JOIN_CONDI_Info_04_06","",""
"Scripts/Content/Story/B/B_AssignAmbientInfos_MIL_4.d:128","Aber denke daran, wenn du zur Miliz gehörst, dann ist Schluss mit dem faulen Leben. Dann ist Disziplin gefordert! Jeden Tag Meldung machen!","Але пам’ятай: у варті вже не буде ледачого життя. Там дисципліна — як цвях у чоботі. Щодня маєш з’являтися на переклик!","","False","Infos_Mil_4_JOIN_CONDI_Info_04_07","",""
"Scripts/Content/Story/B/B_AssignAmbientInfos_MIL_4.d:142","Erzähl mir was über die Orks","Розкажи мені про Орків.","","False","Infos_Mil_4_STORY.description","",""
"Scripts/Content/Story/B/B_AssignAmbientInfos_MIL_4.d:152","Erzähl mir was über die Orks.","Розкажи мені про Орків.","","False","Infos_Mil_4_STORY_Info_15_01","",""
"Scripts/Content/Story/B/B_AssignAmbientInfos_MIL_4.d:153","Ich habe schon oft gegen die Orks gekämpft.","Я вже не раз виходив проти орків.","","False","Infos_Mil_4_STORY_Info_04_03","",""
"Scripts/Content/Story/B/B_AssignAmbientInfos_MIL_4.d:154","Früher bei den Grenzkriegen, da haben sie uns auch belagert. Genau wie jetzt.","Колись, під час прикордонних битв, вони теж брали нас в облогу — так само, як і зараз.","","False","Infos_Mil_4_STORY_Info_04_04","",""
"Scripts/Content/Story/B/B_AssignAmbientInfos_MIL_4.d:155","Sie werden auf einen günstigen Moment warten. Und wenn wir nicht damit rechnen, dann werden sei da sein!","Вони вичікуватимуть момент. І варто нам лиш розслабитися — вони вже тут, як тут!","","False","Infos_Mil_4_STORY_Info_04_05","",""
"Scripts/Content/Story/B/B_AssignAmbientInfos_MIL_4.d:167","Wer hat hier das Sagen?","Хто тут головний?","","False","Infos_Mil_4_BOSS.description","",""
"Scripts/Content/Story/B/B_AssignAmbientInfos_MIL_4.d:185","Wer hat hier das Sagen?","Хто тут головний?","","False","Infos_Mil_4_BOSS_Info_15_01","",""
"Scripts/Content/Story/B/B_AssignAmbientInfos_MIL_4.d:186","Berengar ist unser Hauptmann. Aber du solltest ihm aus dem Weg gehen, glaub mir.","Беренгар — наш капітан. Але радив би тобі триматися від нього якомога далі, повір мені.","","False","Infos_Mil_4_BOSS_Info_04_02","",""
"Scripts/Content/Story/B/B_AssignAmbientInfos_MIL_4.d:187","Sprich lieber mit Cassian, das ist sein Leutnant.","Краще поговори з Касіаном, це його заступник.","","False","Infos_Mil_4_BOSS_Info_04_03","",""
"Scripts/Content/Story/B/B_AssignAmbientInfos_MIL_6.d:32","Wie läufts?","Як справи?","","False","Infos_Mil_6_HI.description","",""
"Scripts/Content/Story/B/B_AssignAmbientInfos_MIL_6.d:42","Wie läufts?","Як справи?","","False","Infos_Mil_6_HI_Info_15_01","",""
"Scripts/Content/Story/B/B_AssignAmbientInfos_MIL_6.d:43","Wie es im Krieg halt so läuft. Wenn die Orks kommen, greifen wir an. Wenn nicht, dann warten wir weiter.","Як завжди на війні. Орки прийдуть — б’ємося. Не прийдуть — чекаємо та відпочиваємо.","","False","Infos_Mil_6_HI_Info_06_02","",""
"Scripts/Content/Story/B/B_AssignAmbientInfos_MIL_6.d:55","Ich hab hier etwas Silber, warum isst du ab Morgen nicht einfach bei Snaf?","У мене тут трохи срібла. Чому б тобі не харчуватися в Снафа з завтрашнього дня?","","False","Info_Mil_6_FOODGOOD.description","",""
"Scripts/Content/Story/B/B_AssignAmbientInfos_MIL_6.d:72","Ich hab hier etwas Silber, warum isst du ab Morgen nicht einfach bei Snaf?","У мене тут трохи срібла. Чому б тобі не харчуватися в Снафа з завтрашнього дня?","","False","Info_Mil_6_FOODGOOD_15_01","",""
"Scripts/Content/Story/B/B_AssignAmbientInfos_MIL_6.d:77","Das ist ein Wort! Halvor's Eintopf schmeckt zwar gut, aber er ist auch ziemlich teuer.","Звісно ж! Хоч рагу Халвора смачне, але й збіса дороге.","","False","Info_Mil_6_FOODGOOD_06_03","",""
"Scripts/Content/Story/B/B_AssignAmbientInfos_MIL_6.d:101","Könnt ihr noch einen Mann gebrauchen?","Вам потрібна ще одна людина?","","False","Infos_Mil_6_JOIN.description","",""
"Scripts/Content/Story/B/B_AssignAmbientInfos_MIL_6.d:111","Könnt ihr noch einen Mann gebrauchen?","Вам потрібна ще одна людина?","","False","Infos_Mil_6_JOIN_Info_15_01","",""
"Scripts/Content/Story/B/B_AssignAmbientInfos_MIL_6.d:116","Ich glaube du bist soweit. Sprich mal mit Cassian. Einer Aufnahme steht wohl nichts mehr im Weg.","Гадаю, ти вже готовий. Поговори з Касіаном — здається, нічого більше не стоїть на заваді, щоб тебе взяли.","","False","Infos_Mil_6_JOIN_Info_06_03","",""
"Scripts/Content/Story/B/B_AssignAmbientInfos_MIL_6.d:122","Du bist noch nicht soweit. Sprich mit Leutnant Cassian , wenn du trainiert hast!","Ще зарано. Потренуйся — і тоді поговориш з лейтенантом Касіаном!","","False","Infos_Mil_6_JOIN_Info_06_04","",""
"Scripts/Content/Story/B/B_AssignAmbientInfos_MIL_6.d:126","Natürlich. Gute Männer können wir immer gebrauchen. Die Frage ist, bist du gut?","Авжеж. Міцних людей нам завжди бракує. Але питання одне: ти справді міцний?","","False","Infos_Mil_6_JOIN_Info_06_02","",""
"Scripts/Content/Story/B/B_AssignAmbientInfos_MIL_6.d:130","Ich weiß es nicht","Я не знаю","","False","Infos_Mil_6_JOIN_Info.Infos_Mil_6_JOIN.Infos_Mil_6_JOIN_DONTKNOW","AI_AddChoice",""
"Scripts/Content/Story/B/B_AssignAmbientInfos_MIL_6.d:131","Ich bin der Beste","Я найкращий!","","False","Infos_Mil_6_JOIN_Info.Infos_Mil_6_JOIN.Infos_Mil_6_JOIN_BEST","AI_AddChoice",""
"Scripts/Content/Story/B/B_AssignAmbientInfos_MIL_6.d:132","Ich  bin verdammt gut","Я, чорт забирай, міцний","","False","Infos_Mil_6_JOIN_Info.Infos_Mil_6_JOIN.Infos_Mil_6_JOIN_DAMNGOOD","AI_AddChoice",""
"Scripts/Content/Story/B/B_AssignAmbientInfos_MIL_6.d:133","Ich bin gut","Так, я міцний","","False","Infos_Mil_6_JOIN_Info.Infos_Mil_6_JOIN.Infos_Mil_6_JOIN_GOOD","AI_AddChoice",""
"Scripts/Content/Story/B/B_AssignAmbientInfos_MIL_6.d:139","Ich weiß es nicht.","Я не знаю.","","False","Infos_Mil_6_JOIN_DONTKNOW_Info_15_01","",""
"Scripts/Content/Story/B/B_AssignAmbientInfos_MIL_6.d:140","Wenn du es nicht weißt, wer soll es dann wissen?","То якщо ти не знаєш — хто взагалі знає?","","False","Infos_Mil_6_JOIN_DONTKNOW_Info_06_02","",""
"Scripts/Content/Story/B/B_AssignAmbientInfos_MIL_6.d:141","Ist vielleicht besser, du trainierst noch ne Weile, bevor du uns beitrittst.","Мабуть, краще тобі ще трохи потренуватися, перш ніж доєднуватися до нас.","","False","Infos_Mil_6_JOIN_DONTKNOW_Info_06_03","",""
"Scripts/Content/Story/B/B_AssignAmbientInfos_MIL_6.d:149","Ich bin der Beste.","Я найкращий!","","False","Infos_Mil_6_JOIN_BEST_Info_15_01","",""
"Scripts/Content/Story/B/B_AssignAmbientInfos_MIL_6.d:150","Scheinst ja sehr von dir überzeugt zu sein. Dann wirst du ja auch alleine zurecht kommen.","Бачу, впевненості в тебе хоч відбавляй. Ну що ж — тоді сам й розберешся.","","False","Infos_Mil_6_JOIN_BEST_Info_06_02","",""
"Scripts/Content/Story/B/B_AssignAmbientInfos_MIL_6.d:158","Ich  bin verdammt gut.","Я, чорт забирай, міцний","","False","Infos_Mil_6_JOIN_DAMNGOOD_Info_15_01","",""
"Scripts/Content/Story/B/B_AssignAmbientInfos_MIL_6.d:159","Das musst du auch sein, wenn du uns beitreten willst.","Таким і маєш бути, якщо хочеш до нас доєднатися.","","False","Infos_Mil_6_JOIN_DAMNGOOD_Info_06_02","",""
"Scripts/Content/Story/B/B_AssignAmbientInfos_MIL_6.d:167","Ich bin gut.","Так, я міцний.","","False","Infos_Mil_6_JOIN_GOOD_Info_15_01","",""
"Scripts/Content/Story/B/B_AssignAmbientInfos_MIL_6.d:168","Das wird sich noch zeigen. Sprich mal mit Cassian. Er wird entscheiden, ob du gut genug bist.","Це стане ясно пізніше. Поговори з Касіяном — він уже розбереться, чи ти годишся.","","False","Infos_Mil_6_JOIN_GOOD_Info_06_02","",""
"Scripts/Content/Story/B/B_AssignAmbientInfos_MIL_6.d:183","Erzähl mir was über die Orks","Розкажи мені щось про орків","","False","Infos_Mil_6_STORY.description","",""
"Scripts/Content/Story/B/B_AssignAmbientInfos_MIL_6.d:193","Erzähl mir was über die Orks","Розкажи мені щось про орків","","False","Infos_Mil_6_STORY_Info_15_01","",""
"Scripts/Content/Story/B/B_AssignAmbientInfos_MIL_6.d:194","Sie haben an den Tal- Zugängen Stellung bezogen. Haben sich eingenistet wie die Ratten im Gemäuer.","Вони зайняли позиції на входах до долини. Улаштувалися там, наче щури в стінах.","","False","Infos_Mil_6_STORY_Info_06_02","",""
"Scripts/Content/Story/B/B_AssignAmbientInfos_MIL_6.d:195","Haben alle Vorteile auf ihrer Seite. Möchte wetten das sie hinter den Bergen einen Haufen Feldlager errichtet haben.","Вони мають значну перевагу. Б’юся об заклад, вони вже отаборилися за горами.","","False","Infos_Mil_6_STORY_Info_06_03","",""
"Scripts/Content/Story/B/B_AssignAmbientInfos_MIL_6.d:196","Werden wohl ein paar hundert sein. Dreckige Bastarde.","Сотні, не менше. Гидомирні виродки.","","False","Infos_Mil_6_STORY_Info_06_04","",""
