"location","source","target","id","fuzzy","context","translator_comments","developer_comments"
"Scripts/Content/Story/Missions/DIA_PAL_1029_Osraed.d:49","HALT!","СТІЙ!","","False","PAL_1029_FirstWarn_Info_06_01","",""
"Scripts/Content/Story/Missions/DIA_PAL_1029_Osraed.d:50","Was ist?","В чому справа?","","False","PAL_1029_FirstWarn_Info_15_02","",""
"Scripts/Content/Story/Missions/DIA_PAL_1029_Osraed.d:51","Hier dürfen nur Gefolgsleute des Königs passieren!","Тут дозволено проходити лише слугам Короля!","","False","PAL_1029_FirstWarn_Info_06_03","",""
"Scripts/Content/Story/Missions/DIA_PAL_1029_Osraed.d:52","Also verschwinde!","Тож геть звідси!","","False","PAL_1029_FirstWarn_Info_06_04","",""
"Scripts/Content/Story/Missions/DIA_PAL_1029_Osraed.d:90","Noch einen Schritt weiter und wir machen Kleinholz aus dir!","Ще крок і від тебе залишиться мокре місце!","","False","PAL_1029_LastWarn_06_01","",""
"Scripts/Content/Story/Missions/DIA_PAL_1029_Osraed.d:179","Lass mich rein, ich möchte Soldat des Königs werden!","Пропусти мене, я хочу стати солдатом Короля!","","False","PAL_1029_SOLDIER.description","",""
"Scripts/Content/Story/Missions/DIA_PAL_1029_Osraed.d:194","Lass mich rein, ich möchte Soldat des Königs werden!","Пропусти мене, я хочу стати солдатом Короля!","","False","PAL_1029_SOLDIER_15_01","",""
"Scripts/Content/Story/Missions/DIA_PAL_1029_Osraed.d:195","Die zwei Spinner da vorne am Lagerfeuer möchten auch Soldat werden.","Ті два дурні там біля вогнища теж хочуть стати солдатами.","","False","PAL_1029_SOLDIER_06_02","",""
"Scripts/Content/Story/Missions/DIA_PAL_1029_Osraed.d:196","(spöttisch) Fällt dir nichts besseres ein?","(глузливо) Нічого кращого не придумав?","","False","PAL_1029_SOLDIER_06_03","",""
"Scripts/Content/Story/Missions/DIA_PAL_1029_Osraed.d:209","Lass mich rein, es soll nicht dein Schaden sein!","Пропусти мене, тобі це буде тільки на руку!","","False","PAL_1029_Osraed_BRIBE.description","",""
"Scripts/Content/Story/Missions/DIA_PAL_1029_Osraed.d:225","Lass mich rein, es soll nicht dein Schaden sein!","Пропусти мене, тобі це буде тільки на руку!","","False","PAL_1029_BRIBE_15_01","",""
"Scripts/Content/Story/Missions/DIA_PAL_1029_Osraed.d:226","(bedrohlich) Soso, du willst mich also bestechen!","(загрозливо) Ага, хабаря мені підсовуєш, значить!","","False","PAL_1029_BRIBE_06_02","",""
"Scripts/Content/Story/Missions/DIA_PAL_1029_Osraed.d:228","Wieviel?","Скільки?","","False","PAL_1029_Osraed_BRIBE_Info.PAL_1029_Osraed_BRIBE.PAL_1029_Osraed_BRIBE_YES","AI_AddChoice",""
"Scripts/Content/Story/Missions/DIA_PAL_1029_Osraed.d:229","Nein, du musst mich missverstanden haben!","Ні, ти мене неправильно зрозумів!","","False","PAL_1029_Osraed_BRIBE_Info.PAL_1029_Osraed_BRIBE.PAL_1029_Osraed_BRIBE_NO","AI_AddChoice",""
"Scripts/Content/Story/Missions/DIA_PAL_1029_Osraed.d:235","Nein, du musst mich missverstanden haben!","Ні, ти мене неправильно зрозумів!","","False","PAL_1029_BRIBE_NO_15_01","",""
"Scripts/Content/Story/Missions/DIA_PAL_1029_Osraed.d:236","Pah! Erst das Maul aufreissen, dann den Schwanz einkneifen.","Тю! Спершу язиком так хвацько молов, а тепер у кущі.","","False","PAL_1029_BRIBE_NO_06_02","",""
"Scripts/Content/Story/Missions/DIA_PAL_1029_Osraed.d:243","Wieviel?","Скільки?","","False","PAL_1029_BRIBE_YES_15_01","",""
"Scripts/Content/Story/Missions/DIA_PAL_1029_Osraed.d:244","100 Silber, darunter läuft nichts!","100 срібла, менше й не думай!","","False","PAL_1029_BRIBE_YES_06_02","",""
"Scripts/Content/Story/Missions/DIA_PAL_1029_Osraed.d:258","(100 Silber geben)","(Дати 100 срібла)","","False","PAL_1029_Osraed_GIVESILVER.description","",""
"Scripts/Content/Story/Missions/DIA_PAL_1029_Osraed.d:277","Ich sagte doch, es soll nicht dein Schaden sein.","Я ж казав, тобі це буде на руку.","","False","PAL_1029_GIVESILVER_15_01","",""
"Scripts/Content/Story/Missions/DIA_PAL_1029_Osraed.d:278","Wenn du jemanden hiervon erzählst bist du tot!","Якщо комусь про це розкажеш - ти мрець!","","False","PAL_1029_GIVESILVER_06_02","",""
"Scripts/Content/Story/Missions/DIA_PAL_1029_Osraed.d:279","Jetzt mach dass du rein kommst und mach keinen Ärger!","А тепер заходь і не наривайся на неприємності!","","False","PAL_1029_GIVESILVER_06_03","",""
"Scripts/Content/Story/Missions/DIA_PAL_1029_Osraed.d:304","Gib mir meine 100 Silber zurück!","Поверни мою сотню!","","False","PAL_1029_Osraed_HOWDYBRIBED.description","",""
"Scripts/Content/Story/Missions/DIA_PAL_1029_Osraed.d:320","Gib mir meine 100 Silber zurück!","Поверни мою сотню!","","False","PAL_1029_HOWDYBRIBED_15_01","",""
"Scripts/Content/Story/Missions/DIA_PAL_1029_Osraed.d:321","(gekünstelt) Ich weiss nicht wovon du sprichst. Zieh Leine!","(вдавано) Не знаю, про що ти. Вали звідси!","","False","PAL_1029_HOWDYBRIBED_06_02","",""
"Scripts/Content/Story/Missions/DIA_PAL_1029_Osraed.d:360","HALT! Hier ist kein...","СТІЙ! Тут не можна...","","False","PAL_1029_HALTTHORA_06_01","",""
"Scripts/Content/Story/Missions/DIA_PAL_1029_Osraed.d:363","(schmierig) Ah, Thora...! Mein Einladung zu einer Flasche Wein steht immer noch.!","(масляно) А, Торо...! Моя пропозиція випити пляшечку вина досі в силі!","","False","PAL_1029_HALTTHORA_06_02","",""
"Scripts/Content/Story/Missions/DIA_PAL_1029_Osraed.d:365","(kalt) Träum weiter, Schmierlocke!","(холодно) Мрій далі, мазунчику!","","False","PAL_1029_HALTTHORA_06_03","",""
"Scripts/Content/Story/Missions/DIA_PAL_1029_Osraed.d:368","Gut du kannst passieren!","Добре, можеш проходити!","","False","PAL_1029_HALTTHORA_06_04","",""
"Scripts/Content/Story/Missions/DIA_PAL_1029_Osraed.d:369","Ach nochwas...","Ага, ще дещо...","","False","PAL_1029_HALTTHORA_06_05","",""
"Scripts/Content/Story/Missions/DIA_PAL_1029_Osraed.d:370","Was?","Що?","","False","PAL_1029_HALTTHORA_15_06","",""
"Scripts/Content/Story/Missions/DIA_PAL_1029_Osraed.d:371","(leise) Nur das das klar ist. Finger weg von Thora, sie gehört mir (krankes Lachen)!","(тихо) Щоб було ясно. Геть руки від Тори, вона моя (хворобливий сміх)!","","False","PAL_1029_HALTTHORA_06_07","",""
"Scripts/Content/Story/Missions/DIA_PAL_1029_Osraed.d:389","Ihr seid also das billige Orkfutter der Paladine?","Отже, ви - дешеве м'ясо для орків від паладинів?","","False","PAL_1029_Osraed_FODDER.description","",""
"Scripts/Content/Story/Missions/DIA_PAL_1029_Osraed.d:404","Ihr seid also das billige Orkfutter der Paladine?","Отже, ви - дешеве м'ясо для орків від паладинів?","","False","PAL_1029_FODDER_15_01","",""
"Scripts/Content/Story/Missions/DIA_PAL_1029_Osraed.d:407","(gepresst) Wenn du nicht mit Thora hier angekommen wärst, dann würde ich dich jetzt einen Kopf kürzer machen.","(крізь зуби) Якби ти не прийшов сюди з Торою, я б зараз таки тобі голову стяв.","","False","PAL_1029_FODDER_06_02","",""
"Scripts/Content/Story/Missions/DIA_PAL_1029_Osraed.d:411","Na warte, diese Beleidigung wirst du mit Deinem Leben bezahlen!","Ну постривай, за цю образу ти заплатиш життям!","","False","PAL_1029_FODDER_06_03","",""
"Scripts/Content/Story/Missions/DIA_PAL_1030_Auxiliary.d:49","HEH DU DA!","ГЕЙ, ТИ ТАМ!","","False","PAL_1030_FirstWarn_Info_07_01","",""
"Scripts/Content/Story/Missions/DIA_PAL_1030_Auxiliary.d:50","Äh ich?","Е, я?","","False","PAL_1030_FirstWarn_Info_15_02","",""
"Scripts/Content/Story/Missions/DIA_PAL_1030_Auxiliary.d:51","Du gehörst nicht zum Gefolge des Königs!","Ти не з почту Короля!","","False","PAL_1030_FirstWarn_Info_07_03","",""
"Scripts/Content/Story/Missions/DIA_PAL_1030_Auxiliary.d:52","Also ziehe Leine, sonst mach ich dir Beine!","То ж вали звідси, бо ноги повиламую!","","False","PAL_1030_FirstWarn_Info_07_04","",""
"Scripts/Content/Story/Missions/DIA_PAL_1030_Auxiliary.d:90","KEINEN SCHRITT WEITER!","АНІ КРОКУ ДАЛІ!","","False","PAL_1030_LastWarn_07_01","",""
"Scripts/Content/Story/Missions/DIA_PAL_1030_Auxiliary.d:91","Oder du siehst die Radieschen von unten!","Або будеш годувати черв'яків!","","False","PAL_1030_LastWarn_07_02","",""
"Scripts/Content/Story/Missions/DIA_PAL_1030_Auxiliary.d:181","Ich möchte in die Festung!","Я хочу до фортеці!","","False","PAL_1030_Auxiliary_WANTIN.description","",""
"Scripts/Content/Story/Missions/DIA_PAL_1030_Auxiliary.d:196","Ich möchte in die Festung!","Я хочу до фортеці!","","False","PAL_1030_WANTIN_15_01","",""
"Scripts/Content/Story/Missions/DIA_PAL_1030_Auxiliary.d:197","Sprich mit Osraed, er hat am Tor das Sagen!","Поговори з Осраедом, він тут при брамі головний!","","False","PAL_1030_WANTIN_07_02","",""
"Scripts/Content/Story/Missions/DIA_PAL_1030_Auxiliary.d:233","HEH DU DA!","АГОВ, ТИ!","","False","PAL_1030_HALTTHORA_07_01","",""
"Scripts/Content/Story/Missions/DIA_PAL_1030_Auxiliary.d:234","(misstrauisch) Thoras Kamerad, wie?","(підозріло) Супутник Тори, еге ж?","","False","PAL_1030_HALTTHORA_07_02","",""
"Scripts/Content/Story/Missions/DIA_PAL_1030_Auxiliary.d:235","OK, kannst passieren!","Гаразд, можеш проходити!","","False","PAL_1030_HALTTHORA_07_03","",""
"Scripts/Content/Story/Missions/DIA_PAL_1039_Paladin.d:49","HALT!","СТІЙ!","","False","PAL_1039_FirstWarn_Info_07_01","",""
"Scripts/Content/Story/Missions/DIA_PAL_1039_Paladin.d:50","Kann ich passieren!","Я можу пройти?","","False","PAL_1039_FirstWarn_Info_15_02","",""
"Scripts/Content/Story/Missions/DIA_PAL_1039_Paladin.d:51","NEIN!","НІ!","","False","PAL_1039_FIRSTWARN_INFO_07_03","",""
"Scripts/Content/Story/Missions/DIA_PAL_1039_Paladin.d:89","BLEIB SOFORT STEHEN!!!","НЕГАЙНО СТІЙ!!!","","False","PAL_1039_LastWarn_07_01","",""
"Scripts/Content/Story/Missions/DIA_PAL_1039_Paladin.d:179","Warum kann ich nicht in die Festung?","","","False","PAL_1039_Paladin_WANTIN.description","",""
"Scripts/Content/Story/Missions/DIA_PAL_1039_Paladin.d:194","Warum kann ich nicht in die Festung?","Чому я не можу до фортеці?","","False","PAL_1039_WANTIN_15_01","",""
"Scripts/Content/Story/Missions/DIA_PAL_1039_Paladin.d:195","Du siehst nicht aus wie ein Gefolgsmann des Königs!","Ти не схожий на слугу Короля!","","False","PAL_1039_WANTIN_07_02","",""
"Scripts/Content/Story/Missions/DIA_PAL_1039_Paladin.d:209","Vielleicht kann ein wenig Silber das ändern.","","","False","PAL_1039_Paladin_BRIBE.description","",""
"Scripts/Content/Story/Missions/DIA_PAL_1039_Paladin.d:224","Vielleicht kann ein wenig Silber das ändern.","Можливо, трохи срібла це змінить.","","False","PAL_1039_BRIBE_15_01","",""
"Scripts/Content/Story/Missions/DIA_PAL_1039_Paladin.d:225","(wütend) Soldat des Königs sind unbestechlich!","(розлючено) Солдати Короля непідкупні!","","False","PAL_1039_BRIBE_08_02","",""
"Scripts/Content/Story/Missions/DIA_PAL_1039_Paladin.d:226","Ich werde dafür sorgen, dass du das nie vergisst!","Я зроблю так, щоб ти цього ніколи не забув!","","False","PAL_1039_BRIBE_08_03","",""
"Scripts/Content/Story/Missions/DIA_PAL_1039_Paladin.d:268","Thora, du kannst passieren...mit Begleitung!","","","False","PAL_1039_HALTTHORA_07_01","",""
"Scripts/Content/Story/Missions/DIA_PAL_1040_Paladin.d:49","KEIN ZUTRITT!","ВХІД ЗАБОРОНЕНО!","","False","PAL_1040_FirstWarn_Info_07_01","",""
"Scripts/Content/Story/Missions/DIA_PAL_1040_Paladin.d:50","Ich will in die Festung!","Я хочу до фортеці!","","False","PAL_1040_FirstWarn_Info_15_02","",""
"Scripts/Content/Story/Missions/DIA_PAL_1040_Paladin.d:51","Nur Gefolgsleute des Königs!","","","False","PAL_1040_FirstWarn_Info_07_03","",""
"Scripts/Content/Story/Missions/DIA_PAL_1040_Paladin.d:89","KEINEN SCHRITT WEITER!","","","False","PAL_1040_LastWarn_07_01","",""
"Scripts/Content/Story/Missions/DIA_PAL_1040_Paladin.d:179","Ich möchte in die Festung!","Я хочу до фортеці!","","False","PAL_1040_Paladin_WANTIN.description","",""
"Scripts/Content/Story/Missions/DIA_PAL_1040_Paladin.d:194","Ich möchte in die Festung.","Я хочу до фортеці.","","False","PAL_1040_WANTIN_15_01","",""
"Scripts/Content/Story/Missions/DIA_PAL_1040_Paladin.d:195","Nur Gefolgsleute des Königs!","Лише слуги Короля!","","False","PAL_1040_WANTIN_07_02","",""
"Scripts/Content/Story/Missions/DIA_PAL_1040_Paladin.d:236","Thora, du kannst passieren...mit Begleitung!","Торо, можеш проходити... з супутником!","","False","PAL_1040_HALTTHORA_07_01","",""
"Scripts/Content/Story/Missions/DIA_PAL_1046_Prinzessin.d:43","Ich bin eine Prinzessin!","Я принцеса!","","False","PAL_1046_HI_16_01","",""
"Scripts/Content/Story/Missions/DIA_PAL_1046_Prinzessin.d:44","Tatsächlich?","Справді?","","False","PAL_1046_HI_16_02","",""
"Scripts/Content/Story/Missions/DIA_PAL_1046_Prinzessin.d:45","Oh ein junger stürmischer Krieger -TRIEF-","О, молодий бурхливий воїн — *аж тече*","","False","PAL_1046_HI_16_03","",""
"Scripts/Content/Story/Missions/DIA_PAL_1046_Prinzessin.d:46","Noch so abgetakelte mitt-40erin die keinen mehr abgekriegt hat","Ще одна потаскана сорокарічка, яка вже нікого не спіймала","","False","PAL_1046_HI_15_04","",""
"Scripts/Content/Story/Missions/DIA_PAL_1046_Prinzessin.d:47","Kann ich was für dich tun - KLIMPER- KLIMPER-","Можу щось для тебе зробити? *плиг-плиг*","","False","PAL_1046_HI_16_05","",""
"Scripts/Content/Story/Missions/DIA_PAL_1046_Prinzessin.d:59","Geh baden!","","","False","PAL_1046_Prinzessin_BATH.description","",""
"Scripts/Content/Story/Missions/DIA_PAL_1046_Prinzessin.d:69","Geh baden!","Йди купатись!","","False","PAL_1046_BATH_15_01","",""
"Scripts/Content/Story/Missions/DIA_PAL_1046_Prinzessin.d:70","Oh Jaaa, ich bin so schmutzig! Willst du mir nicht beim Baden zusehen??","О тааак, я така брудна! Хочеш подивитись, як я купаюсь??","","False","PAL_1046_BATH_16_02","",""
"Scripts/Content/Story/Missions/DIA_PAL_1046_Prinzessin.d:71","BITTE (Winsel)","БУДЬ ЛАСКА (скиглить)","","False","PAL_1046_BATH_16_03","",""
"Scripts/Content/Story/Missions/DIA_PAL_1046_Prinzessin.d:85","Zieh dich aus und leg dich hin!","","","False","PAL_1046_Prinzessin_LOVE.description","",""
"Scripts/Content/Story/Missions/DIA_PAL_1046_Prinzessin.d:95","Zieh dich aus und leg dich hin!","Роздягайся і лягай!","","False","PAL_1046_LOVE_15_01","",""
"Scripts/Content/Story/Missions/DIA_PAL_1046_Prinzessin.d:96","Nichts würde ich lieber, du Starker, aber das Bett ist nicht gemacht...","Нічого б так не хотіла, силачу, але ліжко не застелене...","","False","PAL_1046_LOVE_16_02","",""
"Scripts/Content/Story/Missions/DIA_PAL_1046_Prinzessin.d:97","Scheisse!","Курва!","","False","PAL_1046_LOVE_15_03","",""
"Scripts/Content/Story/Missions/DIA_PAL_1046_Prinzessin.d:109","Du bist über, Bitch! ","Тобі кінець, сучко! ","","False","PAL_1046_Prinzessin_SUICIDE.description","",""
"Scripts/Content/Story/Missions/DIA_PAL_1046_Prinzessin.d:119","Du bist über, Bitch!","Тобі кінець, сучко!","","False","PAL_1046_SUICIDE_15_01","",""
"Scripts/Content/Story/Missions/DIA_PAL_1046_Prinzessin.d:120","Oh - nein, du liebst mich nicht (dramatisch)","О ні, ти мене не кохаєш (драматично)","","False","PAL_1046_SUICIDE_16_02","",""
"Scripts/Content/Story/Missions/DIA_PAL_1046_Prinzessin.d:121","Dann stürze ich mich jetzt zu Tode!!","Тоді я зараз кинусь на смерть!!","","False","PAL_1046_SUICIDE_16_03","",""
