"location","source","target","id","fuzzy","context","translator_comments","developer_comments"
"Scripts/Content/Story/Missions/DIA_BEG_704_Lakarus.d:41","Ich verkaufe Sumpfkraut. Schönes frisches Sumpfkraut.","Я продаю соломинку. красивая свежая соломинка.","","True","BEG_704_HI_00_02","",""
"Scripts/Content/Story/Missions/DIA_BEG_704_Lakarus.d:56","Was kann ich mit Sumpfkraut machen?","Что я могу сделать с огурцами?","","True","BEG_704_Lakarus_WHATHERB.description","",""
"Scripts/Content/Story/Missions/DIA_BEG_704_Lakarus.d:71","Was kann ich mit Sumpfkraut machen?","Что я могу сделать с огурцами?","","True","BEG_704_WHATHERB_15_01","",""
"Scripts/Content/Story/Missions/DIA_BEG_704_Lakarus.d:72","Du kannst es rauchen. Entweder unbehandelt in eine Wasserpfeife stopfen oder stampfen, drehen und dann rauchen.","Вы можете курить его. либо закапывать в трубу с водой без обработки, либо стучать, поворачивать, а затем курить.","","True","BEG_704_WHATHERB_00_02","",""
"Scripts/Content/Story/Missions/DIA_BEG_704_Lakarus.d:73","Es gibt nichst vergleichbares, das dich so entspannt und beruhigt. Du solltest es unbedingt probieren.","Нет ничего подобного, что бы успокаивало и успокаивало вас.","","True","BEG_704_WHATHERB_00_03","",""
"Scripts/Content/Story/Missions/DIA_BEG_704_Lakarus.d:87","Zeig mir deine Ware","Zeig mir deine Ware","","False","BEG_704_Lakarus_TRADEHERB.description","",""
"Scripts/Content/Story/Missions/DIA_BEG_704_Lakarus.d:102","Zeig mir deine Ware","Zeig mir deine Ware","","False","BEG_704_TRADEHERB_15_01","",""
"Scripts/Content/Story/Missions/DIA_BEG_704_Lakarus.d:103","Bei mir bekommst du nur frische Ware.","У нас вы получаете только свежий товар.","","True","BEG_704_TRADEHERB_00_02","",""
"Scripts/Content/Story/Missions/DIA_BEG_704_Lakarus.d:115","Woher bekommst du das Sumpfkraut?","Откуда вы берете этот соус?","","True","BEG_704_Lakarus_WHEREHERB.description","",""
"Scripts/Content/Story/Missions/DIA_BEG_704_Lakarus.d:130","Woher bekommst du das Sumpfkraut?","Откуда вы берете этот соус?","","True","BEG_704_WHEREHERB_15_01","",""
"Scripts/Content/Story/Missions/DIA_BEG_704_Lakarus.d:131","Wie der Name schon sagt wächst es nur im Sumpf. Aber ich bin nicht so wahnsinnig und gehe in dorthin.","Как подсказывает название, он растет только в болоте, но я не так сумасшедший и иду туда.","","True","BEG_704_WHEREHERB_00_02","",""
"Scripts/Content/Story/Missions/DIA_BEG_704_Lakarus.d:132","Niemand der klaren Verstandes ist geht dorthin. Nur ein paar Jäger trauen sich in die Sumpfgebiete.","Никто с чистым умом не идет туда. Только несколько охотников доверяют себе в болотных районах.","","True","BEG_704_WHEREHERB_00_03","",""
"Scripts/Content/Story/Missions/DIA_BEG_704_Lakarus.d:133","Die Jäger kommen ab und zu ins Lager. Und von denen kaufe ich das Kraut.","Охотники время от времени приходят в лагерь, и у них я покупаю траву.","","True","BEG_704_WHEREHERB_00_04","",""
"Scripts/Content/Story/Missions/DIA_BEG_704_Lakarus.d:145","Warum ist es im Sumpf so gefährlich?","Почему в болоте так опасно?","","True","BEG_704_Lakarus_SWAMP.description","",""
"Scripts/Content/Story/Missions/DIA_BEG_704_Lakarus.d:160","Warum ist es im Sumpf so gefährlich?","Почему в болоте так опасно?","","True","BEG_704_SWAMP_15_01","",""
"Scripts/Content/Story/Missions/DIA_BEG_704_Lakarus.d:161","Dort gibt es Blutfliegen....und Sumpfhaie. Aber das ist noch nicht das schlimmste.","Там есть кровянистые мухи и муравьи, но это еще не самое страшное.","","True","BEG_704_SWAMP_00_02","",""
"Scripts/Content/Story/Missions/DIA_BEG_704_Lakarus.d:162","Ja, und? Was ist das 'Schlimmste'?","Что такое «худшее»?","","True","BEG_704_SWAMP_15_03","",""
"Scripts/Content/Story/Missions/DIA_BEG_704_Lakarus.d:163","Als die Barriere noch den Himmel überzog, war der Sumpf das Gebiet einer Bruderschaft die einen Dämon abeteten!","Когда барьера еще пересекала небо, муравьи были территорией братства, которое отнимало демонов!","","True","BEG_704_SWAMP_00_04","",""
"Scripts/Content/Story/Missions/DIA_BEG_704_Lakarus.d:164","Ja, und?","И что?","","False","BEG_704_SWAMP_15_05","",""
"Scripts/Content/Story/Missions/DIA_BEG_704_Lakarus.d:165","...die verdammten Seelen der Toten spuken dort...","Души мёртвых там прокляли...","","True","BEG_704_SWAMP_00_06","",""
"Scripts/Content/Story/Missions/DIA_BEG_704_Lakarus.d:166","...Untote feiern blutige Rituale...","Неумершие совершают кровавые ритуалы.","","True","BEG_704_SWAMP_00_07","",""
"Scripts/Content/Story/Missions/DIA_BEG_704_Lakarus.d:167","...und Skelette staken durch das Sumpfwasser...","...и скелеты стучали сквозь болотную воду...","","True","BEG_704_SWAMP_00_08","",""
"Scripts/Content/Story/Missions/DIA_BEG_704_Lakarus.d:168","Kann es sein das du zuviel rauchst?","Может быть, вы курите слишком много?","","True","BEG_704_SWAMP_15_09","",""
"Scripts/Content/Story/Missions/DIA_BEG_705_Beggar.d:129","Hey, du hast doch bestimmt ein bisschen Silber für mich...!?","У вас, наверное, есть немного серебра для меня.","","True","BEG_705_BEG_00_01","",""
"Scripts/Content/Story/Missions/DIA_BEG_705_Beggar.d:52","Nein, verpiss dich!","Nein, verpiss dich!","","False","BEG_705_BEGGAR_BEG_Info.BEG_705_BEGGAR_BEG.BEG_705_BEGGAR_BEG_NO","AI_AddChoice",""
"Scripts/Content/Story/Missions/DIA_BEG_705_Beggar.d:56","(1 Silbersück geben)","(1 серебряный слой)","","True","BEG_705_BEGGAR_BEG_Info.BEG_705_BEGGAR_BEG.BEG_705_BEGGAR_BEG_ONE","AI_AddChoice",""
"Scripts/Content/Story/Missions/DIA_BEG_705_Beggar.d:61","(5 Silberstücke geben)","(5 серебряных кубиков)","","True","BEG_705_BEGGAR_BEG_Info.BEG_705_BEGGAR_BEG.BEG_705_BEGGAR_BEG_FIVE","AI_AddChoice",""
"Scripts/Content/Story/Missions/DIA_BEG_705_Beggar.d:64","Ich habe gerade leider kein Silber dabei","К сожалению, серебра у меня нет.","","True","BEG_705_BEGGAR_BEG_Info.BEG_705_BEGGAR_BEG.BEG_705_BEGGAR_BEG_SORRY","AI_AddChoice",""
"Scripts/Content/Story/Missions/DIA_BEG_705_Beggar.d:69","Nein, verpiss dich!","Nein, verpiss dich!","","False","BEG_700_BEG_NO_15_01","",""
"Scripts/Content/Story/Missions/DIA_BEG_705_Beggar.d:76","Hier, nimm diese 5 Silberstücke.","Возьмите эти 5 серебряных кубиков.","","True","BEG_700_BEG_FIVE_15_01","",""
"Scripts/Content/Story/Missions/DIA_BEG_705_Beggar.d:78","Danke Mann, vielleicht können wir Bettler dir ja auch mal helfen...","Благодарю Вас, может быть, мы поможем Вам...","","True","BEG_700_BEG_FIVE_00_02","",""
"Scripts/Content/Story/Missions/DIA_BEG_705_Beggar.d:87","Ich habe gerade leider kein Silber dabei.","К сожалению, серебра у меня нет.","","True","BEG_700_BEG_SORRY_15_01","",""
"Scripts/Content/Story/Missions/DIA_BEG_705_Beggar.d:94","Hier, nimm dieses Silberstück.","Возьмите этот серебряный кусок.","","True","BEG_700_BEG_ONE_15_01","",""
"Scripts/Content/Story/Missions/DIA_BEG_705_Beggar.d:96","Damit hast du mir wirklich geholfen.","Вы мне действительно помогли.","","True","BEG_700_BEG_ONE_00_02","",""
"Scripts/Content/Story/Missions/DIA_BEG_705_Beggar.d:131","Nein, verpiss dich!","Nein, verpiss dich!","","False","BEG_705_BEGGAR_BEG2_Info.BEG_705_BEGGAR_BEG2.BEG_705_BEGGAR_BEG_NO","AI_AddChoice",""
"Scripts/Content/Story/Missions/DIA_BEG_705_Beggar.d:135","(1 Silbersück geben)","(1 серебряный слой)","","True","BEG_705_BEGGAR_BEG2_Info.BEG_705_BEGGAR_BEG2.BEG_705_BEGGAR_BEG_ONE","AI_AddChoice",""
"Scripts/Content/Story/Missions/DIA_BEG_705_Beggar.d:140","(5 Silberstücke geben)","(5 серебряных кубиков)","","True","BEG_705_BEGGAR_BEG2_Info.BEG_705_BEGGAR_BEG2.BEG_705_BEGGAR_BEG_FIVE","AI_AddChoice",""
"Scripts/Content/Story/Missions/DIA_BEG_705_Beggar.d:143","Ich habe gerade leider kein Silber dabei","К сожалению, серебра у меня нет.","","True","BEG_705_BEGGAR_BEG2_Info.BEG_705_BEGGAR_BEG2.BEG_705_BEGGAR_BEG_SORRY","AI_AddChoice",""
"Scripts/Content/Story/Missions/DIA_BEG_706_Beggar.d:128","Silber für einen Armen, Silber für einen Armen!","Серебро для бедного, серебро для бедного.","","True","BEG_706_BEG_00_01","",""
"Scripts/Content/Story/Missions/DIA_BEG_706_Beggar.d:51","Nein, verpiss dich!","Nein, verpiss dich!","","False","BEG_706_BEGGAR_BEG_Info.BEG_706_BEGGAR_BEG.BEG_706_BEGGAR_BEG_NO","AI_AddChoice",""
"Scripts/Content/Story/Missions/DIA_BEG_706_Beggar.d:55","(1 Silbersück geben)","(1 серебряный слой)","","True","BEG_706_BEGGAR_BEG_Info.BEG_706_BEGGAR_BEG.BEG_706_BEGGAR_BEG_ONE","AI_AddChoice",""
"Scripts/Content/Story/Missions/DIA_BEG_706_Beggar.d:60","(5 Silberstücke geben)","(5 серебряных кубиков)","","True","BEG_706_BEGGAR_BEG_Info.BEG_706_BEGGAR_BEG.BEG_706_BEGGAR_BEG_FIVE","AI_AddChoice",""
"Scripts/Content/Story/Missions/DIA_BEG_706_Beggar.d:63","Ich habe gerade leider kein Silber dabei","К сожалению, серебра у меня нет.","","True","BEG_706_BEGGAR_BEG_Info.BEG_706_BEGGAR_BEG.BEG_706_BEGGAR_BEG_SORRY","AI_AddChoice",""
"Scripts/Content/Story/Missions/DIA_BEG_706_Beggar.d:68","Nein, verpiss dich!","Nein, verpiss dich!","","False","BEG_706_BEG_NO_15_01","",""
"Scripts/Content/Story/Missions/DIA_BEG_706_Beggar.d:76","Vielleicht bringen dich diese 5 Silberstücke weiter.","Возможно, эти 5 серебряных кусочков приведут вас дальше.","","True","BEG_706_BEG_FIVE_15_01","",""
"Scripts/Content/Story/Missions/DIA_BEG_706_Beggar.d:78","Überaus großzügig, vielen Dank. Vielleicht bringt dich diese Gabe auch weiter...","Спасибо большое, спасибо большое, может быть, этот подарок принесет вам еще больше удовольствия.","","True","BEG_706_BEG_FIVE_00_02","",""
"Scripts/Content/Story/Missions/DIA_BEG_706_Beggar.d:87","Ich habe gerade leider kein Silber dabei.","К сожалению, серебра у меня нет.","","True","BEG_706_BEG_SORRY_15_01","",""
"Scripts/Content/Story/Missions/DIA_BEG_706_Beggar.d:93","Hier, nimm dieses Silberstück.","Возьмите этот серебряный кусок.","","True","BEG_706_BEG_ONE_15_01","",""
"Scripts/Content/Story/Missions/DIA_BEG_706_Beggar.d:95","Danke. Vielleicht bekomme ich dafür sogar etwas zu Essen...","Благодарю, может быть, у меня есть что-нибудь...","","True","BEG_706_BEG_ONE_00_02","",""
"Scripts/Content/Story/Missions/DIA_BEG_706_Beggar.d:131","Nein, verpiss dich!","Nein, verpiss dich!","","False","BEG_706_BEGGAR_BEG2_Info.BEG_706_BEGGAR_BEG2.BEG_706_BEGGAR_BEG_NO","AI_AddChoice",""
"Scripts/Content/Story/Missions/DIA_BEG_706_Beggar.d:135","(1 Silbersück geben)","(1 серебряный слой)","","True","BEG_706_BEGGAR_BEG2_Info.BEG_706_BEGGAR_BEG2.BEG_706_BEGGAR_BEG_ONE","AI_AddChoice",""
"Scripts/Content/Story/Missions/DIA_BEG_706_Beggar.d:140","(5 Silberstücke geben)","(5 серебряных кубиков)","","True","BEG_706_BEGGAR_BEG2_Info.BEG_706_BEGGAR_BEG2.BEG_706_BEGGAR_BEG_FIVE","AI_AddChoice",""
"Scripts/Content/Story/Missions/DIA_BEG_706_Beggar.d:143","Ich habe gerade leider kein Silber dabei","К сожалению, серебра у меня нет.","","True","BEG_706_BEGGAR_BEG2_Info.BEG_706_BEGGAR_BEG2.BEG_706_BEGGAR_BEG_SORRY","AI_AddChoice",""
