"location","source","target","id","fuzzy","context","translator_comments","developer_comments"
"Scripts/Content/Story/Missions/DIA_MIL_122_Arenamaster.d:515","Brutus ist Gewalt pur! Goliath ist zwar stark wie ein Bär, hat aber trotzdem	oft	das	Nachsehen.","Брутус - само воплощение мощи! Голиаф может и силён как медведь, но ему ещё есть куда стремиться.","","False","Info_Arenamaster_AGAIN_12_04","",""
"Scripts/Content/Story/Missions/DIA_MIL_122_Arenamaster.d:519","Brutus gegen	Malgar!	Immer spannend!	Stumpfe	Gewalt gegen tödliche Finesse! Dass	die	Finesse	meistens siegt bringt mich immer wieder	zum	Jubeln!","Брутус против Мальгара! Захватывающее зрелище, как и всегда! Грубая сила против смертоносной ловкости! Не могу не радоваться тому, что ловкость нередко побеждает!","","False","Info_Arenamaster_AGAIN_12_05","",""
"Scripts/Content/Story/Missions/DIA_MIL_122_Arenamaster.d:523","Dann	hast du	das	echte Finale erlebt. Thora und Malgar sind die besten Kämpfer in der Arena.","Впереди настоящий финал. Тора и Мальгар - лучшие бойцы на этой арене!","","False","Info_Arenamaster_AGAIN_12_06","",""
"Scripts/Content/Story/Missions/DIA_MIL_122_Arenamaster.d:540","Wie sieht die Rangliste aus?","Как сейчас выглядит турнирная таблица?","","False","MIL_122_Arenamaster_RANKING.description","",""
"Scripts/Content/Story/Missions/DIA_MIL_122_Arenamaster.d:553","Wie sieht die Rangliste aus?","Как сейчас выглядит турнирная таблица?","","False","MIL_122_RANKING_15_01","",""
"Scripts/Content/Story/Missions/DIA_MIL_122_Arenamaster.d:571","Wie bewertest du...","Что ты можешь сказать о...","","False","MIL_122_Arenamaster_GLADIATOR.description","",""
"Scripts/Content/Story/Missions/DIA_MIL_122_Arenamaster.d:585","...Thora?","...Торе?","","False","MIL_122_Arenamaster_GLADIATOR_Info.MIL_122_Arenamaster_GLADIATOR.MIL_122_Arenamaster_GLADIATOR_THORA","AI_AddChoice",""
"Scripts/Content/Story/Missions/DIA_MIL_122_Arenamaster.d:586","...Malgar?","...Мальгаре?","","False","MIL_122_Arenamaster_GLADIATOR_Info.MIL_122_Arenamaster_GLADIATOR.MIL_122_Arenamaster_GLADIATOR_MALGAR","AI_AddChoice",""
"Scripts/Content/Story/Missions/DIA_MIL_122_Arenamaster.d:587","...Brutus?","...Брутусе?","","False","MIL_122_Arenamaster_GLADIATOR_Info.MIL_122_Arenamaster_GLADIATOR.MIL_122_Arenamaster_GLADIATOR_BRUTUS","AI_AddChoice",""
"Scripts/Content/Story/Missions/DIA_MIL_122_Arenamaster.d:588","...Goliath?","... Голиафе?","","False","MIL_122_Arenamaster_GLADIATOR_Info.MIL_122_Arenamaster_GLADIATOR.MIL_122_Arenamaster_GLADIATOR_GOLIATH","AI_AddChoice",""
"Scripts/Content/Story/Missions/DIA_MIL_122_Arenamaster.d:589","...Grim?","...Гриме?","","False","MIL_122_Arenamaster_GLADIATOR_Info.MIL_122_Arenamaster_GLADIATOR.MIL_122_Arenamaster_GLADIATOR_GRIM","AI_AddChoice",""
"Scripts/Content/Story/Missions/DIA_MIL_122_Arenamaster.d:590","...Mich?","...мне?","","False","MIL_122_Arenamaster_GLADIATOR_Info.MIL_122_Arenamaster_GLADIATOR.MIL_122_Arenamaster_GLADIATOR_ME","AI_AddChoice",""
"Scripts/Content/Story/Missions/DIA_MIL_122_Arenamaster.d:596","Wie bewertest du mich?","Что ты можешь сказать обо мне?","","False","MIL_122_GLADIATOR_ME_15_01","",""
"Scripts/Content/Story/Missions/DIA_MIL_122_Arenamaster.d:600","Du liegst	auf	dem	letzten	Platz, bist	aber auch erst kürzlich	dazugestossen.","Ты лишь недавно присоединился к числу гладиаторов. Сейчас ты находишься на последнем месте.","","False","MIL_122_GLADIATOR_ME_12_02","",""
"Scripts/Content/Story/Missions/DIA_MIL_122_Arenamaster.d:601","Du wirst dich	schon noch hochkämpfen,	da bin ich mir sicher.","Я уверен, ты сможешь пробиться наверх.","","False","MIL_122_GLADIATOR_ME_12_03","",""
"Scripts/Content/Story/Missions/DIA_MIL_122_Arenamaster.d:606","Du hast dich auf den fünften Platz hochgearbeitet. Nicht schlecht!","Неплохо! Ты поднялся на пятое место!","","False","MIL_122_GLADIATOR_ME_12_04","",""
"Scripts/Content/Story/Missions/DIA_MIL_122_Arenamaster.d:611","Du belegst jetzt schon den vierten Platz.	Mach weiter	so und du wirst	noch ganz an die Spitze	kommen.","Ты достиг четвёртого места. Продолжай в том же духе, и скоро сможешь подняться ещё выше!","","False","MIL_122_GLADIATOR_ME_12_05","",""
"Scripts/Content/Story/Missions/DIA_MIL_122_Arenamaster.d:616","Du liegst	heute schon	auf	dem	dritten	Platz. Nur noch	zwei Gladiatoren trennen dich vom Titel	des	Champions.","Ты на третьем месте. Лишь два гладиатора стоят между тобой и титулом чемпиона арены.","","False","MIL_122_GLADIATOR_ME_12_06","",""
"Scripts/Content/Story/Missions/DIA_MIL_122_Arenamaster.d:621","Du hast es geschafft,	dich auf den zweiten Platz hochzuarbeiten.","Тебе удалось подняться на второе место.","","False","MIL_122_GLADIATOR_ME_12_07","",""
"Scripts/Content/Story/Missions/DIA_MIL_122_Arenamaster.d:622","Noch nie habe	ich	einen Gladiator	gesehen, der sich so schnell nach oben gearbeitet hat. Der Titel des Champion ist nun zum Greifen nahe.","Никогда не видел Гладиатора, столь быстро поднимавшегося на вершину. Титул чемпиона арены уже близко.","","False","MIL_122_GLADIATOR_ME_12_08","",""
"Scripts/Content/Story/Missions/DIA_MIL_122_Arenamaster.d:627","Du hast es geschafft!	Du bist	der	neue Arena-Champion!","Поздравляю! Ты смог стать новым чемпионом арены!","","False","MIL_122_GLADIATOR_ME_12_09","",""
"Scripts/Content/Story/Missions/DIA_MIL_122_Arenamaster.d:628","Niemand der anderen Gladiatoren kann deinen Waffenkünsten	paroli bieten. Ich verneige	mich vor dir.","Ни один гладиатор здесь не сравнится с тобой в искусстве сражения. Я преклоняюсь перед тобой.","","False","MIL_122_GLADIATOR_ME_12_10","",""
"Scripts/Content/Story/Missions/DIA_MIL_122_Arenamaster.d:635","Wie bewertest du Grim?","Что ты можешь сказать о Гриме?","","False","MIL_122_GLADIATOR_GRIM_15_01","",""
"Scripts/Content/Story/Missions/DIA_MIL_122_Arenamaster.d:639","Grim war noch nie gut. Jetzt ist er	sogar auf den letzten Platz	abgerutscht. Ein hoffnungsloser	Fall.","Грим никогда не был хорош. Теперь он сидит на последнем месте. Безнадёжный случай.","","False","MIL_122_GLADIATOR_GRIM_12_02","",""
"Scripts/Content/Story/Missions/DIA_MIL_122_Arenamaster.d:644","Grim behauptet sich	auf	seinem fünften Platz. Er war noch nie gut, aber	zumindest wird er auch nicht schlechter.","Грим претендует на пятое место. Боец из него так себе, но, по крайней мере, он не теряет навыки.","","False","MIL_122_GLADIATOR_GRIM_12_03","",""
"Scripts/Content/Story/Missions/DIA_MIL_122_Arenamaster.d:649","Grim hat entgegen aller	Erwartungen	auf	den	4 Platz	verbessert.	Es stecken doch	noch Überraschungen	in ihm.","Вопреки всем ожиданиям, Грим поднялся на четвертое место. Парень знает, как удивить.","","False","MIL_122_GLADIATOR_GRIM_12_04","",""
"Scripts/Content/Story/Missions/DIA_MIL_122_Arenamaster.d:654","Grim überrascht	mich immer mehr. Einst das Schlußlicht,	liegt er heute auf dem dritten Platz.","Я всё больше поражаюсь Гриму. Когда-то он был в самом низу, а теперь занимает третье место.","","False","MIL_122_GLADIATOR_GRIM_12_05","",""
"Scripts/Content/Story/Missions/DIA_MIL_122_Arenamaster.d:659","Grim überrascht	das	ganze Lager. Niemand versteht, wie dieser unbegabte	Kämpfer	sich auf Platz 2 hocharbeiten konnte.","Грим удивил весь лагерь. Никто не понимает, как этот бездарный боец смог занять второе место.","","False","MIL_122_GLADIATOR_GRIM_12_06","",""
"Scripts/Content/Story/Missions/DIA_MIL_122_Arenamaster.d:664","Grim's sonderbare Wendung ist schon	fast verdächtig. Dieser	nichtsnutzige Gladiator	der	früher keinen Kampf	gewonnen hat ist heute Champion. Wenn ich herausfinde, wer da nachgeholfen hat,	dann gibt es saures!","Поворот судьбы Грима вызывает подозрения. Этот никчёмный боец, который не мог выиграть и одного боя, теперь стал чемпионом арены. Его помощник очень об этом пожалеет, попадись он мне!","","False","MIL_122_GLADIATOR_GRIM_12_07","",""
"Scripts/Content/Story/Missions/DIA_MIL_122_Arenamaster.d:671","Wie bewertest du Goliath?","Что ты можешь сказать о Голиафе?","","False","MIL_122_GLADIATOR_GOLIATH_15_01","",""
"Scripts/Content/Story/Missions/DIA_MIL_122_Arenamaster.d:675","Goliath hat nachgelassen. Früher	war	er besser als Grim.	Heute ist er das Schlußlicht.","Голиаф теряет форму. Раньше он был лучше Грима, а теперь занимает последнее место на арене.","","False","MIL_122_GLADIATOR_GOLIATH_12_02","",""
"Scripts/Content/Story/Missions/DIA_MIL_122_Arenamaster.d:680","Goliath liegt auf dem fünften Platz.	Früher war er besser, aber am Ende ist er halt doch	nur	ein	einfacher Schmiedegehilfe","Голиаф занимает пятое место. Раньше он был лучше, но в конце концов он всего лишь подмастерье кузнеца.","","False","MIL_122_GLADIATOR_GOLIATH_12_03","",""
"Scripts/Content/Story/Missions/DIA_MIL_122_Arenamaster.d:685","Goliath hat seinen vierten Platz	gehalten. Ich glaube allerdings	auch nicht,	dass er	sich verbessern	kann.","Голиаф занял четвёртое место. Сомневаюсь, что он сможет пробиться выше.","","False","MIL_122_GLADIATOR_GOLIATH_12_04","",""
"Scripts/Content/Story/Missions/DIA_MIL_122_Arenamaster.d:690","Goliath hat sich	doch tatsächlich auf den dritten Platz vorgeschoben. Das hätte wirklich	niemand	gedacht.","Никто и подумать не мог, что Голиаф когда-то займёт третье место.","","False","MIL_122_GLADIATOR_GOLIATH_12_05","",""
"Scripts/Content/Story/Missions/DIA_MIL_122_Arenamaster.d:695","Goliath stellt Rätsel auf. Einst	ein	Schmiedegehilfe	auf	dem	vorletzten Platz, heute	schon der Vizechampion.","Голиаф - настоящая загадка. Подмастерье кузнеца, занимавший предпоследнее место, теперь почти стал чемпионом арены.","","False","MIL_122_GLADIATOR_GOLIATH_12_06","",""
"Scripts/Content/Story/Missions/DIA_MIL_122_Arenamaster.d:700","Goliath hat das unmögliche wahrgemacht. Allein mit seinem Schmiedehammer	hat	er sich	selbst zum Championtitel verholfen.","Голиаф сделал невозможное. С одним лишь кузнечным молотом в руке он смог добиться титула чемпиона арены.","","False","MIL_122_GLADIATOR_GOLIATH_12_07","",""
"Scripts/Content/Story/Missions/DIA_MIL_122_Arenamaster.d:707","Wie bewertest du Brutus?","Что ты можешь сказать о Брутусе?","","False","MIL_122_GLADIATOR_BRUTUS_15_01","",""
"Scripts/Content/Story/Missions/DIA_MIL_122_Arenamaster.d:711","Brutus war immer ein recht guter Kämpfer.","Брутус всегда был хорошим бойцом.","","False","MIL_122_GLADIATOR_BRUTUS_12_02","",""
"Scripts/Content/Story/Missions/DIA_MIL_122_Arenamaster.d:712","Das er heute auf dem letzten Platz liegt,	versteht keiner.","Никто не может понять, как он смог оказаться на последнем месте.","","False","MIL_122_GLADIATOR_BRUTUS_12_03","",""
"Scripts/Content/Story/Missions/DIA_MIL_122_Arenamaster.d:717","Brutus hat nachgelassen. Früher drittbester ist er heute auf Platz 5.","Брутус теряет форму. Третий лучший боец арены теперь занимает пятое место.","","False","MIL_122_GLADIATOR_BRUTUS_12_04","",""
"Scripts/Content/Story/Missions/DIA_MIL_122_Arenamaster.d:722","Brutus liegt heute nur noch auf Platz	4. Offensichtlich ist rohe Gewalt doch nicht alles!","Брутус теперь на четвёртом месте. Как показывает практика, одной грубой силы может быть недостаточно.","","False","MIL_122_GLADIATOR_BRUTUS_12_05","",""
"Scripts/Content/Story/Missions/DIA_MIL_122_Arenamaster.d:727","Brutus ist und bleibt	die	Nummer drei. Wer in	die	Spitzengruppe aufsteigen will, muß an ihm vorbei.","Брутус был и остаётся на третьем месте. Каждый, кто хочет пробиться выше, должен сразиться с ним.","","False","MIL_122_GLADIATOR_BRUTUS_12_06","",""
"Scripts/Content/Story/Missions/DIA_MIL_122_Arenamaster.d:732","Brutus hat sich doch tatsächlich auf den zweiten Platz hocharbeiten können. Vielleicht steckt	in ihm doch	mehr als rohe Gewalt.","Брутус всё-таки смог занять второе место. Может быть, у него есть что-то помимо грубой силы.","","False","MIL_122_GLADIATOR_BRUTUS_12_07","",""
"Scripts/Content/Story/Missions/DIA_MIL_122_Arenamaster.d:737","Brutus rohe Kampfgewalt hat es geschafft,	selbst so elegante Kämpfer wie Thora und Malgar	in den Schatten	zu stellen.	Eine neue Ära im Arenakampf	bricht an.","Грубая боевая сила Брутуса смогла поразить даже таких элегантных бойцов как Тора и Мальгар. На арене грядут перемены.","","False","MIL_122_GLADIATOR_BRUTUS_12_08","",""
"Scripts/Content/Story/Missions/DIA_MIL_122_Arenamaster.d:744","Wie bewertest du Malgar?","Что ты можешь сказать о Мальгаре?","","False","MIL_122_GLADIATOR_MALGAR_15_01","",""
"Scripts/Content/Story/Missions/DIA_MIL_122_Arenamaster.d:748","Malgar ist am	Ende. Einst	der	zweitbeste,	heute ein Wrack	auf	dem	letzten	Platz der Rangliste.","Дни Мальгара сочтены. Когда-то второй лучший боец арены теперь занимает последнее место.","","False","MIL_122_GLADIATOR_MALGAR_12_02","",""
"Scripts/Content/Story/Missions/DIA_MIL_122_Arenamaster.d:753","Malgar ist stark nachgelassen. Er	ist	heute auf Platz	5.","Мальгар сильно отстаёт. Он теперь занимает пятое место.","","False","MIL_122_GLADIATOR_MALGAR_12_03","",""
"Scripts/Content/Story/Missions/DIA_MIL_122_Arenamaster.d:758","Malgar hat ganz schön	an Boden verloren. Früher zweitbester, heute nur noch auf Platz	4.","Мальгар теряет запал. Он опустился со второго места на четвёртое.","","False","MIL_122_GLADIATOR_MALGAR_12_04","",""
"Scripts/Content/Story/Missions/DIA_MIL_122_Arenamaster.d:763","Malgar hat an	Boden verloren.	Er muss	sich heute mit den dritten Platz zufrieden geben.","Мальгар потерпел поражение. Теперь ему придётся довольствоваться третьим местом.","","False","MIL_122_GLADIATOR_MALGAR_12_05","",""
"Scripts/Content/Story/Missions/DIA_MIL_122_Arenamaster.d:768","Malgar hält souverän den zweiten Platz. Niemand kämpft gegen den Champion, ohne ihn zu besiegen.","Мальгар уверенно занимает второе место. Без победы над ним никому не стоит и мечтать о сражении с чемпионом арены.","","False","MIL_122_GLADIATOR_MALGAR_12_06","",""
"Scripts/Content/Story/Missions/DIA_MIL_122_Arenamaster.d:773","Malgar war schon immer ein fantastischer Kämfper,	heute liegt	er sogar auf Platz 1 und ist damit der neue	Champion.","Мальгар всегда был поразительным бойцом. Сегодня он занял первое место на арене и стал новым чемпионом.","","False","MIL_122_GLADIATOR_MALGAR_12_07","",""
"Scripts/Content/Story/Missions/DIA_MIL_122_Arenamaster.d:782","Wie bewertest du Thora?","Что ты можешь сказать о Торе?","","False","MIL_122_GLADIATOR_THORA_15_01","",""
"Scripts/Content/Story/Missions/DIA_MIL_122_Arenamaster.d:784","Thora ist hoffnungslos	abgesackt. Einst der Champion, ist sie heute kein Silberstück mehr wert.","Тора безнадёжна. Когда-то она была чемпионом арены. Теперь же она не стоит и серебряника.","","False","MIL_122_GLADIATOR_THORA_12_02","",""
"Scripts/Content/Story/Missions/DIA_MIL_122_Arenamaster.d:789","Thora ist am Ende.	Wie	konnte der einstige	Champion auf den vorletzten	Platz sinken?","Дни Торы сочтены. Как мог чемпион арены оказаться на предпоследнем месте?","","False","MIL_122_GLADIATOR_THORA_12_03","",""
"Scripts/Content/Story/Missions/DIA_MIL_122_Arenamaster.d:794","Thora ist gewaltig	abgesackt. Einst der Champion, heute nur noch Mittelmass auf Platz 4.","Тора уже не та, что раньше. Когда-то она был чемпионом арены, а теперь занимает четвёртое место.","","False","MIL_122_GLADIATOR_THORA_12_04","",""
"Scripts/Content/Story/Missions/DIA_MIL_122_Arenamaster.d:799","Thora ist schon lange nicht mehr der Champion.	Heute liegt	sie	nur	noch auf Platz 3.","Тора уже давно не чемпион арены. Теперь она занимает третье место.","","False","MIL_122_GLADIATOR_THORA_12_05","",""
"Scripts/Content/Story/Missions/DIA_MIL_122_Arenamaster.d:804","Thora ist nicht mehr der Champion.	Wahrscheinlich sind	ihre grössten Tage als Gladiator gezählt.","Тора утратила место чемпиона. Дни её незыблемой славы позади.","","False","MIL_122_GLADIATOR_THORA_12_06","",""
"Scripts/Content/Story/Missions/DIA_MIL_122_Arenamaster.d:809","Thora ist und bleibt der Champion.	Ihre exotischen	Waffenkünste mit dem Kampfstab suchen ihresgleichen.","Тора была и остаётся чемпионом арены. Её навыки владения таким экзотическим оружием как посох не имеют равных.","","False","MIL_122_GLADIATOR_THORA_12_07","",""
"Scripts/Content/Story/Missions/DIA_MIL_122_Arenamaster.d:825","Welche	Regeln gibt	es in der Arena?","Какие правила действуют на арене?","","False","MIL_122_Arenamaster_RULES.description","",""
"Scripts/Content/Story/Missions/DIA_MIL_122_Arenamaster.d:839","Welche Regeln gibt es in der Arena?","Какие правила действуют на арене?","","False","MIL_122_RULES_Info_15_01","",""
"Scripts/Content/Story/Missions/DIA_MIL_122_Arenamaster.d:840","Regel Nummer 1 ...","Правило номер один...","","False","MIL_122_RULES_Info_12_02","",""
"Scripts/Content/Story/Missions/DIA_MIL_122_Arenamaster.d:841","KEIN Töten in der Arena!","Никаких убийств на арене!","","False","MIL_122_RULES_Info_12_03","",""
"Scripts/Content/Story/Missions/DIA_MIL_122_Arenamaster.d:842","Umhauen	ja,	Töten nein!","Выбить из кого-то дух - всегда пожалуйста. Но убивать запрещено!","","False","MIL_122_RULES_Info_12_04","",""
"Scripts/Content/Story/Missions/DIA_MIL_122_Arenamaster.d:843","Regel Nummer 2 ...","Правило номер два...","","False","MIL_122_RULES_Info_12_05","",""
"Scripts/Content/Story/Missions/DIA_MIL_122_Arenamaster.d:843","Weder Bögen, noch Armbrüste	noch Magie in der Arena!","Никаких луков, арбалетов или магии на арене!","","False","MIL_122_RULES_Info_12_06","",""
"Scripts/Content/Story/Missions/DIA_MIL_122_Arenamaster.d:845","Es wird	nur	mit	Nahkampfwaffen gekämpft!","Драться только оружием ближнего боя!","","False","MIL_122_RULES_Info_12_07","",""
"Scripts/Content/Story/Missions/DIA_MIL_122_Arenamaster.d:846","Regel Nummer 3 ...","Правило номер три...","","False","MIL_122_RULES_Info_12_08","",""
"Scripts/Content/Story/Missions/DIA_MIL_122_Arenamaster.d:846","Jeder behält seine eigenen Waffen! Solltest	du deinen Gegner umhauen, ist seine	Waffe tabu für dich, ist das klar!","Каждый остаётся при своём оружии! Твоя победа не даёт тебе права грабить противника! Понял?!","","False","MIL_122_RULES_Info_12_09","",""
"Scripts/Content/Story/Missions/DIA_MIL_122_Arenamaster.d:847","Was	passiert, wenn es die Gladiatoren mit den Regeln nicht so genau	nehmen?","Что происходит с гладиаторами, которые нарушают правила?","","False","MIL_122_RULES_Info_15_10","",""
"Scripts/Content/Story/Missions/DIA_MIL_122_Arenamaster.d:848","Regel Nummer 4 : Wer die Regeln	verletzt, verliert den Kampf und das Preisgeld!","Правило номер четыре: Нарушивший правила гладиатор проигрывает бой и лишается призовых денег!","","False","MIL_122_RULES_Info_12_11","",""
"Scripts/Content/Story/Missions/DIA_MIL_122_Arenamaster.d:865","Wie läuft so	ein	Kampf ab?","Как проходят бои на арене?","","False","MIL_122_Arenamaster_FLOWCHART.description","",""
"Scripts/Content/Story/Missions/DIA_MIL_122_Arenamaster.d:879","Wie	läuft so ein Kampf ab?","Как проходят бои на арене?","","False","MIL_122_FLOWCHART_Info_15_01","",""
"Scripts/Content/Story/Missions/DIA_MIL_122_Arenamaster.d:879","Es wird	solange	gekämpft, bis einer	zu Boden geht!","Поединок продолжается до тех пор, пока кого-то не собьют с ног!","","False","MIL_122_FLOWCHART_Info_12_02","",""
"Scripts/Content/Story/Missions/DIA_MIL_122_Arenamaster.d:880","Wer	den	anderen	umhaut,	gewinnt	einen Punkt.","Победитель получает очко.","","False","MIL_122_FLOWCHART_Info_12_03","",""
"Scripts/Content/Story/Missions/DIA_MIL_122_Arenamaster.d:881","Es wird	mindestens gekämpft, bis einer 5 Punkte hat, manchmal aber	auch länger.","Бой продолжается пока один из бойцов не наберёт как минимум пять очков. Иногда и дольше.","","False","MIL_122_FLOWCHART_Info_12_04","",""
"Scripts/Content/Story/Missions/DIA_MIL_122_Arenamaster.d:883","Wovon hängt	das	ab?","От чего это зависит?","","False","MIL_122_FLOWCHART_Info_15_05","",""
"Scripts/Content/Story/Missions/DIA_MIL_122_Arenamaster.d:884","Davon, ob der Kampf	mir	gefällt	oder nicht.","От того, нравится мне этот поединок или нет.","","False","MIL_122_FLOWCHART_Info_12_06","",""
"Scripts/Content/Story/Missions/DIA_MIL_122_Arenamaster.d:885","Verstehe!","Понимаю!","","False","MIL_122_FLOWCHART_Info_15_07","",""
"Scripts/Content/Story/Missions/DIA_MIL_122_Arenamaster.d:885","Werden bis zum Ende	der	Kampfzeit keine	5 Punkte erreicht,	verlieren beide	und	ich	behalte	alle Preisgelder.","Если к концу поединка ни один из гладиаторов не сможет набрать пять очков, обоим засчитывается поражение и никто не получает призовых денег.","","False","MIL_122_FLOWCHART_Info_12_08","",""
"Scripts/Content/Story/Missions/DIA_MIL_122_Arenamaster.d:919","DU HAST	REGEL NUMMER 3 VERLETZT.","Ты нарушил правило номер три!","","False","MIL_122_PLAYERCHEATED_Info_12_09","",""
"Scripts/Content/Story/Missions/DIA_MIL_122_Arenamaster.d:919","Finger weg,	von	den	Waffen der anderen Gladiatoren!","Руки прочь от оружия других гладиаторов!","","False","MIL_122_PLAYERCHEATED_Info_12_10","",""
"Scripts/Content/Story/Missions/DIA_MIL_122_Arenamaster.d:925","DU HAST	REGEL NUMMER 2 VERLETZT.","Ты нарушил правило номер два!","","False","MIL_122_PLAYERCHEATED_Info_12_11","",""
"Scripts/Content/Story/Missions/DIA_MIL_122_Arenamaster.d:925","Weder Fernkampfwaffen noch Magie in	der	Arena!","Магия, луки и арбалеты запрещены на арене!","","False","MIL_122_PLAYERCHEATED_Info_12_12","",""
"Scripts/Content/Story/Missions/DIA_MIL_122_Arenamaster.d:931","DU HAST	REGEL NUMMER 1 VERLETZT.","Ты нарушил правило номер один!","","False","MIL_122_PLAYERCHEATED_Info_12_13","",""
"Scripts/Content/Story/Missions/DIA_MIL_122_Arenamaster.d:934","Kein Töten in der Arena!","Никаких убийств на арене!","","False","MIL_122_PLAYERCHEATED_Info_12_14","",""
