"location","source","target","id","fuzzy","context","translator_comments","developer_comments"
"Scripts/Content/Story/Missions/DIA_MIN_306_Grim.d:250","Du bist nicht gerade gut in Form. Könntest ein bischen Training gebrauchen!","По твоему виду, тренировка тебе бы не помешала!","","False","OUMULTI_Training_10_00","",""
"Scripts/Content/Story/Missions/DIA_MIN_306_Grim.d:251","Wie wär's mit einem Freundschaftskämpfchen in der Arena!?","Как насчет дружеского боя на арене?","","False","OUMULTI_Freundschaftskampf_10_00","",""
"Scripts/Content/Story/Missions/DIA_MIN_306_Grim.d:248","Nicht wirklich!","Не совсем.","","False","Info_Grim_ARENA_NO_15_01","",""
"Scripts/Content/Story/Missions/DIA_MIN_306_Grim.d:249","(misstrauisch) Hab dich noch nie hier gesehen!","(с недоверием) Я тебя здесь раньше не видел!","","False","Info_Grim_ARENA_NO_10_02","",""
"Scripts/Content/Story/Missions/DIA_MIN_306_Grim.d:263","Na dann zeig mal was du drauf hast!","Ну так покажи, на что способен!","","False","MIN_306_Grim_FRIENDFIGHT.description","",""
"Scripts/Content/Story/Missions/DIA_MIN_306_Grim.d:278","Na dann zeig mal was du drauf hast!","Ну так покажи, на что способен!","","False","MIN_306_FRIENDFIGHT_15_01","",""
"Scripts/Content/Story/Missions/DIA_MIN_306_Grim.d:279","Moment, nicht so schnell!","Эй, не так быстро!","","False","MIN_306_FRIENDFIGHT_10_02","",""
"Scripts/Content/Story/Missions/DIA_MIN_306_Grim.d:280","Hol dir erst vom Arenameister die Erlaubnis für einen Kampf. Du findest ihn oben am Arenaplatz.","Сначала получи разрешение у распорядителя арены. Можешь найти его наверху.","","False","MIN_306_FRIENDFIGHT_10_03","",""
"Scripts/Content/Story/Missions/DIA_MIN_306_Grim.d:294","Ich will in der Arena gegen dich kämpfen!","Я хочу сразиться с тобой на арене!","","False","Info_Grim_CHALLENGE.description","",""
"Scripts/Content/Story/Missions/DIA_MIN_306_Grim.d:316","Ich will in der Arena gegen dich kämpfen!","Я хочу сразиться с тобой на арене!","","False","Info_Grim_CHALLENGE_15_01","",""
"Scripts/Content/Story/Missions/DIA_MIN_306_Grim.d:320","Ohne meine Spitzhacke trete ich nicht an.","Я не буду драться без моей кирки.","","False","Info_Grim_CHALLENGE_10_02","",""
"Scripts/Content/Story/Missions/DIA_MIN_306_Grim.d:325","Ich habe deine Waffe... ähem... gefunden! Hier!","Я... эм... нашёл твою кирку! Вот она!","","False","Info_Grim_CHALLENGE_Info.Info_Grim_CHALLENGE.Info_Grim_CHALLENGE_FOUND","AI_AddChoice",""
"Scripts/Content/Story/Missions/DIA_MIN_306_Grim.d:333","Der Arenameister ist stinksauer auf dich! Du musst ihn erst wieder besänftigen!","Распорядитель арены зол на тебя. Тебе придётся его сначала успокоить.","","False","Info_Grim_CHALLENGE_10_03","",""
"Scripts/Content/Story/Missions/DIA_MIN_306_Grim.d:339","Seeehr gut!","О-очень хорошо!","","False","Info_Grim_CHALLENGE_10_04","",""
"Scripts/Content/Story/Missions/DIA_MIN_306_Grim.d:340","Am besten gehst du gleich zum Arenameister und gibst dein Preisgeld ab.","Тогда тебе нужно сразу направиться к распорядителю арены и внести призовые.","","False","Info_Grim_CHALLENGE_10_05","",""
"Scripts/Content/Story/Missions/DIA_MIN_306_Grim.d:350","Ich weiss nicht... also gut, einmal versuche ich es noch gegen dich!","Хмм... ладно, попробую сразиться с тобой ещё раз!","","False","Info_Grim_CHALLENGE_10_06","",""
"Scripts/Content/Story/Missions/DIA_MIN_306_Grim.d:351","Vergiss nicht dein Preisgeld beim Arenameister abzugeben.","Не забудь внести призовые у распорядителя арены.","","False","Info_Grim_CHALLENGE_10_07","",""
"Scripts/Content/Story/Missions/DIA_MIN_306_Grim.d:361","Du bist zu stark für mich! Ich warte lieber, bis Goliath wieder zurückkommt.","Ты слишком силён! Лучше уж я подожду, пока Голиаф не вернётся.","","False","Info_Grim_CHALLENGE_10_08","",""
"Scripts/Content/Story/Missions/DIA_MIN_306_Grim.d:362","Da kannst du lange warten (grins)","(с улыбкой) Он вернётся не скоро.","","False","Info_Grim_CHALLENGE_15_09","",""
"Scripts/Content/Story/Missions/DIA_MIN_306_Grim.d:366","Vergiss es! Ich kämpfe lieber gegen Goliath, da hab ich bessere Chancen.","Забудь об этом! Лучше уж я сражусь с Голиафом. Там у меня есть хоть какие-то шансы.","","False","Info_Grim_CHALLENGE_10_10","",""
"Scripts/Content/Story/Missions/DIA_MIN_306_Grim.d:374","Ich habe deine Waffe... ähem... gefunden! Hier!","Я... эм... нашёл твою кирку! Вот она!","","False","Info_Grim_CHALLENGE_FOUND_15_01","",""
"Scripts/Content/Story/Missions/DIA_MIN_306_Grim.d:376","Da ist sie ja, meine geliebte Waffe. Gib her.","Вот ты где, моя любовь. Давай её сюда!","","False","Info_Grim_CHALLENGE_FOUND_10_02","",""
"Scripts/Content/Story/Missions/DIA_MIN_306_Grim.d:389","Preisgeld? Was für ein Preisgeld?","Какая ещё награда?","","False","Info_Grim_PRIZE.description","",""
"Scripts/Content/Story/Missions/DIA_MIN_306_Grim.d:405","Preisgeld? Was für ein Preisgeld?","Какая ещё награда?","","False","Info_Grim_PRIZE_15_01","",""
"Scripts/Content/Story/Missions/DIA_MIN_306_Grim.d:406","Wir Gladiatoren kämpfen natürlich um Geld. Sonst macht das Ganze doch gar keinen Spaß.","Гладиаторы сражаются за деньги. Иначе арена бы нам быстро наскучила.","","False","Info_Grim_PRIZE_10_02","",""
"Scripts/Content/Story/Missions/DIA_MIN_306_Grim.d:418","Welche Waffe bevorzugst du?","Какое оружие ты предпочитаешь?","","False","Info_Grim_WEAPON.description","",""
"Scripts/Content/Story/Missions/DIA_MIN_306_Grim.d:433","Welche Waffe bevorzugst du?","Какое оружие ты предпочитаешь?","","False","Info_Grim_WEAPON_15_01","",""
"Scripts/Content/Story/Missions/DIA_MIN_306_Grim.d:440","Mit dieser Spitzhacke habe ich jahrelang Erz geschürft, die ist quasi mit meinem Körper verwachsen.","Я столько лет работал этой киркой, что она теперь как часть меня.","","False","Info_Grim_WEAPON_10_02","",""
"Scripts/Content/Story/Missions/DIA_MIN_306_Grim.d:456","Wieviele Kämpfe hast du gewonnen?","Сколько боёв ты уже выиграл?","","False","Info_Grim_VICTORIES.description","",""
"Scripts/Content/Story/Missions/DIA_MIN_306_Grim.d:471","Wieviele Kämpfe hast du gewonnen?","Сколько боёв ты уже выиграл?","","False","Info_Grim_VICTORIES_15_01","",""
"Scripts/Content/Story/Missions/DIA_MIN_306_Grim.d:472","Also... puhhh.... wieviel waren es doch gleich...","Так... брр... сколько ж это было...","","False","Info_Grim_VICTORIES_10_02","",""
"Scripts/Content/Story/Missions/DIA_MIN_306_Grim.d:473","Wenn du mich so direkt fragst... ja da waren auf jeden Fall schon mal Siege.... bestimmt...","Раз ты так спрашиваешь... Да, победы у меня были... точно...","","False","Info_Grim_VICTORIES_10_03","",""
"Scripts/Content/Story/Missions/DIA_MIN_306_Grim.d:474","OK, OK, ich denke ich bin im Bilde!","Думаю, я понял.","","False","Info_Grim_VICTORIES_15_04","",""
"Scripts/Content/Story/Missions/DIA_MIN_306_Grim.d:486","Warum kämpfst du in der Arena?","Почему ты сражаешься на арене?","","False","Info_Grim_WHY.description","",""
"Scripts/Content/Story/Missions/DIA_MIN_306_Grim.d:501","Warum kämpfst du in der Arena?","Почему ты сражаешься на арене?","","False","Info_Grim_WHY_15_01","",""
"Scripts/Content/Story/Missions/DIA_MIN_306_Grim.d:502","Hab keine Lust mehr auf Erzhacken! Jetzt will ich mir hier etwas Silber zu verdienen.","Надоело мне копать руду! Теперь я зарабатываю серебро здесь.","","False","Info_Grim_WHY_10_02","",""
"Scripts/Content/Story/Missions/DIA_MIN_306_Grim.d:515","Na, wie laufen die Kämpfe?","Как дела на арене?","","False","MIN_306_Grim_HOWDY.description","",""
"Scripts/Content/Story/Missions/DIA_MIN_306_Grim.d:532","Na, wie laufen die Kämpfe?","Как дела на арене?","","False","MIN_306_HOWDY_15_01","",""
"Scripts/Content/Story/Missions/DIA_MIN_306_Grim.d:533","Schlecht Mann! Ich habe bald kein Preisgeld mehr, das ich setzen könnte!","Паршиво! Скоро у меня не останется денег на ставки!","","False","MIN_306_HOWDY_10_02","",""
