"location","source","target","id","fuzzy","context","translator_comments","developer_comments"
"Scripts/Content/Story/Missions/DIA_MIL_100_Halvor.d:33","Du musst der Koch sein!","Ты, должно быть, повар?","","False","MIL_100_Halvor_COOK.description","",""
"Scripts/Content/Story/Missions/DIA_MIL_100_Halvor.d:43","Du musst der Koch sein!","Ты, должно быть, повар?","","False","MIL_100_COOK_15_01","",""
"Scripts/Content/Story/Missions/DIA_MIL_100_Halvor.d:44","Bist ja ein ganz Schlauer! Hab dich hier noch nie gesehen!","Смышлёный малый! Я тебя тут раньше не видел!","","False","MIL_100_COOK_00_02","",""
"Scripts/Content/Story/Missions/DIA_MIL_100_Halvor.d:56","Hast du Essen für mich?","Дашь мне что-нибудь поесть?","","False","MIL_100_Halvor_WANTBUY.description","",""
"Scripts/Content/Story/Missions/DIA_MIL_100_Halvor.d:71","Hast du Essen für mich?","Дашь мне что-нибудь поесть?","","False","MIL_100_WANTBUY_15_01","",""
"Scripts/Content/Story/Missions/DIA_MIL_100_Halvor.d:72","Geschnorrt wird hier nicht. Wer was zu Essen haben will bezahlt dafür!","На халяву здесь не кормят. Хочешь есть — плати!","","False","MIL_100_WANTBUY_00_02","",""
"Scripts/Content/Story/Missions/DIA_MIL_100_Halvor.d:88","Zeig mir deine Speisekarte!","Покажи свои блюда!","","False","MIL_100_Halvor_TRADE.description","",""
"Scripts/Content/Story/Missions/DIA_MIL_100_Halvor.d:103","Zeig mir deine Speisekarte!","Покажи свои блюда!","","False","MIL_100_TRADE_15_01","",""
"Scripts/Content/Story/Missions/DIA_MIL_100_Halvor.d:104","Was willst du haben?","Чего желаешь?","","False","MIL_100_TRADE_00_02","",""
"Scripts/Content/Story/Missions/DIA_MIL_100_Halvor.d:120","Silber gegen Ware, so gefällt mir das!","Серебро за товар, всё как я люблю!","","False","MIL_100_TRADE_MEAL_00_01","",""
"Scripts/Content/Story/Missions/DIA_MIL_100_Halvor.d:162","Dein Fleischeintopf schmeckt sehr gut!","У тебя очень вкусная мясная похлёбка!","","False","MIL_100_Halvor_STEWGOOD.description","",""
"Scripts/Content/Story/Missions/DIA_MIL_100_Halvor.d:179","Dein Fleischeintopf schmeckt sehr gut!","У тебя очень вкусная мясная похлёбка!","","False","MIL_100_STEWGOOD_15_01","",""
"Scripts/Content/Story/Missions/DIA_MIL_100_Halvor.d:180","HA... Das kannst du laut sagen.","Ха... Можешь ещё громче об этом сказать.","","False","MIL_100_STEWGOOD_00_02","",""
"Scripts/Content/Story/Missions/DIA_MIL_100_Halvor.d:192","Deine Auswahl ist ja nicht gerade berauschend!","Выбирать у тебя особо нечего...","","False","MIL_100_Halvor_FEWCHOICES.description","",""
"Scripts/Content/Story/Missions/DIA_MIL_100_Halvor.d:209","Deine Auswahl ist ja nicht gerade berauschend!","Выбирать у тебя особо нечего...","","False","MIL_100_FEWCHOICES_15_01","",""
"Scripts/Content/Story/Missions/DIA_MIL_100_Halvor.d:210","Wenn es dir nicht passt, kannst du ja den Schweinefrass von diesem Versager Snaf essen!","Если не нравится, проваливай к Снафу и жри его помои!","","False","MIL_100_FEWCHOICES_00_02","",""
"Scripts/Content/Story/Missions/DIA_MIL_100_Halvor.d:222","Den Leuten schmeckt es hier wohl besser als bei Snaf, was?","Снафа считают поваром похуже, так?","","False","MIL_100_Halvor_SNAF.description","",""
"Scripts/Content/Story/Missions/DIA_MIL_100_Halvor.d:238","Den Leuten schmeckt es hier wohl besser als bei Snaf, was?","Снафа считают поваром похуже, так?","","False","MIL_100_SNAF_15_01","",""
"Scripts/Content/Story/Missions/DIA_MIL_100_Halvor.d:239","Snaf's jämmerliche Suppe wäre nicht mal was für den Schweinetrog meines Vetters in Khorinis.","То жалкое подобие похлёбки, которое предлагает Снаф, я бы побрезговал скормить свиньям моего двоюродного брата из Хориниса!","","False","MIL_100_SNAF_00_02","",""
"Scripts/Content/Story/Missions/DIA_MIL_100_Halvor.d:240","HA... dieser armseelige Nichtsnutz sollte sich mal so langsam was überlegen, wenn er im Geschäft bleiben will.","Ха… этому жалкому бездельнику давно пора бы пораскинуть мозгами, если он хочет остаться на плаву.","","False","MIL_100_SNAF_00_03","",""
"Scripts/Content/Story/Missions/DIA_MIL_100_Halvor.d:241","Meine neues Rezept kommt sehr gut an. Die Leute können garnicht genug davon bekommen.","Рецепт моего нового блюда превзошел ожидания. Местные всё никак не наедятся!","","False","MIL_100_SNAF_00_04","",""
"Scripts/Content/Story/Missions/DIA_MIL_100_Halvor.d:255","Das Rezept für den Fleisch-Eintopf?","Рецепт мясной похлёбки?","","False","MIL_100_Halvor_RECIPE.description","",""
"Scripts/Content/Story/Missions/DIA_MIL_100_Halvor.d:270","Das Rezept für den Fleisch-Eintopf?","Рецепт мясной похлёбки?","","False","MIL_100_RECIPE_15_01","",""
"Scripts/Content/Story/Missions/DIA_MIL_100_Halvor.d:271","Richtig. Ich glaube fast, das mein Kochbuch das wertvollste Stück Papier in diesem Lager hier ist! (lacht laut)","Верно. Я уже думаю, что в лагере нет ничего ценнее моей кулинарной книги! (громко смеётся)","","False","MIL_100_RECIPE_00_02","",""
"Scripts/Content/Story/Missions/DIA_MIL_100_Halvor.d:283","Verkaufst du mir das Rezept?","Продашь мне рецепт?","","False","MIL_100_Halvor_WANTRECIPE.description","",""
"Scripts/Content/Story/Missions/DIA_MIL_100_Halvor.d:298","Verkaufst du mir das Rezept?","Продашь мне рецепт?","","False","MIL_100_WANTRECIPE_15_01","",""
"Scripts/Content/Story/Missions/DIA_MIL_100_Halvor.d:299","HA... HA... du musst mich ja für völlig verblödet halten.","Ха-ха, ты меня, видимо, за дурака держишь.","","False","MIL_100_WANTRECIPE_00_02","",""
"Scripts/Content/Story/Missions/DIA_MIL_100_Halvor.d:300","Das Rezept bleibt schön da wo es ist. In meiner gut verschlossenen Truhe.","Рецепт моего рагу хранится в надёжном сундуке. Там он и останется.","","False","MIL_100_WANTRECIPE_00_03","",""
"Scripts/Content/Story/Missions/DIA_MIL_100_Halvor.d:301","Verstehe!","Понимаю!","","False","MIL_100_WANTRECIPE_15_04","",""
"Scripts/Content/Story/Missions/DIA_MIL_100_Halvor.d:315","Snaf hat mich beauftragt herauszufinden, warum seine Kunden...","Снаф хочет выяснить, почему его посетители уходят к тебе.","","False","MIL_100_Halvor_FROMSNAF.description","",""
"Scripts/Content/Story/Missions/DIA_MIL_100_Halvor.d:331","Snaf hat mich beauftrag herauszufinden, warum seine Kunden zu dir überlaufen!","Снаф хочет выяснить, почему его посетители уходят к тебе.","","False","MIL_100_FROMSNAF_15_01","",""
"Scripts/Content/Story/Missions/DIA_MIL_100_Halvor.d:332","HA..., dann solltest du Snaf zurückgehen und ihm sagen, das liegt daran, dass er ein mieserabler Koch ist.","Ха, тогда можешь передать Снафу, что он просто паршивый повар.","","False","MIL_100_FROMSNAF_00_02","",""
"Scripts/Content/Story/Missions/DIA_MIL_100_Halvor.d:333","Ausserdem hab ich nichts übrig für Spione von Snaf, also mach, dass du dich hier nicht mehr sehen lässt!","Больше мне его шпионам нечего сказать. А теперь проваливай! Не хватало ещё, чтобы ты следил за мной!","","False","MIL_100_FROMSNAF_00_03","",""
"Scripts/Content/Story/Missions/DIA_MIL_100_Halvor.d:363","Mach das du hier verschwindest.","Проваливай!","","False","MIL_100_SNAFSPY_00_01","",""
"Scripts/Content/Story/Missions/DIA_MIL_100_Halvor.d:364","Spione von Snaf sind hier nicht willkommen!","Шпионам Снафа здесь не рады!","","False","MIL_100_SNAFSPY_00_02","",""
"Scripts/Content/Story/Missions/DIA_MIL_100_Halvor.d:424","Hab gehört, du verbreitest Lügen über meinen Fleischeintopf!","Слышал, ты распространяешь слухи о моей похлебке!","","False","MIL_100_LIAR_00_01","",""
"Scripts/Content/Story/Missions/DIA_MIL_100_Halvor.d:425","Behauptest da wäre Menschenfleisch drin und so!","Дескать, я добавляю туда человечину да чего похуже!","","False","MIL_100_LIAR_00_02","",""
"Scripts/Content/Story/Missions/DIA_MIL_100_Halvor.d:426","Muss dir wohl ein paar Manieren beibringen, Junge!","Пора бы преподать тебе урок, парень!","","False","MIL_100_LIAR_00_03","",""
"Scripts/Content/Story/Missions/DIA_MIL_100_Halvor.d:457","Mach das du hier verschwindest.","Проваливай!","","False","MIL_100_LIAR2_00_01","",""
"Scripts/Content/Story/Missions/DIA_MIL_100_Halvor.d:458","Ich kann miese Lügner wie dich nicht ausstehen!","Терпеть не могу лжецов!","","False","MIL_100_LIAR2_00_02","",""
"Scripts/Content/Story/Missions/DIA_MIL_101_Wylfern.d:34","Was machst du hier?","Что ты здесь делаешь?","","False","MIL_101_Wylfern_NEUTRAL.description","",""
"Scripts/Content/Story/Missions/DIA_MIL_101_Wylfern.d:44","Was machst du hier?","Что ты здесь делаешь?","","False","MIL_101_NEUTRAL_15_01","",""
"Scripts/Content/Story/Missions/DIA_MIL_101_Wylfern.d:45","Ich bin Wylfern, Rekrut der Miliz.","Меня зовут Вилферн. Я рекрут ополчения.","","False","MIL_101_NEUTRAL_08_02","",""
"Scripts/Content/Story/Missions/DIA_MIL_101_Wylfern.d:46","Als angehender Milizsoldat hat man immer viel zu tun. Wenn man nicht gerade Wache hält, muss man trainieren.","В ополчении всегда есть чем заняться. Если тебя не поставили на караул, нужно проводить время за тренировками.","","False","MIL_101_NEUTRAL_08_03","",""
"Scripts/Content/Story/Missions/DIA_MIL_101_Wylfern.d:47","Wir kümmern uns um alles, was für die anderen zu gefährlich ist.","Всё, что слишком опасно для других - наша забота.","","False","MIL_101_NEUTRAL_08_04","",""
"Scripts/Content/Story/Missions/DIA_MIL_101_Wylfern.d:48","Ja, es ist ganz schön hart, aber ich bin stolz dabeisein zu dürfen!","Бывает тяжело, но я горжусь тем, что могу взять на себя эту работу.","","False","MIL_101_NEUTRAL_08_05","",""
"Scripts/Content/Story/Missions/DIA_MIL_101_Wylfern.d:60","Du warst in der Mine?","Ты был шахтёром?","","False","MIL_101_Wylfern_HI.description","",""
"Scripts/Content/Story/Missions/DIA_MIL_101_Wylfern.d:76","Du warst in der Mine?","Ты был шахтёром?","","False","MIL_101_HI_15_01","",""
"Scripts/Content/Story/Missions/DIA_MIL_101_Wylfern.d:77","Ja, das ist richtig. Ich hab bis vor ein paar Wochen in der Mine gearbeitet.","Да, ты прав. До недавнего я работал в шахте.","","False","MIL_101_HI_08_02","",""
"Scripts/Content/Story/Missions/DIA_MIL_101_Wylfern.d:78","Aber dann bekam ich den Auftrag zwei Schürfer zum Lager zu bringen.","Но затем мне поручили привести двух скребков сюда в лагерь.","","False","MIL_101_HI_08_03","",""
"Scripts/Content/Story/Missions/DIA_MIL_101_Wylfern.d:79","Wir haben uns auf den Weg gemacht, aus Vorsicht sind wir Nachts gegangen.","В долине сейчас опасно, поэтому мы отправились ночью.","","False","MIL_101_HI_08_04","",""
"Scripts/Content/Story/Missions/DIA_MIL_101_Wylfern.d:80","Kurz vor dem Lager haben uns die Orks überfallen. Sie kamen wie aus dem Nichts,... wir hatten keine Chance.","Около лагеря на нас напали орки. Появились изниоткуда... у нас не было шансов.","","False","MIL_101_HI_08_05","",""
"Scripts/Content/Story/Missions/DIA_MIL_101_Wylfern.d:81","Nur Sylvester und ich konnten uns retten. Aber Pedro haben sie erwischt.","Только я и Силвестр смогли сбежать. Беднягу Педро же поймали орки.","","False","MIL_101_HI_08_06","",""
"Scripts/Content/Story/Missions/DIA_MIL_101_Wylfern.d:93","Wo hat der Überfall stattgefunden?","Где на вас напали?","","False","MIL_101_Wylfern_RUSH.description","",""
"Scripts/Content/Story/Missions/DIA_MIL_101_Wylfern.d:108","Wo hat der Überfall stattgefunden?","Где на вас напали?","","False","MIL_101_RUSH_15_01","",""
"Scripts/Content/Story/Missions/DIA_MIL_101_Wylfern.d:109","Am Waldrand. Willst du dahin?","На опушке леса. А почему ты спрашиваешь?","","False","MIL_101_RUSH_08_02","",""
"Scripts/Content/Story/Missions/DIA_MIL_101_Wylfern.d:110","Ja, ich brauche unbedingt Bluterz. Vielleicht finde ich da noch was.","Я ищу кровавую руду. Можешь быть я смогу добыть её там.","","False","MIL_101_RUSH_15_03","",""
"Scripts/Content/Story/Missions/DIA_MIL_101_Wylfern.d:111","Du wirst die Stelle alleine nicht finden.","Сам ты это место не найдёшь.","","False","MIL_101_RUSH_08_04","",""
"Scripts/Content/Story/Missions/DIA_MIL_101_Wylfern.d:112","Deshalb wirst du mich begleiten.","Поэтому ты и проводишь меня туда.","","False","MIL_101_RUSH_15_05","",""
"Scripts/Content/Story/Missions/DIA_MIL_101_Wylfern.d:113","Was ich? Nein, vergiss es. Ich gehe dort nicht mehr hin!","Я? Ну уж нет, туда я больше ни ногой!","","False","MIL_101_RUSH_08_06","",""
"Scripts/Content/Story/Missions/DIA_MIL_101_Wylfern.d:116","Dann beschreib mir wenigstens den Weg","Тогда опиши мне, как туда попасть.","","False","MIL_101_Wylfern_RUSH_Info.MIL_101_Wylfern_RUSH.MIL_101_Wylfern_RUSH_WAY","AI_AddChoice",""
"Scripts/Content/Story/Missions/DIA_MIL_101_Wylfern.d:117","Du bist halt ein Feigling...","Ты просто трус...","","False","MIL_101_Wylfern_RUSH_Info.MIL_101_Wylfern_RUSH.MIL_101_Wylfern_RUSH_FEAR","AI_AddChoice",""
"Scripts/Content/Story/Missions/DIA_MIL_101_Wylfern.d:118","Ich zahl dir dreissig Silberstücke","Я заплачу тебе тридцать серебряников.","","False","MIL_101_Wylfern_RUSH_Info.MIL_101_Wylfern_RUSH.MIL_101_Wylfern_RUSH_30","AI_AddChoice",""
"Scripts/Content/Story/Missions/DIA_MIL_101_Wylfern.d:119","Ich zahl dir zehn Silberstücke","Я заплачу тебе десять серебряников.","","False","MIL_101_Wylfern_RUSH_Info.MIL_101_Wylfern_RUSH.MIL_101_Wylfern_RUSH_10","AI_AddChoice",""
"Scripts/Content/Story/Missions/DIA_MIL_101_Wylfern.d:124","Ich zahl dir zehn Silberstücke.","Я заплачу тебе десять серебряников.","","False","MIL_101_RUSH_20_15_01","",""
"Scripts/Content/Story/Missions/DIA_MIL_101_Wylfern.d:125","Nicht für alles Geld des Lagers würde ich da wieder hingehen!","Отдай мне хоть всё золото в лагере, я туда не пойду!","","False","MIL_101_RUSH_20_08_02","",""
"Scripts/Content/Story/Missions/DIA_MIL_101_Wylfern.d:132","Ich zahl dir dreissig Silberstücke.","Я заплачу тебе тридцать серебряников.","","False","MIL_101_RUSH_30_15_01","",""
"Scripts/Content/Story/Missions/DIA_MIL_101_Wylfern.d:133","Hmmm.. okay, wenn du mir das Silber gibst, bringe ich dich hin.","Хм... Ладно, принесешь мне серебро, и я отведу тебя.","","False","MIL_101_RUSH_30_08_02","",""
"Scripts/Content/Story/Missions/DIA_MIL_101_Wylfern.d:140","Du bist halt ein Feigling...","Ты просто трус...","","False","MIL_101_RUSH_FEAR_15_01","",""
"Scripts/Content/Story/Missions/DIA_MIL_101_Wylfern.d:141","Was, du nennst mich einen Feigling? Ich bin Rekrut der Miliz. Ich bin nicht feige!","Что? Я трус? Я рекрут ополчения! Мне неизвестен страх!","","False","MIL_101_RUSH_FEAR_08_02","",""
"Scripts/Content/Story/Missions/DIA_MIL_101_Wylfern.d:142","Dann bring mich zum Ort des Überfalls!","Тогда показывай, где на вас напали орки!","","False","MIL_101_RUSH_FEAR_15_03","",""
"Scripts/Content/Story/Missions/DIA_MIL_101_Wylfern.d:143","-SEUFZ-","(вздыхает)","","False","MIL_101_RUSH_FEAR_08_04","",""
"Scripts/Content/Story/Missions/DIA_MIL_101_Wylfern.d:144","Na gut, ich werde dich hinbringen.","Хорошо, я отведу тебя.","","False","MIL_101_RUSH_FEAR_08_05","",""
"Scripts/Content/Story/Missions/DIA_MIL_101_Wylfern.d:151","Dann beschreib mir wenigstens den Weg.","Тогда опиши мне, как туда попасть.","","False","MIL_101_RUSH_WAY_15_01","",""
"Scripts/Content/Story/Missions/DIA_MIL_101_Wylfern.d:152","Verlasse das Lager durch den Haupteingang und wende ich nach rechts.","Выходи из лагеря через главные ворота и поворачивай направо.","","False","MIL_101_RUSH_WAY_08_02","",""
"Scripts/Content/Story/Missions/DIA_MIL_101_Wylfern.d:153","Folge dem Weg, bis du zum Wald kommst.","Иди по дороге, пока не дойдёшь до леса.","","False","MIL_101_RUSH_WAY_08_03","",""
"Scripts/Content/Story/Missions/DIA_MIL_101_Wylfern.d:154","Dort verlässt du den Weg und folgst rechterhand dem Waldrand, bis du im Wald den Hügel siehst.","Затем следуй по правой части опушки, пока не увидишь холм в лесу.","","False","MIL_101_RUSH_WAY_08_04","",""
"Scripts/Content/Story/Missions/DIA_MIL_101_Wylfern.d:155","Hinter dem Hügel, da haben sie uns angegriffen!","За этим холмом на нас и напали.","","False","MIL_101_RUSH_WAY_08_05","",""
"Scripts/Content/Story/Missions/DIA_MIL_101_Wylfern.d:168","Hattet ihr Erz dabei?","У тебя не осталось с собой руды?","","False","MIL_101_Wylfern_WAREZ.description","",""
"Scripts/Content/Story/Missions/DIA_MIL_101_Wylfern.d:183","Hattet ihr Erz dabei?","У тебя не осталось с собой руды?","","False","MIL_101_WAREZ_15_01","",""
"Scripts/Content/Story/Missions/DIA_MIL_101_Wylfern.d:184","Sylvester und Pedro hatten beide Erz dabei.","Руда была у Сильвестра и Педро.","","False","MIL_101_WAREZ_08_02","",""
"Scripts/Content/Story/Missions/DIA_MIL_101_Wylfern.d:196","Dann beschreib mir wenigstens den Weg","Тогда опиши мне, как туда попасть.","","False","MIL_101_Wylfern_AGAIN.description","",""
"Scripts/Content/Story/Missions/DIA_MIL_101_Wylfern.d:211","Dann beschreibe mir wenigstens den Weg.","Тогда опиши мне, как туда попасть.","","False","MIL_101_AGAIN_15_01","",""
"Scripts/Content/Story/Missions/DIA_MIL_101_Wylfern.d:212","Verlasse das Lager durch den Haupteingang und wende ich nach rechts.","Выходи из лагеря через главные ворота и поворачивай направо.","","False","MIL_101_AGAIN_08_02","",""
"Scripts/Content/Story/Missions/DIA_MIL_101_Wylfern.d:213","Folge dem Weg, bis du zum Wald kommst.","Иди по дороге, пока не дойдёшь до леса.","","False","MIL_101_AGAIN_08_03","",""
"Scripts/Content/Story/Missions/DIA_MIL_101_Wylfern.d:214","Dort verlässt du den Weg und folgst rechterhand dem Waldrand, bis du im Wald den Hügel siehst.","Затем следуй по правой части опушки, пока не увидишь холм в лесу.","","False","MIL_101_AGAIN_08_04","",""
"Scripts/Content/Story/Missions/DIA_MIL_101_Wylfern.d:215","Hinter dem Hügel, da haben sie uns angegriffen!","За этим холмом на нас и напали.","","False","MIL_101_AGAIN_08_05","",""
"Scripts/Content/Story/Missions/DIA_MIL_101_Wylfern.d:227","Lass uns zum Ort des Überfalls gehen","Показывай, где на вас напали.","","False","MIL_101_Wylfern_GUIDE.description","",""
"Scripts/Content/Story/Missions/DIA_MIL_101_Wylfern.d:243","Lass uns zum Ort des Überfalls gehen.","Показывай, где на вас напали.","","False","MIL_101_GUIDE_15_01","",""
"Scripts/Content/Story/Missions/DIA_MIL_101_Wylfern.d:244","Gut, dann folge mir. Aber ich werde dich nur hinbringen, nichts weiter!","Хорошо, иди за мной. Но я лишь отведу тебя туда, не больше!","","False","MIL_101_GUIDE_08_02","",""
"Scripts/Content/Story/Missions/DIA_MIL_101_Wylfern.d:245","Sollten wir uns unterwegs verlieren, treffen wir und am besten hier im Burghof wieder.","Если кто-то из нас заблудится, встретимся снова в замке.","","False","MIL_101_GUIDE_08_03","",""
"Scripts/Content/Story/Missions/DIA_MIL_101_Wylfern.d:266","Lass uns zum Ort des Überfalls gehen","Показывай, где на вас напали.","","False","MIL_101_Wylfern_SILVERGUIDE.description","",""
"Scripts/Content/Story/Missions/DIA_MIL_101_Wylfern.d:282","Lass uns zum Ort des Überfalls gehen. Ich habe das Silber.","Показывай, где на вас напали. Я заплачу.","","False","MIL_101_SILVERGUIDE_15_01","",""
"Scripts/Content/Story/Missions/DIA_MIL_101_Wylfern.d:285","Alles klar, aber ich werde dich nur hinbringen, nichts weiter.","По рукам. Но я лишь отведу тебя туда, не больше.","","False","MIL_101_SILVERGUIDE_08_02","",""
"Scripts/Content/Story/Missions/DIA_MIL_101_Wylfern.d:294","Komm wieder, wenn du dreissig Silberstücke hast!","Возвращайся, когда соберёшь тридцать серебряников!","","False","MIL_101_SILVERGUIDE_08_03","",""
"Scripts/Content/Story/Missions/DIA_MIL_101_Wylfern.d:323","Okay, hier war es. Du solltest dich beeilen, es ist nicht sicher hier.","Мы на месте. Тебе лучше поторопиться, здесь опасно.","","False","MIL_101_RUSHHOUR_08_01","",""
"Scripts/Content/Story/Missions/DIA_MIL_101_Wylfern.d:324","Ich gehe wieder zurück ins Lager.","Я возвращаюсь в лагерь.","","False","MIL_101_RUSHHOUR_08_02","",""
"Scripts/Content/Story/Missions/DIA_MIL_103_Berengar.d:45","Was willst DU von mir? (aggresiv)","(агрессивно) А чего ТЕБЕ от меня нужно?","","False","MIL_103_KINGANGRY_08_01","",""
"Scripts/Content/Story/Missions/DIA_MIL_103_Berengar.d:57","Wer bist du?","Кто ты?","","False","MIL_103_Berengar_WHOAREYOU.description","",""
"Scripts/Content/Story/Missions/DIA_MIL_103_Berengar.d:67","Wer bist du?","Кто ты?","","False","MIL_103_WHOAREYOU_15_01","",""
"Scripts/Content/Story/Missions/DIA_MIL_103_Berengar.d:68","(aggressiv) Was für eine dämliche Frage!","(агрессивно) Он ещё спрашивает!","","False","MIL_103_WHOAREYOU_08_02","",""
"Scripts/Content/Story/Missions/DIA_MIL_103_Berengar.d:69","Jeder weis doch, dass ich der Hauptmann der Miliz bin.","Здесь каждый знает, что я - капитан ополчения!","","False","MIL_103_WHOAREYOU_08_03","",""
"Scripts/Content/Story/Missions/DIA_MIL_103_Berengar.d:70","Und ich bin niemandem Rechenschaft schuldig, schon garnicht diesem nichtsnutzigen König Rhobar.","И я ни перед кем не отчитываюсь. Тем более не перед этим бездарным королём Робаром!","","False","MIL_103_WHOAREYOU_08_04","",""
"Scripts/Content/Story/Missions/DIA_MIL_103_Berengar.d:71","Ist das klar!","Уяснил?!","","False","MIL_103_WHOAREYOU_08_05","",""
"Scripts/Content/Story/Missions/DIA_MIL_103_Berengar.d:83","Kannst du mir was über den König erzählen?","Что ты можешь рассказать мне о короле?","","False","MIL_103_Berengar_KING.description","",""
"Scripts/Content/Story/Missions/DIA_MIL_103_Berengar.d:98","Kannst du mir was über den König erzählen?","Что ты можешь рассказать мне о короле?","","False","MIL_103_KING_15_01","",""
"Scripts/Content/Story/Missions/DIA_MIL_103_Berengar.d:99","(laut) Du willst was über den König wissen?...VON MIR?","(громко) Тебе нужна информация о короле? ОТ МЕНЯ?!","","False","MIL_103_KING_08_02","",""
"Scripts/Content/Story/Missions/DIA_MIL_103_Berengar.d:100","Dann will ich dir was über den König sagen.","Так слушай внимательно, что я тебе скажу.","","False","MIL_103_KING_08_03","",""
"Scripts/Content/Story/Missions/DIA_MIL_103_Berengar.d:101","Der taucht hier mit seinen gestriegelten Affen auf und steckt seinen Kopf mitsamt seiner Krone ganz tief in den Sand!","Он пришёл сюда со своиму припудренными обезьянами и тут же спрятал свою голову, вместе с короной, глубоко в песок!","","False","MIL_103_KING_08_04","",""
"Scripts/Content/Story/Missions/DIA_MIL_103_Berengar.d:102","Der soll mir mal im Dunkeln begegnen, der König! Den werde ich noch ganz woanders reinstecken den König!","Попадись мне этот королишка, так я его высочество засуну туда, где света не бывает!","","False","MIL_103_KING_08_05","",""
