"location","source","target","id","fuzzy","context","translator_comments","developer_comments"
"Scripts/Content/Story/Missions/DIA_MIL_103_Berengar.d:115","Kannst du mich im Kampf trainieren?","Можешь научить меня обращаться с оружием?","","False","MIL_103_Berengar_ABOUT.description","",""
"Scripts/Content/Story/Missions/DIA_MIL_103_Berengar.d:130","Kannst du mich im Kampf trainieren?","Можешь научить меня обращаться с оружием?","","False","MIL_103_ABOUT_15_01","",""
"Scripts/Content/Story/Missions/DIA_MIL_103_Berengar.d:131","(laut) NEIN, ich bin beschäftigt, siehst du das nicht?","(громко) Нет! Не видишь, что я сейчас занят?!","","False","MIL_103_ABOUT_08_02","",""
"Scripts/Content/Story/Missions/DIA_MIL_103_Berengar.d:132","Besorg dir eine Waffe und wende dich an Cassian. Er kümmert sich um Typen wie dich!","Найди себе какое-нибудь оружие и тащи свою задницу к Кассиану! Он занимается такими как ты!","","False","MIL_103_ABOUT_08_03","",""
"Scripts/Content/Story/Missions/DIA_MIL_103_Berengar.d:144","Wo finde ich diesen Cassian?","Где я могу найти Кассиана?","","False","MIL_103_Berengar_WHERECASSIAN.description","",""
"Scripts/Content/Story/Missions/DIA_MIL_103_Berengar.d:160","Wo finde ich diesen Cassian?","Где я могу найти Кассиана?","","False","MIL_103_WHERECASSIAN_15_01","",""
"Scripts/Content/Story/Missions/DIA_MIL_103_Berengar.d:161","Bei den Rekruten im Burghof. Kannst ihn nicht verfehlen, er trägt eine sehr auffällige Rüstung.","Он занимается рекрутами во дворе замка. Сможешь узнать его по доспехам.","","False","MIL_103_WHERECASSIAN_08_02","",""
"Scripts/Content/Story/Missions/DIA_MIL_104_Hyglas.d:33","Wie läuft's?","Как идут дела?","","False","MIL_104_Hyglas_HI.description","",""
"Scripts/Content/Story/Missions/DIA_MIL_104_Hyglas.d:43","Wie läuft's?","Как идут дела?","","False","MIL_104_HI_15_01","",""
"Scripts/Content/Story/Missions/DIA_MIL_104_Hyglas.d:44","Die Magier sind an allem schuld. Erst errichten sie eine riesige Barriere und sie wird größer als sie planen.","Во всём виноваты маги. Сначала они собираются возвести громадный барьер, а затем его размеры выходят из под контроля.","","False","MIL_104_HI_08_02","",""
"Scripts/Content/Story/Missions/DIA_MIL_104_Hyglas.d:45","Das muss man sich mal vorstellen! Ich meine, die pfuschen mit Mächten herum, die sie nicht mal verstehen!","Ты только подумай! Они даже понятия не имели, какие силы пытались обуздать!","","False","MIL_104_HI_08_03","",""
"Scripts/Content/Story/Missions/DIA_MIL_104_Hyglas.d:46","Und nicht genug damit, dann sprengen sie das Teil und alles wird zerstört! Und wieder einmal pfuschen sie mit Mächten herum, die sie nicht verstehen!","Так ведь мало того, затем они рушат этот купол, и всей долине приходит конец! И они СНОВА суют свой нос в дела, которые сами понять не в силах!","","False","MIL_104_HI_08_04","",""
"Scripts/Content/Story/Missions/DIA_MIL_104_Hyglas.d:48","Die werden uns noch alle umbringen.","Эти маги нас со свету сживут.","","False","MIL_104_HI_08_06","",""
"Scripts/Content/Story/Missions/DIA_MIL_104_Hyglas.d:49","Du sagst ja gar nichts. Wie siehst du das denn?","Молчишь? Сам-то что думаешь?","","False","MIL_104_HI_08_07","",""
"Scripts/Content/Story/Missions/DIA_MIL_104_Hyglas.d:51","Die Frage ist doch, was machst du mit diesem Wissen?","И что ты планируешь делать?","","False","MIL_104_Hyglas_HI_Info.MIL_104_Hyglas_HI.MIL_104_Hyglas_HI_WHAT","AI_AddChoice",""
"Scripts/Content/Story/Missions/DIA_MIL_104_Hyglas.d:52","Du bist ein Spinner","Ты просто сумасшедший.","","False","MIL_104_Hyglas_HI_Info.MIL_104_Hyglas_HI.MIL_104_Hyglas_HI_IDIOT","AI_AddChoice",""
"Scripts/Content/Story/Missions/DIA_MIL_104_Hyglas.d:53","Du hast Recht! Die Magier sind an allem Schuld! ","Ты прав! Во всём виноваты маги! ","","False","MIL_104_Hyglas_HI_Info.MIL_104_Hyglas_HI.MIL_104_Hyglas_HI_MAGE","AI_AddChoice",""
"Scripts/Content/Story/Missions/DIA_MIL_104_Hyglas.d:54","Das interessiert mich nicht","Меня это не интересует.","","False","MIL_104_Hyglas_HI_Info.MIL_104_Hyglas_HI.MIL_104_Hyglas_HI_DONTKNOW","AI_AddChoice",""
"Scripts/Content/Story/Missions/DIA_MIL_104_Hyglas.d:59","Das interessiert mich nicht.","Меня это не интересует.","","False","MIL_104_HI_DONTKNOW_15_01","",""
"Scripts/Content/Story/Missions/DIA_MIL_104_Hyglas.d:60","Oh, ... na dann steck deinen Kopf in den Sand und verharre solange, bis du stirbst","О, ну тогда можешь с радостью зарыться поглубже и ждать своей смерти.","","False","MIL_104_HI_DONTKNOW_08_02","",""
"Scripts/Content/Story/Missions/DIA_MIL_104_Hyglas.d:66","Du hast Recht! Die Magier sind an allem Schuld!","Ты прав! Во всём виноваты маги!","","False","MIL_104_HI_MAGE_15_01","",""
"Scripts/Content/Story/Missions/DIA_MIL_104_Hyglas.d:67","Was ich sage. Denk daran wenn du einen Magier triffst, denn es geht um unser aller Leben!","Именно. Поэтому будь осторошен, если наткнёшься на мага. Это вопрос нашего выживания!","","False","MIL_104_HI_MAGE_08_02","",""
"Scripts/Content/Story/Missions/DIA_MIL_104_Hyglas.d:73","Du bist ein Spinner.","Ты просто сумасшедший.","","False","MIL_104_HI_IDIOT_15_01","",""
"Scripts/Content/Story/Missions/DIA_MIL_104_Hyglas.d:74","Ich hätte dich für schlauer gehalten.","А я думал, у тебя есть голова на плечах.","","False","MIL_104_HI_IDIOT_08_02","",""
"Scripts/Content/Story/Missions/DIA_MIL_104_Hyglas.d:80","Die Frage ist doch, was machst du mit diesem Wissen?","И что ты планируешь делать?","","False","MIL_104_HI_WHAT_15_01","",""
"Scripts/Content/Story/Missions/DIA_MIL_104_Hyglas.d:81","Genau. Das ist die entscheidene Frage. Was tun wir?","Верно, в этом и вопрос: что же нам делать?","","False","MIL_104_HI_WHAT_08_02","",""
"Scripts/Content/Story/Missions/DIA_MIL_104_Hyglas.d:82","Sie alle umbringen? Das kann nicht der Weg sein.","Перерезать их всех? Явно есть другой путь.","","False","MIL_104_HI_WHAT_08_03","",""
"Scripts/Content/Story/Missions/DIA_MIL_104_Hyglas.d:85","Ich habe keine Ahnung","Понятия не имею.","","False","MIL_104_Hyglas_HI_WHAT.MIL_104_Hyglas_HI.MIL_104_Hyglas_HI_WHAT_DONTKNOW","AI_AddChoice",""
"Scripts/Content/Story/Missions/DIA_MIL_104_Hyglas.d:86","Zuerst mal müssen wir an sie rankommen","Сперва нужно до них добраться.","","False","MIL_104_Hyglas_HI_WHAT.MIL_104_Hyglas_HI.MIL_104_Hyglas_HI_WHAT_FIRST","AI_AddChoice",""
"Scripts/Content/Story/Missions/DIA_MIL_104_Hyglas.d:87","Wir sollten sie alle umbringen!","Ни один из них не должен выжить!","","False","MIL_104_Hyglas_HI_WHAT.MIL_104_Hyglas_HI.MIL_104_Hyglas_HI_WHAT_KILLEMALL","AI_AddChoice",""
"Scripts/Content/Story/Missions/DIA_MIL_104_Hyglas.d:92","Wir sollten sie alle umbringen!","Ни один из них не должен выжить!","","False","MIL_104_HI_WHAT_KILLEMALL_15_01","",""
"Scripts/Content/Story/Missions/DIA_MIL_104_Hyglas.d:93","Das ist 'ne geniale Idee. Die ist so genial, die sollte man eigentlich in Gold aufwiegen.","Поразительная идея. Настолько поразительная, что её вес можно приравнять к золоту.","","False","MIL_104_HI_WHAT_KILLEMALL_08_02","",""
"Scripts/Content/Story/Missions/DIA_MIL_104_Hyglas.d:94","Nur für den Fall das du es versuchen solltest, es war nett dich gekannt zu haben.","Если действительно собрался с ними сражаться... был рад познакомиться.","","False","MIL_104_HI_WHAT_KILLEMALL_08_03","",""
"Scripts/Content/Story/Missions/DIA_MIL_104_Hyglas.d:100","Zuerst mal müssen wir an sie rankommen.","Сперва нужно до них добраться.","","False","MIL_104_Hyglas_HI_WHAT_FIRST_15_01","",""
"Scripts/Content/Story/Missions/DIA_MIL_104_Hyglas.d:101","Ja, aber dahin zu gehen kann ziemlich gefährlich sein.","Верно. Только не могу сказать, что путь к ним будет лёгким.","","False","MIL_104_Hyglas_HI_WHAT_FIRST_08_02","",""
"Scripts/Content/Story/Missions/DIA_MIL_104_Hyglas.d:102","Ich denke, die Wege der Magier und mein Weg werden sich bald kreuzen, deshalb werde ich mich um sie kümmern.","Думаю, рано или поздно мы друг на друга наткнёмся. Тогда я и позабочусь о магах.","","False","MIL_104_Hyglas_HI_WHAT_FIRST_15_03","",""
"Scripts/Content/Story/Missions/DIA_MIL_104_Hyglas.d:103","Wenn du Hilfe brauchst, du kannst auf mich zählen!","Если будет нужна помощь, можешь расчитывать на меня.","","False","MIL_104_Hyglas_HI_WHAT_FIRST_08_04","",""
"Scripts/Content/Story/Missions/DIA_MIL_104_Hyglas.d:116","Ich habe keine Ahnung.","Понятия не имею.","","False","MIL_104_HI_WHAT_DONTKNOW_15_01","",""
"Scripts/Content/Story/Missions/DIA_MIL_104_Hyglas.d:117","Tja, dann werde ich mich wohl alleine darum kümmern.","Что ж. Придётся мне самому позаботиться об этой проблеме.","","False","MIL_104_HI_WHAT_DONTKNOW_08_02","",""
"Scripts/Content/Story/Missions/DIA_MIL_104_Hyglas.d:131","Wodurch zeichnet sich ein guter Soldat aus?","Что отличает хорошего солдата?","","False","MIL_104_Hyglas_MILITIA.description","",""
"Scripts/Content/Story/Missions/DIA_MIL_104_Hyglas.d:141","Wodurch zeichnet sich ein guter Soldat aus?","Что отличает хорошего солдата?","","False","MIL_104_MILITIA_15_01","",""
"Scripts/Content/Story/Missions/DIA_MIL_104_Hyglas.d:142","Ein Soldat ist ein Kämpfer. Er ist Beschützer derer, die nicht kämpfen.","Солдат - это боец. Он встаёт на защиту тех, кто не в силах сражаться.","","False","MIL_104_MILITIA_08_02","",""
"Scripts/Content/Story/Missions/DIA_MIL_104_Hyglas.d:143","Soldat zu sein, bedeutet mehr, als eine zeitlang eine Waffe zu tragen. Es ist der Weg des Lebens, den du wählst.","Быть солдатом - не просто бряцать оружием на поясе. Это осознанный выбор жизненного пути.","","False","MIL_104_MILITIA_08_03","",""
"Scripts/Content/Story/Missions/DIA_MIL_104_Hyglas.d:144","Und wenn du dein Leben danach ausrichtest, wirst du ein guter Soldat.","И если ты готов так жить, то из тебя получится хороший солдат.","","False","MIL_104_MILITIA_08_04","",""
"Scripts/Content/Story/Missions/DIA_MIL_104_Hyglas.d:145","Ausserdem kann man gegen eine Menge Leute kämpfen!","Помимо того, на твою долю выпадет не мало сражений!","","False","MIL_104_MILITIA_08_05","",""
"Scripts/Content/Story/Missions/DIA_MIL_116_Militia.d:25","Hey, wo willst du hin?","Эй, куда это ты собрался?","","False","MIL_116_WAIT_06_01","",""
"Scripts/Content/Story/Missions/DIA_MIL_116_Militia.d:27","Ich suche meinen alten Freund Diego.","Я ищу Диего. Мы старые друзья.","","False","MIL_116_Militia_WAIT_Info.MIL_116_Militia_WAIT.MIL_116_Militia_WAIT_TROUBLE","AI_AddChoice",""
"Scripts/Content/Story/Missions/DIA_MIL_116_Militia.d:28","Ich will ins Lager.","Я хочу попасть в лагерь.","","False","MIL_116_Militia_WAIT_Info.MIL_116_Militia_WAIT.MIL_116_Militia_WAIT_CAMP","AI_AddChoice",""
"Scripts/Content/Story/Missions/DIA_MIL_116_Militia.d:33","Ich will ins Lager.","Я хочу попасть в лагерь.","","False","MIL_116_WAIT_CAMP_15_01","",""
"Scripts/Content/Story/Missions/DIA_MIL_116_Militia.d:34","Auf der Flucht vor den Orks , wie?","Бежишь от орков, а?","","False","MIL_116_WAIT_CAMP_06_02","",""
"Scripts/Content/Story/Missions/DIA_MIL_116_Militia.d:35","Damit das eine mal klar ist, hier drin wird gearbeitet und trainiert.","Объясняю сразу: здесь люди работают и тренируются.","","False","MIL_116_WAIT_CAMP_06_03","",""
"Scripts/Content/Story/Missions/DIA_MIL_116_Militia.d:36","Wenn du vorhast Ärger zu machen, kannst du direkt wieder gehen.","Если собрался создавать здесь проблемы, можешь идти откуда пришёл.","","False","MIL_116_WAIT_CAMP_06_04","",""
"Scripts/Content/Story/Missions/DIA_MIL_116_Militia.d:45","Ich suche meinen alten Freund Diego.","Я ищу Диего. Мы старые друзья.","","False","MIL_116_WAIT_TROUBLE_15_01","",""
"Scripts/Content/Story/Missions/DIA_MIL_116_Militia.d:46","Schon wieder einer, der meint ein Freund von Diego zu sein.","Да-да, уже в который раз слышу подобные истории.","","False","MIL_116_WAIT_TROUBLE_06_02","",""
"Scripts/Content/Story/Missions/DIA_MIL_116_Militia.d:47","Damit das klar ist, Bürschchen. Diego ist hier der Boss im Lager und er hat bestimmt keine Zeit, mit jedem dahergelaufenen Penner zu reden.","Слушай внимательно, парень. Диего заправляет этим лагерем, и у него нет времени на всякий сброд вроде тебя.","","False","MIL_116_WAIT_TROUBLE_06_03","",""
"Scripts/Content/Story/Missions/DIA_MIL_116_Militia.d:48","Und wo finde ich nun ...euren Boss?","И где я могу найти вашего... начальника?","","False","MIL_116_WAIT_TROUBLE_15_04","",""
"Scripts/Content/Story/Missions/DIA_MIL_116_Militia.d:49","Er hält Rat im alten Erzbaronhaus innerhalb der Burg. Und nun zieh Leine!","Он держит совет в доме баронов внутри крепости. А теперь исчезни!","","False","MIL_116_WAIT_TROUBLE_06_05","",""
"Scripts/Content/Story/Missions/DIA_MIL_116_Militia.d:83","Willst du noch 'ne Runde?","Тебе не хватило прошлого раза?","","False","MIL_116_DEFEAT_06_01","",""
"Scripts/Content/Story/Missions/DIA_MIL_116_Militia.d:95","Weisst du was von einer Molerat-Höhle hier in der Nähe?","Что ты знаешь о логове кротокрысов неподалёку?","","False","MIL_116_Militia_ORECAVE.description","",""
"Scripts/Content/Story/Missions/DIA_MIL_116_Militia.d:110","Weisst du was von einer Molerat-Höhle hier in der Nähe?","Что ты знаешь о логове кротокрысов неподалёку?","","False","MIL_116_ORECAVE_15_01","",""
"Scripts/Content/Story/Missions/DIA_MIL_116_Militia.d:111","Siehst du da drüben die Brücke über den Fluss?","Видишь мост через реку?","","False","MIL_116_ORECAVE_06_02","",""
"Scripts/Content/Story/Missions/DIA_MIL_116_Militia.d:112","Ja!","Да, вижу.","","False","MIL_116_ORECAVE_15_03","",""
"Scripts/Content/Story/Missions/DIA_MIL_116_Militia.d:113","Links davon ist eine Höhle in der sich solche Biester eingenistet haben.","Слева от него находится пещера, в которой эти твари и обитают.","","False","MIL_116_ORECAVE_06_04","",""
"Scripts/Content/Story/Missions/DIA_MIL_116_Militia.d:114","Diese Viecher sind ziemlich hinterhältig. Beobachten einen nur und beissen genau in dem Moment zu, in dem man selbst zum Schlag ausholen will.","Хитрые хищники. Следят за твоими движениями и кусают как только ты собираешься атаковать.","","False","MIL_116_ORECAVE_06_05","",""
"Scripts/Content/Story/Missions/DIA_MIL_118_Calgor.d:31","Was machst du hier?","Что ты здесь делаешь?","","False","MIL_118_Calgor_HI.description","",""
"Scripts/Content/Story/Missions/DIA_MIL_118_Calgor.d:41","Was machst du hier?","Что ты здесь делаешь?","","False","MIL_118_HI_15_01","",""
"Scripts/Content/Story/Missions/DIA_MIL_118_Calgor.d:42","Ich bin Calgor, Soldat der ... dieses Haufens.","Меня зовут Калгор. Я солдат... этого отряда.","","False","MIL_118_HI_08_02","",""
"Scripts/Content/Story/Missions/DIA_MIL_118_Calgor.d:43","Hier im Lager wimmelt es nur so von Halsabschneidern und Dieben.","Здесь в лагере ты вряд ли найдёшь кого-то кроме воров и головорезов.","","False","MIL_118_HI_08_03","",""
"Scripts/Content/Story/Missions/DIA_MIL_118_Calgor.d:44","Aber niemand tut was dagegen. Ja, wenn der König hier wäre, er würde hier Ordnung und Disziplin reinbringen.","Но что поделать. Конечно, если бы король прибыл сюда, он точно навёл бы здесь порядок.","","False","MIL_118_HI_08_04","",""
"Scripts/Content/Story/Missions/DIA_MIL_118_Calgor.d:45","Aber der weiß schon, warum er nicht hier ist, er hat sich um wichtigeres zu kümmern, als um diesen Haufen Gesindel!","Однако, и так понятно, почему он сейчас не здесь. У короля есть дела поважнее, чем возиться с этой кучкой негодяев.","","False","MIL_118_HI_08_05","",""
"Scripts/Content/Story/Missions/DIA_MIL_119_Cassian.d:30","Was machst du hier?","Что ты здесь делаешь?","","False","Mil_119_Cassian_HI.description","",""
"Scripts/Content/Story/Missions/DIA_MIL_119_Cassian.d:40","Was machst du hier?","Что ты здесь делаешь?","","False","Mil_119_HI_15_01","",""
"Scripts/Content/Story/Missions/DIA_MIL_119_Cassian.d:41","Ich bin Cassian, erster Leutnant der Miliz.","Я Кассиан, первый лейтенант ополчения.","","False","Mil_119_HI_08_02","",""
"Scripts/Content/Story/Missions/DIA_MIL_119_Cassian.d:42","Ich sorge dafür, das niemand die Reglen des Lagers bricht.","Я слежу за тем, чтобы в лагере соблюдались правила.","","False","Mil_119_HI_08_03","",""
"Scripts/Content/Story/Missions/DIA_MIL_119_Cassian.d:43","Und ich sorge dafür das die, die es doch tun, es nie wieder tun werden.","Слежу также, чтобы у тех, кто нарушает эти правила отпало всякое желание повторять такие выходки.","","False","Mil_119_HI_08_04","",""
"Scripts/Content/Story/Missions/DIA_MIL_119_Cassian.d:55","Diego sagte mir, du trainierst Kämpfer?","Диего говорит, что ты занимаешься обучением новобранцев.","","False","Mil_119_Cassian_BEGINTRAIN.description","",""
"Scripts/Content/Story/Missions/DIA_MIL_119_Cassian.d:73","Hauptmann Berengar sagte mir, du trainierst Kämpfer?","Капитан Беренгар сказал, что ты тренируешь новобранцев.","","False","Mil_119_BEGINTRAIN_15_01","",""
"Scripts/Content/Story/Missions/DIA_MIL_119_Cassian.d:77","Diego sagte mir, du trainierst Kämpfer?","Диего говорит, что ты занимаешься обучением новобранцев.","","False","Mil_119_BEGINTRAIN_15_02","",""
"Scripts/Content/Story/Missions/DIA_MIL_119_Cassian.d:80","Das ist richtig. Ich sorge dafür, dass die Milizsoldaten kräftig genug sind, wenn die Orks kommen.","Именно так. Я забочусь о том, чтобы солдаты ополчения были готовы в случае нападения орков.","","False","Mil_119_BEGINTRAIN_08_03","",""
"Scripts/Content/Story/Missions/DIA_MIL_119_Cassian.d:81","Und sie werden kommen...","А в том, что они нападут, сомнений нет...","","False","Mil_119_BEGINTRAIN_08_04","",""
"Scripts/Content/Story/Missions/DIA_MIL_119_Cassian.d:82","Ich kann auch dir zeigen wie du deine Stärke und dein Talent im Umgang mit dem Einhänder verbesserst.","Я могу и тебе показать, как повысить силу и лучше обращаться с одноручным оружием.","","False","Mil_119_BEGINTRAIN_08_05","",""
"Scripts/Content/Story/Missions/DIA_MIL_119_Cassian.d:83","Aber im Gegenzug wirst du einige Aufgaben für mich erledigen. Wenn du einverstanden bist, können wir gleich loslegen.","Но взамен ты должен будешь выполнить пару моих поручений. Если согласен, можем сразу же приступить.","","False","Mil_119_BEGINTRAIN_08_06","",""
"Scripts/Content/Story/Missions/DIA_MIL_119_Cassian.d:95","Wofür benötige ich Stärke?","Для чего мне нужна сила?","","False","Mil_119_Cassian_WHYSTR.description","",""
"Scripts/Content/Story/Missions/DIA_MIL_119_Cassian.d:110","Wofür benötige ich Stärke?","Для чего мне нужна сила?","","False","Mil_119_WHYSTR_15_01","",""
"Scripts/Content/Story/Missions/DIA_MIL_119_Cassian.d:111","Je stärker du bist, desto tiefere Wunden verursachst du mit Nahkampfwaffen.","Чем ты сильнее, тем больше вреда твои удары причинят врагу в ближнем бою.","","False","Mil_119_WHYSTR_08_02","",""
"Scripts/Content/Story/Missions/DIA_MIL_119_Cassian.d:112","Wenn dir erst einmal ein gut gerüsteter Ork gegenübersteht, dann wirst du ihn nur mit grosser Stärke verwunden können.","А если ты наткнёшься на орка с хорошими доспехами, то тебе понадобится немало силы, чтобы хоть как-то ранить его.","","False","Mil_119_WHYSTR_08_03","",""
"Scripts/Content/Story/Missions/DIA_MIL_119_Cassian.d:113","Dazu kommt, dass vor allem die grösseren Nahkampfwaffen so schwer sind, dass du sie nur mit hoher Stärke schwingen kannst.","Помимо того, большой силы и требует некоторое оружие ближнего боя, чей вес значительно затрудняет замахи.","","False","Mil_119_WHYSTR_08_04","",""
"Scripts/Content/Story/Missions/DIA_MIL_119_Cassian.d:125","Was nützt mir Talent im Umgang mit Einhändern?","Чем мне помогут навыки владения одноручным оружием?","","False","Mil_119_Cassian_WHY1HAND.description","",""
"Scripts/Content/Story/Missions/DIA_MIL_119_Cassian.d:140","Was nützt mir Talent im Umgang mit Einhändern?","Чем мне помогут навыки владения одноручным оружием?","","False","Mil_119_WHY1HAND_15_01","",""
"Scripts/Content/Story/Missions/DIA_MIL_119_Cassian.d:141","Je mehr Talent du erlernt hast, desto schneller kannst du mit solchen Waffen zuschlagen.","Чем лучше ты станешь обращаться с одноручным оружием, тем быстрее станут твои атаки.","","False","Mil_119_WHY1HAND_08_02","",""
"Scripts/Content/Story/Missions/DIA_MIL_119_Cassian.d:142","Talentierte Kämfper können ihre Gegner mit blitzschnellen Schlagkombinationen derart bedrängen, dass diese nicht mehr mal zum Parrieren geschweige denn zum Angreifen kommen.","Умелые бойцы могут повалить врага цепочкой молниеносных ударов. У противника не будет шанса парировать такие атаки, чего уж говорить об ответных ударах.","","False","Mil_119_WHY1HAND_08_03","",""
"Scripts/Content/Story/Missions/DIA_MIL_119_Cassian.d:143","Ausserdem wissen nur talentierte Kämpfer, wie sie ungeschütze stellen des Gegners treffen, und so manchmal viel tiefere Wunden reissen als sonst.","Помимо того, умелый боец с легкостью может определить слабые места противника и нанести серьёзные раны своими атаками.","","False","Mil_119_WHY1HAND_08_04","",""
"Scripts/Content/Story/Missions/DIA_MIL_119_Cassian.d:156","Ich will stärker werden","Я хочу стать сильнее.","","False","Mil_119_Cassian_Teach.description","",""
"Scripts/Content/Story/Missions/DIA_MIL_119_Cassian.d:171","Ich will stärker werden.","Я хочу стать сильнее.","","False","Mil_119_Cassian_Teach_15_01","",""
"Scripts/Content/Story/Missions/DIA_MIL_119_Cassian.d:228","Zeig mir den Kampf mit einhändigen Waffen.","Обучи меня техникам владения одноручным оружием.","","False","Mil_119_Cassian_TRAIN_15_01","",""
"Scripts/Content/Story/Missions/DIA_MIL_119_Cassian.d:232","Zunächst halte die Waffe mit einer Hand. Dadurch kannst du schneller zuschlagen.","Сперва возьми оружие в одну руку. Так ты сможешь замахиваться быстрее.","","False","Mil_119_Cassian_TRAIN_08_02","",""
