"location","source","target","id","fuzzy","context","translator_comments","developer_comments"
"Scripts/Content/Story/Missions/DIA_BEG_700_Jesper.d:34","Was machst du hier?","Что ты тут делаешь?","","False","BEG_700_Jesper_JOB.description","",""
"Scripts/Content/Story/Missions/DIA_BEG_700_Jesper.d:44","Was machst du hier?","Что ты тут делаешь?","","False","BEG_700_JOB_15_01","",""
"Scripts/Content/Story/Missions/DIA_BEG_700_Jesper.d:45","Ich bin Jesper. War früher mal Soldat. Jetzt bin ich Bettler.","Раньше я был солдатом, теперь я молящийся.","","True","BEG_700_JOB_02_02","",""
"Scripts/Content/Story/Missions/DIA_BEG_700_Jesper.d:46","Was ist geschehen?","Что случилось?","","False","BEG_700_JOB_15_03","",""
"Scripts/Content/Story/Missions/DIA_BEG_700_Jesper.d:47","Drei Offiziere haben sich einen hübschen jungen Rekruten vorgenommen. Darauf hin habe ich sie mir vorgenommen.","Три офицера сделали себе красивого молодого рекрута.","","True","BEG_700_JOB_02_04","",""
"Scripts/Content/Story/Missions/DIA_BEG_700_Jesper.d:48","Innerhalb einer Minute waren sie alle tot. Und das war das Ende meiner Karriere. Seitdem hangel ich mich so durch.","В течение одной минуты все они были мертвы, и это был конец моей карьеры.","","True","BEG_700_JOB_02_05","",""
"Scripts/Content/Story/Missions/DIA_BEG_700_Jesper.d:70","Hey, ich hab dich hier noch nie gesehen. Bringst du Neuigkeiten mit?","Я никогда не видел вас здесь, носите ли вы какие-нибудь новости?","","True","BEG_700_HI_02_01","",""
"Scripts/Content/Story/Missions/DIA_BEG_700_Jesper.d:72","Der alte Tempel ist eingestürzt","Старый храм рухнул","","True","BEG_700_Jesper_HI_Info.BEG_700_Jesper_HI.BEG_700_Jesper_HI_TEMPLE","AI_AddChoice",""
"Scripts/Content/Story/Missions/DIA_BEG_700_Jesper.d:73","Ich hörte das Orks in der Gegend sind.","Я слышал, что в этом районе есть орки.","","True","BEG_700_Jesper_HI_Info.BEG_700_Jesper_HI.BEG_700_Jesper_HI_ORK","AI_AddChoice",""
"Scripts/Content/Story/Missions/DIA_BEG_700_Jesper.d:74","Nein, aber kennst du Neuigkeiten? ","Нет, но знаете ли вы новости?","","True","BEG_700_Jesper_HI_Info.BEG_700_Jesper_HI.BEG_700_Jesper_HI_NO","AI_AddChoice",""
"Scripts/Content/Story/Missions/DIA_BEG_700_Jesper.d:79","Nein, aber kennst du Neuigkeiten?","Нет, но знаете ли вы новости?","","True","BEG_700_HI_NO_15_01","",""
"Scripts/Content/Story/Missions/DIA_BEG_700_Jesper.d:80","Ich kriege einiges mit. Wenn du etwas wissen willst, bin ich dein Mann.","Если вы хотите что-то знать, я ваш муж.","","True","BEG_700_HI_NO_02_02","",""
"Scripts/Content/Story/Missions/DIA_BEG_700_Jesper.d:86","Ich hörte das Orks in der Gegend sind.","Я слышал, что в этом районе есть орки.","","True","BEG_700_HI_ORK_15_01","",""
"Scripts/Content/Story/Missions/DIA_BEG_700_Jesper.d:87","Ach was? Tatsächlich? Sag mal hast du die letzten Monate geschlafen?","Вы спите в течение последних нескольких месяцев?","","True","BEG_700_HI_ORK_02_02","",""
"Scripts/Content/Story/Missions/DIA_BEG_700_Jesper.d:88","Naja, geschlafen trifft es nicht unbedingt...","Но спать не обязательно...","","True","BEG_700_HI_ORK_15_03","",""
"Scripts/Content/Story/Missions/DIA_BEG_700_Jesper.d:89","Junge, wenn du Information suchst, dann bist du bei mir genau richtig.","Мальчик, если ты ищешь информацию, то ты у меня точно прав.","","True","BEG_700_HI_ORK_02_04","",""
"Scripts/Content/Story/Missions/DIA_BEG_700_Jesper.d:95","Der alte Tempel ist eingestürzt","Старый храм рухнул","","True","BEG_700_HI_TEMPLE_15_01","",""
"Scripts/Content/Story/Missions/DIA_BEG_700_Jesper.d:96","Tempel? Welcher Tempel?","Какой храм? какой храм?","","True","BEG_700_HI_TEMPLE_02_02","",""
"Scripts/Content/Story/Missions/DIA_BEG_700_Jesper.d:97","Der alte Ork Tempel in dem der Erzdämon tausend Jahre geschlafen hat.","Древний храм орков, в котором архдемон спал тысячу лет.","","True","BEG_700_HI_TEMPLE_15_03","",""
"Scripts/Content/Story/Missions/DIA_BEG_700_Jesper.d:98","Was... ein Tempel? Dämon... Orks? Damit kann ich nichts anfangen. Aber wenn du Neuigkeiten suchst, bist du bei mir richtig.","Что... храм? демоны... орки? Я не могу с этим начать, но если вы ищете новостей, вы с нами.","","True","BEG_700_HI_TEMPLE_02_04","",""
"Scripts/Content/Story/Missions/DIA_BEG_700_Jesper.d:112","Hast Du Neuigkeiten?","У вас есть новости?","","True","BEG_700_Jesper_NEWS.description","",""
"Scripts/Content/Story/Missions/DIA_BEG_700_Jesper.d:127","Hast Du Neuigkeiten?","У вас есть новости?","","True","BEG_700_NEWS_15_01","",""
"Scripts/Content/Story/Missions/DIA_BEG_700_Jesper.d:128","Das Wasser ist nass, die Miliz schläft im Dienst, die Bettler haben kein Silber, alles ist ruhig.","Вода влажная, милиция спит на службе, у нищих нет серебра, все тихо.","","True","BEG_700_NEWS_02_02","",""
"Scripts/Content/Story/Missions/DIA_BEG_700_Jesper.d:141","(Neuigkeit erwerben über...)","(Новости о приобретении...)","","True","BEG_700_Jesper_GIVENEWS.description","",""
"Scripts/Content/Story/Missions/DIA_BEG_700_Jesper.d:157","Herumtreiber (2 Silber)","Двигатель вокруг (2 серебра)","","True","BEG_700_Jesper_GIVENEWS_Info.BEG_700_Jesper_GIVENEWS.BEG_700_Jesper_GIVENEWS_LOAFER","AI_AddChoice",""
"Scripts/Content/Story/Missions/DIA_BEG_700_Jesper.d:158","Miliz (2 Silber)","Милиция (2 серебра)","","True","BEG_700_Jesper_GIVENEWS_Info.BEG_700_Jesper_GIVENEWS.BEG_700_Jesper_GIVENEWS_MILITIA","AI_AddChoice",""
"Scripts/Content/Story/Missions/DIA_BEG_700_Jesper.d:159","Heiler (2 Silber)","Лечитель (2 серебра)","","True","BEG_700_Jesper_GIVENEWS_Info.BEG_700_Jesper_GIVENEWS.BEG_700_Jesper_GIVENEWS_HEALER","AI_AddChoice",""
"Scripts/Content/Story/Missions/DIA_BEG_700_Jesper.d:160","Arbeiter (2 Silber)","Рабочие (2 серебра)","","True","BEG_700_Jesper_GIVENEWS_Info.BEG_700_Jesper_GIVENEWS.BEG_700_Jesper_GIVENEWS_WORKER","AI_AddChoice",""
"Scripts/Content/Story/Missions/DIA_BEG_700_Jesper.d:168","Erzähl mir was über die Arbeiter!","Расскажите о рабочих.","","True","BEG_700_GIVENEWS_WORKER_15_01","",""
"Scripts/Content/Story/Missions/DIA_BEG_700_Jesper.d:169","Einige der Arbeiter sind unzufrieden, weil Bromor ein Sklaventreiber ist.","Некоторые из рабочих недовольны тем, что Бромор является рабовладельцем.","","True","BEG_700_GIVENEWS_WORKER_02_02","",""
"Scripts/Content/Story/Missions/DIA_BEG_700_Jesper.d:170","Einer von ihnen, Rassmuson, will sogar abhauen.","Один из них, Рассмусон, даже хочет уйти.","","True","BEG_700_GIVENEWS_WORKER_02_03","",""
"Scripts/Content/Story/Missions/DIA_BEG_700_Jesper.d:171","Na, und?","Ну и что?","","True","BEG_700_GIVENEWS_WORKER_15_04","",""
"Scripts/Content/Story/Missions/DIA_BEG_700_Jesper.d:172","Nun, wenn du das Bromor erzähslt, springt vielleicht was für dich raus.","Теперь, когда вы подсчитываете бромор, может быть, что-то выскочит для вас.","","True","BEG_700_GIVENEWS_WORKER_02_05","",""
"Scripts/Content/Story/Missions/DIA_BEG_700_Jesper.d:173","Und wenn du dich auf die Seite von Rassmuson stellst, kannst du vielleicht bei ihm ewas rausschlagen.","И если вы окажетесь на стороне Рассмусона, вы можете что-то сделать с ним.","","True","BEG_700_GIVENEWS_WORKER_02_06","",""
"Scripts/Content/Story/Missions/DIA_BEG_700_Jesper.d:174","Wie auch immer, es ist deine Entscheidung...","В любом случае, это ваше решение...","","True","BEG_700_GIVENEWS_WORKER_02_07","",""
"Scripts/Content/Story/Missions/DIA_BEG_700_Jesper.d:197","Besorge dir Silber, dann bekommst du Informationen.","Подарите себе серебро, и вы получите информацию.","","True","BEG_700_NOMONEY_02_04","",""
"Scripts/Content/Story/Missions/DIA_BEG_700_Jesper.d:189","Erzähl mir was über die Heiler!","Расскажите о лечителях.","","True","BEG_700_GIVENEWS_HEALER_15_01","",""
"Scripts/Content/Story/Missions/DIA_BEG_700_Jesper.d:190","Angeblich gibt es ein Rezept für ein Mittel, das den Kranken für eine Weile einen klaren Verstand verschafft.","Предполагается, что существует рецепт средства, которое на некоторое время даст больному четкий смысл.","","True","BEG_700_GIVENEWS_HEALER_02_02","",""
"Scripts/Content/Story/Missions/DIA_BEG_700_Jesper.d:191","Aber niemand weiß wo dieses Rezept zu finden ist.","Никто не знает, где найти этот рецепт.","","True","BEG_700_GIVENEWS_HEALER_02_03","",""
"Scripts/Content/Story/Missions/DIA_BEG_700_Jesper.d:192","Sie werden sich bestimmt erkenntlich zeigen, wenn jemand das Rezept findet...","Вы наверняка узнаете, когда найдете рецепт.","","True","BEG_700_GIVENEWS_HEALER_02_04","",""
"Scripts/Content/Story/Missions/DIA_BEG_700_Jesper.d:207","Erzähl mir was über die Miliz!","Расскажите о милиции.","","True","BEG_700_GIVENEWS_MILITIA_15_01","",""
"Scripts/Content/Story/Missions/DIA_BEG_700_Jesper.d:208","Brutus der Leutnant kämpft gerne in der Arena. Zu gerne. Denn damit verspielt er sich seine Chance auf den Rang des Hauptmanns, denn er vernachlässigt seine Pflichten.","Брутус лейтенант любит сражаться на арене. слишком любит. потому что тем самым он тратит свой шанс на ранг капитана, потому что он пренебрегает своими обязанностями.","","True","BEG_700_GIVENEWS_MILITIA_02_02","",""
"Scripts/Content/Story/Missions/DIA_BEG_700_Jesper.d:212","Besorge dir Silber, dann bekommst du Informationen.","Подарите себе серебро, и вы получите информацию.","","True","BEG_700_NOMONEY_02_03","",""
"Scripts/Content/Story/Missions/DIA_BEG_700_Jesper.d:222","Erzähl mir was über die Herumtreiber!","Расскажите немного о окружающих!","","True","BEG_700_GIVENEWS_LOAFER_15_01","",""
"Scripts/Content/Story/Missions/DIA_BEG_700_Jesper.d:223","Ihre Position ist schlecht im Lager. Sie helfen nicht beim Aufbau des Lagers und kümmern sich nicht um die Versorgung.","Их положение плохое на складе. они не помогают в строительстве склада и не заботятся о снабжении.","","True","BEG_700_GIVENEWS_LOAFER_02_02","",""
"Scripts/Content/Story/Missions/DIA_BEG_700_Jesper.d:224","Vor allem den Arbeitern stinkt das gewaltig. Aber Diego hat klargemacht, das jeder hier im Lager Zuflucht findet und bleiben kann.","Но Диего ясно дал понять, что каждый может найти убежище и остаться в лагере.","","True","BEG_700_GIVENEWS_LOAFER_02_03","",""
"Scripts/Content/Story/Missions/DIA_BEG_700_Jesper.d:225","Zudem ist jeder Mann bei einem möglichen Orkangriff wichtig.","Кроме того, каждый мужчина имеет важное значение в случае возможного нападения оргкомитета.","","True","BEG_700_GIVENEWS_LOAFER_02_04","",""
"Scripts/Content/Story/Missions/DIA_BEG_700_Jesper.d:229","Besorge dir Silber, dann bekommst du Informationen.","Подарите себе серебро, и вы получите информацию.","","True","BEG_700_NOMONEY_02_05","",""
"Scripts/Content/Story/Missions/DIA_BEG_701_Jose.d:34","Was machst du hier?","Что ты тут делаешь?","","False","BEG_701_Jose_HI.description","",""
"Scripts/Content/Story/Missions/DIA_BEG_701_Jose.d:44","Was machst du hier?","Что ты тут делаешь?","","False","BEG_701_HI_15_01","",""
"Scripts/Content/Story/Missions/DIA_BEG_701_Jose.d:45","Ich schau mir an wer hier ein und ausgeht. Die Soldaten achten nicht auf alles. Ich schon.","Я смотрю, кто входит и выходит, солдаты не обращают внимания на все.","","True","BEG_701_HI_02_02","",""
"Scripts/Content/Story/Missions/DIA_BEG_701_Jose.d:46","Und warum?","А почему ?","","True","BEG_701_HI_15_03","",""
"Scripts/Content/Story/Missions/DIA_BEG_701_Jose.d:47","Es gibt immer jemanden der bereit ist, für Neuigkeiten zu bezahlen.","Всегда найдется кто-то, кто готов заплатить за новости.","","True","BEG_701_HI_02_04","",""
"Scripts/Content/Story/Missions/DIA_BEG_701_Jose.d:59","Und, gibt's was Neues?","А есть ли что-то новое?","","True","BEG_701_Jose_NEWS.description","",""
"Scripts/Content/Story/Missions/DIA_BEG_701_Jose.d:75","Und, gibt's was Neues?","А есть ли что-то новое?","","True","BEG_701_NEWS_15_01","",""
"Scripts/Content/Story/Missions/DIA_BEG_701_Jose.d:76","Es gibt immer was Neues. Bei so viel Verrückten hier...","Всегда есть что-то новое, с таким количеством сумасшедших...","","True","BEG_701_NEWS_02_02","",""
"Scripts/Content/Story/Missions/DIA_BEG_701_Jose.d:77","Wie meinst du das?","Что ты имеешь в виду?","","False","BEG_701_NEWS_15_03","",""
"Scripts/Content/Story/Missions/DIA_BEG_701_Jose.d:78","Zum Beispiel Bromor. Der Baumeister sammelt Trophäen von Tieren.","Например, бромор. строитель собирает трофеи животных.","","True","BEG_701_NEWS_02_04","",""
"Scripts/Content/Story/Missions/DIA_BEG_701_Jose.d:79","Und die meisten anderen trauen sich selber nicht über den Weg. Alles Verrückte!","Большинство людей не верят в себя, все безумцы.","","True","BEG_701_NEWS_02_05","",""
"Scripts/Content/Story/Missions/DIA_BEG_701_Jose.d:80","Und ich bin mittendrin und krieg alles mit. Das ist besser als Arenakämpfe ansehen.","И я в середине, и я воюю со всеми.Это лучше, чем смотреть на арены.","","True","BEG_701_NEWS_02_06","",""
"Scripts/Content/Story/Missions/DIA_BEG_702_Nabor.d:33","Was machst du hier?","Что ты тут делаешь?","","False","BEG_702_Nabor_TIP.description","",""
"Scripts/Content/Story/Missions/DIA_BEG_702_Nabor.d:43","Was machst du hier?","Что ты тут делаешь?","","False","BEG_702_TIP_15_01","",""
"Scripts/Content/Story/Missions/DIA_BEG_702_Nabor.d:44","Ich sitze hier und frage mich, ob du der Richtige bist.","Я сижу здесь и спрашиваю, правильный ли ты.","","True","BEG_702_TIP_00_02","",""
"Scripts/Content/Story/Missions/DIA_BEG_702_Nabor.d:45","Der Richtige? Wofür?","Правильный для чего?","","True","BEG_702_TIP_15_03","",""
"Scripts/Content/Story/Missions/DIA_BEG_702_Nabor.d:46","Der richtige Mann, der eine wertvolle Information für wenig Silber kaufen will. Aber ich glaube, du bist es nicht. Oder doch?","Правильный человек, который хочет купить ценную информацию за небольшое количество серебра, но я думаю, что вы этого не делаете.","","True","BEG_702_TIP_00_04","",""
"Scripts/Content/Story/Missions/DIA_BEG_702_Nabor.d:48","Ich bin der Richtige. Her mit der Information.","Я - правильный человек с информацией.","","True","BEG_702_Nabor_TIP_Info.BEG_702_Nabor_TIP.BEG_702_Nabor_TIP_RIGHTMAN","AI_AddChoice",""
"Scripts/Content/Story/Missions/DIA_BEG_702_Nabor.d:49","Wie teuer ist deine Information?","Сколько стоит ваша информация?","","True","BEG_702_Nabor_TIP_Info.BEG_702_Nabor_TIP.BEG_702_Nabor_TIP_HOWMUCH","AI_AddChoice",""
"Scripts/Content/Story/Missions/DIA_BEG_702_Nabor.d:50","Ich glaube du willst nur schnell ein bisschen Silber abstauben. ","Я думаю, что вы просто хотите быстро сбросить немного серебра.","","True","BEG_702_Nabor_TIP_Info.BEG_702_Nabor_TIP.BEG_702_Nabor_TIP_TRICK","AI_AddChoice",""
"Scripts/Content/Story/Missions/DIA_BEG_702_Nabor.d:55","Ich glaube du willst nur schnell ein bisschen Silber abstauben.","Я думаю, что вы просто хотите быстро сбросить немного серебра.","","True","BEG_702_TIP_TRICK_15_01","",""
"Scripts/Content/Story/Missions/DIA_BEG_702_Nabor.d:56","Ich wußte doch das du nicht der Richtige bist.","Я знал, что ты не тот, кто нужен.","","True","BEG_702_TIP_TRICK_00_02","",""
"Scripts/Content/Story/Missions/DIA_BEG_702_Nabor.d:62","Wie teuer ist deine Information?","Сколько стоит ваша информация?","","True","BEG_702_TIP_HOWMUCH_15_01","",""
"Scripts/Content/Story/Missions/DIA_BEG_702_Nabor.d:63","Für dich nur 10 Silberstücke. Wenn du die hast, kommen wir ins Geschäft.","У вас только 10 серебряных штук. Если у вас их есть, мы идем в магазин.","","True","BEG_702_TIP_HOWMUCH_00_02","",""
"Scripts/Content/Story/Missions/DIA_BEG_702_Nabor.d:70","Ich bin der Richtige. Her mit der Information.","Я - правильный человек с информацией.","","True","BEG_702_TIP_RIGHTMAN_15_01","",""
"Scripts/Content/Story/Missions/DIA_BEG_702_Nabor.d:71","Die kostet allerdings 20 Silberstücke. Kein Verhandeln. Kein Feilschen. Sprich mich an, wenn du das Geld hast.","Но она стоит 20 серебряных штук. Никаких переговоров. Никаких ошибок. Позвоните мне, если у вас есть деньги.","","True","BEG_702_TIP_RIGHTMAN_00_02","",""
"Scripts/Content/Story/Missions/DIA_BEG_702_Nabor.d:85","Okay, hier ist dein Silber","Вот ваше серебро.","","True","BEG_702_Nabor_BUYINFO.description","",""
"Scripts/Content/Story/Missions/DIA_BEG_702_Nabor.d:103","Okay, hier sind die 20 Silberstücke.","Вот эти 20 серебряных монет.","","True","BEG_702_BUYINFO_15_01","",""
"Scripts/Content/Story/Missions/DIA_BEG_702_Nabor.d:109","Okay, hier sind die 10 Silberstücke.","Вот десять серебряных монет.","","True","BEG_702_BUYINFO_15_02","",""
"Scripts/Content/Story/Missions/DIA_BEG_702_Nabor.d:113","Okay, hier ist die Information. Also hör gut zu: Viele halten uns nur für Bettler. Und das ist gut so.","Хорошо, вот информация. так что слушайте хорошо: многие считают нас просто просящими.","","True","BEG_702_BUYINFO_00_03","",""
"Scripts/Content/Story/Missions/DIA_BEG_702_Nabor.d:114","Aber wir sind die Augen und die Ohren dieses Lagers. Alles was hier passiert, jedes krumme Ding das gedreht wird...","Но мы глаза и уши этого лагеря.Все, что происходит здесь, каждая кривая вещь, которая вращается...","","True","BEG_702_BUYINFO_00_04","",""
"Scripts/Content/Story/Missions/DIA_BEG_702_Nabor.d:115","Wir wissen es.","Мы знаем это.","","True","BEG_702_BUYINFO_00_05","",""
"Scripts/Content/Story/Missions/DIA_BEG_702_Nabor.d:116","Und wir verwahren dieses Wissen. Und du bist der Mann, der davon profitieren kann.","И мы сохраняем это знание, и ты человек, который может извлечь выгоду из этого.","","True","BEG_702_BUYINFO_00_06","",""
"Scripts/Content/Story/Missions/DIA_BEG_702_Nabor.d:117","Was meinst du damit?","Was meinst du damit?","","False","BEG_702_BUYINFO_15_07","",""
"Scripts/Content/Story/Missions/DIA_BEG_702_Nabor.d:118","Zeige dich den Bettlern dreimal großzügig. Dann suche Jesper. Er hat dir bestimmt interessante Dinge zu erzählen.","Покажите себя просящим щедро трижды, а затем ищите Джеспера, и он обязательно расскажет вам интересные вещи.","","True","BEG_702_BUYINFO_00_08","",""
"Scripts/Content/Story/Missions/DIA_BEG_702_Nabor.d:119","Warum erzählst du das gerade mir?","Почему вы рассказываете мне об этом?","","True","BEG_702_BUYINFO_15_09","",""
"Scripts/Content/Story/Missions/DIA_BEG_702_Nabor.d:120","Weil du der richtige bist. Und weil wir ja auch davon profitieren , dir unser Wissen zu Verfügung zu stellen. Gegen ein kleines Entgelt...","Потому что вы правы, и потому что мы получаем выгоду от предоставления вам наших знаний за небольшую плату...","","True","BEG_702_BUYINFO_00_10","",""
"Scripts/Content/Story/Missions/DIA_BEG_702_Nabor.d:133","Wo finde ich Jesper?","Где найти Джессика?","","True","BEG_702_Nabor_WHERE.description","",""
"Scripts/Content/Story/Missions/DIA_BEG_702_Nabor.d:148","Wo finde ich Jesper?","Где найти Джессика?","","True","BEG_702_WHERE_15_01","",""
"Scripts/Content/Story/Missions/DIA_BEG_702_Nabor.d:149","Du musst ihn schon alleine finden. Ich nehme an, das wird keine Herausforderung für dich sein.","Вы должны найти его самостоятельно.Я думаю, что это не будет вызовом для вас.","","True","BEG_702_WHERE_00_02","",""
"Scripts/Content/Story/Missions/DIA_BEG_703_Beggar.d:131","Hast du vielleicht ein bisschen Silber?","Может быть, у вас немного серебра?","","True","BEG_703_BEG_00_01","",""
"Scripts/Content/Story/Missions/DIA_BEG_703_Beggar.d:52","Nein, verpiss dich!","Nein, verpiss dich!","","False","BEG_703_BEGGAR_BEG_Info.BEG_703_BEGGAR_BEG.BEG_703_BEGGAR_BEG_NO","AI_AddChoice",""
"Scripts/Content/Story/Missions/DIA_BEG_703_Beggar.d:56","(1 Silbersück geben)","(1 серебряный слой)","","True","BEG_703_BEGGAR_BEG_Info.BEG_703_BEGGAR_BEG.BEG_703_BEGGAR_BEG_ONE","AI_AddChoice",""
"Scripts/Content/Story/Missions/DIA_BEG_703_Beggar.d:61","(5 Silberstücke geben)","(5 серебряных кубиков)","","True","BEG_703_BEGGAR_BEG_Info.BEG_703_BEGGAR_BEG.BEG_703_BEGGAR_BEG_FIVE","AI_AddChoice",""
"Scripts/Content/Story/Missions/DIA_BEG_703_Beggar.d:64","Ich habe gerade leider kein Silber dabei","К сожалению, серебра у меня нет.","","True","BEG_703_BEGGAR_BEG_Info.BEG_703_BEGGAR_BEG.BEG_703_BEGGAR_BEG_SORRY","AI_AddChoice",""
"Scripts/Content/Story/Missions/DIA_BEG_703_Beggar.d:69","Nein, verpiss dich!","Nein, verpiss dich!","","False","BEG_703_BEG_NO_15_01","",""
"Scripts/Content/Story/Missions/DIA_BEG_703_Beggar.d:78","Reichen diese 5 Silberstücke?","Достаточно ли пяти серебряных монет?","","True","BEG_703_BEG_FIVE_15_01","",""
"Scripts/Content/Story/Missions/DIA_BEG_703_Beggar.d:80","Das ist weit mehr als genug, danke! Wenn du Neuigkeiten erfahren willst, sei weiterhin so großzügig!","Это намного больше, чем достаточно, спасибо! Если вы хотите узнать новости, продолжайте быть так щедрыми!","","True","BEG_703_BEG_FIVE_00_02","",""
"Scripts/Content/Story/Missions/DIA_BEG_703_Beggar.d:89","Ich habe gerade leider kein Silber dabei.","К сожалению, серебра у меня нет.","","True","BEG_703_BEG_SORRY_15_01","",""
"Scripts/Content/Story/Missions/DIA_BEG_703_Beggar.d:96","Nimm erstmal dieses Silberstück.","Возьмите сначала этот серебряный кусочек.","","True","BEG_703_BEG_ONE_15_01","",""
"Scripts/Content/Story/Missions/DIA_BEG_703_Beggar.d:98","Wer ein Silber nicht ehrt..jaja ich kenne die Sprüche.","Кто не уважает серебро, тот знает пословицу.","","True","BEG_703_BEG_ONE_00_02","",""
"Scripts/Content/Story/Missions/DIA_BEG_703_Beggar.d:133","Nein, verpiss dich!","Nein, verpiss dich!","","False","BEG_703_BEGGAR_BEG2_Info.BEG_703_BEGGAR_BEG2.BEG_703_BEGGAR_BEG_NO","AI_AddChoice",""
"Scripts/Content/Story/Missions/DIA_BEG_703_Beggar.d:137","(1 Silbersück geben)","(1 серебряный слой)","","True","BEG_703_BEGGAR_BEG2_Info.BEG_703_BEGGAR_BEG2.BEG_703_BEGGAR_BEG_ONE","AI_AddChoice",""
"Scripts/Content/Story/Missions/DIA_BEG_703_Beggar.d:142","(5 Silberstücke geben)","(5 серебряных кубиков)","","True","BEG_703_BEGGAR_BEG2_Info.BEG_703_BEGGAR_BEG2.BEG_703_BEGGAR_BEG_FIVE","AI_AddChoice",""
"Scripts/Content/Story/Missions/DIA_BEG_703_Beggar.d:145","Ich habe gerade leider kein Silber dabei","К сожалению, серебра у меня нет.","","True","BEG_703_BEGGAR_BEG2_Info.BEG_703_BEGGAR_BEG2.BEG_703_BEGGAR_BEG_SORRY","AI_AddChoice",""
"Scripts/Content/Story/Missions/DIA_BEG_704_Lakarus.d:30","Was machst du hier?","Что ты тут делаешь?","","False","BEG_704_Lakarus_HI.description","",""
"Scripts/Content/Story/Missions/DIA_BEG_704_Lakarus.d:40","Was machst du hier?","Что ты тут делаешь?","","False","BEG_704_HI_15_01","",""
