"location","source","target","id","fuzzy","context","translator_comments","developer_comments"
"Scripts/Content/Story/Missions/DIA_MIL_119_Cassian.d:233","Mit weiten Seitenhieben kannst du dir gefährliche Gegner vom Hals halten.","Широкие замахи из стороны в сторону позволят держать опаснх противников на расстоянии.","","False","Mil_119_Cassian_TRAIN_08_03","",""
"Scripts/Content/Story/Missions/DIA_MIL_119_Cassian.d:234","Und mit einer Kombination von Schlägen kannst du gezielte Attacken durchführen.","А комбинация ударов позволит тебе совершать атаки по направлению к цели.","","False","Mil_119_Cassian_TRAIN_08_04","",""
"Scripts/Content/Story/Missions/DIA_MIL_119_Cassian.d:235","Das wichtigste ist, das du Kampferfahrung sammelst. Da habe ich auch direkt die erste Gelegenheit für dich.","Во владении техниками боя с одноручным оружием важнее всего полевой опыт. Поэтому у меня есть для тебя первое задание.","","False","Mil_119_Cassian_TRAIN_08_05","",""
"Scripts/Content/Story/Missions/DIA_MIL_119_Cassian.d:236","Lass hören.","Рассказывай.","","False","Mil_119_Cassian_TRAIN_15_06","",""
"Scripts/Content/Story/Missions/DIA_MIL_119_Cassian.d:237","Du mußt wissen, das es hier im Lager einige Herumtreiber gibt. Faule Hunde, die sich einen Dreck um die Gemeinschaft des Lagers scheren.","Ты наверняка знаешь, что в лагере есть несколько бродяг. Этим ленивым собакам наплевать на благосостояние лагеря.","","False","Mil_119_Cassian_TRAIN_08_07","",""
"Scripts/Content/Story/Missions/DIA_MIL_119_Cassian.d:238","Huldrych ist einer von ihnen. Er wurde beobachtet, wie er sich an den Vorräten des Händlers Agon bedient hat.","Есть среди них один парень по имени Ульрих. Его застали за воровством товаров Агона.","","False","Mil_119_Cassian_TRAIN_08_08","",""
"Scripts/Content/Story/Missions/DIA_MIL_119_Cassian.d:239","Und meine Aufgabe ist ...","И я должен...","","False","Mil_119_Cassian_TRAIN_15_09","",""
"Scripts/Content/Story/Missions/DIA_MIL_119_Cassian.d:240","Deine Aufgabe ist es, Huldrych das gestohlene Zeug wieder abzunehmen. Verpass ihm eine Lektion. Aber LASS IHM AM LEBEN!","Ты должен вернуть украденное. Преподай Ульриху урок, НО ДАЖЕ НЕ ДУМАЙ ЕГО УБИВАТЬ!","","False","Mil_119_Cassian_TRAIN_08_10","",""
"Scripts/Content/Story/Missions/DIA_MIL_119_Cassian.d:284","Vielleicht solltest du zuerst mit Agon sprechen, bevor du zu Huldrych gehst.","Думаю, лучше тебе сначала поговорить с Агоном, а лишь потом идти за Ульрихом.","","False","Mil_119_Cassian_WHILEHULDRYCH_08_01","",""
"Scripts/Content/Story/Missions/DIA_MIL_119_Cassian.d:299","Huldrych hat seine Lektion erhalten","Ульрих усвоил урок.","","False","Mil_119_Cassian_FIRSTMISSION.description","",""
"Scripts/Content/Story/Missions/DIA_MIL_119_Cassian.d:319","Huldrych hat seine Lektion erhalten","Ульрих усвоил урок.","","False","Mil_119_Cassian_FIRSTMISSION_Info_15_01","",""
"Scripts/Content/Story/Missions/DIA_MIL_119_Cassian.d:320","Saubere Arbeit. Hoffentlich lernt er daraus.","Отличная работа. Думаю, он запомнит эту встречу надолго.","","False","Mil_119_Cassian_FIRSTMISSION_Info_08_02","",""
"Scripts/Content/Story/Missions/DIA_MIL_119_Cassian.d:343","Huldrych hat...äh seine Lektion endgültig verstanden","Ульрих... усвоил урок. Посмертно.","","False","Mil_119_Cassian_HULDRYCHDEAD.description","",""
"Scripts/Content/Story/Missions/DIA_MIL_119_Cassian.d:362","Huldrych hat...äh seine Lektion endgültig verstanden.","Ульрих... усвоил урок. Посмертно.","","False","Mil_119_Cassian_HULDRYCHDEAD_Info_15_01","",""
"Scripts/Content/Story/Missions/DIA_MIL_119_Cassian.d:363","Du hast ihn umgebracht. Hatte ich dir nicht gesagt, du sollst ihn nicht umbringen?","Разве я тебе не сказал, что ты не должен был его убить?","","False","Mil_119_Cassian_HULDRYCHDEAD_Info_08_02","",""
"Scripts/Content/Story/Missions/DIA_MIL_119_Cassian.d:364","Das oberste Gesetz hier im Lager lautete: KEIN MORD! Ein Mord ist ein Grund jemanden aus dem Lager zu verweisen!","Главный закон лагеря гласит: НИКАКИХ УБИЙСТВ! Убийство члена лагеря является основанием выгнать виновника их лагеря.","","False","Mil_119_Cassian_HULDRYCHDEAD_Info_08_03","",""
"Scripts/Content/Story/Missions/DIA_MIL_119_Cassian.d:365","Wenn du noch einmal jemanden tötest, dann kann dir keiner helfen. Nicht mal Diego, Lester oder ich. Bei aller Freundschaft nicht.","Если ты ещё хоть кого-то убьёшь, тебе уже никто не сможет помочь. Ни Диего, ни Лестер, ни я. Какого бы мы ни были о тебе мнения.","","False","Mil_119_Cassian_HULDRYCHDEAD_Info_08_04","",""
"Scripts/Content/Story/Missions/DIA_MIL_119_Cassian.d:384","Agon hat sein Silber wieder","Агон получил своё серебро обратно.","","False","Mil_119_Cassian_AGONSSILVER.description","",""
"Scripts/Content/Story/Missions/DIA_MIL_119_Cassian.d:396","Agon hat sein Silber wieder.","Агон получил своё серебро обратно.","","False","Mil_119_Cassian_AGONSSILVER_Info_15_01","",""
"Scripts/Content/Story/Missions/DIA_MIL_119_Cassian.d:397","Gut gemacht. Da wird der knausrige Kerl sich aber freuen.","Отлично сработано. Этот скупец будет доволен.","","False","Mil_119_Cassian_AGONSSILVER_Info_08_02","",""
"Scripts/Content/Story/Missions/DIA_MIL_119_Cassian.d:410","Huldrych hat bekommen, was er verdient!","Ульрих получил по заслугам!","","False","Mil_119_Cassian_HULDRYCHDEAL.description","",""
"Scripts/Content/Story/Missions/DIA_MIL_119_Cassian.d:431","Huldrych hat bekommen, was er verdient!","Ульрих получил по заслугам!","","False","Mil_119_Cassian_HULDRYCHDEAL_15_01","",""
"Scripts/Content/Story/Missions/DIA_MIL_119_Cassian.d:432","Ich hoffe du hast ihn nicht zu hart rangenommen.","Надеюсь, ты не был слишком строг.","","False","Mil_119_Cassian_HULDRYCHDEAL_08_02","",""
"Scripts/Content/Story/Missions/DIA_MIL_119_Cassian.d:433","Er hat es verstanden.","Он всё понял.","","False","Mil_119_Cassian_HULDRYCHDEAL_15_03","",""
"Scripts/Content/Story/Missions/DIA_MIL_119_Cassian.d:434","Und du weißt jetzt auch, wie die Dinge hier laufen.","А ты теперь знаешь, как здесь обстоят дела.","","False","Mil_119_Cassian_HULDRYCHDEAL_08_04","",""
"Scripts/Content/Story/Missions/DIA_MIL_119_Cassian.d:474","Zeig mir mehr über den Kampf mit einhändigen Waffen.","Расскажи мне больше о техниках владения одноручным оружем.","","False","Mil_119_Cassian_LEARN1HST2_15_01","",""
"Scripts/Content/Story/Missions/DIA_MIL_119_Cassian.d:478","Durch die Meisterschaft des einhändigen Kampfes schlägst du schneller und härter zu.","Мастерство владения одноручным оружием повысит силу и скорость твоих ударов.","","False","Mil_119_Cassian_LEARN1HST2_08_02","",""
"Scripts/Content/Story/Missions/DIA_MIL_119_Cassian.d:479","Deine Angriffskombinationen werden geschikter und präziser.","Цепочки ударов станут ловче и точнее.","","False","Mil_119_Cassian_LEARN1HST2_08_03","",""
"Scripts/Content/Story/Missions/DIA_MIL_119_Cassian.d:480","Und die Chance einen kritischen Treffer zu landen wird größer.","Также станет выше и шанс нанесения критического урона.","","False","Mil_119_Cassian_LEARN1HST2_08_04","",""
"Scripts/Content/Story/Missions/DIA_MIL_119_Cassian.d:481","Aber es ist der Verstand, der einen guten von einem schlechten Kämpder unterscheidet.","Но больше всего отличает мастера от новичка умение оценивать ситуацию.","","False","Mil_119_Cassian_LEARN1HST2_08_05","",""
"Scripts/Content/Story/Missions/DIA_MIL_119_Cassian.d:482","Erkenne die Situation, bewahre einen kühlen Kopf und handel umsichtig.","Сохраняй ясность мысли и осторожность.","","False","Mil_119_Cassian_LEARN1HST2_08_06","",""
"Scripts/Content/Story/Missions/DIA_MIL_119_Cassian.d:483","Denn nur wer die Situation versteht, kann sie lenken und kontrollieren.","Только полностью поняв обстановку, ты сможешь взять контроль в свои руки.","","False","Mil_119_Cassian_LEARN1HST2_08_07","",""
"Scripts/Content/Story/Missions/DIA_MIL_119_Cassian.d:502","Hast du noch eine Aufgabe für mich?","У тебя есть поручения для меня?","","False","Mil_119_Cassian_JOB.description","",""
"Scripts/Content/Story/Missions/DIA_MIL_119_Cassian.d:514","Hast du noch eine Aufgabe für mich?","У тебя есть поручения для меня?","","False","Mil_119_JOB_15_01","",""
"Scripts/Content/Story/Missions/DIA_MIL_119_Cassian.d:515","Ich nicht, aber Agon hat braucht einen Kämpfer, der ihn beschützt.","Нет, но, говорят, Агон ищет себе охрану.","","False","Mil_119_JOB_08_02","",""
"Scripts/Content/Story/Missions/DIA_MIL_119_Cassian.d:516","Wir versuchen das Gebiet um das Lager herum besetzt zu halten, aber es gibt immer wieder Monster die verdammt nah ans Lager heran kommen.","Мы стараемся контроллировать близлежащую территорию, но монстры вечно подходят чертовски близко к лагерю.","","False","Mil_119_JOB_08_03","",""
"Scripts/Content/Story/Missions/DIA_MIL_119_Cassian.d:532","Brutus lässt dir was ausrichten...","У меня послание от Брутуса...","","False","Mil_119_Cassian_BRUTUS.description","",""
"Scripts/Content/Story/Missions/DIA_MIL_119_Cassian.d:544","Brutus lässt dir was ausrichten. Er fordert dich auf, gegen ihn in der Arena zu kämpfen.","У меня послание от Брутуса. Он хочет сразиться с тобой на арене.","","False","Mil_119_BRUTUS_15_01","",""
"Scripts/Content/Story/Missions/DIA_MIL_119_Cassian.d:545","Brutus sollte sich mehr um seine Pflichten als Leutnant der Miliz kümmern.","Брутусу не помешало бы вместо этого позаботиться о своих должностях как лейтенанта ополчения.","","False","Mil_119_BRUTUS_08_02","",""
"Scripts/Content/Story/Missions/DIA_MIL_119_Cassian.d:546","Er hängt den ganzen Tag nur vor der Arena herum und reisst grosse Sprüche.","Однако он только и ошивается вокруг арены да бахвалится дни напролёт.","","False","Mil_119_BRUTUS_08_03","",""
"Scripts/Content/Story/Missions/DIA_MIL_119_Cassian.d:547","Er sollte seine Kraft lieber für die Orks aufheben, oder sich um die Milizsoldaten kümmern.","Лучше бы он поберёг свои силы для орков, или занялся солдатами ополчения.","","False","Mil_119_BRUTUS_08_04","",""
"Scripts/Content/Story/Missions/DIA_MIL_119_Cassian.d:548","Wenn er so weiter macht, wird ihn Berengar über kurz oder lang rausschmeissen.","Если он продолжит в том же духе, Беренгар выпрет его из ополчения.","","False","Mil_119_BRUTUS_08_05","",""
"Scripts/Content/Story/Missions/DIA_MIL_120_Julius.d:41","Die Schmiede sieht verlassen aus!","Кузница выглядит заброшенной!","","False","Info_Julius_SMITH.description","",""
"Scripts/Content/Story/Missions/DIA_MIL_120_Julius.d:51","Die Schmiede sieht verlassen aus!","Кузница выглядит заброшенной!","","False","Info_Julius_SMITH_15_01","",""
"Scripts/Content/Story/Missions/DIA_MIL_120_Julius.d:52","Ja, ja. Den alten Bartok haben sie vor ein paar Tagen abgeholt.","Верно. Старину Бартока забрали несколько дней назад.","","False","Info_Julius_SMITH_00_02","",""
"Scripts/Content/Story/Missions/DIA_MIL_120_Julius.d:53","Abgeholt?","Забрали?","","False","Info_Julius_SMITH_15_03","",""
"Scripts/Content/Story/Missions/DIA_MIL_120_Julius.d:54","Er hat die Krankheit. Armer Kerl! Sie haben ihn in das Aussätzigen-Viertel gebracht.","Бедолага подхватил какую-то заразу! Его увели к остальным прокажённым.","","False","Info_Julius_SMITH_00_04","",""
"Scripts/Content/Story/Missions/DIA_MIL_120_Julius.d:66","Wo sind seine Werkzeuge?","Где его инструменты?","","False","Info_Julius_CHEST.description","",""
"Scripts/Content/Story/Missions/DIA_MIL_120_Julius.d:81","Wo sind seine Werkzeuge?","Где его инструменты?","","False","Info_Julius_CHEST_15_01","",""
"Scripts/Content/Story/Missions/DIA_MIL_120_Julius.d:82","Er hat den ganzen Schmiede-Krempel gehütet wie seinen Augapfel.","Он берег своё снаряжение как зеницу ока.","","False","Info_Julius_CHEST_00_02","",""
"Scripts/Content/Story/Missions/DIA_MIL_120_Julius.d:83","Hat alles in seiner Kiste aufbewahrt. Den Schlüssel trug er immer bei sich.","Всё хранил в сундуке, а ключ наверняка забрал с собой.","","False","Info_Julius_CHEST_00_03","",""
"Scripts/Content/Story/Missions/DIA_MIL_120_Julius.d:102","Immer noch hier?","Все еще здесь?","","False","MIL_120_Julius_STILLHERE.description","",""
"Scripts/Content/Story/Missions/DIA_MIL_120_Julius.d:117","Immer noch hier?","Все еще здесь?","","False","MIL_120_STILLHERE_15_01","",""
"Scripts/Content/Story/Missions/DIA_MIL_120_Julius.d:118","Jaja! Ist zwar nicht der interessanteste Job, auf eine verlassene Schmiede aufzupassen, aber Hauptsache ich bekomme jede Woche meinen Sold!","Да! Следить за заброшенной кузницей - работа не самая интересная, но платят мне каждую неделю, а это главное.","","False","MIL_120_STILLHERE_00_02","",""
"Scripts/Content/Story/Missions/DIA_MIL_121_Brutus.d:70","Rück mein Schwert raus, oder ich mach dich platt!","Верни мой меч, пока я тебя не раздавил!","","False","MIL_121_MYWEAPON_Info_06_01","",""
"Scripts/Content/Story/Missions/DIA_MIL_121_Brutus.d:73","Das Schwert gefällt mir. Ich behalte es!","Лучше я оставлю этот меч себе.","","False","MIL_121_Brutus_MYWEAPON_Info.MIL_121_Brutus_MYWEAPON.MIL_121_Brutus_MYWEAPON_TAKEN","AI_AddChoice",""
"Scripts/Content/Story/Missions/DIA_MIL_121_Brutus.d:74","Bleib locker, hier ist dein Schwert.","Спокойно, вот твой меч.","","False","MIL_121_Brutus_MYWEAPON_Info.MIL_121_Brutus_MYWEAPON.MIL_121_Brutus_MYWEAPON_GIVEBACK","AI_AddChoice",""
"Scripts/Content/Story/Missions/DIA_MIL_121_Brutus.d:80","Bleib locker, hier ist dein Schwert.","Спокойно, вот твой меч.","","False","MIL_121_MYWEAPON_GIVEBACK_15_01","",""
"Scripts/Content/Story/Missions/DIA_MIL_121_Brutus.d:82","(bedrohlich) dann lass mal sehen, wieviel Durchhaltevermögen du hast..","(угрожающе) Ну, посмотрим, насколько ты вынослив...","","False","MIL_121_MYWEAPON_GIVEBACK_06_02","",""
"Scripts/Content/Story/Missions/DIA_MIL_121_Brutus.d:89","Das Schwert gefällt mir. Ich behalte es!","Лучше я оставлю этот меч себе.","","False","MIL_121_MYWEAPON_TAKEN_15_01","",""
"Scripts/Content/Story/Missions/DIA_MIL_121_Brutus.d:90","Regel Nummer 3, du Trottel! Jetzt habe ich den Kampf gewonnen, Har Har Har!","Болван, ты нарушил правило номер 3. Победа теперь за мной! (смеётся)","","False","MIL_121_MYWEAPON_TAKEN_06_02","",""
"Scripts/Content/Story/Missions/DIA_MIL_121_Brutus.d:127","Wir sehen uns in der Arena, Kleiner! Heute Abend!","Увидимя вечером на арене, щенок!","","False","MIL_121_CHALLENGED_06_01","",""
"Scripts/Content/Story/Missions/DIA_MIL_121_Brutus.d:131","Verschwinde in deine eigene Kammer!","Это не твоя комната! Проваливай!","","False","MIL_121_CHALLENGED_06_02","",""
"Scripts/Content/Story/Missions/DIA_MIL_121_Brutus.d:140","(bedrohlich) Ich mach dich platt!!!","(угрожающе) Я раздавлю тебя!","","False","MIL_121_CHALLENGED_06_03","",""
"Scripts/Content/Story/Missions/DIA_MIL_121_Brutus.d:146","Wir sehen uns in der Arena, Kleiner! Morgen Abend!","Увидимся следующим вечером на арене, щенок!","","False","MIL_121_CHALLENGED_06_04","",""
"Scripts/Content/Story/Missions/DIA_MIL_121_Brutus.d:179","Verschwinde! Dieser Raum ist nur für Gladiatoren vor dem Kampf!","Проваливай! Здесь гладиаторы готовятся к сражению!","","False","MIL_121_PRENPC_06_01","",""
"Scripts/Content/Story/Missions/DIA_MIL_121_Brutus.d:192","Du bist bestimmt einer der Gladiatoren!","Так ты один из гладиаторов?","","False","MIL_121_Brutus_GLADIATOR.description","",""
"Scripts/Content/Story/Missions/DIA_MIL_121_Brutus.d:202","Du bist bestimmt einer der Gladiatoren!","Так ты один из гладиаторов?","","False","MIL_121_GLADIATOR_15_01","",""
"Scripts/Content/Story/Missions/DIA_MIL_121_Brutus.d:203","Woher willst du das wissen, Kleiner?","А тебе откуда знать, щенок?","","False","MIL_121_GLADIATOR_06_02","",""
"Scripts/Content/Story/Missions/DIA_MIL_121_Brutus.d:206","Ich habe geraten.","Догадался.","","False","MIL_121_Brutus_GLADIATOR_Info.MIL_121_Brutus_GLADIATOR.MIL_121_Brutus_GLADIATOR_NOONE","AI_AddChoice",""
"Scripts/Content/Story/Missions/DIA_MIL_121_Brutus.d:207","Was ist dein Problem?","В чём проблема?","","False","MIL_121_Brutus_GLADIATOR_Info.MIL_121_Brutus_GLADIATOR.MIL_121_Brutus_GLADIATOR_PROVOKE","AI_AddChoice",""
"Scripts/Content/Story/Missions/DIA_MIL_121_Brutus.d:214","Was ist dein Problem?","В чём проблема?","","False","MIL_121_GLADIATOR_PROVOKE_15_01","",""
"Scripts/Content/Story/Missions/DIA_MIL_121_Brutus.d:220","Wenn du nicht deine Fresse hältst, hast DU ein Problem, Kleiner!","Проблемы будут, если ты, щенок, не закроешь свою пасть!","","False","MIL_121_GLADIATOR_PROVOKE_06_02","",""
"Scripts/Content/Story/Missions/DIA_MIL_121_Brutus.d:221","Vorlaute Spinner wie dich mach ich besonders gerne platt!","Мне очень нравится давить наглых идиотов вроде тебя!","","False","MIL_121_GLADIATOR_PROVOKE_06_03","",""
"Scripts/Content/Story/Missions/DIA_MIL_121_Brutus.d:233","Ich habe geraten.","Догадался.","","False","MIL_121_GLADIATOR_NOONE_15_01","",""
"Scripts/Content/Story/Missions/DIA_MIL_121_Brutus.d:234","Und ich rate dir mich nicht zu nerven, sonst mach ich dich platt!","Следовало бы догадаться, что лучше не действовать мне на нервы, пока я тебя не раздавил!","","False","MIL_121_GLADIATOR_NOONE_06_02","",""
"Scripts/Content/Story/Missions/DIA_MIL_121_Brutus.d:246","Du siehst aber eher aus wie ein Milizsoldat!","Ты выглядишь как солдат ополчения!","","False","MIL_121_Brutus_YOUMILITIA.description","",""
"Scripts/Content/Story/Missions/DIA_MIL_121_Brutus.d:262","Du siehst aber eher aus wie ein Milizsoldat!","Ты выглядишь как солдат ополчения!","","False","MIL_121_YOUMILITIA_15_01","",""
"Scripts/Content/Story/Missions/DIA_MIL_121_Brutus.d:263","Hör zu Kleiner, falls du es noch nicht gemerkt hast...","Слушай сюда, щенок...","","False","MIL_121_YOUMILITIA_06_02","",""
"Scripts/Content/Story/Missions/DIA_MIL_121_Brutus.d:264","Du sprichst mit LEUTNANT Brutus, dem zweiten Mann in der Miliz gleich nach diesem verbitterten Arsch von Berengar.","Если ты не заметил, ты сейчас говоришь с ЛЕЙТЕНАНТОМ Брутусом, вторым человеком в ополчении после этой сволочи Беренгара.","","False","MIL_121_YOUMILITIA_06_03","",""
"Scripts/Content/Story/Missions/DIA_MIL_121_Brutus.d:265","Also zeig gefälligst ein bischen mehr Respekt oder ich mach dich platt!","Так что проявляй больше уважения, или я тебя раздавлю!","","False","MIL_121_YOUMILITIA_06_04","",""
"Scripts/Content/Story/Missions/DIA_MIL_121_Brutus.d:277","Bist du nicht einer dieser beiden Leutnants der Miliz?","Ты один из лейтенантов ополчения, ведь так?","","False","MIL_121_Brutus_YOULIEUTENANT.description","",""
"Scripts/Content/Story/Missions/DIA_MIL_121_Brutus.d:293","Bist du nicht einer dieser beiden Leutnants der Miliz?","Ты один из лейтенантов ополчения, ведь так?","","False","MIL_121_YOULIEUTENANT_15_01","",""
"Scripts/Content/Story/Missions/DIA_MIL_121_Brutus.d:294","Das bin ich, Kleiner. Und deshalb solltest du gut aufpassen, wie du mir mir redest!","Да, щенок, ты прав. Так что следи за своим языком, когда говоришь со мной!","","False","MIL_121_YOULIEUTENANT_06_02","",""
"Scripts/Content/Story/Missions/DIA_MIL_121_Brutus.d:306","Ich habe gehört, Cassian ist ebenfalls Miliz-Leutnant!","Я слышал, что Кассиан тоже лейтенант!","","False","MIL_121_Brutus_CASSIAN.description","",""
"Scripts/Content/Story/Missions/DIA_MIL_121_Brutus.d:325","Ich habe gehört, Cassian ist ebenfalls Miliz-Leutnant!","Я слышал, что Кассиан тоже лейтенант!","","False","MIL_121_CASSIAN_15_01","",""
"Scripts/Content/Story/Missions/DIA_MIL_121_Brutus.d:326","(aggressiv)Cassian, ist ein Weichling! Eine Memme.","(агрессивно) Кассиан - слабак! Тряпка!","","False","MIL_121_CASSIAN_06_02","",""
"Scripts/Content/Story/Missions/DIA_MIL_121_Brutus.d:327","Der weiss schon garnicht mehr, wie sich ein Schwert überhaupt anfühlt.","Он и понятия не имеет, что на самом деле представляет собой меч.","","False","MIL_121_CASSIAN_06_03","",""
"Scripts/Content/Story/Missions/DIA_MIL_121_Brutus.d:328","Steht den ganzen Tag im Burghof, und gibt besserwisserische Kommentare an die Rekruten.","Только и стоит целыми днями во дворе замка да раздаёт рекрутам премудрые замечания.","","False","MIL_121_CASSIAN_06_04","",""
"Scripts/Content/Story/Missions/DIA_MIL_121_Brutus.d:329","Der sollte sich liebermal hier in die Arena herunterwagen, dann werde ich ihm schon zeigen, wie man kämfpt.","Вот решит он выйти на арену, так я ему подробно объясню, как нужно сражаться.","","False","MIL_121_CASSIAN_06_05","",""
"Scripts/Content/Story/Missions/DIA_MIL_121_Brutus.d:330","(grins) Wenn ich ihn sehe, werde ich es ihm ausrichten.","(с улыбкой) Если встречу Кассиана, передам ему твоё послание.","","False","MIL_121_CASSIAN_15_06","",""
"Scripts/Content/Story/Missions/DIA_MIL_121_Brutus.d:343","Laß uns in der Arena klären, wer hier wen plattmacht!","Пусть арена решит, кто из нас кого раздавит!","","False","MIL_121_Brutus_CHALLENGE.description","",""
"Scripts/Content/Story/Missions/DIA_MIL_121_Brutus.d:365","Laß uns in der Arena klären, wer hier wen plattmacht!","Пусть арена решит, кто из нас кого раздавит!","","False","MIL_121_CHALLENGE_15_01","",""
"Scripts/Content/Story/Missions/DIA_MIL_121_Brutus.d:369","Irgend so ein Witzbold hat sich mein Schwert unter den Nagel gerissen. Wenn ich den erwische, mach ich ihn platt...","Какой-то шутник украл мой меч. Поймаю сволочь - раздавлю.","","False","MIL_121_CHALLENGE_06_02","",""
"Scripts/Content/Story/Missions/DIA_MIL_121_Brutus.d:374","Ich habe deine Waffe... ähem... gefunden! Hier!","Я, э-э... нашел твой меч! Держи!","","False","MIL_121_Brutus_CHALLENGE_Info.MIL_121_Brutus_CHALLENGE.MIL_121_Brutus_CHALLENGE_FOUND","AI_AddChoice",""
"Scripts/Content/Story/Missions/DIA_MIL_121_Brutus.d:382","Sehr gerne!","С удовольствием!","","False","MIL_121_CHALLENGE_06_03","",""
"Scripts/Content/Story/Missions/DIA_MIL_121_Brutus.d:383","Aber der Arenameister wird dich nicht kämpfen lassen, weil du Scheisse gebaut hast","Но ты заварил такую кашу, что распорядитель арены не позволит тебе выйти на бой.","","False","MIL_121_CHALLENGE_06_04","",""
