"location","source","target","id","fuzzy","context","translator_comments","developer_comments"
"Scripts/Content/Story/Missions/DIA_PAL_1029_Osraed.d:49","HALT!","HALT!","","False","PAL_1029_FirstWarn_Info_06_01","",""
"Scripts/Content/Story/Missions/DIA_PAL_1029_Osraed.d:50","Was ist?","Что?","","False","PAL_1029_FirstWarn_Info_15_02","",""
"Scripts/Content/Story/Missions/DIA_PAL_1029_Osraed.d:51","Hier dürfen nur Gefolgsleute des Königs passieren!","","","False","PAL_1029_FirstWarn_Info_06_03","",""
"Scripts/Content/Story/Missions/DIA_PAL_1029_Osraed.d:52","Also verschwinde!","","","False","PAL_1029_FirstWarn_Info_06_04","",""
"Scripts/Content/Story/Missions/DIA_PAL_1029_Osraed.d:90","Noch einen Schritt weiter und wir machen Kleinholz aus dir!","","","False","PAL_1029_LastWarn_06_01","",""
"Scripts/Content/Story/Missions/DIA_PAL_1029_Osraed.d:179","Lass mich rein, ich möchte Soldat des Königs werden!","","","False","PAL_1029_SOLDIER.description","",""
"Scripts/Content/Story/Missions/DIA_PAL_1029_Osraed.d:194","Lass mich rein, ich möchte Soldat des Königs werden!","","","False","PAL_1029_SOLDIER_15_01","",""
"Scripts/Content/Story/Missions/DIA_PAL_1029_Osraed.d:195","Die zwei Spinner da vorne am Lagerfeuer möchten auch Soldat werden.","","","False","PAL_1029_SOLDIER_06_02","",""
"Scripts/Content/Story/Missions/DIA_PAL_1029_Osraed.d:196","(spöttisch) Fällt dir nichts besseres ein?","","","False","PAL_1029_SOLDIER_06_03","",""
"Scripts/Content/Story/Missions/DIA_PAL_1029_Osraed.d:209","Lass mich rein, es soll nicht dein Schaden sein!","","","False","PAL_1029_Osraed_BRIBE.description","",""
"Scripts/Content/Story/Missions/DIA_PAL_1029_Osraed.d:225","Lass mich rein, es soll nicht dein Schaden sein!","","","False","PAL_1029_BRIBE_15_01","",""
"Scripts/Content/Story/Missions/DIA_PAL_1029_Osraed.d:226","(bedrohlich) Soso, du willst mich also bestechen!","","","False","PAL_1029_BRIBE_06_02","",""
"Scripts/Content/Story/Missions/DIA_PAL_1029_Osraed.d:228","Wieviel?","Wieviel?","","False","PAL_1029_Osraed_BRIBE_Info.PAL_1029_Osraed_BRIBE.PAL_1029_Osraed_BRIBE_YES","AI_AddChoice",""
"Scripts/Content/Story/Missions/DIA_PAL_1029_Osraed.d:229","Nein, du musst mich missverstanden haben!","","","False","PAL_1029_Osraed_BRIBE_Info.PAL_1029_Osraed_BRIBE.PAL_1029_Osraed_BRIBE_NO","AI_AddChoice",""
"Scripts/Content/Story/Missions/DIA_PAL_1029_Osraed.d:235","Nein, du musst mich missverstanden haben!","","","False","PAL_1029_BRIBE_NO_15_01","",""
"Scripts/Content/Story/Missions/DIA_PAL_1029_Osraed.d:236","Pah! Erst das Maul aufreissen, dann den Schwanz einkneifen.","","","False","PAL_1029_BRIBE_NO_06_02","",""
"Scripts/Content/Story/Missions/DIA_PAL_1029_Osraed.d:243","Wieviel?","Wieviel?","","False","PAL_1029_BRIBE_YES_15_01","",""
"Scripts/Content/Story/Missions/DIA_PAL_1029_Osraed.d:244","100 Silber, darunter läuft nichts!","","","False","PAL_1029_BRIBE_YES_06_02","",""
"Scripts/Content/Story/Missions/DIA_PAL_1029_Osraed.d:258","(100 Silber geben)","","","False","PAL_1029_Osraed_GIVESILVER.description","",""
"Scripts/Content/Story/Missions/DIA_PAL_1029_Osraed.d:277","Ich sagte doch, es soll nicht dein Schaden sein.","","","False","PAL_1029_GIVESILVER_15_01","",""
"Scripts/Content/Story/Missions/DIA_PAL_1029_Osraed.d:278","Wenn du jemanden hiervon erzählst bist du tot!","","","False","PAL_1029_GIVESILVER_06_02","",""
"Scripts/Content/Story/Missions/DIA_PAL_1029_Osraed.d:279","Jetzt mach dass du rein kommst und mach keinen Ärger!","","","False","PAL_1029_GIVESILVER_06_03","",""
"Scripts/Content/Story/Missions/DIA_PAL_1029_Osraed.d:304","Gib mir meine 100 Silber zurück!","","","False","PAL_1029_Osraed_HOWDYBRIBED.description","",""
"Scripts/Content/Story/Missions/DIA_PAL_1029_Osraed.d:320","Gib mir meine 100 Silber zurück!","","","False","PAL_1029_HOWDYBRIBED_15_01","",""
"Scripts/Content/Story/Missions/DIA_PAL_1029_Osraed.d:321","(gekünstelt) Ich weiss nicht wovon du sprichst. Zieh Leine!","","","False","PAL_1029_HOWDYBRIBED_06_02","",""
"Scripts/Content/Story/Missions/DIA_PAL_1029_Osraed.d:360","HALT! Hier ist kein...","","","False","PAL_1029_HALTTHORA_06_01","",""
"Scripts/Content/Story/Missions/DIA_PAL_1029_Osraed.d:363","(schmierig) Ah, Thora...! Mein Einladung zu einer Flasche Wein steht immer noch.!","","","False","PAL_1029_HALTTHORA_06_02","",""
"Scripts/Content/Story/Missions/DIA_PAL_1029_Osraed.d:365","(kalt) Träum weiter, Schmierlocke!","","","False","PAL_1029_HALTTHORA_06_03","",""
"Scripts/Content/Story/Missions/DIA_PAL_1029_Osraed.d:368","Gut du kannst passieren!","","","False","PAL_1029_HALTTHORA_06_04","",""
"Scripts/Content/Story/Missions/DIA_PAL_1029_Osraed.d:369","Ach nochwas...","","","False","PAL_1029_HALTTHORA_06_05","",""
"Scripts/Content/Story/Missions/DIA_PAL_1029_Osraed.d:370","Was?","Что?","","False","PAL_1029_HALTTHORA_15_06","",""
"Scripts/Content/Story/Missions/DIA_PAL_1029_Osraed.d:371","(leise) Nur das das klar ist. Finger weg von Thora, sie gehört mir (krankes Lachen)!","","","False","PAL_1029_HALTTHORA_06_07","",""
"Scripts/Content/Story/Missions/DIA_PAL_1029_Osraed.d:389","Ihr seid also das billige Orkfutter der Paladine?","","","False","PAL_1029_Osraed_FODDER.description","",""
"Scripts/Content/Story/Missions/DIA_PAL_1029_Osraed.d:404","Ihr seid also das billige Orkfutter der Paladine?","","","False","PAL_1029_FODDER_15_01","",""
"Scripts/Content/Story/Missions/DIA_PAL_1029_Osraed.d:407","(gepresst) Wenn du nicht mit Thora hier angekommen wärst, dann würde ich dich jetzt einen Kopf kürzer machen.","","","False","PAL_1029_FODDER_06_02","",""
"Scripts/Content/Story/Missions/DIA_PAL_1029_Osraed.d:411","Na warte, diese Beleidigung wirst du mit Deinem Leben bezahlen!","","","False","PAL_1029_FODDER_06_03","",""
"Scripts/Content/Story/Missions/DIA_PAL_1030_Auxiliary.d:49","HEH DU DA!","","","False","PAL_1030_FirstWarn_Info_07_01","",""
"Scripts/Content/Story/Missions/DIA_PAL_1030_Auxiliary.d:50","Äh ich?","","","False","PAL_1030_FirstWarn_Info_15_02","",""
"Scripts/Content/Story/Missions/DIA_PAL_1030_Auxiliary.d:51","Du gehörst nicht zum Gefolge des Königs!","","","False","PAL_1030_FirstWarn_Info_07_03","",""
"Scripts/Content/Story/Missions/DIA_PAL_1030_Auxiliary.d:52","Also ziehe Leine, sonst mach ich dir Beine!","","","False","PAL_1030_FirstWarn_Info_07_04","",""
"Scripts/Content/Story/Missions/DIA_PAL_1030_Auxiliary.d:90","KEINEN SCHRITT WEITER!","","","False","PAL_1030_LastWarn_07_01","",""
"Scripts/Content/Story/Missions/DIA_PAL_1030_Auxiliary.d:91","Oder du siehst die Radieschen von unten!","","","False","PAL_1030_LastWarn_07_02","",""
"Scripts/Content/Story/Missions/DIA_PAL_1030_Auxiliary.d:181","Ich möchte in die Festung!","","","False","PAL_1030_Auxiliary_WANTIN.description","",""
"Scripts/Content/Story/Missions/DIA_PAL_1030_Auxiliary.d:196","Ich möchte in die Festung!","","","False","PAL_1030_WANTIN_15_01","",""
"Scripts/Content/Story/Missions/DIA_PAL_1030_Auxiliary.d:197","Sprich mit Osraed, er hat am Tor das Sagen!","","","False","PAL_1030_WANTIN_07_02","",""
"Scripts/Content/Story/Missions/DIA_PAL_1030_Auxiliary.d:233","HEH DU DA!","","","False","PAL_1030_HALTTHORA_07_01","",""
"Scripts/Content/Story/Missions/DIA_PAL_1030_Auxiliary.d:234","(misstrauisch) Thoras Kamerad, wie?","","","False","PAL_1030_HALTTHORA_07_02","",""
"Scripts/Content/Story/Missions/DIA_PAL_1030_Auxiliary.d:235","OK, kannst passieren!","","","False","PAL_1030_HALTTHORA_07_03","",""
"Scripts/Content/Story/Missions/DIA_PAL_1039_Paladin.d:49","HALT!","HALT!","","False","PAL_1039_FirstWarn_Info_07_01","",""
"Scripts/Content/Story/Missions/DIA_PAL_1039_Paladin.d:50","Kann ich passieren!","","","False","PAL_1039_FirstWarn_Info_15_02","",""
"Scripts/Content/Story/Missions/DIA_PAL_1039_Paladin.d:51","NEIN!","","","False","PAL_1039_FIRSTWARN_INFO_07_03","",""
"Scripts/Content/Story/Missions/DIA_PAL_1039_Paladin.d:89","BLEIB SOFORT STEHEN!!!","","","False","PAL_1039_LastWarn_07_01","",""
"Scripts/Content/Story/Missions/DIA_PAL_1039_Paladin.d:179","Warum kann ich nicht in die Festung?","","","False","PAL_1039_Paladin_WANTIN.description","",""
"Scripts/Content/Story/Missions/DIA_PAL_1039_Paladin.d:194","Warum kann ich nicht in die Festung?","","","False","PAL_1039_WANTIN_15_01","",""
"Scripts/Content/Story/Missions/DIA_PAL_1039_Paladin.d:195","Du siehst nicht aus wie ein Gefolgsmann des Königs!","","","False","PAL_1039_WANTIN_07_02","",""
"Scripts/Content/Story/Missions/DIA_PAL_1039_Paladin.d:209","Vielleicht kann ein wenig Silber das ändern.","","","False","PAL_1039_Paladin_BRIBE.description","",""
"Scripts/Content/Story/Missions/DIA_PAL_1039_Paladin.d:224","Vielleicht kann ein wenig Silber das ändern.","","","False","PAL_1039_BRIBE_15_01","",""
"Scripts/Content/Story/Missions/DIA_PAL_1039_Paladin.d:225","(wütend) Soldat des Königs sind unbestechlich!","","","False","PAL_1039_BRIBE_08_02","",""
"Scripts/Content/Story/Missions/DIA_PAL_1039_Paladin.d:226","Ich werde dafür sorgen, dass du das nie vergisst!","","","False","PAL_1039_BRIBE_08_03","",""
"Scripts/Content/Story/Missions/DIA_PAL_1039_Paladin.d:268","Thora, du kannst passieren...mit Begleitung!","","","False","PAL_1039_HALTTHORA_07_01","",""
"Scripts/Content/Story/Missions/DIA_PAL_1040_Paladin.d:49","KEIN ZUTRITT!","","","False","PAL_1040_FirstWarn_Info_07_01","",""
"Scripts/Content/Story/Missions/DIA_PAL_1040_Paladin.d:50","Ich will in die Festung!","","","False","PAL_1040_FirstWarn_Info_15_02","",""
"Scripts/Content/Story/Missions/DIA_PAL_1040_Paladin.d:51","Nur Gefolgsleute des Königs!","","","False","PAL_1040_FirstWarn_Info_07_03","",""
"Scripts/Content/Story/Missions/DIA_PAL_1040_Paladin.d:89","KEINEN SCHRITT WEITER!","","","False","PAL_1040_LastWarn_07_01","",""
"Scripts/Content/Story/Missions/DIA_PAL_1040_Paladin.d:179","Ich möchte in die Festung!","","","False","PAL_1040_Paladin_WANTIN.description","",""
"Scripts/Content/Story/Missions/DIA_PAL_1040_Paladin.d:194","Ich möchte in die Festung.","","","False","PAL_1040_WANTIN_15_01","",""
"Scripts/Content/Story/Missions/DIA_PAL_1040_Paladin.d:195","Nur Gefolgsleute des Königs!","","","False","PAL_1040_WANTIN_07_02","",""
"Scripts/Content/Story/Missions/DIA_PAL_1040_Paladin.d:236","Thora, du kannst passieren...mit Begleitung!","","","False","PAL_1040_HALTTHORA_07_01","",""
"Scripts/Content/Story/Missions/DIA_PAL_1046_Prinzessin.d:43","Ich bin eine Prinzessin!","","","False","PAL_1046_HI_16_01","",""
"Scripts/Content/Story/Missions/DIA_PAL_1046_Prinzessin.d:44","Tatsächlich?","Правда?","","False","PAL_1046_HI_16_02","",""
"Scripts/Content/Story/Missions/DIA_PAL_1046_Prinzessin.d:45","Oh ein junger stürmischer Krieger -TRIEF-","","","False","PAL_1046_HI_16_03","",""
"Scripts/Content/Story/Missions/DIA_PAL_1046_Prinzessin.d:46","Noch so abgetakelte mitt-40erin die keinen mehr abgekriegt hat","","","False","PAL_1046_HI_15_04","",""
"Scripts/Content/Story/Missions/DIA_PAL_1046_Prinzessin.d:47","Kann ich was für dich tun - KLIMPER- KLIMPER-","","","False","PAL_1046_HI_16_05","",""
"Scripts/Content/Story/Missions/DIA_PAL_1046_Prinzessin.d:59","Geh baden!","","","False","PAL_1046_Prinzessin_BATH.description","",""
"Scripts/Content/Story/Missions/DIA_PAL_1046_Prinzessin.d:69","Geh baden!","","","False","PAL_1046_BATH_15_01","",""
"Scripts/Content/Story/Missions/DIA_PAL_1046_Prinzessin.d:70","Oh Jaaa, ich bin so schmutzig! Willst du mir nicht beim Baden zusehen??","","","False","PAL_1046_BATH_16_02","",""
"Scripts/Content/Story/Missions/DIA_PAL_1046_Prinzessin.d:71","BITTE (Winsel)","","","False","PAL_1046_BATH_16_03","",""
"Scripts/Content/Story/Missions/DIA_PAL_1046_Prinzessin.d:85","Zieh dich aus und leg dich hin!","","","False","PAL_1046_Prinzessin_LOVE.description","",""
"Scripts/Content/Story/Missions/DIA_PAL_1046_Prinzessin.d:95","Zieh dich aus und leg dich hin!","","","False","PAL_1046_LOVE_15_01","",""
"Scripts/Content/Story/Missions/DIA_PAL_1046_Prinzessin.d:96","Nichts würde ich lieber, du Starker, aber das Bett ist nicht gemacht...","","","False","PAL_1046_LOVE_16_02","",""
"Scripts/Content/Story/Missions/DIA_PAL_1046_Prinzessin.d:97","Scheisse!","","","False","PAL_1046_LOVE_15_03","",""
"Scripts/Content/Story/Missions/DIA_PAL_1046_Prinzessin.d:109","Du bist über, Bitch! ","","","False","PAL_1046_Prinzessin_SUICIDE.description","",""
"Scripts/Content/Story/Missions/DIA_PAL_1046_Prinzessin.d:119","Du bist über, Bitch!","","","False","PAL_1046_SUICIDE_15_01","",""
"Scripts/Content/Story/Missions/DIA_PAL_1046_Prinzessin.d:120","Oh - nein, du liebst mich nicht (dramatisch)","","","False","PAL_1046_SUICIDE_16_02","",""
"Scripts/Content/Story/Missions/DIA_PAL_1046_Prinzessin.d:121","Dann stürze ich mich jetzt zu Tode!!","","","False","PAL_1046_SUICIDE_16_03","",""
