"location","source","target","id","fuzzy","context","translator_comments","developer_comments"
"Scripts/Content/Story/Missions/DIA_MIN_300_Sylvester.d:42","Wie geht es so?","Как идут дела?","","False","MIN_300_Sylvester_HOWDY.description","",""
"Scripts/Content/Story/Missions/DIA_MIN_300_Sylvester.d:52","Wie geht es so?","Как идут дела?","","False","MIN_300_HOWDY_15_01","",""
"Scripts/Content/Story/Missions/DIA_MIN_300_Sylvester.d:58","Dank dir kann ich nun endlich wieder mein Essen selbst verdienen!","Благодаря тебе, я наконец-то могу снова зарабатывать себе на еду!","","False","MIN_300_HOWDY_03_02","",""
"Scripts/Content/Story/Missions/DIA_MIN_300_Sylvester.d:62","Naja, ich kann jetzt weiss ich zwar wo eine neue Erzader ist, aber du hast mich ganz schön dafür bluten lassen!","Хоть теперь я и знаю, где найти новую жилу руды, ты заставил меня пролить немало крови ради неё!","","False","MIN_300_HOWDY_03_03","",""
"Scripts/Content/Story/Missions/DIA_MIN_300_Sylvester.d:67","Schlecht! Ich habe zur Zeit keine Arbeit! Und jetzt lass mich in Ruhe!","Паршиво! Никакой работы сейчас нет! Так что оставь меня в покое!","","False","MIN_300_HOWDY_03_04","",""
"Scripts/Content/Story/Missions/DIA_MIN_300_Sylvester.d:81","Nette Spitzhacke, die du da hast!","Неплохая у тебя кирка!","","False","Info_Sylvester_PICK.description","",""
"Scripts/Content/Story/Missions/DIA_MIN_300_Sylvester.d:97","Nette Spitzhacke, die du da hast!","Неплохая у тебя кирка!","","False","Info_Sylvester_PICK_15_01","",""
"Scripts/Content/Story/Missions/DIA_MIN_300_Sylvester.d:98","Pah! Wenn ich blos Verwendung dafür hätte...","Тфу, была бы от неё ещё польза...","","False","Info_Sylvester_PICK_03_02","",""
"Scripts/Content/Story/Missions/DIA_MIN_300_Sylvester.d:99","Wie meinst du das?","Ты это о чём?","","False","Info_Sylvester_PICK_15_03","",""
"Scripts/Content/Story/Missions/DIA_MIN_300_Sylvester.d:100","Der einzige Ort, wo ich meine Silber verdienen kann ist die Mine im Norden.","Нигде не заработать серебра, кроме как в шахте на севере.","","False","Info_Sylvester_PICK_03_04","",""
"Scripts/Content/Story/Missions/DIA_MIN_300_Sylvester.d:101","Aber meine Kumpels haben den Eingang verrammelt, wegen der Orks die sich da rumtreiben.","Но в окрестностях шныряют орки, так что мои приятели замуровали вход.","","False","Info_Sylvester_PICK_03_05","",""
"Scripts/Content/Story/Missions/DIA_MIN_300_Sylvester.d:102","Jetzt sitze ich hier und kann zusehen, wo ich mein Mittagessen herbekomme.","Теперь я сижу тут и думаю, где заработать на обед.","","False","Info_Sylvester_PICK_03_06","",""
"Scripts/Content/Story/Missions/DIA_MIN_300_Sylvester.d:105","Ich kenne einen anderen Ort, an dem du Erz finden kannst.","Я знаю ещё одно местечко, где ты можешь добыть руду.","","False","Info_Sylvester_PICK_Info.Info_Sylvester_PICK.Info_Sylvester_PICKCAVE","AI_AddChoice",""
"Scripts/Content/Story/Missions/DIA_MIN_300_Sylvester.d:106","Dann könntest du mir ja deine Spitzhacke überlassen.","Отдай мне тогда свою кирку.","","False","Info_Sylvester_PICK_Info.Info_Sylvester_PICK.Info_Sylvester_PICKGIVE","AI_AddChoice",""
"Scripts/Content/Story/Missions/DIA_MIN_300_Sylvester.d:111","Dann könntest du mir ja deine Spitzhacke überlassen.","Отдай мне тогда свою кирку.","","False","Info_Sylvester_PICKGIVE_15_01","",""
"Scripts/Content/Story/Missions/DIA_MIN_300_Sylvester.d:112","Ich bin zwar ohne Arbeit aber nicht ohne Verstand.","Я остался без работы, а не без ума.","","False","Info_Sylvester_PICKGIVE_03_02","",""
"Scripts/Content/Story/Missions/DIA_MIN_300_Sylvester.d:113","Wenn du meine Spitzhacke haben willst, will ich Silber sehen!","Если тебе так нужна моя кирка, то будь готов за неё заплатить!","","False","Info_Sylvester_PICKGIVE_03_03","",""
"Scripts/Content/Story/Missions/DIA_MIN_300_Sylvester.d:122","Ich kenne einen anderen Ort, an dem du Erz finden kannst.","Я знаю ещё одно местечко, где ты можешь добыть руду.","","False","Info_Sylvester_PICKCAVE_15_01","",""
"Scripts/Content/Story/Missions/DIA_MIN_300_Sylvester.d:123","Was sagst du da? Eine neue Erzader? Wo kann ich sie finden?","Что? Есть ещё жилы? Где?","","False","Info_Sylvester_PICKCAVE_03_02","",""
"Scripts/Content/Story/Missions/DIA_MIN_300_Sylvester.d:126","Das kostet dich aber 'ne Kleinigkeit","Всему своя цена.","","False","Info_Sylvester_PICKCAVE.Info_Sylvester_PICK.Info_Sylvester_PICKCOST","AI_AddChoice",""
"Scripts/Content/Story/Missions/DIA_MIN_300_Sylvester.d:127","Komm mit, ich führe dich hin.","Пойдем, я покажу, где жила.","","False","Info_Sylvester_PICKCAVE.Info_Sylvester_PICK.Info_Sylvester_PICKCOME","AI_AddChoice",""
"Scripts/Content/Story/Missions/DIA_MIN_300_Sylvester.d:132","Komm mit, ich führe dich hin.","Пойдем, я покажу, где жила.","","False","Info_Sylvester_PICKCOME_15_01","",""
"Scripts/Content/Story/Missions/DIA_MIN_300_Sylvester.d:133","Du bist echt in Ordnung. Nichts wie los!","А ты, парень, не промах! Пошли!","","False","Info_Sylvester_PICKCOME_03_02","",""
"Scripts/Content/Story/Missions/DIA_MIN_300_Sylvester.d:143","Das kostet dich aber 'ne Kleinigkeit","Всему своя цена.","","False","Info_Sylvester_PICKCOST_15_01","",""
"Scripts/Content/Story/Missions/DIA_MIN_300_Sylvester.d:144","Du bist ein echt eigennütziger Kerl.","А ты только о себе и думаешь.","","False","Info_Sylvester_PICKCOST_03_02","",""
"Scripts/Content/Story/Missions/DIA_MIN_300_Sylvester.d:145","Aber ich habe keine Wahl.","Ну, выбора у меня нет.","","False","Info_Sylvester_PICKCOST_03_03","",""
"Scripts/Content/Story/Missions/DIA_MIN_300_Sylvester.d:146","Wenn ich nicht bald eine neue Erzader finde, kann ich mich zu dem bettelnden Lumpenpack gesellen.","Если я не найду новую жилу, могу записываться в отряды попрошаек.","","False","Info_Sylvester_PICKCOST_03_04","",""
"Scripts/Content/Story/Missions/DIA_MIN_300_Sylvester.d:147","Tja, jeder ist sich selbst der nächste!","Что ж, каждый сам за себя!","","False","Info_Sylvester_PICKCOST_15_05","",""
"Scripts/Content/Story/Missions/DIA_MIN_300_Sylvester.d:148","OK. wenn du mir die Erzader zeigst, geb ich dir meine Spitzhacke.","Ладно, покажешь мне жилу, и я отдам тебе мою кирку.","","False","Info_Sylvester_PICKCOST_03_06","",""
"Scripts/Content/Story/Missions/DIA_MIN_300_Sylvester.d:149","Hab' noch eine Reservehacke im Rucksack.","У меня ещё осталась с собой запасная кирка.","","False","Info_Sylvester_PICKCOST_03_07","",""
"Scripts/Content/Story/Missions/DIA_MIN_300_Sylvester.d:152","Also wenn du keine Wahl hast, kannst du auch noch was drauflegen!","Ну, раз у тебя нет выбора, можешь и ещё кое-что добавить!","","False","Info_Sylvester_PICKCOST.Info_Sylvester_PICK.Info_Sylvester_PICKCOSTNO","AI_AddChoice",""
"Scripts/Content/Story/Missions/DIA_MIN_300_Sylvester.d:153","Die Spitzhacke ist OK.","По рукам. Давай кирку.","","False","Info_Sylvester_PICKCOST.Info_Sylvester_PICK.Info_Sylvester_PICKCOSTYES","AI_AddChoice",""
"Scripts/Content/Story/Missions/DIA_MIN_300_Sylvester.d:158","Die Spitzhacke ist OK.","По рукам. Давай кирку.","","False","Info_Sylvester_PICKCOSTYES_15_01","",""
"Scripts/Content/Story/Missions/DIA_MIN_300_Sylvester.d:159","Hier, und nun zeig mir den Weg zur Ader.","Вот. А теперь показывай, где жила.","","False","Info_Sylvester_PICKCOSTYES_03_02","",""
"Scripts/Content/Story/Missions/DIA_MIN_300_Sylvester.d:168","Also wenn du keine Wahl hast, kannst du auch noch was drauflegen!","Ну, раз у тебя нет выбора, можешь и ещё кое-что добавить!","","False","Info_Sylvester_PICKCOSTNO_15_01","",""
"Scripts/Content/Story/Missions/DIA_MIN_300_Sylvester.d:173","Ich seh schon, du bist auch nicht besser als die anderen Halsabschneider hier.","Смотрю, ты не лучше других головорезов.","","False","Info_Sylvester_PICKCOSTNO_03_02","",""
"Scripts/Content/Story/Missions/DIA_MIN_300_Sylvester.d:174","OK, OK, ich kann dir noch das bischen Silber dazugeben, dass ich habe.","Хорошо, хорошо... Я могу дать тебе часть оставшегося у меня серебра.","","False","Info_Sylvester_PICKCOSTNO_03_03","",""
"Scripts/Content/Story/Missions/DIA_MIN_300_Sylvester.d:187","Vergiss es. Ich bin nicht interessiert!","Забудь об этом.","","False","Info_Sylvester_PICKCOSTNO.Info_Sylvester_PICK.Info_Sylvester_PICKCOSTNONO","AI_AddChoice",""
"Scripts/Content/Story/Missions/DIA_MIN_300_Sylvester.d:188","Die Spitzhacke ist OK. Ich führ dich zur Ader.","Кирки хватит. Пойдём к жиле.","","False","Info_Sylvester_PICKCOSTNO.Info_Sylvester_PICK.Info_Sylvester_PICKCOSTYES","AI_AddChoice",""
"Scripts/Content/Story/Missions/DIA_MIN_300_Sylvester.d:179","OK, das Geschäft gilt!","По рукам!","","False","Info_Sylvester_PICKCOSTNO.Info_Sylvester_PICK.Info_Sylvester_PICKCOSTNOSILVER","AI_AddChoice",""
"Scripts/Content/Story/Missions/DIA_MIN_300_Sylvester.d:183","Ich besitzte sonst nichts von Wert.","Это всё, что у меня есть ценного.","","False","Info_Sylvester_PICKCOSTNO_03_04","",""
"Scripts/Content/Story/Missions/DIA_MIN_300_Sylvester.d:184","Zeigst du mir die Ader trotzdem?","Так что, покажешь мне жилу?","","False","Info_Sylvester_PICKCOSTNO_03_05","",""
"Scripts/Content/Story/Missions/DIA_MIN_300_Sylvester.d:194","OK, das Geschäft gilt!","По рукам!","","False","Info_Sylvester_PICKCOSTNOSILVER_15_01","",""
"Scripts/Content/Story/Missions/DIA_MIN_300_Sylvester.d:195","Du bist ein übler Gauner! Ich sollte die anderen Leute hier vor dir warnen.","Мерзкий мошенник! Надо будет других предупредить о тебе.","","False","Info_Sylvester_PICKCOSTNOSILVER_03_02","",""
"Scripts/Content/Story/Missions/DIA_MIN_300_Sylvester.d:196","Hier ist meine Spitzhacke.","Вот, держи мою кирку.","","False","Info_Sylvester_PICKCOSTNOSILVER_03_03","",""
"Scripts/Content/Story/Missions/DIA_MIN_300_Sylvester.d:198","Nun führe mich wie abgemacht zur Erzader, dort bekommst du dann das Silber.","А теперь пошли к жиле. Как придем, получишь своё серебро.","","False","Info_Sylvester_PICKCOSTNOSILVER_03_04","",""
"Scripts/Content/Story/Missions/DIA_MIN_300_Sylvester.d:209","Vergiss es. Ich bin nicht interessiert!","Забудь об этом!","","False","Info_Sylvester_PICKCOSTNONO_15_01","",""
"Scripts/Content/Story/Missions/DIA_MIN_300_Sylvester.d:210","Immer diese Aufschneider. Wahrscheinlich gibt es die Ader überhaupt nicht.","Вечно одни болтуны. Небось, этой жилы и нет вовсе.","","False","Info_Sylvester_PICKCOSTNONO_03_02","",""
"Scripts/Content/Story/Missions/DIA_MIN_300_Sylvester.d:211","Ist wohl ohnehin besser, wenn ich meine Hacke behalte. Wer weiss wann die Orks sich von der Mine verziehen.","Думаю, лучше мне придержать свою кирку. Кто знает, когда орки покинут шахту.","","False","Info_Sylvester_PICKCOSTNONO_03_03","",""
"Scripts/Content/Story/Missions/DIA_MIN_300_Sylvester.d:243","OK, hier hast du die Hacke. Konnte die mühselige Schürferei eh nie leiden.","Ладно, держи кирку. Всё-равно мне шахтёрская работа не нравилась.","","False","Info_Sylvester_BUYPICK_03_01","",""
"Scripts/Content/Story/Missions/DIA_MIN_300_Sylvester.d:251","Verarsch mich nicht! Besorg erst das Silber, dann kannst du auch die Hacke haben.","Не пытайся меня надуть! Принесешь серебро - получишь кирку.","","False","Info_Sylvester_BUYPICK_03_02","",""
"Scripts/Content/Story/Missions/DIA_MIN_300_Sylvester.d:281","Unglaublich, hier gibt es tatsächlich Erz.","Невероятно. Здесь и вправду есть руда!","","False","Info_Sylvester_CAVE_03_01","",""
"Scripts/Content/Story/Missions/DIA_MIN_300_Sylvester.d:285","Danke nochmal. Leute wie dich gibt es hier sehr wenige.","Спасибо большое. Такие как ты сейчас на вес золота.","","False","Info_Sylvester_CAVE_03_02","",""
"Scripts/Content/Story/Missions/DIA_MIN_300_Sylvester.d:286","Wenn du etwas Erz brauchst, komm vorbei. Ich kann bestimmt mal ein paar Brocken abzweigen.","Будет нужна руда - приходи. Может у меня заваляется пара кусков.","","False","Info_Sylvester_CAVE_03_03","",""
"Scripts/Content/Story/Missions/DIA_MIN_300_Sylvester.d:298","Hier ist das Silber! Hoffentlich erstickst du daran, du Erpresser!","Держи своё серебро! Чтоб ты им подавился!","","False","Info_Sylvester_CAVE_03_04","",""
"Scripts/Content/Story/Missions/DIA_MIN_300_Sylvester.d:307","Dann werde ich mich mal gleich an die Arbeit machen.","Тогда пора браться за работу.","","False","Info_Sylvester_CAVE_03_05","",""
"Scripts/Content/Story/Missions/DIA_MIN_300_Sylvester.d:311","Es ist schon spät. Ich werde mich noch etwas ausruhen und mich morgen früh dann an die Arbeit machen.","Уже поздно. Я пока передохну, а завтра примусь за работу.","","False","Info_Sylvester_CAVE_03_06","",""
"Scripts/Content/Story/Missions/DIA_MIN_300_Sylvester.d:328","Hast du etwas Erz übrig?","У тебя не осталось руды?","","False","Info_Sylvester_GIVEORE.description","",""
"Scripts/Content/Story/Missions/DIA_MIN_300_Sylvester.d:344","Hast du etwas Erz übrig?","У тебя не осталось руды?","","False","Info_Sylvester_GIVEORE_15_01","",""
"Scripts/Content/Story/Missions/DIA_MIN_300_Sylvester.d:348","Klar. Kannst ein paar Brocken haben, hier!","Конечно! Можешь взять пару кусков.","","False","Info_Sylvester_GIVEORE_03_02","",""
"Scripts/Content/Story/Missions/DIA_MIN_300_Sylvester.d:355","Kann heute leider nichts mehr entbehren, aber vielleicht morgen wieder!","Пока нет, но приходи завтра. Наверняка, что-нибудь найдётся!","","False","Info_Sylvester_GIVEORE_03_03","",""
"Scripts/Content/Story/Missions/DIA_MIN_300_Sylvester.d:368","Hast du eine Spitzhacke für mich?","Есть для меня кирка?","","False","Info_Sylvester_BUYPICKFRIEND.description","",""
"Scripts/Content/Story/Missions/DIA_MIN_300_Sylvester.d:384","Hast du eine Spitzhacke für mich?","Есть для меня кирка?","","False","Info_Sylvester_BUYPICKFRIEND_15_01","",""
"Scripts/Content/Story/Missions/DIA_MIN_300_Sylvester.d:388","Ich hab noch eine Reservehacke, die kannst du haben. Hier nimm!","У меня завалялась ещё запасная кирка. Вот, можешь её взять!","","False","Info_Sylvester_BUYPICKFRIEND_03_02","",""
"Scripts/Content/Story/Missions/DIA_MIN_300_Sylvester.d:394","Ich habe nur noch diese eine Hacke. Tut mir leid!","Прости, у меня осталась только эта кирка.","","False","Info_Sylvester_BUYPICKFRIEND_03_03","",""
"Scripts/Content/Story/Missions/DIA_MIN_300_Sylvester.d:407","Ich bin auf der Suche nach Bluterz!","Я ищу кровавую руду!","","False","MIN_300_Sylvester_BLOODORE.description","",""
"Scripts/Content/Story/Missions/DIA_MIN_300_Sylvester.d:422","Ich bin auf der Suche nach Bluterz!","Я ищу кровавую руду!","","False","MIL_101_BLOODORE_15_01","",""
"Scripts/Content/Story/Missions/DIA_MIN_300_Sylvester.d:423","In der Mine gibt es eine Bluterzader. Allerdings ist dieses besondere Erz sehr selten. Warum willst du das wissen?","В шахте есть жила кровавой руды. Очень редкая руда. Зачем тебе она?","","False","MIL_101_BLOODORE_03_02","",""
"Scripts/Content/Story/Missions/DIA_MIN_300_Sylvester.d:424","Ich brauche Bluterz, um einen Runenstein zu gießen.","Я хочу создать рунный камень из кровавой руды.","","False","MIL_101_BLOODORE_15_03","",""
"Scripts/Content/Story/Missions/DIA_MIN_300_Sylvester.d:425","Damit kenne ich mich nicht aus, aber ich besitze noch ein paar Brocken.","В этом я не разбираюсь, но пара кусков у меня всё же осталась.","","False","MIL_101_BLOODORE_03_04","",""
"Scripts/Content/Story/Missions/DIA_MIN_300_Sylvester.d:426","Ich schlage dir ein Geschäft vor.","У меня есть к тебе предложение.","","False","MIL_101_BLOODORE_03_05","",""
"Scripts/Content/Story/Missions/DIA_MIN_300_Sylvester.d:427","Was für ein Geschäft?","Предложение?","","False","MIL_101_BLOODORE_15_06","",""
"Scripts/Content/Story/Missions/DIA_MIN_300_Sylvester.d:428","Ich brauche eine bessere Waffe, eines dieser handlichen Kurzschwerter!","Мне нужно оружие получше. Короткий меч был бы очень кстати!","","False","MIL_101_BLOODORE_03_07","",""
"Scripts/Content/Story/Missions/DIA_MIN_300_Sylvester.d:429","Aber Gotmar verkauft seine Waffen nur an die Miliz.","Но Готмар продаёт оружие только ополченцам.","","False","MIL_101_BLOODORE_03_08","",""
"Scripts/Content/Story/Missions/DIA_MIN_300_Sylvester.d:430","Wenn du mir ein Kurzschwert besorgst, bekommst du mein Bluterz.","Если принесешь мне короткий меч, я отдам тебе кровавую руду.","","False","MIL_101_BLOODORE_03_09","",""
"Scripts/Content/Story/Missions/DIA_MIN_300_Sylvester.d:432","Vergiss es!","Забудь об этом.","","False","MIN_300_Sylvester_BLOODORE_Info.MIN_300_Sylvester_BLOODORE.MIN_300_Sylvester_BLOODORE_NO","AI_AddChoice",""
"Scripts/Content/Story/Missions/DIA_MIN_300_Sylvester.d:433","Ich schau mal, ob ich ein Kurzschwert bekomme","Посмотрим, что я смогу сделать.","","False","MIN_300_Sylvester_BLOODORE_Info.MIN_300_Sylvester_BLOODORE.MIN_300_Sylvester_BLOODORE_YES","AI_AddChoice",""
"Scripts/Content/Story/Missions/DIA_MIN_300_Sylvester.d:434","Ich überlege es mir","Я подумаю.","","False","MIN_300_Sylvester_BLOODORE_Info.MIN_300_Sylvester_BLOODORE.MIN_300_Sylvester_BLOODORE_MAYBE","AI_AddChoice",""
"Scripts/Content/Story/Missions/DIA_MIN_300_Sylvester.d:439","Ich überlege es mir.","Я подумаю.","","False","MIL_101_BLOODORE_MAYBE_15_01","",""
"Scripts/Content/Story/Missions/DIA_MIN_300_Sylvester.d:440","Wenn du ein Kurzschwert hast, tausche ich es gegen mein Bluterz.","Если найдешь короткий меч, буду готов обменять его на руду.","","False","MIL_101_BLOODORE_MAYBE_03_02","",""
"Scripts/Content/Story/Missions/DIA_MIN_300_Sylvester.d:451","Ich schau mal, ob ich ein Kurzschwert bekomme","Посмотрим, что я смогу сделать.","","False","MIL_101_BLOODORE_YES_15_01","",""
"Scripts/Content/Story/Missions/DIA_MIN_300_Sylvester.d:452","Gut, wenn du eins hast, bekommst du mein Bluterz.","Отлично. Приходи, как найдешь меч, и я дам тебе руду.","","False","MIL_101_BLOODORE_YES_03_02","",""
"Scripts/Content/Story/Missions/DIA_MIN_300_Sylvester.d:463","Vergiss es!","Забудь об этом.","","False","MIL_101_BLOODORE_NO_15_01","",""
"Scripts/Content/Story/Missions/DIA_MIN_300_Sylvester.d:464","Dann gibt's auch kein Bluterz!","Тогда и о кровавой руде можешь забыть!","","False","MIL_101_BLOODORE_NO_03_02","",""
"Scripts/Content/Story/Missions/DIA_MIN_300_Sylvester.d:480","Ich habe ein Kurzschwert für dich","Я принёс тебе короткий меч.","","False","MIL_101_Sylvester_Sword.description","",""
"Scripts/Content/Story/Missions/DIA_MIN_300_Sylvester.d:496","Ich habe ein Kurzschwert für dich.","Я принёс тебе короткий меч.","","False","MIL_101_SWORD_15_01","",""
"Scripts/Content/Story/Missions/DIA_MIN_300_Sylvester.d:507","Ausgezeichnet. Hier, nimm mein Bluterz. Wenn du noch mehr brauchst, dann sprich mal mit Wylfern.","Прекрасно. Держи кровавую руду. Если тебе нужно будет больше этой руды, зайди к Вилферну.","","False","MIL_101_SWORD_03_02","",""
"Scripts/Content/Story/Missions/DIA_MIN_300_Sylvester.d:508","Er ist Rekrut bei der Miliz und war vorher auch in der Mine.","Он раньше работал в шахте, а сейчас вступил в ополчение.","","False","MIL_101_SWORD_03_03","",""
"Scripts/Content/Story/Missions/DIA_MIN_306_Grim.d:70","Hey, du hast dir meine Spitzhacke gekrallt!","Эй, ты украл мою кирку!","","False","MIN_306_Grim_MYWEAPON_Info_10_01","",""
"Scripts/Content/Story/Missions/DIA_MIN_306_Grim.d:73","Du hast sie fallen gelassen, jetzt gehört sie mir!","Ты упустил кирку. Теперь она моя!","","False","MIN_306_Grim_MYWEAPON_Info.MIN_306_Grim_MYWEAPON.MIN_306_Grim_MYWEAPON_TAKEN","AI_AddChoice",""
"Scripts/Content/Story/Missions/DIA_MIN_306_Grim.d:74","Hier hast du sie zurück.","Вот, забирай.","","False","MIN_306_Grim_MYWEAPON_Info.MIN_306_Grim_MYWEAPON.MIN_306_Grim_MYWEAPON_GIVEBACK","AI_AddChoice",""
"Scripts/Content/Story/Missions/DIA_MIN_306_Grim.d:80","Hier hast du sie zurück.","Вот, забирай.","","False","MIN_306_Grim_MYWEAPON_GIVEBACK_15_01","",""
"Scripts/Content/Story/Missions/DIA_MIN_306_Grim.d:82","(säuerlich) Dann kann es ja weitergehen!","(кисло) А теперь обратно к делу!","","False","MIN_306_Grim_MYWEAPON_GIVEBACK_10_02","",""
"Scripts/Content/Story/Missions/DIA_MIN_306_Grim.d:90","Du hast sie fallen gelassen, jetzt gehört sie mir!","Ты упустил кирку. Теперь она моя!","","False","MIN_306_Grim_MYWEAPON_TAKEN_15_01","",""
"Scripts/Content/Story/Missions/DIA_MIN_306_Grim.d:91","Du kennst wohl Regel Nummer 3 nicht!","Видимо, ты не слышал о правиле номер три!","","False","MIN_306_Grim_MYWEAPON_TAKEN_10_02","",""
"Scripts/Content/Story/Missions/DIA_MIN_306_Grim.d:128","Wir sehen uns heute abend in der Arena!","Увидимся вечером на арене!","","False","Info_Grim_CHALLENGED_10_01","",""
"Scripts/Content/Story/Missions/DIA_MIN_306_Grim.d:132","Ich versuche mich auf den Kampf zu konzentrieren! Geh rüber in deinen Raum!","Я готовлюсь к бою! Возвращайся в свою комнату!","","False","Info_Grim_CHALLENGED_10_02","",""
"Scripts/Content/Story/Missions/DIA_MIN_306_Grim.d:141","Jetzt ist nicht die Zeit zum Reden!","У меня нет времени на разговоры!","","False","Info_Grim_CHALLENGED_10_03","",""
"Scripts/Content/Story/Missions/DIA_MIN_306_Grim.d:147","Wir sehen uns morgen Abend in der Arena!","Увидимся следующим вечером на арене!","","False","Info_Grim_CHALLENGED_10_04","",""
"Scripts/Content/Story/Missions/DIA_MIN_306_Grim.d:181","Stör mich jetzt nicht, ich muß mich auf den Kampf vorbereiten!","Не мешай мне, я готовлюсь к бою!","","False","Info_Grim_PRENPC_10_01","",""
"Scripts/Content/Story/Missions/DIA_MIN_306_Grim.d:194","Dein Name kommt mir bekannt vor!","Знакомое у тебя имя...","","False","Info_Grim_KNOWYOU.description","",""
"Scripts/Content/Story/Missions/DIA_MIN_306_Grim.d:204","Dein Name kommt mir bekannt vor!","Знакомое у тебя имя...","","False","Info_Grim_KNOWYOU_15_01","",""
"Scripts/Content/Story/Missions/DIA_MIN_306_Grim.d:205","Na und? Ist ja auch kein seltener Name!","И что с того? Не самое редкое имя.","","False","Info_Grim_KNOWYOU_10_02","",""
"Scripts/Content/Story/Missions/DIA_MIN_306_Grim.d:217","Kämpfst du in der Arena?","Ты один из бойцов на арене?","","False","Info_Grim_ARENA.description","",""
"Scripts/Content/Story/Missions/DIA_MIN_306_Grim.d:227","Kämpfst du in der Arena?","Ты один из бойцов на арене?","","False","Info_Grim_ARENA_15_01","",""
"Scripts/Content/Story/Missions/DIA_MIN_306_Grim.d:228","Du bist neu hier, richtig?","Ты здесь недавно, так?","","False","Info_Grim_ARENA_10_02","",""
"Scripts/Content/Story/Missions/DIA_MIN_306_Grim.d:231","Nicht wirklich!","Не совсем.","","False","Info_Grim_ARENA_Info.Info_Grim_ARENA.Info_Grim_ARENA_NO","AI_AddChoice",""
"Scripts/Content/Story/Missions/DIA_MIN_306_Grim.d:232","Sozusagen! Bin erst vor kurzem angekommen.","Верно. Я прибыл не так давно.","","False","Info_Grim_ARENA_Info.Info_Grim_ARENA.Info_Grim_ARENA_YES","AI_AddChoice",""
"Scripts/Content/Story/Missions/DIA_MIN_306_Grim.d:239","Sozusagen! Bin erst vor kurzem angekommen.","Верно. Я прибыл не так давно.","","False","Info_Grim_ARENA_YES_15_01","",""
