"location","source","target","id","fuzzy","context","translator_comments","developer_comments"
"Scripts/Content/Story/Log_Constants.d:71","Gerion hat kann mir alles beigebracht, was er über die Diebeskünste weiss. Wenn ich noch mehr lernen will, muss ich mir einen anderen Lehrer suchen.","Герион научил меня всему, что он знает о искусстве воровства.Если я хочу узнать еще больше, я должен найти другого учителя.","","True","GE_TeacheroC_5","",""
"Scripts/Content/Story/Log_Constants.d:77","Lehrer im Neuen Lager","Учителя в Новом Лагере","","True","GE_TeacherNC","",""
"Scripts/Content/Story/Log_Constants.d:77","Lehrer im Sumpflager","Учителя в Болотном Лагере","","True","GE_TeacherPSI","",""
"Scripts/Content/Story/Log_Constants.d:79","Lehrer ausserhalb der Lager","Учителя вне Лагерей","","True","GE_TeacherOW","",""
"Scripts/Content/Story/Log_Constants.d:81","Dämonische Bedrohung","демоническая угроза","","True","CH1_DemonThreat","",""
"Scripts/Content/Story/Log_Constants.d:81","Ich konnte Thora dazu bringen, mich zur Bergfestung zu führen. Allerdings wird sie mich nur an den ersten Wachen vorbeibringen. Danach bin ich auf mich allein gestellt.","Я смог заставить Тору повести меня к горной крепости, но она поведёт меня только к первым сторожам.","","True","CH1_DemonThreat_1","",""
"Scripts/Content/Story/Log_Constants.d:83","Sollte wir auf dem Weg in die Bergfestung getrennt werden, treffen wir uns an der Arena im Alten Lager wieder.","Если нас разлучат по пути в горную крепость, мы снова встретимся на арене в Старом лагере.","","True","CH1_DemonThreat_2","",""
"Scripts/Content/Story/Log_Constants.d:83","Der Schläfer versucht aus der Dämonenwelt in unsere Welt zurückzukommen. Er muss unter allen Umständen aufgehalten werden, sonst waren alle meine Bemühungen umsonst.","Спящий пытается вернуться из мира демонов в наш мир. Он должен быть остановлен при любых обстоятельствах, иначе все мои усилия были напрасными.","","True","CH1_DemonThreat_3","",""
"Scripts/Content/Story/Log_Constants.d:84","Bevor ich der dämonischen Bedrohung begegnen kann, muss ich meine verlernten Fähigkeiten zurückerlernen und wieder in Form kommen. Das Alte Lager ist der geeignete Ort dafür.","Прежде чем я смогу столкнуться с демонической угрозой, я должен вернуть свои забытые способности и вернуться в форму.","","True","CH1_DemonThreat_4","",""
"Scripts/Content/Story/Log_Constants.d:85","Xardas gab mir eine Botschaft für Diego. Mein alter Weggefährte ist mittlerweile der Anführer des Alten Lagers. Er wird mich beraten und weiss was zu tun ist.","Xardas дал мне сообщение для Диего. Мой старый спутник теперь является лидером старого лагеря.","","True","CH1_DemonThreat_5","",""
"Scripts/Content/Story/Log_Constants.d:87","Diego hält mich noch nicht wieder für überlebensfähig. Ich muss im Lager meine Fähigkeiten trainiere und wieder fit werden.","Диего не считает меня жизнеспособным.Я должен тренировать свои навыки в лагере и вернуться в форму.","","True","CH1_DemonThreat_6","",""
"Scripts/Content/Story/Log_Constants.d:87","Nach ausreichend Training werde ich nun zu Milten, meinem Weggefährten von früher, aufbrechen. Er ist einer der Feuermagier in der Bergfestung. Diego braucht seine Hilfe gegen die dämonische Bedrohung.","После долгих тренировок я собираюсь расстаться с Милтенсом, моим бывшим спутником. Он один из огневых волшебников в горной крепости. Диего нуждается в его помощи против демонической угрозы.","","True","CH1_DemonThreat_7","",""
"Scripts/Content/Story/Log_Constants.d:88","Die Bergfestung wird von den Paladinen des Königs abgeschottet. Thora arbeitet als Kundschafterin für die Paladine. Sie ist der einzige Weg für mich, in die Festung zu gelangen.","Горная крепость закрыта королевскими паладинами. Тора работает клиентом для паладинов. Это единственный способ для меня попасть в крепость.","","True","CH1_DemonThreat_8","",""
"Scripts/Content/Story/Log_Constants.d:91","Huldrych's Lektion","Урок Хулдриха","","True","CH1_Train1h","",""
"Scripts/Content/Story/Log_Constants.d:91","Huldrych hat den Händler Agon bestohlen. Cassian hat mich nun beauftragt, zum einen Huldrych eine Lektion zu erteilen und zum anderen Agon sein Eigentum wiederzubringen. Dabei wäre es unklug, Huldrych zu töten!","Хулдрих украл торговца Агона.Кассиан теперь поручил мне дать Хулдриху урок, а Агону вернуть его собственность.","","True","CH1_Train1h_1","",""
"Scripts/Content/Story/Log_Constants.d:93","Vielleicht ist es besser, erst mit Agon zu reden, bevor ich zu Huldrych gehe, um einen besseren Überblick der Situation zu bekommen.","Может быть, лучше поговорить с Агоном, прежде чем я пойду в Хулдрих, чтобы получить лучший обзор ситуации.","","True","CH1_Train1h_2","",""
"Scripts/Content/Story/Log_Constants.d:94","Ich habe die Aufgabe zu Cassian's Zufriedenheit erledigt. Huldrych hat seine Lektion erhalten.","Я выполнил задание для удовлетворения Кассиана.Huldrych получил свой урок.","","True","CH1_Train1h_3","",""
"Scripts/Content/Story/Log_Constants.d:95","Es wäre besser gewesen, ich hätte Huldrych nicht umgebracht. In Zukunft sollte ich vorsichtig sein, Mord wird von allen sehr ernst genommen","Было бы лучше, если бы я не убил Хулдриха. В будущем я должен быть осторожным, убийство воспринимается всеми очень серьезно","","True","CH1_Train1h_4","",""
"Scripts/Content/Story/Log_Constants.d:96","Ich habe ein gutes Geschäft mit Huldrych gemacht. Und niemand hat etwas davon bemerkt. Vielleicht wird mir das noch einmal nützlich sein.","Я сделал хорошую сделку с Huldrych, и никто ничего не заметил.","","True","CH1_Train1h_5","",""
"Scripts/Content/Story/Log_Constants.d:97","Vielleicht sollte ich mal mit Agon sprechen.","Я бы хотел поговорить с Аганом.","","True","CH1_Train1h_6","",""
"Scripts/Content/Story/Log_Constants.d:98","Ich fürchte Huldrych hat das Silber jetzt in Sicherheit gebracht. Bleibt mir nur noch, ihm aufs Maul... ähem ihm eine Lektion zu erteilen.","Я боюсь, что Хулдрих привел серебро в безопасность, и мне остается только дать ему урок.","","True","CH1_Train1h_7","",""
"Scripts/Content/Story/Log_Constants.d:99","Huldrych hat Agon 100 Silberstücke gestohlen.","Хулдрих украл Агону 100 серебряных кусков.","","True","CH1_Train1h_8","",""
"Scripts/Content/Story/Log_Constants.d:101","Agon hat seine 100 Silberstücke wieder. Aber ausser seinem Dank hat der Geizkragen keine Belohnung herausgerückt. Damit habe ich einen Teil von Cassians Auftrag erfüllt.","Агон получил свои 100 серебряных кусков, но, помимо благодарности, он не получил никакого вознаграждения, и я выполнил часть заказов Кассиана.","","True","CH1_Train1h_9","",""
"Scripts/Content/Story/Log_Constants.d:102","Der Weg zum Bogenschützen","Дорога к охраннику","","True","CH1_TrainBow_1","",""
"Scripts/Content/Story/Log_Constants.d:103","Auf dem unzugänglichen Stück Wehrgang an der Burgschmiede und auf dem Vordach sind ein paar Fleischwanzen. Davon soll ich mindestens fünf erledigen.","На недоступном участке Военного хода на замке и на передней крыше есть несколько мясных хвостов, из которых я должен сделать не менее пяти.","","True","CH1_TrainBow_1_1","",""
"Scripts/Content/Story/Log_Constants.d:107","Die Fleischwanzen sind erledigt.","Мясные палочки закончены.","","True","CH1_TrainBow_1_2","",""
"Scripts/Content/Story/Log_Constants.d:107","Der Weg zum Bogenmeister","Дорога к мастеру","","True","CH1_TrainBow_2","",""
"Scripts/Content/Story/Log_Constants.d:109","Ich soll Diego das Fleisch von 5 Molerats bringen","Я хочу, чтобы Диего принес мясо 5 молератов","","True","CH1_TrainBow_2_1","",""
"Scripts/Content/Story/Log_Constants.d:110","Diego hat das Fleisch der Molerats. Damit habe ich alles über den Umgang mit dem Bogen gelernt.","У Диего есть мясо молератов. С этим я узнал все о том, как обращаться с луком.","","True","CH1_TrainBow_2_2","",""
"Scripts/Content/Story/Log_Constants.d:111","Ein Schlüssel für Gerion","Ключ от гериона","","True","CH1_TrainSneak","",""
"Scripts/Content/Story/Log_Constants.d:111","Verdammt, jetzt hat Osbert den Schlüssel. Ich sollte Gerion darüber informieren.","Теперь у Осберта есть ключ, и я должен сообщить об этом Гериону.","","True","CH1_TrainSneak_1","",""
"Scripts/Content/Story/Log_Constants.d:112","Gerion will einen Schlüssel aus dem Obergeschoß des Erzbaronhauses haben. Ich muß mich an Osbert vorbeischleichen, der den Raum bewacht.","Герион хочет иметь ключ с верхнего этажа дома архиерейского барона.Я должен пройти мимо Осберта, который охраняет комнату.","","True","CH1_TrainSneak_2","",""
"Scripts/Content/Story/Log_Constants.d:113","Ich habe Gerion den Schlüssel besorgt. Jetzt ist er bereit mir Grundkenntnisse in TASCHENDIEBSTAHL und SCHLÖSSER KNACKEN beizubringen.","Я предоставил ключ Гериону, и теперь он готов научить меня базовым знаниям в СКЛАДНОЙ СТАЛИ И ЗАКРЫТОЙ СКЛАДКИ.","","True","CH1_TrainSneak_3","",""
"Scripts/Content/Story/Log_Constants.d:114","Nachdem ich schon bei meiner ersten Aufgabe als Dieb gescheitert bin, ist es wohl besser, keine weitere Zeit und Mühe in die Diebeskunst zu investieren.","После того, как я потерпел неудачу в своей первой задаче в качестве вора, лучше не тратить больше времени и сил на искусство воровства.","","True","CH1_TrainSneak_4","",""
"Scripts/Content/Story/Log_Constants.d:115","Gerion hat mir das Talent des Taschendiebstahls gezeigt. Jetzt kann ich Osbert den Schlüssel unbemerkt abnehmen","Герион показал мне талант карманной кражи.Теперь я могу снять ключ Осберта незаметно","","True","CH1_TrainSneak_5","",""
"Scripts/Content/Story/Log_Constants.d:116","Ich habe Osbert den Schlüssel unbemerkt abgenommen. Gerion ist nun auch bereit mir Grundkenntnisse über SCHLÖSSER KNACKEN beizubringen","Я отнял ключ от Осберта незаметно.Герион теперь готов научить меня базовым знаниям о ЗАКЛЮЧЕНИИ","","True","CH1_TrainSneak_6","",""
"Scripts/Content/Story/Log_Constants.d:118","Ich habe Osbert niedergeschlagen und Gerion den Schlüssel gebracht. Das war zwar nicht ganz im Sinn der Aufgabe, aber er wird mich weiterhin unterrichten","Я победил Осберта и принес ключ Гериону.Это было не совсем в смысле задачи, но он продолжит учить меня","","True","CH1_TrainSneak_7","",""
"Scripts/Content/Story/Log_Constants.d:120","Akrobatik","Акробатика","","False","CH1_TrainAcrobatic","",""
"Scripts/Content/Story/Log_Constants.d:121","Eine Kiste voller Kraut","Коробка полная травы","","True","CH1_TrainLockpick_1","",""
"Scripts/Content/Story/Log_Constants.d:122","Lakarus der Bettler verwahrt seinen Sumpfkrautvorrat in seiner Hütte. Gerion braucht 20 Stengel.","Лакарус просящий хранит свой запас сосновых трав в своей хижине. Герион нуждается в 20 стеблях.","","True","CH1_TrainLockpick_1_1","",""
"Scripts/Content/Story/Log_Constants.d:123","Die Hütte von Lakarus steht oberhalb der Arena.","Хостел Лакаруса стоит над ареной.","","True","CH1_TrainLockpick_1_2","",""
"Scripts/Content/Story/Log_Constants.d:125","Gerion will das ich das Sumpfkraut bei dem Heiler Isgar gegen einen 'Schlafwein' tausche.","Герион хочет, чтобы я обменял горчицу у исцелителя Исгара на «спящее вино».","","True","CH1_TrainLockpick_1_3","",""
"Scripts/Content/Story/Log_Constants.d:127","Gerion hat den 'Schlafwein' bekommen.","Герион получил «Спящее вино».","","True","CH1_TrainLockpick_1_4","",""
"Scripts/Content/Story/Log_Constants.d:127","Schlösser öffnen Stufe 2","Открытие замков 2 этап","","True","CH1_TrainLockpick_2","",""
"Scripts/Content/Story/Log_Constants.d:128","Taschendiebstahl Stufe 1","Ограбление кармана 1","","True","CH1_TrainPickpocket_1","",""
"Scripts/Content/Story/Log_Constants.d:128","Wylfern, Rekrut der Miliz, besitzt einen Ring. Gerion würde mir 250 Silberstücke daür geben.","Вулффер, рекрут милиции, владеет кольцом.Герион дал бы мне 250 серебряных штук.","","True","CH1_TrainPickpocket_1_1","",""
"Scripts/Content/Story/Log_Constants.d:132","Gerion hat den Ring und ich bin um einige Silberstücke reicher","У Гериона есть кольцо, а у меня немного серебра.","","True","CH1_TrainPickpocket_1_2","",""
"Scripts/Content/Story/Log_Constants.d:132","Taschendiebstahl Stufe 2","Ограбление кармана 2","","True","CH1_TrainPickpocket_2","",""
"Scripts/Content/Story/Log_Constants.d:134","Der Soldat Hyglas","Солдат Гиглас","","True","CH1_Hyglas","",""
"Scripts/Content/Story/Log_Constants.d:135","Wenn sich der Weg der Magier mit meinem Weg kreuzt,werde ich herausfinden was sie vorhaben. Falls es Schwierigkeiten gibt, wird Hyglas mir beistehen.","Когда путь волшебников пересекается с моим, я узнаю, что они собираются сделать.","","True","CH1_Hyglas_1","",""
"Scripts/Content/Story/Log_Constants.d:136","Bartok's Werkzeuge","Инструменты Бартока","","True","CH1_Bartok","",""
"Scripts/Content/Story/Log_Constants.d:136","Der Pfleger Odo gab mir den Schlüssel zu Bartok's Kiste. Einfach so!!! Es geschehen noch Zeichen und Wunder.","Медсестра Одо дала мне ключ к ящику Бартока. Просто так!!! Происходят еще знаки и чудеса.","","True","CH1_Bartok_1","",""
"Scripts/Content/Story/Log_Constants.d:137","Die rätselhafte Krankheit hat auch den ehemalige Burgschmied Bartok erwischt. Er wurde ins Viertel der Kranken gebracht. Den Schlüssel zu seiner Werkzeugkiste trug er stets bei sich.","Эта загадочная болезнь также поймала бывшего крестьянина Бартока, который был доставлен в район больных и всегда носил с собой ключ к своей коробке с инструментами.","","True","CH1_Bartok_2","",""
"Scripts/Content/Story/Log_Constants.d:139","Ich habe Bartok im Krankenviertel getroffen. Er ist völlig durchgeknallt. Es ist unmöglich aus ihm etwas vernünftiges herauszubekommen. Vielleicht weiss einer der Pfleger etwas von dem Schlüssel.","Я познакомился с Бартоком в больничном районе. Он полностью проглочен. Невозможно извлечь из него что-то разумное. Возможно, кто-то из медсестер знает что-то о ключе.","","True","CH1_Bartok_3","",""
"Scripts/Content/Story/Log_Constants.d:141","Der Weg zum Waffenschmied","Дорога к оружию","","True","CH1_LearnSmith","",""
"Scripts/Content/Story/Log_Constants.d:141","Sylvester war dankbar, dass ich ihn zur Erzader geführt habe. Ich kann mir ab heute täglich etwas Erz bei ihm abholen.","Сильвестр поблагодарил меня за то, что я привел его в Эрзадер, и с сегодняшнего дня я могу каждый день брать у него медь.","","True","CH1_LearnSmith_1","",""
"Scripts/Content/Story/Log_Constants.d:142","Gotmar, ist bereit mir das Waffenschmieden beizubringen, falls ich ihm 40 Brocken Erz besorge.","Готмар, готов научить меня оружейному ковчегу, если я дам ему 40 кубиков руды.","","True","CH1_LearnSmith_2","",""
"Scripts/Content/Story/Log_Constants.d:143","Ein Mann namens Edo soll seine Kisten mit geklautem Erz gefüllt haben. Er ist am Marktplatz zu finden.","Мужчина по имени Эдо якобы наполнил свои ящики украденной медью.","","True","CH1_LearnSmith_3","",""
"Scripts/Content/Story/Log_Constants.d:144","Es soll eine kleine Erzader in einer Molerat-Höhle in der Nähe des Lager-Haupttores geben.","Предполагается, что в молератской пещере рядом с главными воротами лагеря находится небольшая аркада.","","True","CH1_LearnSmith_4","",""
"Scripts/Content/Story/Log_Constants.d:145","Für's Erzhacken brauche ich eine Spitzhacke. Der Schürfer Sylvester am Arenaplatz soll eine verkaufen.","Для этого мне нужна шпицхакка.Силвестер на площади арены должен продать одну.","","True","CH1_LearnSmith_5","",""
"Scripts/Content/Story/Log_Constants.d:146","In der Schmiede im Burghof könnten noch Werkzeuge des letzten Schmiedes herumliegen.","Во дворе крепости могут находиться инструменты последней крепости.","","True","CH1_LearnSmith_6","",""
"Scripts/Content/Story/Log_Constants.d:147","Zum Schmieden braucht man ein Roheisen. Das wird am Schmelzofen gemacht. Man braucht dazu Erzbrocken und eine Zange.","Для скважины нужна сырая железа. Это делается в плавильной печи. Для этого нужно скважину и штангу.","","True","CH1_LearnSmith_7","",""
"Scripts/Content/Story/Log_Constants.d:148","Nun muss das Roheisen in ein Schmiedefeuer gehalten und zum Glühen gebracht werden.","Теперь же необходимо держать сырое железо в кованом огне и приводить его в огонь.","","True","CH1_LearnSmith_8","",""
"Scripts/Content/Story/Log_Constants.d:149","Das glühende Roheisen muss nun auf dem Amboss zu einer Schwertklinge geschmiedet werden. Allerdings brauche ich dazu einen Schmiedehammer.","Зажженное железо теперь должно быть сформировано на амбосе в мечеть, но для этого мне нужен комод.","","True","CH1_LearnSmith_9","",""
"Scripts/Content/Story/Log_Constants.d:150","Die glühende Schwertklinge muss in einem Wassereimer abgekühlt und gehärtet werden. Wenigstens brauche ich dafür nicht wieder ein neues Werkzeug.","Зажигание меча нужно охлаждать и закаливать в водохранилище.По крайней мере, для этого мне не нужен новый инструмент.","","True","CH1_LearnSmith_10","",""
"Scripts/Content/Story/Log_Constants.d:152","Zuletzt muss die abgekühlte Klinge am Schleifstein geschliffen werden.","Наконец, охлажденный лист необходимо измельчить на шлифовальном камне.","","True","CH1_LearnSmith_11","",""
"Scripts/Content/Story/Log_Constants.d:152","Unglaublich, ich habe meine erste Waffe geschmiedet!","Невероятно, я придумал свой первый пистолет!","","True","CH1_LearnSmith_12","",""
"Scripts/Content/Story/Log_Constants.d:153","Gotmar hat heute keine Zeit, mir die Herstellung eines besseren Schwertes beizubringen. Ich sollte ihn an einem anderen Tag nochmal aufsuchen.!","Сегодня у Готмара нет времени, чтобы научить меня делать лучший меч.","","True","CH1_LearnSmith_13","",""
"Scripts/Content/Story/Log_Constants.d:154","Gotmar will mir die Herstellung von Langschwertern zeigen, wenn ich ihm etwas zur Hand gehe. Er will 5 Kurzschwerter von mir haben.","Готмар хочет показать мне, как изготавливать длинные мечи, если я сделаю что-то для него, он хочет от меня пять коротких мечей.","","True","CH1_LearnSmith_14","",""
"Scripts/Content/Story/Log_Constants.d:155","Gerne würde ich das Schmieden von noch besseren Schwertern lernen, aber Gotmar hat heute zu viel zu tun. Ich sollte ihn an einem späteren Tag nochmal aufsuchen!","Я хотел бы научиться ковать еще лучшие мечи, но у Готмара сегодня слишком много работы.","","True","CH1_LearnSmith_15","",""
"Scripts/Content/Story/Log_Constants.d:156","Gotmar hat eingewilligt, mir zu zeigen, wie man Breitschwerter herstellt. Allerdings soll ich ihm einen Gefallen tun und seinen ehemaligen Schmiedegehilfen Goliath dazu überreden, die Arbeit in der Schmiede wieder aufzunehmen!","Готмар согласился показать мне, как изготавливать широкие мечи, но я должен сделать ему услугу и убедить своего бывшего помощника Голиафа возобновить работу в мечети!","","True","CH1_LearnSmith_16","",""
"Scripts/Content/Story/Log_Constants.d:157","Der Schmied war sehr erfreut darüber, dass sein Gehilfe Goliath die Arbeit wieder aufgenommen hat. Er will mir jetzt das Schmieden eines noch besseren Schwertes zeigen.","Мельник был очень рад тому, что его помощник Голиат снова начал работу, и теперь он хочет показать мне, как выкачивать еще лучший меч.","","True","CH1_LearnSmith_17","",""
"Scripts/Content/Story/Log_Constants.d:158","Ich habe alles gelernt, was Gotmar mir beibringen kann. Um bessere Waffen herzustellen, muß ich den Schmied in der Felsenfestung aufsuchen.","Я научился всему, чему меня может научить Готмар.Чтобы изготовить лучшее оружие, я должен посетить скважину в скальной крепости.","","True","CH1_LearnSmith_18","",""
"Scripts/Content/Story/Log_Constants.d:159","Goliath lässt sich nicht von seinem neuen Lebensweg abbringen. Zumindest nicht, solange er als Gladiator erfolgreich ist... .","Голиафа нельзя отвлечь от своего нового жизненного пути, по крайней мере, не до тех пор, пока он будет успешным гладиатором...","","True","CH1_LearnSmith_19","",""
"Scripts/Content/Story/Log_Constants.d:162","Ich konnte Goliath doch tatsächlich davon überzeugen, dass seine Zukunft nicht in der Arena liegt. Ich bin gespannt, was Gotmar dazu sagen wird.","Я действительно смог убедить Голиафа в том, что его будущее не в арене.","","True","CH1_LearnSmith_20","",""
"Scripts/Content/Story/Log_Constants.d:163","Die Arena","Арена","","True","CH1_Arena","",""
"Scripts/Content/Story/Log_Constants.d:163","Wenn ich als Gladiator	kämpfen	will, muß ich einen	der	anderen	Kämpfer	herausfordern und dann zum Arenameister	zurückkehren!","Если я хочу сражаться в качестве гладиатора, я должен бросить вызов одному из других бойцов, а затем вернуться на арену!","","True","CH1_Arena_1","",""
