"location","source","target","id","fuzzy","context","translator_comments","developer_comments"
"Scripts/Content/Story/Log_Constants.d:235","Das siebente Buch beschreibt den Tod des Phoenix am höchsten Ort seines Hortes.","Седьмая книга описывает смерть Феникса на самом высоком месте его огорода.","","True","CH1_Phoenix_7","",""
"Scripts/Content/Story/Log_Constants.d:235","Das achte Buch klingt wie der Abschluss der 'Spur des Phoenix'. Nur ist dieser Hinweis der rätselhafteste von allen.","Восьмая книга звучит как завершение «След Феникса».","","True","CH1_Phoenix_8","",""
"Scripts/Content/Story/Log_Constants.d:239","Ich habe die Geheime Kammer der Feuermagier gefunden. Doch Corristo warnte im letzten Buch davor, das Wissen zu verschwenden, denn es sei 'der letzte Hort des Feuers innerhalb der Barriere'.","Но в последней книге Корристос предупреждал о том, чтобы не тратить знания, потому что это «последний огонь внутри барьера».","","True","CH1_Phoenix_9","",""
"Scripts/Content/Story/Log_Constants.d:244","Wiedergutmachungsauftrag von Gorn","Постановление о возмещении ущерба ГОРН","","True","REP_GORN","",""
"Scripts/Content/Story/Log_Constants.d:244","Wiedergutmachungsauftrag von Diego","Постановление о возврате Диего","","True","REP_DIEGO","",""
"Scripts/Content/Story/Log_Constants.d:244","Wiedergutmachungsauftrag von Milten","Заказ на возмещение ущерба Milten","","True","REP_MILTEN","",""
"Scripts/Content/Story/Log_Constants.d:244","Wiedergutmachungsauftrag von Lester","Заказ на возмещение ущерба Лестеру","","True","REP_LESTER","",""
