"location","source","target","id","fuzzy","context","translator_comments","developer_comments"
"Scripts/Content/Story/B/B_AssignAmbientInfos_MIL_7.d:124","Erzähl mir was über die Orks","Tell me about the orcs.","","True","Infos_Mil_7_STORY.description","",""
"Scripts/Content/Story/B/B_AssignAmbientInfos_MIL_7.d:134","Erzähl mir was über die Orks.","Tell me about the orcs.","","True","Infos_Mil_7_STORY_ORK_Info_15_01","",""
"Scripts/Content/Story/B/B_AssignAmbientInfos_MIL_7.d:135","Die Orks haben alle Armeen des Königs aufgrieben. Sie haben alles niedergewalzt was ihnen im Weg stand.","The orcs have overrun all the armies of the king. They have knocked down everything that stood in their way.","","True","Infos_Mil_7_STORY_ORK_Info_07_02","",""
"Scripts/Content/Story/B/B_AssignAmbientInfos_MIL_7.d:136","Jetzt lassen sie uns noch ein wenig zappeln und dann sind auch wir dran!","Now they'll make us a little more messy and then it'll be our turn!","","True","Infos_Mil_7_STORY_ORK_Info_07_03","",""
"Scripts/Content/Story/B/B_AssignAmbientInfos_MIL_7.d:148","Wer hat bei euch das Sagen?","Who's in charge among you?","","True","Infos_Mil_7_BOSS.description","",""
"Scripts/Content/Story/B/B_AssignAmbientInfos_MIL_7.d:168","Wer hat bei euch  das Sagen?","Who's in charge among you?","","True","Infos_Mil_7_BOSS_Info_15_01","",""
"Scripts/Content/Story/B/B_AssignAmbientInfos_MIL_7.d:169","Berengar, der Hauptmann. Aber mit jemanden wie dir wird er nicht reden. Ihm untersteht Leutnant Brutus.","Berengar, the captain. But he won't talk to someone like you. Lieutenant Brutus is his subordinate.","","True","Infos_Mil_7_BOSS_Info_07_02","",""
"Scripts/Content/Story/B/B_AssignAmbientInfos_MIL_9.d:32","Wie läufts?","How's it going?","","True","Infos_Mil_9_HI.description","",""
"Scripts/Content/Story/B/B_AssignAmbientInfos_MIL_9.d:42","Wie läufts?","How's it going?","","True","Infos_Mil_9_HI_Info_15_01","",""
"Scripts/Content/Story/B/B_AssignAmbientInfos_MIL_9.d:43","(brummig) jaja, läuft gut.","(grumpily) Yeah, it's going well.","","True","Infos_Mil_9_HI_Info_06_02","",""
"Scripts/Content/Story/B/B_AssignAmbientInfos_MIL_9.d:55","Übles Essen hier! Willst du dir etwas Silber verdienen?","Bad food here! You want to earn some silver?","","True","Info_Mil_9_FOODGOOD.description","",""
"Scripts/Content/Story/B/B_AssignAmbientInfos_MIL_9.d:72","Übles Essen hier! Willst du dir etwas Silber verdienen?","Bad food here! You want to earn some silver?","","True","Info_Mil_9_FOODGOOD_15_01","",""
"Scripts/Content/Story/B/B_AssignAmbientInfos_MIL_9.d:76","Was muss ich dafür machen?","What do I have to do for it?","","True","Info_Mil_9_FOODGOOD_09_03","",""
"Scripts/Content/Story/B/B_AssignAmbientInfos_MIL_9.d:77","Kauf dein Mittagessen ab morgen bei Snaf im Aussenring!","Buy your lunch from Snaf in the Outer Ring tomorrow!","","True","Info_Mil_9_FOODGOOD_15_04","",""
"Scripts/Content/Story/B/B_AssignAmbientInfos_MIL_9.d:78","Warum nicht, dort schmeckt es zwar nicht ganz so gut, aber Silber ist Silber!","Why not, it doesn't taste all that good there, but silver is silver!","","True","Info_Mil_9_FOODGOOD_09_05","",""
"Scripts/Content/Story/B/B_AssignAmbientInfos_MIL_9.d:104","Könnt ihr noch einen Mann gebrauchen?","Could you use another man?","","True","Infos_Mil_9_JOIN.description","",""
"Scripts/Content/Story/B/B_AssignAmbientInfos_MIL_9.d:114","Könnt ihr noch einen Mann gebrauchen?","Could you use another man?","","True","Infos_Mil_9_JOIN_Info_15_01","",""
"Scripts/Content/Story/B/B_AssignAmbientInfos_MIL_9.d:116","Das solltest du dir gut überlegen. Bei uns ist Disziplin gefordert.","You should think about that. Discipline is required here.","","True","Infos_Mil_9_JOIN_Info_06_02","",""
"Scripts/Content/Story/B/B_AssignAmbientInfos_MIL_9.d:117","Selbst wenn du keine Aufgaben hast, hast du Aufgaben. Jeden Tag musst du dich einmal melden.","Even if you don't have tasks, you do. You have to report once a day.","","True","Infos_Mil_9_JOIN_Info_06_03","",""
"Scripts/Content/Story/B/B_AssignAmbientInfos_MIL_9.d:118","Wenn du das wirklich willst, dann sprich mal mit Cassian. Er ist Leutnant und kümmert sich um die Neuen.","If you really want to do that, you should talk to Cassian. He's a lieutenant and takes care of the newcomers.","","True","Infos_Mil_9_JOIN_Info_06_04","",""
"Scripts/Content/Story/B/B_AssignAmbientInfos_MIL_9.d:131","Erzähl mir was über die Orks","Tell me about the orcs.","","True","Infos_Mil_9_STORY.description","",""
"Scripts/Content/Story/B/B_AssignAmbientInfos_MIL_9.d:141","Erzähl mir was über die Orks.","Tell me about the orcs.","","True","Infos_Mil_9_STORY_Info_15_01","",""
"Scripts/Content/Story/B/B_AssignAmbientInfos_MIL_9.d:142","Man darf nicht den Fehler machen, sie zu unterschätzen. Es sind keine Wilden, gegen die wir da kämpfen.","One must not make the mistake of underestimating them. We are not fighting any savages.","","True","Infos_Mil_9_STORY_Info_09_02","",""
"Scripts/Content/Story/B/B_AssignAmbientInfos_MIL_9.d:143","Sie haben eine Kultur die wahrscheinlich älter ist, als die der Menschen.","They have a culture that is probably older than that of humans.","","True","Infos_Mil_9_STORY_Info_09_03","",""
"Scripts/Content/Story/B/B_AssignAmbientInfos_MIL_9.d:144","Aber das gefährliche ist, das sie leben um zu kämpfen. Und sie kämpfen um zu sterben.","But the dangerous part is that they live to fight. And they fight to die.","","True","Infos_Mil_9_STORY_Info_09_04","",""
"Scripts/Content/Story/B/B_AssignAmbientInfos_MIL_9.d:156","Wer hat hier das Sagen?","Who's in charge here?","","True","Infos_Mil_9_BOSS.description","",""
"Scripts/Content/Story/B/B_AssignAmbientInfos_MIL_9.d:179","Wer hat hier das Sagen?","Who's in charge here?","","True","Infos_Mil_9_BOSS_Info_15_01","",""
"Scripts/Content/Story/B/B_AssignAmbientInfos_MIL_9.d:180","Hauptmann Berengar führt das Kommando. Er hat zwei Leutnants die seine Befehle weitergeben, Cassian und Brutus.","Captain Berengar leads the command. He has two lieutenants who pass on his orders, Cassian and Brutus.","","True","Infos_Mil_9_BOSS_Info_09_02","",""
"Scripts/Content/Story/B/B_AssignAmbientInfos_THF_10.d:26","Wie läufts?","How's it going?","","True","Infos_Thf_10_HI.description","",""
"Scripts/Content/Story/B/B_AssignAmbientInfos_THF_10.d:36","Wie läufts?","How's it going?","","True","Infos_Thf_10_HI_Info_15_01","",""
"Scripts/Content/Story/B/B_AssignAmbientInfos_THF_10.d:37","Wenn du überleben willst, dann verlasse nicht das Lager. Draussen gibt es nichts, was es wert wäre sein Leben dafür aufs Spiel zu setzen!","If you want to survive, don't leave the camp. There's nothing out there worth risking his life for!","","True","Infos_Thf_10_HI_Info_01_02","",""
"Scripts/Content/Story/B/B_AssignAmbientInfos_THF_10.d:73","Wie siehts im Lager aus?","How's it going in the camp?","","True","Infos_Thf_10_CAMP.description","",""
"Scripts/Content/Story/B/B_AssignAmbientInfos_THF_10.d:83","Wie siehts im Lager aus?","How's it going in the camp?","","True","Infos_Thf_10_CAMP_Info_15_01","",""
"Scripts/Content/Story/B/B_AssignAmbientInfos_THF_10.d:84","Wenn du dich mit Snaf dem Koch gutstellst, dann kriegst du eine warme Mahlzeit am Tag.","If you make peace with Snaf the cook, you'll get a warm meal a day.","","True","Infos_Thf_10_CAMP_Info_01_02","",""
"Scripts/Content/Story/B/B_AssignAmbientInfos_THF_10.d:85","Ansonsten gilt, verhalte dich ruhig und mache keinen Ärger!","Otherwise, you need to stay calm and avoid any trouble!","","True","Infos_Thf_10_CAMP_Info_01_03","",""
"Scripts/Content/Story/B/B_AssignAmbientInfos_THF_10.d:96","Wer hat hier das Sagen?","Who's in charge here?","","True","Infos_Thf_10_BOSS.description","",""
"Scripts/Content/Story/B/B_AssignAmbientInfos_THF_10.d:106","Wer hat hier das Sagen?","Who's in charge here?","","True","Infos_Thf_10_BOSS_Info_15_01","",""
"Scripts/Content/Story/B/B_AssignAmbientInfos_THF_10.d:107","Niemand hat mir etwas zu sagen.","Nobody has anything to say to me.","","True","Infos_Thf_10_BOSS_Info_01_02","",""
"Scripts/Content/Story/B/B_AssignAmbientInfos_THF_11.d:26","Wie läufts?","How's it going?","","True","Infos_Thf_11_HI.description","",""
"Scripts/Content/Story/B/B_AssignAmbientInfos_THF_11.d:36","Wie läufts?","How's it going?","","True","Infos_Thf_11_HI_Info_15_01","",""
"Scripts/Content/Story/B/B_AssignAmbientInfos_THF_11.d:37","Ich sage dir wie es läuft. Jeder für sich und du für dich. Pass auf dich auf, denn sonst tut es keiner!","I'll tell you how it goes. Everyone for himself and you for yourself. Watch out, otherwise nobody will!","","True","Infos_Thf_11_HI_Info_01_02","",""
"Scripts/Content/Story/B/B_AssignAmbientInfos_THF_11.d:71","Wie siehts im Lager aus?","How's it going in the camp?","","True","Infos_Thf_11_CAMP.description","",""
"Scripts/Content/Story/B/B_AssignAmbientInfos_THF_11.d:81","Wie siehts im Lager aus?","How's it going in the camp?","","True","Infos_Thf_11_CAMP_Info_15_01","",""
"Scripts/Content/Story/B/B_AssignAmbientInfos_THF_11.d:82","Halte dich fern von den Arbeitern und den Kranken. Da gibt es nichts zu holen.","Stay away from the workers and the sick. There's nothing there to get.","","True","Infos_Thf_11_CAMP_Info_01_02","",""
"Scripts/Content/Story/B/B_AssignAmbientInfos_THF_11.d:83","Geh der Miliz aus dem Weg, wenn einer von ihnen in der Nähe ist, verhalte dich ruhig und provoziere sie nicht!","Get out of the way of the militia, if one of them is nearby, be calm and don't provoke them!","","True","Infos_Thf_11_CAMP_Info_01_03","",""
"Scripts/Content/Story/B/B_AssignAmbientInfos_THF_11.d:91","Wer hat hier das Sagen?","Who's in charge here?","","True","Infos_Thf_11_BOSS.description","",""
"Scripts/Content/Story/B/B_AssignAmbientInfos_THF_11.d:101","Wer hat hier das Sagen?","Who's in charge here?","","True","Infos_Thf_11_BOSS_Info_15_01","",""
"Scripts/Content/Story/B/B_AssignAmbientInfos_THF_11.d:102","Diego ist der Anführer des Lagers. Auf sein Wort hören jeder im Lager.","Diego is the leader of the camp. Everyone in the camp listens to his word.","","True","Infos_Thf_11_BOSS_Info_01_02","",""
"Scripts/Content/Story/B/B_AssignAmbientInfos_THF_5.d:26","Wie läufts?","How's it going?","","True","Infos_Thf_5_HI.description","",""
"Scripts/Content/Story/B/B_AssignAmbientInfos_THF_5.d:36","Wie läufts?","How's it going?","","True","Infos_Thf_5_HI_Info_15_01","",""
"Scripts/Content/Story/B/B_AssignAmbientInfos_THF_5.d:37","Mach es wie ich, lebe in den Tag!","Do as I do, live to see it!","","True","Infos_Thf_5_HI_Info_01_02","",""
"Scripts/Content/Story/B/B_AssignAmbientInfos_THF_5.d:38","Du scheinst ja richtig gut drauf zu sein.","You seem to be really good at it.","","True","Infos_Thf_5_HI_Info_15_03","",""
"Scripts/Content/Story/B/B_AssignAmbientInfos_THF_5.d:39","Denn jeder Tag könnte dein letzter sein! Wer weiß ob nicht morgen schon die Orks angreifen?","Because every day could be your last! Who knows if the orcs won't attack tomorrow?","","True","Infos_Thf_5_HI_Info_01_04","",""
"Scripts/Content/Story/B/B_AssignAmbientInfos_THF_5.d:77","Wie siehts im Lager aus?","How's it going in the camp?","","True","Infos_Thf_5_CAMP.description","",""
"Scripts/Content/Story/B/B_AssignAmbientInfos_THF_5.d:87","Wie siehts im Lager aus?","How's it going in the camp?","","True","Infos_Thf_5_CAMP_Info_15_01","",""
"Scripts/Content/Story/B/B_AssignAmbientInfos_THF_5.d:88","Die einzige Abwechslung die es hier gibt sind die abendlichen Arenakämpfe.","The only variation there is here are the evening arena fights.","","True","Infos_Thf_5_CAMP_Info_01_02","",""
"Scripts/Content/Story/B/B_AssignAmbientInfos_THF_5.d:89","Den Rest wirst du schon mit der Zeit selber rausfinden.","You'll find out the rest yourself in time.","","True","Infos_Thf_5_CAMP_Info_01_03","",""
"Scripts/Content/Story/B/B_AssignAmbientInfos_THF_5.d:100","Wer hat hier das Sagen?","Who's in charge here?","","True","Infos_Thf_5_BOSS.description","",""
"Scripts/Content/Story/B/B_AssignAmbientInfos_THF_5.d:110","Wer hat hier das Sagen?","Who's in charge here?","","True","Infos_Thf_5_BOSS_Info_15_01","",""
"Scripts/Content/Story/B/B_AssignAmbientInfos_THF_5.d:111","Unterschiedlich. Die Arbeiter lassen sich nur was vom Baumeister sagen, die Miliz von ihrem Hauptmann, und der Rest lässt sich von keinem was sagen.","Different. The workers can only be told something by the builder, the militia by their captain, and the rest is not to be told by anyone.","","True","Infos_Thf_5_BOSS_Info_01_02","",""
"Scripts/Content/Story/B/B_AssignAmbientInfos_WRK_1.d:48","Pass auf, das du nicht runterfällst!","Watch out, don't fall off!","","True","Wrk_207_Worker_STEP_Info_15_01","",""
"Scripts/Content/Story/B/B_AssignAmbientInfos_WRK_1.d:60","Wie läufts?","How's it going?","","True","Infos_Wrk_1_HI.description","",""
"Scripts/Content/Story/B/B_AssignAmbientInfos_WRK_1.d:70","Wie läufts?","How's it going?","","True","Infos_Wrk_1_HI_Info_15_01","",""
"Scripts/Content/Story/B/B_AssignAmbientInfos_WRK_1.d:71","Es gibt viel zu tun. Wir müssen vorbereitet sein, falls die Orks kommen.","There's a lot to do. We need to be prepared if the orcs come.","","True","Infos_Wrk_1_HI_Info_01_02","",""
"Scripts/Content/Story/B/B_AssignAmbientInfos_WRK_1.d:72","Was meinst du mit Vorbereiten?","What do you mean by prepare?","","True","Infos_Wrk_1_HI_Info_15_03","",""
"Scripts/Content/Story/B/B_AssignAmbientInfos_WRK_1.d:73","Einen stabilen Wallschutz aufbauen, Waffen schmieden und Vorräte anlegen. Wir müssen in jeder Hinsicht vorbereitet sein. Jeder von uns. Du solltest dich auch vorbereiten.","Build a strong wall protection, forge weapons and stockpile supplies. We must be prepared in every way. Each of us. You should prepare yourself as well.","","True","Infos_Wrk_1_HI_Info_01_04","",""
"Scripts/Content/Story/B/B_AssignAmbientInfos_WRK_1.d:85","Wie siehts im Lager aus?","How's it going in the camp?","","True","Infos_Wrk_1_CAMP.description","",""
"Scripts/Content/Story/B/B_AssignAmbientInfos_WRK_1.d:95","Wie siehts im Lager aus?","How's it going in the camp?","","True","Infos_Wrk_1_CAMP_Info_15_01","",""
"Scripts/Content/Story/B/B_AssignAmbientInfos_WRK_1.d:96","Es könnte besser laufen, wenn mehr Leute arbeiten würden.  Es gibt einfach zuviel Gesindel.","It could be better if more people worked. There's just too much scum.","","True","Infos_Wrk_1_CAMP_Info_01_02","",""
"Scripts/Content/Story/B/B_AssignAmbientInfos_WRK_1.d:97","Das sie faul sind ist eine Sache, aber die sind auch feige. Und damit werden sie für uns völlig wertlos.","They're lazy, that's one thing, but they're cowards, too. And that makes them worthless to us.","","True","Infos_Wrk_1_CAMP_Info_01_03","",""
"Scripts/Content/Story/B/B_AssignAmbientInfos_WRK_1.d:98","Verstehe. Gerade jetzt ist jeder Mann wichtig.","I see. Every man is important, especially now.","","True","Infos_Wrk_1_CAMP_Info_15_04","",""
"Scripts/Content/Story/B/B_AssignAmbientInfos_WRK_1.d:99","Die nicht! Dieses Diebespack, diese faulen Hunde, soll Beliar sie alle holen!","Not them! Those thieves, those lazy dogs, let Beliar get them all!","","True","Infos_Wrk_1_CAMP_Info_01_05","",""
"Scripts/Content/Story/B/B_AssignAmbientInfos_WRK_1.d:135","Wer hat hier das Sagen?","Who's in charge here?","","True","Infos_Wrk_1_BOSS.description","",""
"Scripts/Content/Story/B/B_AssignAmbientInfos_WRK_1.d:151","Wer hat hier das Sagen?","Who's in charge here?","","True","Infos_Wrk_1_BOSS_Info_15_01","",""
"Scripts/Content/Story/B/B_AssignAmbientInfos_WRK_1.d:152","Bromor. Er ist der Baumeister. Sprich mit ihm, wenn du was willst.","Bromor. He's the master builder. Talk to him if you need anything.","","True","Infos_Wrk_1_BOSS_Info_01_02","",""
"Scripts/Content/Story/B/B_AssignAmbientInfos_WRK_11.d:29","Wie läufts?","How's it going?","","True","Infos_Wrk_11_HI.description","",""
"Scripts/Content/Story/B/B_AssignAmbientInfos_WRK_11.d:39","Wie läufts?","How's it going?","","True","Infos_Wrk_11_HI_Info_15_01","",""
"Scripts/Content/Story/B/B_AssignAmbientInfos_WRK_11.d:40","Gut. Es gibt zwar noch genug Arbeit, aber wir haben schon eine starke Verteidigung.","Good. There's still enough work to do, but we already have a strong defense.","","True","Infos_Wrk_11_HI_Info_11_02","",""
"Scripts/Content/Story/B/B_AssignAmbientInfos_WRK_11.d:41","Das gibt den Männern Mut. Und den werden sie brauchen, falls die Orks angreifen.","That gives the men courage. And they'll need it if the orcs attack.","","True","Infos_Wrk_11_HI_Info_11_03","",""
"Scripts/Content/Story/B/B_AssignAmbientInfos_WRK_11.d:42","Und werden die Orks angreifen?","And will the orcs attack?","","True","Infos_Wrk_11_HI_Info_15_04","",""
"Scripts/Content/Story/B/B_AssignAmbientInfos_WRK_11.d:43","Wenn es soweit ist, werden wir es wissen.","We'll know when it's time.","","True","Infos_Wrk_11_HI_Info_11_05","",""
"Scripts/Content/Story/B/B_AssignAmbientInfos_WRK_11.d:55","Wie siehts im Lager aus?","How's it going in the camp?","","True","Infos_Wrk_11_CAMP.description","",""
"Scripts/Content/Story/B/B_AssignAmbientInfos_WRK_11.d:65","Wie siehts im Lager aus?","How's it going in the camp?","","True","Infos_Wrk_11_CAMP_Info_15_01","",""
"Scripts/Content/Story/B/B_AssignAmbientInfos_WRK_11.d:66","Seit unserer Ankunft hier sind wir damit beschäftigt das Lager wieder aufzubauen.","Since we arrived here, we have been busy rebuilding the Camp.","","True","Infos_Wrk_11_CAMP_Info_11_02","",""
"Scripts/Content/Story/B/B_AssignAmbientInfos_WRK_11.d:67","Und die Arbeit geht voran. Die Orks werden sich ihre Schädel am Wall einrennen!","And the work is on. The orcs will be rushing their skulls against the wall!","","True","Infos_Wrk_11_CAMP_Info_11_03","",""
"Scripts/Content/Story/B/B_AssignAmbientInfos_WRK_11.d:68","Glaubst du, sie werden bald angreifen?","Do you think they'll attack soon?","","True","Infos_Wrk_11_CAMP_Info_15_04","",""
"Scripts/Content/Story/B/B_AssignAmbientInfos_WRK_11.d:69","Natürlich. Wozu machen wir uns sonst die ganze Arbeit?","Of course. Why else would we do all this work?","","True","Infos_Wrk_11_CAMP_Info_11_05","",""
"Scripts/Content/Story/B/B_AssignAmbientInfos_WRK_11.d:105","Wer hat hier das Sagen?","Who's in charge here?","","True","Infos_Wrk_11_BOSS.description","",""
"Scripts/Content/Story/B/B_AssignAmbientInfos_WRK_11.d:124","Wer hat hier das Sagen?","Who's in charge here?","","True","Infos_Wrk_11_BOSS_Info_15_01","",""
"Scripts/Content/Story/B/B_AssignAmbientInfos_WRK_11.d:125","Gotmar der Schmied und Bromor der Baumeister. Die beiden haben das Kommando.","Gotmar the smith and Bromor the master builder. The two are in command.","","True","Infos_Wrk_11_BOSS_Info_11_02","",""
"Scripts/Content/Story/B/B_AssignAmbientInfos_WRK_2.d:32","Wie läufts?","How's it going?","","True","Infos_Wrk_2_HI.description","",""
"Scripts/Content/Story/B/B_AssignAmbientInfos_WRK_2.d:42","Wie läufts?","How's it going?","","True","Infos_Wrk_2_HI_Info_15_01","",""
"Scripts/Content/Story/B/B_AssignAmbientInfos_WRK_2.d:43","Wir müssen einen starken Wall bauen. Nur ein starker Wall kann die Orks aufhalten!","We need to build a strong wall. Only a strong wall can stop the orcs!","","True","Infos_Wrk_2_HI_Info_01_02","",""
"Scripts/Content/Story/B/B_AssignAmbientInfos_WRK_2.d:55","Wie siehts im Lager aus?","How's it going in the camp?","","True","Infos_Wrk_2_CAMP.description","",""
"Scripts/Content/Story/B/B_AssignAmbientInfos_WRK_2.d:65","Wie siehts im Lager aus?","How's it going in the camp?","","True","Infos_Wrk_2_CAMP_Info_15_01","",""
"Scripts/Content/Story/B/B_AssignAmbientInfos_WRK_2.d:66","Die Miliz beschützt alle die arbeiten.","The militia protects all the workers.","","True","Infos_Wrk_2_CAMP_Info_01_02","",""
"Scripts/Content/Story/B/B_AssignAmbientInfos_WRK_2.d:67","Aber es gibt auch viele die nicht arbeiten. Die sollen selber zusehen wie sie klarkommen.","But there are also many who don't work. They should watch themselves how they manage.","","True","Infos_Wrk_2_CAMP_Info_01_03","",""
"Scripts/Content/Story/B/B_AssignAmbientInfos_WRK_2.d:103","Wer hat hier das Sagen?","Who's in charge here?","","True","Infos_Wrk_2_BOSS.description","",""
"Scripts/Content/Story/B/B_AssignAmbientInfos_WRK_2.d:119","Wer hat hier das Sagen?","Who's in charge here?","","True","Infos_Wrk_2_BOSS_Info_15_01","",""
"Scripts/Content/Story/B/B_AssignAmbientInfos_WRK_2.d:120","Bromor. Er ist der Baumeister. Sprich mit ihm, wenn du was willst.","Bromor. He's the master builder. Talk to him if you need anything.","","True","Infos_Wrk_2_BOSS_Info_01_02","",""
"Scripts/Content/Story/B/B_AssignAmbientInfos_WRK_6.d:29","Wie läufts?","How's it going?","","True","Infos_Wrk_6_HI.description","",""
"Scripts/Content/Story/B/B_AssignAmbientInfos_WRK_6.d:39","Wie läufts?","How's it going?","","True","Infos_Wrk_6_HI_Info_15_01","",""
"Scripts/Content/Story/B/B_AssignAmbientInfos_WRK_6.d:40","Viel Arbeit, wenig Schlaf. Wenigstens haben wir noch Bier.","A lot of work, not much sleep. At least we still have beer.","","True","Infos_Wrk_6_HI_Info_06_02","",""
"Scripts/Content/Story/B/B_AssignAmbientInfos_WRK_6.d:52","Wie siehts im Lager aus?","How's it going in the camp?","","True","Infos_Wrk_6_CAMP.description","",""
"Scripts/Content/Story/B/B_AssignAmbientInfos_WRK_6.d:62","Wie siehts im Lager aus?","How's it going in the camp?","","True","Infos_Wrk_6_CAMP_Info_15_01","",""
"Scripts/Content/Story/B/B_AssignAmbientInfos_WRK_6.d:63","Wir Arbeiter verstärken den Wall. Wir sorgen dafür das die Orks hier nicht reinspazieren werden.","We workers are reinforcing the wall. We make sure that the orcs don't come in here.","","True","Infos_Wrk_6_CAMP_Info_06_02","",""
"Scripts/Content/Story/B/B_AssignAmbientInfos_WRK_6.d:64","Und wenn sie es versuchen sollten, wird ihnen die Miliz ganz schön einheizen.","And if they try, the militia will be very upset.","","True","Infos_Wrk_6_CAMP_Info_06_03","",""
"Scripts/Content/Story/B/B_AssignAmbientInfos_WRK_6.d:65","Die Heiler kümmern sich um die Aussätzigen. Und wenn du was brauchst, das Händlerviertel ist hinter der Arena.","The healers take care of the lepers. And if you need anything, the trading district is behind the arena.","","True","Infos_Wrk_6_CAMP_Info_06_04","",""
"Scripts/Content/Story/B/B_AssignAmbientInfos_WRK_6.d:101","Wer hat hier das Sagen?","Who's in charge here?","","True","Infos_Wrk_6_BOSS.description","",""
"Scripts/Content/Story/B/B_AssignAmbientInfos_WRK_6.d:119","Wer hat hier das Sagen?","Who's in charge here?","","True","Infos_Wrk_6_BOSS_Info_15_01","",""
"Scripts/Content/Story/B/B_AssignAmbientInfos_WRK_6.d:120","Bromor und Dyrian. Der Baumeister und der Zimmermann. Die beiden kümmern sich um uns und das Lager.","Bromor and Dyrian. The master builder and the carpenter. They're the two who take care of us and the camp.","","True","Infos_Wrk_6_BOSS_Info_06_02","",""
"Scripts/Content/Story/B/B_Arena_ProclaimStart.d:20","(theatralisch) ICH GRÜSSE EUCH, GLADIATOREN!","(theatrically) I WILL YOU, GLADITORS!","","True","MIL_122_ProclaimStart_12_01","",""
"Scripts/Content/Story/B/B_Arena_ProclaimStart.d:22","KAMPFT NACH DEN REGELN UND KÄMPFT GUT!","FIGHT FOR THE RULES AND FIGHT FOR GOOD!","","True","MIL_122_ProclaimStart_12_02","",""
"Scripts/Content/Story/B/B_Arena_ProclaimStart.d:23","MÖGE DER BESSERE GEWINNEN!","MAY THE BEST WIN!","","True","MIL_122_ProclaimStart_12_03","",""
"Scripts/Content/Story/B/B_Arena_ProclaimFinish.d:43","(theatralisch) DIE WÜRFEL SIND GEFALLEN.","(theatrically) THE WRATCHS HAVE FALLEN.","","True","MIL_122_ProclaimFinish_12_01","",""
"Scripts/Content/Story/B/B_Arena_ProclaimFinish.d:50","WIR ABEN EINEN NEUEN CHAMPION !!!","WE ARE A NEW CHAMPION!!!","","True","MIL_122_ProclaimFinish_12_02","",""
"Scripts/Content/Story/B/B_Arena_ProclaimFinish.d:51","!!! DU !!! ...BIST DER NEUE CHAMPION DIESER ARENA!","!!! YOU !!! ...IT IS THE NEW CHAMPION OF THIS ARENA!","","True","MIL_122_ProclaimFinish_12_03","",""
"Scripts/Content/Story/B/B_Arena_ProclaimFinish.d:52","!!! DU !!! ...BIST DER BESTE KÄMPFER WEIT UND BREIT!","!!! YOU !!! ...IT IS THE BEST FIGHTER EVER and EVER!","","True","MIL_122_ProclaimFinish_12_04","",""
"Scripts/Content/Story/B/B_Arena_ProclaimFinish.d:53","WIR VERNEIGEN UNS VOR DIR!","WE WINK FOR YOU!","","True","MIL_122_ProclaimFinish_12_05","",""
"Scripts/Content/Story/B/B_Arena_ProclaimFinish.d:57","DER SIEGER DES HEUTIGEN KAMPFES...","THE WINNER OF THE COMPATING OF THE DAY ...","","True","MIL_122_ProclaimFinish_12_06","",""
"Scripts/Content/Story/B/B_Arena_ProclaimFinish.d:59","...bist DU !!!","...is YOU!!!","","True","MIL_122_ProclaimFinish_12_07","",""
"Scripts/Content/Story/B/B_Arena_ProclaimFinish.d:64","DER SIEGER DES HEUTIGEN KAMPFES IST...","THE WINNER OF THE COMPATING OF TODAY is ...","","True","MIL_122_ProclaimFinish_12_08","",""
"Scripts/Content/Story/B/B_Arena_ProclaimFinish.d:75","NIEMAND !!!","NO ONE!!!","","True","MIL_122_ProclaimFinish_12_09","",""
"Scripts/Content/Story/B/B_Arena_ProclaimFinish.d:76","Kein Gladiator hat 10 Punkte erringen können.","No gladiator has managed to get 10 points.","","True","MIL_122_ProclaimFinish_12_10","",""
"Scripts/Content/Story/B/B_Arena_ProclaimFinish.d:77","Somit ist der heutige Kampf unentschieden!","So today's fight is undecided!","","True","MIL_122_ProclaimFinish_12_11","",""
"Scripts/Content/Story/B/B_Arena_ProclaimFinish.d:84","!!!   G R I M   !!!!","!!! G R I M !!!!","","True","MIL_122_ProclaimFinish_12_12","",""
"Scripts/Content/Story/B/B_Arena_ProclaimFinish.d:92","!!!   G O L I A T H   !!!!","!!! G O L I A T H !!!!","","True","MIL_122_ProclaimFinish_12_13","",""
"Scripts/Content/Story/B/B_Arena_ProclaimFinish.d:100","!!!   B R U T U S   !!!!","!!! B R U T U S !!!!","","True","MIL_122_ProclaimFinish_12_14","",""
