"location","source","target","id","fuzzy","context","translator_comments","developer_comments"
"Scripts/Content/Story/B/B_AssignAmbientInfos_THF_10.d:84","Wenn du dich mit Snaf dem Koch gutstellst, dann kriegst du eine warme Mahlzeit am Tag.","","","False","Infos_Thf_10_CAMP_Info_01_02","",""
"Scripts/Content/Story/B/B_AssignAmbientInfos_THF_10.d:85","Ansonsten gilt, verhalte dich ruhig und mache keinen Ärger!","","","False","Infos_Thf_10_CAMP_Info_01_03","",""
"Scripts/Content/Story/B/B_AssignAmbientInfos_THF_10.d:96","Wer hat hier das Sagen?","Who's in charge here?","","True","Infos_Thf_10_BOSS.description","",""
"Scripts/Content/Story/B/B_AssignAmbientInfos_THF_10.d:106","Wer hat hier das Sagen?","Who's in charge here?","","True","Infos_Thf_10_BOSS_Info_15_01","",""
"Scripts/Content/Story/B/B_AssignAmbientInfos_THF_10.d:107","Niemand hat mir etwas zu sagen.","","","False","Infos_Thf_10_BOSS_Info_01_02","",""
"Scripts/Content/Story/B/B_AssignAmbientInfos_THF_11.d:26","Wie läufts?","","","False","Infos_Thf_11_HI.description","",""
"Scripts/Content/Story/B/B_AssignAmbientInfos_THF_11.d:36","Wie läufts?","","","False","Infos_Thf_11_HI_Info_15_01","",""
"Scripts/Content/Story/B/B_AssignAmbientInfos_THF_11.d:37","Ich sage dir wie es läuft. Jeder für sich und du für dich. Pass auf dich auf, denn sonst tut es keiner!","","","False","Infos_Thf_11_HI_Info_01_02","",""
"Scripts/Content/Story/B/B_AssignAmbientInfos_THF_11.d:71","Wie siehts im Lager aus?","","","False","Infos_Thf_11_CAMP.description","",""
"Scripts/Content/Story/B/B_AssignAmbientInfos_THF_11.d:81","Wie siehts im Lager aus?","","","False","Infos_Thf_11_CAMP_Info_15_01","",""
"Scripts/Content/Story/B/B_AssignAmbientInfos_THF_11.d:82","Halte dich fern von den Arbeitern und den Kranken. Da gibt es nichts zu holen.","","","False","Infos_Thf_11_CAMP_Info_01_02","",""
"Scripts/Content/Story/B/B_AssignAmbientInfos_THF_11.d:83","Geh der Miliz aus dem Weg, wenn einer von ihnen in der Nähe ist, verhalte dich ruhig und provoziere sie nicht!","","","False","Infos_Thf_11_CAMP_Info_01_03","",""
"Scripts/Content/Story/B/B_AssignAmbientInfos_THF_11.d:91","Wer hat hier das Sagen?","Who's in charge here?","","True","Infos_Thf_11_BOSS.description","",""
"Scripts/Content/Story/B/B_AssignAmbientInfos_THF_11.d:101","Wer hat hier das Sagen?","Who's in charge here?","","True","Infos_Thf_11_BOSS_Info_15_01","",""
"Scripts/Content/Story/B/B_AssignAmbientInfos_THF_11.d:102","Diego ist der Anführer des Lagers. Auf sein Wort hören jeder im Lager.","","","False","Infos_Thf_11_BOSS_Info_01_02","",""
"Scripts/Content/Story/B/B_AssignAmbientInfos_THF_5.d:26","Wie läufts?","","","False","Infos_Thf_5_HI.description","",""
"Scripts/Content/Story/B/B_AssignAmbientInfos_THF_5.d:36","Wie läufts?","","","False","Infos_Thf_5_HI_Info_15_01","",""
"Scripts/Content/Story/B/B_AssignAmbientInfos_THF_5.d:37","Mach es wie ich, lebe in den Tag!","","","False","Infos_Thf_5_HI_Info_01_02","",""
"Scripts/Content/Story/B/B_AssignAmbientInfos_THF_5.d:38","Du scheinst ja richtig gut drauf zu sein.","","","False","Infos_Thf_5_HI_Info_15_03","",""
"Scripts/Content/Story/B/B_AssignAmbientInfos_THF_5.d:39","Denn jeder Tag könnte dein letzter sein! Wer weiß ob nicht morgen schon die Orks angreifen?","","","False","Infos_Thf_5_HI_Info_01_04","",""
"Scripts/Content/Story/B/B_AssignAmbientInfos_THF_5.d:77","Wie siehts im Lager aus?","","","False","Infos_Thf_5_CAMP.description","",""
"Scripts/Content/Story/B/B_AssignAmbientInfos_THF_5.d:87","Wie siehts im Lager aus?","","","False","Infos_Thf_5_CAMP_Info_15_01","",""
"Scripts/Content/Story/B/B_AssignAmbientInfos_THF_5.d:88","Die einzige Abwechslung die es hier gibt sind die abendlichen Arenakämpfe.","","","False","Infos_Thf_5_CAMP_Info_01_02","",""
"Scripts/Content/Story/B/B_AssignAmbientInfos_THF_5.d:89","Den Rest wirst du schon mit der Zeit selber rausfinden.","","","False","Infos_Thf_5_CAMP_Info_01_03","",""
"Scripts/Content/Story/B/B_AssignAmbientInfos_THF_5.d:100","Wer hat hier das Sagen?","Who's in charge here?","","True","Infos_Thf_5_BOSS.description","",""
"Scripts/Content/Story/B/B_AssignAmbientInfos_THF_5.d:110","Wer hat hier das Sagen?","Who's in charge here?","","True","Infos_Thf_5_BOSS_Info_15_01","",""
"Scripts/Content/Story/B/B_AssignAmbientInfos_THF_5.d:111","Unterschiedlich. Die Arbeiter lassen sich nur was vom Baumeister sagen, die Miliz von ihrem Hauptmann, und der Rest lässt sich von keinem was sagen.","","","False","Infos_Thf_5_BOSS_Info_01_02","",""
"Scripts/Content/Story/B/B_AssignAmbientInfos_WRK_1.d:48","Pass auf, das du nicht runterfällst!","","","False","Wrk_207_Worker_STEP_Info_15_01","",""
"Scripts/Content/Story/B/B_AssignAmbientInfos_WRK_1.d:60","Wie läufts?","","","False","Infos_Wrk_1_HI.description","",""
"Scripts/Content/Story/B/B_AssignAmbientInfos_WRK_1.d:70","Wie läufts?","","","False","Infos_Wrk_1_HI_Info_15_01","",""
"Scripts/Content/Story/B/B_AssignAmbientInfos_WRK_1.d:71","Es gibt viel zu tun. Wir müssen vorbereitet sein, falls die Orks kommen.","","","False","Infos_Wrk_1_HI_Info_01_02","",""
"Scripts/Content/Story/B/B_AssignAmbientInfos_WRK_1.d:72","Was meinst du mit Vorbereiten?","","","False","Infos_Wrk_1_HI_Info_15_03","",""
"Scripts/Content/Story/B/B_AssignAmbientInfos_WRK_1.d:73","Einen stabilen Wallschutz aufbauen, Waffen schmieden und Vorräte anlegen. Wir müssen in jeder Hinsicht vorbereitet sein. Jeder von uns. Du solltest dich auch vorbereiten.","","","False","Infos_Wrk_1_HI_Info_01_04","",""
"Scripts/Content/Story/B/B_AssignAmbientInfos_WRK_1.d:85","Wie siehts im Lager aus?","","","False","Infos_Wrk_1_CAMP.description","",""
"Scripts/Content/Story/B/B_AssignAmbientInfos_WRK_1.d:95","Wie siehts im Lager aus?","","","False","Infos_Wrk_1_CAMP_Info_15_01","",""
"Scripts/Content/Story/B/B_AssignAmbientInfos_WRK_1.d:96","Es könnte besser laufen, wenn mehr Leute arbeiten würden.  Es gibt einfach zuviel Gesindel.","","","False","Infos_Wrk_1_CAMP_Info_01_02","",""
"Scripts/Content/Story/B/B_AssignAmbientInfos_WRK_1.d:97","Das sie faul sind ist eine Sache, aber die sind auch feige. Und damit werden sie für uns völlig wertlos.","","","False","Infos_Wrk_1_CAMP_Info_01_03","",""
"Scripts/Content/Story/B/B_AssignAmbientInfos_WRK_1.d:98","Verstehe. Gerade jetzt ist jeder Mann wichtig.","","","False","Infos_Wrk_1_CAMP_Info_15_04","",""
"Scripts/Content/Story/B/B_AssignAmbientInfos_WRK_1.d:99","Die nicht! Dieses Diebespack, diese faulen Hunde, soll Beliar sie alle holen!","","","False","Infos_Wrk_1_CAMP_Info_01_05","",""
"Scripts/Content/Story/B/B_AssignAmbientInfos_WRK_1.d:135","Wer hat hier das Sagen?","Who's in charge here?","","True","Infos_Wrk_1_BOSS.description","",""
"Scripts/Content/Story/B/B_AssignAmbientInfos_WRK_1.d:151","Wer hat hier das Sagen?","Who's in charge here?","","True","Infos_Wrk_1_BOSS_Info_15_01","",""
"Scripts/Content/Story/B/B_AssignAmbientInfos_WRK_1.d:152","Bromor. Er ist der Baumeister. Sprich mit ihm, wenn du was willst.","","","False","Infos_Wrk_1_BOSS_Info_01_02","",""
"Scripts/Content/Story/B/B_AssignAmbientInfos_WRK_11.d:29","Wie läufts?","","","False","Infos_Wrk_11_HI.description","",""
"Scripts/Content/Story/B/B_AssignAmbientInfos_WRK_11.d:39","Wie läufts?","","","False","Infos_Wrk_11_HI_Info_15_01","",""
"Scripts/Content/Story/B/B_AssignAmbientInfos_WRK_11.d:40","Gut. Es gibt zwar noch genug Arbeit, aber wir haben schon eine starke Verteidigung.","","","False","Infos_Wrk_11_HI_Info_11_02","",""
"Scripts/Content/Story/B/B_AssignAmbientInfos_WRK_11.d:41","Das gibt den Männern Mut. Und den werden sie brauchen, falls die Orks angreifen.","","","False","Infos_Wrk_11_HI_Info_11_03","",""
"Scripts/Content/Story/B/B_AssignAmbientInfos_WRK_11.d:42","Und werden die Orks angreifen?","","","False","Infos_Wrk_11_HI_Info_15_04","",""
"Scripts/Content/Story/B/B_AssignAmbientInfos_WRK_11.d:43","Wenn es soweit ist, werden wir es wissen.","","","False","Infos_Wrk_11_HI_Info_11_05","",""
"Scripts/Content/Story/B/B_AssignAmbientInfos_WRK_11.d:55","Wie siehts im Lager aus?","","","False","Infos_Wrk_11_CAMP.description","",""
"Scripts/Content/Story/B/B_AssignAmbientInfos_WRK_11.d:65","Wie siehts im Lager aus?","","","False","Infos_Wrk_11_CAMP_Info_15_01","",""
"Scripts/Content/Story/B/B_AssignAmbientInfos_WRK_11.d:66","Seit unserer Ankunft hier sind wir damit beschäftigt das Lager wieder aufzubauen.","","","False","Infos_Wrk_11_CAMP_Info_11_02","",""
"Scripts/Content/Story/B/B_AssignAmbientInfos_WRK_11.d:67","Und die Arbeit geht voran. Die Orks werden sich ihre Schädel am Wall einrennen!","","","False","Infos_Wrk_11_CAMP_Info_11_03","",""
"Scripts/Content/Story/B/B_AssignAmbientInfos_WRK_11.d:68","Glaubst du, sie werden bald angreifen?","","","False","Infos_Wrk_11_CAMP_Info_15_04","",""
"Scripts/Content/Story/B/B_AssignAmbientInfos_WRK_11.d:69","Natürlich. Wozu machen wir uns sonst die ganze Arbeit?","","","False","Infos_Wrk_11_CAMP_Info_11_05","",""
"Scripts/Content/Story/B/B_AssignAmbientInfos_WRK_11.d:105","Wer hat hier das Sagen?","Who's in charge here?","","True","Infos_Wrk_11_BOSS.description","",""
"Scripts/Content/Story/B/B_AssignAmbientInfos_WRK_11.d:124","Wer hat hier das Sagen?","Who's in charge here?","","True","Infos_Wrk_11_BOSS_Info_15_01","",""
"Scripts/Content/Story/B/B_AssignAmbientInfos_WRK_11.d:125","Gotmar der Schmied und Bromor der Baumeister. Die beiden haben das Kommando.","","","False","Infos_Wrk_11_BOSS_Info_11_02","",""
"Scripts/Content/Story/B/B_AssignAmbientInfos_WRK_2.d:32","Wie läufts?","","","False","Infos_Wrk_2_HI.description","",""
"Scripts/Content/Story/B/B_AssignAmbientInfos_WRK_2.d:42","Wie läufts?","","","False","Infos_Wrk_2_HI_Info_15_01","",""
"Scripts/Content/Story/B/B_AssignAmbientInfos_WRK_2.d:43","Wir müssen einen starken Wall bauen. Nur ein starker Wall kann die Orks aufhalten!","","","False","Infos_Wrk_2_HI_Info_01_02","",""
"Scripts/Content/Story/B/B_AssignAmbientInfos_WRK_2.d:55","Wie siehts im Lager aus?","","","False","Infos_Wrk_2_CAMP.description","",""
"Scripts/Content/Story/B/B_AssignAmbientInfos_WRK_2.d:65","Wie siehts im Lager aus?","","","False","Infos_Wrk_2_CAMP_Info_15_01","",""
"Scripts/Content/Story/B/B_AssignAmbientInfos_WRK_2.d:66","Die Miliz beschützt alle die arbeiten.","","","False","Infos_Wrk_2_CAMP_Info_01_02","",""
"Scripts/Content/Story/B/B_AssignAmbientInfos_WRK_2.d:67","Aber es gibt auch viele die nicht arbeiten. Die sollen selber zusehen wie sie klarkommen.","","","False","Infos_Wrk_2_CAMP_Info_01_03","",""
"Scripts/Content/Story/B/B_AssignAmbientInfos_WRK_2.d:103","Wer hat hier das Sagen?","Who's in charge here?","","True","Infos_Wrk_2_BOSS.description","",""
"Scripts/Content/Story/B/B_AssignAmbientInfos_WRK_2.d:119","Wer hat hier das Sagen?","Who's in charge here?","","True","Infos_Wrk_2_BOSS_Info_15_01","",""
"Scripts/Content/Story/B/B_AssignAmbientInfos_WRK_2.d:120","Bromor. Er ist der Baumeister. Sprich mit ihm, wenn du was willst.","","","False","Infos_Wrk_2_BOSS_Info_01_02","",""
"Scripts/Content/Story/B/B_AssignAmbientInfos_WRK_6.d:29","Wie läufts?","","","False","Infos_Wrk_6_HI.description","",""
"Scripts/Content/Story/B/B_AssignAmbientInfos_WRK_6.d:39","Wie läufts?","","","False","Infos_Wrk_6_HI_Info_15_01","",""
"Scripts/Content/Story/B/B_AssignAmbientInfos_WRK_6.d:40","Viel Arbeit, wenig Schlaf. Wenigstens haben wir noch Bier.","","","False","Infos_Wrk_6_HI_Info_06_02","",""
"Scripts/Content/Story/B/B_AssignAmbientInfos_WRK_6.d:52","Wie siehts im Lager aus?","","","False","Infos_Wrk_6_CAMP.description","",""
"Scripts/Content/Story/B/B_AssignAmbientInfos_WRK_6.d:62","Wie siehts im Lager aus?","","","False","Infos_Wrk_6_CAMP_Info_15_01","",""
"Scripts/Content/Story/B/B_AssignAmbientInfos_WRK_6.d:63","Wir Arbeiter verstärken den Wall. Wir sorgen dafür das die Orks hier nicht reinspazieren werden.","","","False","Infos_Wrk_6_CAMP_Info_06_02","",""
"Scripts/Content/Story/B/B_AssignAmbientInfos_WRK_6.d:64","Und wenn sie es versuchen sollten, wird ihnen die Miliz ganz schön einheizen.","","","False","Infos_Wrk_6_CAMP_Info_06_03","",""
"Scripts/Content/Story/B/B_AssignAmbientInfos_WRK_6.d:65","Die Heiler kümmern sich um die Aussätzigen. Und wenn du was brauchst, das Händlerviertel ist hinter der Arena.","","","False","Infos_Wrk_6_CAMP_Info_06_04","",""
"Scripts/Content/Story/B/B_AssignAmbientInfos_WRK_6.d:101","Wer hat hier das Sagen?","Who's in charge here?","","True","Infos_Wrk_6_BOSS.description","",""
"Scripts/Content/Story/B/B_AssignAmbientInfos_WRK_6.d:119","Wer hat hier das Sagen?","Who's in charge here?","","True","Infos_Wrk_6_BOSS_Info_15_01","",""
"Scripts/Content/Story/B/B_AssignAmbientInfos_WRK_6.d:120","Bromor und Dyrian. Der Baumeister und der Zimmermann. Die beiden kümmern sich um uns und das Lager.","","","False","Infos_Wrk_6_BOSS_Info_06_02","",""
"Scripts/Content/Story/B/B_Arena_ProclaimStart.d:20","(theatralisch) ICH GRÜSSE EUCH, GLADIATOREN!","","","False","MIL_122_ProclaimStart_12_01","",""
"Scripts/Content/Story/B/B_Arena_ProclaimStart.d:22","KAMPFT NACH DEN REGELN UND KÄMPFT GUT!","","","False","MIL_122_ProclaimStart_12_02","",""
"Scripts/Content/Story/B/B_Arena_ProclaimStart.d:23","MÖGE DER BESSERE GEWINNEN!","","","False","MIL_122_ProclaimStart_12_03","",""
"Scripts/Content/Story/B/B_Arena_ProclaimFinish.d:43","(theatralisch) DIE WÜRFEL SIND GEFALLEN.","","","False","MIL_122_ProclaimFinish_12_01","",""
"Scripts/Content/Story/B/B_Arena_ProclaimFinish.d:50","WIR ABEN EINEN NEUEN CHAMPION !!!","","","False","MIL_122_ProclaimFinish_12_02","",""
"Scripts/Content/Story/B/B_Arena_ProclaimFinish.d:51","!!! DU !!! ...BIST DER NEUE CHAMPION DIESER ARENA!","","","False","MIL_122_ProclaimFinish_12_03","",""
"Scripts/Content/Story/B/B_Arena_ProclaimFinish.d:52","!!! DU !!! ...BIST DER BESTE KÄMPFER WEIT UND BREIT!","","","False","MIL_122_ProclaimFinish_12_04","",""
"Scripts/Content/Story/B/B_Arena_ProclaimFinish.d:53","WIR VERNEIGEN UNS VOR DIR!","","","False","MIL_122_ProclaimFinish_12_05","",""
"Scripts/Content/Story/B/B_Arena_ProclaimFinish.d:57","DER SIEGER DES HEUTIGEN KAMPFES...","","","False","MIL_122_ProclaimFinish_12_06","",""
"Scripts/Content/Story/B/B_Arena_ProclaimFinish.d:59","...bist DU !!!","","","False","MIL_122_ProclaimFinish_12_07","",""
"Scripts/Content/Story/B/B_Arena_ProclaimFinish.d:64","DER SIEGER DES HEUTIGEN KAMPFES IST...","","","False","MIL_122_ProclaimFinish_12_08","",""
"Scripts/Content/Story/B/B_Arena_ProclaimFinish.d:75","NIEMAND !!!","","","False","MIL_122_ProclaimFinish_12_09","",""
"Scripts/Content/Story/B/B_Arena_ProclaimFinish.d:76","Kein Gladiator hat 10 Punkte erringen können.","","","False","MIL_122_ProclaimFinish_12_10","",""
"Scripts/Content/Story/B/B_Arena_ProclaimFinish.d:77","Somit ist der heutige Kampf unentschieden!","","","False","MIL_122_ProclaimFinish_12_11","",""
"Scripts/Content/Story/B/B_Arena_ProclaimFinish.d:84","!!!   G R I M   !!!!","","","False","MIL_122_ProclaimFinish_12_12","",""
"Scripts/Content/Story/B/B_Arena_ProclaimFinish.d:92","!!!   G O L I A T H   !!!!","","","False","MIL_122_ProclaimFinish_12_13","",""
"Scripts/Content/Story/B/B_Arena_ProclaimFinish.d:100","!!!   B R U T U S   !!!!","","","False","MIL_122_ProclaimFinish_12_14","",""
"Scripts/Content/Story/B/B_Arena_ProclaimFinish.d:108","!!!   M A L G A R   !!!!","","","False","MIL_122_ProclaimFinish_12_15","",""
"Scripts/Content/Story/B/B_Arena_ProclaimFinish.d:115","!!!   T H O R A   !!!!","","","False","MIL_122_ProclaimFinish_12_16","",""
"Scripts/Content/AI/B_Human/B_AssignNewsTheftToVoice.d:43","Dreckiger Dieb","","","False","Thief_ANGRY.description","",""
"Scripts/Content/AI/B_Human/B_AssignNewsTheftToVoice.d:74","(ignorieren)","","","False","Thief_ANGRY_Info.Thief_Angry.Thief_Angry_HauAb","AI_AddChoice",""
"Scripts/Content/AI/B_Human/B_AssignNewsMurderToVoice.d:19","Dreckiger Mörder","","","False","Murder.description","",""
"Scripts/Content/AI/B_Human/B_AssignNewsMurderToVoice.d:52","Dreckiger Mörder","","","False","Murder2.description","",""
"Scripts/Content/AI/B_Human/B_AssignNewsDamageToVoice.d:73","(ignorieren)","","","False","Attacker_ANGRY_Info.Attacker_Angry.Attacker_Angry_HauAb","AI_AddChoice",""
"Scripts/Content/Story/B/B_AssignReparationDialog.d:8","Reparationsauftragslösung","","","False","Reparation.description","",""
"Scripts/Content/Story/B/B_AssignReparationReceiver.d:8","Reparationsauftragsempfänger","","","False","ReparationReceiver.description","",""
"Scripts/Content/Story/B/B_AssignReparationReceiver.d:33","Ich bin geschickt worden, dir Heiltränke zu überreichen","","","False","ReparationReceiver_Info.ReparationReceiver.ReparationReceiver_Lieb","AI_AddChoice",""
"Scripts/Content/Story/B/B_AssignReparationReceiver.d:37","Keine fünf Heiltränke, zum Entschuldigen","","","False","ReparationReceiver_Info.ReparationReceiver.ReparationReceiver_NoGiveAway","AI_AddChoice",""
"Scripts/Content/AI/B_Human/B_GetBAckPersonalWeapon.d:62","Das war ein Versehen, hier hast Du Deine Waffe zurück.","","","False","MyWeapon_Info.MyWeapon.MyWeapon_Lieb","AI_AddChoice",""
"Scripts/Content/AI/B_Human/B_GetBAckPersonalWeapon.d:64","Hol sie Dir, wenn Du kannst","","","False","MyWeapon_Info.MyWeapon.MyWeapon_HauAb","AI_AddChoice",""
"Scripts/Content/AI/B_Human/B_GetBAckPersonalWeapon.d:90","Das war ein Versehen, hier hast Du Deine Waffe zurück.","","","False","MyWeapon_Info_15_01","",""
"Scripts/Content/AI/B_Human/B_GetBAckPersonalWeapon.d:141","Hol sie Dir, wenn Du kannst","","","False","MyWeapon_Info_15_02","",""
"Scripts/Content/Story/ZS/ZS_OtMeditate.d:59","Omm...","Omm...","","True","ZS_Meditate_Om","",""
"Scripts/Content/Story/Events/EV_Phoenix.d:28","Widerauferstehung","","","False","EV_BOOK_PHOENIX_S1_1","",""
"Scripts/Content/Story/Events/EV_Phoenix.d:29","des Phoenix","","","False","EV_BOOK_PHOENIX_S1_2","",""
"Scripts/Content/Story/Events/EV_Phoenix.d:30","Du hast das Rätsel des Phoenix entschlüsselt. Du bist würdig, das Wissen des Feuers an dich zu nehmen.","","","False","EV_BOOK_PHOENIX_S1_3","",""
"Scripts/Content/Story/Events/EV_Phoenix.d:31","Bewahre das Wissen und vergeude es nicht sinnlos. Dies ist der letzte Hort des Feuers innerhalb der Barriere.","","","False","EV_BOOK_PHOENIX_S1_4","",""
"Scripts/Content/Story/Events/EV_Phoenix.d:32","Der Phoenix hat sich aus seiner Asche erhoben, und die Macht des Feuers erstrahlt in neuem Glanz. Dies ist der Kreislauf des Lebens. Es war immer so. Es wird immer so sein.","","","False","EV_BOOK_PHOENIX_S1_5","",""
