"location","source","target","id","fuzzy","context","translator_comments","developer_comments"
"Scripts/Content/Story/Missions/DIA_DMH_1302_Malgar.d:70","(eiskalt) Gib mir meine Waffe! JETZT!","(ice cold) Give me my weapon! NOW!","","False","DMH_1302_MYWEAPON_Info_11_01","",""
"Scripts/Content/Story/Missions/DIA_DMH_1302_Malgar.d:73","Nein, ich behalte sie!","No, I'll keep it!","","False","DMH_1302_Malgar_MYWEAPON_Info.DMH_1302_Malgar_MYWEAPON.DMH_1302_Malgar_MYWEAPON_TAKEN","AI_AddChoice",""
"Scripts/Content/Story/Missions/DIA_DMH_1302_Malgar.d:74","Hier hast du sie zurück!","Here you go!","","False","DMH_1302_Malgar_MYWEAPON_Info.DMH_1302_Malgar_MYWEAPON.DMH_1302_Malgar_MYWEAPON_GIVEBACK","AI_AddChoice",""
"Scripts/Content/Story/Missions/DIA_DMH_1302_Malgar.d:80","Hier hast du sie zurück!","Here you go!","","False","DMH_1302_MYWEAPON_GIVEBACK_15_01","",""
"Scripts/Content/Story/Missions/DIA_DMH_1302_Malgar.d:82","(souverän) Gut!","(confident) Good!","","False","DMH_1302_MYWEAPON_GIVEBACK_11_02","",""
"Scripts/Content/Story/Missions/DIA_DMH_1302_Malgar.d:89","Nein, ich behalte sie!","No, I'll keep it!","","False","DMH_1302_MYWEAPON_TAKEN_15_01","",""
"Scripts/Content/Story/Missions/DIA_DMH_1302_Malgar.d:90","(verständnislos) Ts ts ts, Regel Nummer 3...","(without understanding) Ts ts ts, rule number three...","","False","DMH_1302_MYWEAPON_TAKEN_11_02","",""
"Scripts/Content/Story/Missions/DIA_DMH_1302_Malgar.d:127","(grüssend) Heute abend, Gladiator...","(greeting) Tonight, gladiator...","","False","DMH_1302_CHALLENGED_11_01","",""
"Scripts/Content/Story/Missions/DIA_DMH_1302_Malgar.d:131","Geh rüber!","Go there!","","False","DMH_1302_CHALLENGED_11_02","",""
"Scripts/Content/Story/Missions/DIA_DMH_1302_Malgar.d:140","Kämpfe Gladiator!","Fight gladiator!","","False","DMH_1302_CHALLENGED_11_03","",""
"Scripts/Content/Story/Missions/DIA_DMH_1302_Malgar.d:146","(grüssend) Morgen abend, Gladiator...","(greeting) Tomorrow evening, gladiator...","","False","DMH_1302_CHALLENGED_11_04","",""
"Scripts/Content/Story/Missions/DIA_DMH_1302_Malgar.d:179","Raus hier!","Get out of here!","","False","DMH_1302_PRENPC_11_01","",""
"Scripts/Content/Story/Missions/DIA_DMH_1302_Malgar.d:192","Du bist Gladiator, oder?","You are a gladiator, or?","","False","DMH_1302_Malgar_GLADIATOR.description","",""
"Scripts/Content/Story/Missions/DIA_DMH_1302_Malgar.d:202","Du bist Gladiator, oder?","You are a gladiator, or?","","False","DMH_1302_GLADIATOR_15_01","",""
"Scripts/Content/Story/Missions/DIA_DMH_1302_Malgar.d:203","Ja.","Yes.","","False","DMH_1302_GLADIATOR_11_02","",""
"Scripts/Content/Story/Missions/DIA_DMH_1302_Malgar.d:215","Kämpfst wohl mit dem Schwert.","You probably fight with a sword.","","False","DMH_1302_Malgar_WEAPON.description","",""
"Scripts/Content/Story/Missions/DIA_DMH_1302_Malgar.d:230","Kämpfst wohl mit dem Schwert.","You probably fight with a sword.","","False","DMH_1302_WEAPON_15_01","",""
"Scripts/Content/Story/Missions/DIA_DMH_1302_Malgar.d:231","Ja!","Yes!","","False","DMH_1302_WEAPON_11_02","",""
"Scripts/Content/Story/Missions/DIA_DMH_1302_Malgar.d:243","Wieviele Arenakämpfe hast du schon gewonnen?","How many fights in the arena have you already won?","","False","DMH_1302_Malgar_VICTORIES.description","",""
"Scripts/Content/Story/Missions/DIA_DMH_1302_Malgar.d:258","Wieviele Arenakämpfe hast du schon gewonnen?","How many fights in the arena have you already won?","","False","DMH_1302_VICTORIES_15_01","",""
"Scripts/Content/Story/Missions/DIA_DMH_1302_Malgar.d:259","Genug!","Enough!","","False","DMH_1302_VICTORIES_11_02","",""
"Scripts/Content/Story/Missions/DIA_DMH_1302_Malgar.d:271","Du sprichst wohl nicht sehr viel, was?","You don't speak much, do you?","","False","DMH_1302_Malgar_QUIET.description","",""
"Scripts/Content/Story/Missions/DIA_DMH_1302_Malgar.d:287","Du sprichst wohl nicht sehr viel, was?","You don't speak much, do you?","","False","DMH_1302_QUIET_15_01","",""
"Scripts/Content/Story/Missions/DIA_DMH_1302_Malgar.d:288","hmmmm","Hmmmm","","False","DMH_1302_QUIET_11_02","",""
"Scripts/Content/Story/Missions/DIA_DMH_1302_Malgar.d:289","Na dann...","Oh well...","","False","DMH_1302_QUIET_15_03","",""
"Scripts/Content/Story/Missions/DIA_DMH_1302_Malgar.d:302","Kämpfe gegen mich in der Arena!","Fight me in the arena!","","False","DMH_1302_Malgar_CHALLENGE.description","",""
"Scripts/Content/Story/Missions/DIA_DMH_1302_Malgar.d:324","Kämpfe gegen mich in der Arena!","Fight me in the arena!","","False","DMH_1302_CHALLENGE_15_01","",""
"Scripts/Content/Story/Missions/DIA_DMH_1302_Malgar.d:325","Das geht auch ganz ohne sprechen!","We can do that without talking!","","False","DMH_1302_CHALLENGE_15_02","",""
"Scripts/Content/Story/Missions/DIA_DMH_1302_Malgar.d:329","Geht nicht. Mein Schwert ist weg.","I can't. My sword is gone.","","False","DMH_1302_CHALLENGE_11_03","",""
"Scripts/Content/Story/Missions/DIA_DMH_1302_Malgar.d:334","Ich habe deine Waffe... ähem... gefunden! Hier!","I have... found... your weapon! Here!","","False","DMH_1302_Malgar_CHALLENGE_Info.DMH_1302_Malgar_CHALLENGE.DMH_1302_Malgar_CHALLENGE_FOUND","AI_AddChoice",""
"Scripts/Content/Story/Missions/DIA_DMH_1302_Malgar.d:342","Nein, du bist verbannt!","No, you were banned!","","False","DMH_1302_CHALLENGE_11_04","",""
"Scripts/Content/Story/Missions/DIA_DMH_1302_Malgar.d:348","Wenn du Brutus besiegst, kämpfe ich gegen dich!","I will fight you when you defeat Brutus!","","False","DMH_1302_CHALLENGE_11_05","",""
"Scripts/Content/Story/Missions/DIA_DMH_1302_Malgar.d:349","Das waren ja mehr als drei Silben in einem Satz!","That was more than three syllables in one sentence!","","False","DMH_1302_CHALLENGE_15_06","",""
"Scripts/Content/Story/Missions/DIA_DMH_1302_Malgar.d:350","(Brummel)","(Grumbling)","","False","DMH_1302_CHALLENGE_11_07","",""
"Scripts/Content/Story/Missions/DIA_DMH_1302_Malgar.d:357","Dir fehlt nur ein Sieg zum Titel!","You are just one victory away from the title!","","False","DMH_1302_CHALLENGE_11_08","",""
"Scripts/Content/Story/Missions/DIA_DMH_1302_Malgar.d:358","Du musst gegen den Champion kämpfen.","You have to fight against the champion.","","False","DMH_1302_CHALLENGE_11_09","",""
"Scripts/Content/Story/Missions/DIA_DMH_1302_Malgar.d:359","Wenn du Thora besiegst, bist DU der neue Champion!","If you defeat Thora, YOU will be the new champion!","","False","DMH_1302_CHALLENGE_11_10","",""
"Scripts/Content/Story/Missions/DIA_DMH_1302_Malgar.d:367","Du bist der Champion, ich bin nicht mal zweiter.","You are a champion, I'm not even second.","","False","DMH_1302_CHALLENGE_11_11","",""
"Scripts/Content/Story/Missions/DIA_DMH_1302_Malgar.d:368","Kämpfe gegen den zweiten!","Fight against the second one!","","False","DMH_1302_CHALLENGE_11_12","",""
"Scripts/Content/Story/Missions/DIA_DMH_1302_Malgar.d:374","Gut!","Good!","","False","DMH_1302_CHALLENGE_11_13","",""
"Scripts/Content/Story/Missions/DIA_DMH_1302_Malgar.d:375","Geh zum Arenameister!","Go to the arena master!","","False","DMH_1302_CHALLENGE_11_14","",""
"Scripts/Content/Story/Missions/DIA_DMH_1302_Malgar.d:384","Ich habe deine Waffe... ähem... gefunden! Hier!","I have... found... your weapon! Here!","","False","DMH_1302_CHALLENGE_FOUND_15_01","",""
"Scripts/Content/Story/Missions/DIA_DMH_1302_Malgar.d:386","Kann nur für dich hoffen, dass du sie wirklich GEFUNDEN hast.","I can only hope for your sake that you really FOUND it.","","False","DMH_1302_CHALLENGE_FOUND_11_02","",""
"Scripts/Content/Story/Missions/DIA_DMH_1302_Malgar.d:400","Möchtest du dich unterhalten?","Do you want to talk?","","False","DMH_1302_Malgar_HOWDY.description","",""
"Scripts/Content/Story/Missions/DIA_DMH_1302_Malgar.d:416","(leicht spöttisch) Möchtest du dich unterhalten?","(slightly mocking) Do you want to talk?","","False","DMH_1302_HOWDY_15_01","",""
"Scripts/Content/Story/Missions/DIA_DMH_1302_Malgar.d:417","Nein!","No!","","False","DMH_1302_HOWDY_11_02","",""
"Scripts/Content/Story/Missions/DIA_DMH_1302_Malgar.d:418","Das... dachte ich mir!","I thought so!","","False","DMH_1302_HOWDY_15_03","",""
