"location","source","target","id","fuzzy","context","translator_comments","developer_comments"
"Scripts/Content/Story/Missions/DIA_WRK_224_Igaraz.d:77","Sag mir Bescheid, wenn du bereit bist.","Let me know when you're ready.","","True","Wrk_224_VISITE_02_03","",""
"Scripts/Content/Story/Missions/DIA_WRK_224_Igaraz.d:89","(20 Silber geben)","(give 20 silvers)","","True","Wrk_224_Igaraz_PAY.description","",""
"Scripts/Content/Story/Missions/DIA_WRK_224_Igaraz.d:105","Okay, hier ist das Silber","Okay, here's the silver.","","True","Wrk_224_PAY_15_01","",""
"Scripts/Content/Story/Missions/DIA_WRK_224_Igaraz.d:107","Ausgezeichnet. Ich stehe dir jederzeit zur Verfügung. Sag mir einfach Bescheid.","Excellent. I'll be at your service any time. Just let me know.","","True","Wrk_224_PAY_02_02","",""
"Scripts/Content/Story/Missions/DIA_WRK_224_Igaraz.d:119","Diego schickt mich,...","Diego sent me ...","","True","Wrk_224_Igaraz_DIEGO.description","",""
"Scripts/Content/Story/Missions/DIA_WRK_224_Igaraz.d:134","Diego schickt mich , du kannst mir das Lager zeigen?","Diego sent me. Can you show me the camp?","","True","Wrk_224_DIEGO_15_01","",""
"Scripts/Content/Story/Missions/DIA_WRK_224_Igaraz.d:135","Oh, du bist ein Freund von Diego! Diegos Freunde sind auch meine Freunde.","Oh, you're a friend of Diego! Diego's friends are my friends, too.","","True","Wrk_224_DIEGO_02_02","",""
"Scripts/Content/Story/Missions/DIA_WRK_224_Igaraz.d:136","Und es gibt einen besonderen Grund, warum er dich zu mir geschickt hat...","And there's a special reason why he sent you to me ...","","True","Wrk_224_DIEGO_02_03","",""
"Scripts/Content/Story/Missions/DIA_WRK_224_Igaraz.d:137","Weil du nichts anderes zu tun hast?","Because you have nothing else to do?","","True","Wrk_224_DIEGO_15_04","",""
"Scripts/Content/Story/Missions/DIA_WRK_224_Igaraz.d:138","Nein, weil es keinen Besseren als mich gibt.","No, because there's no better man than me.","","True","Wrk_224_DIEGO_02_05","",""
"Scripts/Content/Story/Missions/DIA_WRK_224_Igaraz.d:139","Ich stehe dir jederzeit zur Verfügung. Sag mir einfach Bescheid.","I'll be at your disposal any time. Just let me know.","","True","Wrk_224_DIEGO_02_06","",""
"Scripts/Content/Story/Missions/DIA_WRK_224_Igaraz.d:152","Bring mich zu...","Bring me here ...","","True","Wrk_224_Igaraz_GUIDE.description","",""
"Scripts/Content/Story/Missions/DIA_WRK_224_Igaraz.d:168","Bring mich zu...","Bring me here ...","","True","Wrk_224_GUIDE_15_01","",""
"Scripts/Content/Story/Missions/DIA_WRK_224_Igaraz.d:171","...der Arena","... the arena","","True","Wrk_224_Igaraz_GUIDE_Info.Wrk_224_Igaraz_GUIDE.Wrk_224_Igaraz_GUIDE_ARENA","AI_AddChoice",""
"Scripts/Content/Story/Missions/DIA_WRK_224_Igaraz.d:172","...den Händlern","... the merchants","","True","Wrk_224_Igaraz_GUIDE_Info.Wrk_224_Igaraz_GUIDE.Wrk_224_Igaraz_GUIDE_TRADE","AI_AddChoice",""
"Scripts/Content/Story/Missions/DIA_WRK_224_Igaraz.d:173","...den Heilern","... the healers","","True","Wrk_224_Igaraz_GUIDE_Info.Wrk_224_Igaraz_GUIDE.Wrk_224_Igaraz_GUIDE_HEAL","AI_AddChoice",""
"Scripts/Content/Story/Missions/DIA_WRK_224_Igaraz.d:174","...den Arbeitern","... the workers","","True","Wrk_224_Igaraz_GUIDE_Info.Wrk_224_Igaraz_GUIDE.Wrk_224_Igaraz_GUIDE_WORKER","AI_AddChoice",""
"Scripts/Content/Story/Missions/DIA_WRK_224_Igaraz.d:184","...den Arbeitern.","... the workers.","","True","Wrk_224_GUIDE_WORKER_15_01","",""
"Scripts/Content/Story/Missions/DIA_WRK_224_Igaraz.d:185","Es ist mir ein Vergnügen.","It's a pleasure.","","True","Wrk_224_GUIDE_WORKER_02_02","",""
"Scripts/Content/Story/Missions/DIA_WRK_224_Igaraz.d:194","...den Heilern.","... the healers.","","True","Wrk_224_GUIDE_HEAL_15_01","",""
"Scripts/Content/Story/Missions/DIA_WRK_224_Igaraz.d:195","Natürlich, sehr gerne.","Of course, I'd love to.","","True","Wrk_224_GUIDE_HEAL_02_02","",""
"Scripts/Content/Story/Missions/DIA_WRK_224_Igaraz.d:204","...den Händlern.","... the merchants.","","True","Wrk_224_GUIDE_TRADE_15_01","",""
"Scripts/Content/Story/Missions/DIA_WRK_224_Igaraz.d:205","Eine meiner leichtesten Übungen.","One of my easiest exercises.","","True","Wrk_224_GUIDE_TRADE_02_02","",""
"Scripts/Content/Story/Missions/DIA_WRK_224_Igaraz.d:214","...der Arena.","... the arena.","","True","Wrk_224_GUIDE_ARENA_15_01","",""
"Scripts/Content/Story/Missions/DIA_WRK_224_Igaraz.d:215","Wenn's weiter nichts ist.","If that's all there is to it.","","True","Wrk_224_GUIDE_ARENA_02_02","",""
"Scripts/Content/Story/Missions/DIA_WRK_224_Igaraz.d:246","Hier ist das Viertel der Kranken. Niemand weiß was ihnen fehlt.","This is the sick quarter. Nobody knows what they're missing.","","True","Wrk_224_HEALER_02_01","",""
"Scripts/Content/Story/Missions/DIA_WRK_224_Igaraz.d:247","Sie leiden alle an einer seltenen Krankheit. Sogar Die Heiler sind ratlos.","They all suffer from a rare disease. Even the healers are clueless.","","True","Wrk_224_HEALER_02_02","",""
"Scripts/Content/Story/Missions/DIA_WRK_224_Igaraz.d:248","Ich gehe zurück zum Haupteingang.","I'm going back to the main entrance.","","True","Wrk_224_HEALER_02_03","",""
"Scripts/Content/Story/Missions/DIA_WRK_224_Igaraz.d:277","Hier sind die Arbeiter beschäftigt.","The workers are busy here.","","True","Wrk_224_WORKER_02_01","",""
"Scripts/Content/Story/Missions/DIA_WRK_224_Igaraz.d:278","Sie glauben, das sie es schaffen können, das Lager gegen die Orks zu verteidigen.","They believe they can manage to defend the camp against the orcs.","","True","Wrk_224_WORKER_02_02","",""
"Scripts/Content/Story/Missions/DIA_WRK_224_Igaraz.d:279","Der Baumeister ist Bormor, ein unglaublich brutaler Kerl, halte dich besser fern von ihm...","The master builder is Bormor, an incredibly brutal fellow. You'd better stay away from him ...","","True","Wrk_224_WORKER_02_03","",""
"Scripts/Content/Story/Missions/DIA_WRK_224_Igaraz.d:280","Wenn du mich wieder brauchst, ich bin am Haupteingang.","If you need me again, I'll be at the main entrance.","","True","Wrk_224_WORKER_02_04","",""
"Scripts/Content/Story/Missions/DIA_WRK_224_Igaraz.d:310","Die Arena ist der einzige Ort wo man ein wenig Abwechslung finden kann.","The arena is the only place where you can find a bit of variety.","","True","Wrk_224_ARENA_02_01","",""
"Scripts/Content/Story/Missions/DIA_WRK_224_Igaraz.d:311","Hier gibt es allabendlich gute  Kämpfe  zu sehen.","There's good fighting here every night.","","True","Wrk_224_ARENA_02_02","",""
"Scripts/Content/Story/Missions/DIA_WRK_224_Igaraz.d:312","Der beste Arenakämpfer ist übrigens eine fremde Schönheit namens Thora.","The best arena fighter, by the way, is a strange beauty called Thora.","","True","Wrk_224_ARENA_02_03","",""
"Scripts/Content/Story/Missions/DIA_WRK_224_Igaraz.d:313","Die Frau haut alle anderen Gladiatoren aus den Latschen (hihi)","The woman kicks all the other gladiators out of their lawns (hihi)","","True","Wrk_224_ARENA_02_04","",""
"Scripts/Content/Story/Missions/DIA_WRK_224_Igaraz.d:314","Wenn du mich wieder brauchst, ich bin am Haupteingang.","If you need me again, I'll be at the main entrance.","","True","Wrk_224_ARENA_02_05","",""
"Scripts/Content/Story/Missions/DIA_WRK_224_Igaraz.d:344","Hier sind wir bei den Händlern. Alle Händler arbeiten für Agon.","Here we are with the merchants. All the merchants work for Agon.","","True","Wrk_224_TRADER_02_01","",""
"Scripts/Content/Story/Missions/DIA_WRK_224_Igaraz.d:345","Ruga, der Rüstungsmacher, Gordian der Schreiber, Helvegor der Rüstungsmacher, sie alle beziehen ihre Waren von Agon.","Ruga the armormaker, Gordian the scribe, Helvegor the armormaker - they all get their goods from Agon.","","True","Wrk_224_TRADER_02_02","",""
"Scripts/Content/Story/Missions/DIA_WRK_224_Igaraz.d:346","Und dafür zahlen sie hohe Preise.","And they pay a high price for it.","","True","Wrk_224_TRADER_02_03","",""
"Scripts/Content/Story/Missions/DIA_WRK_224_Igaraz.d:347","Wenn du mich wieder brauchst, ich bin am Haupteingang.","If you need me again, I'll be at the main entrance.","","True","Wrk_224_TRADER_02_04","",""
"Scripts/Content/Story/Missions/DIA_WRK_224_Igaraz.d:362","Was gibt's in der Burg? ","What's in the castle?","","True","Wrk_224_Igaraz_CASTLE.description","",""
"Scripts/Content/Story/Missions/DIA_WRK_224_Igaraz.d:378","Was gibt's in der Burg?","What's in the castle?","","True","Wrk_224_CASTLE_15_01","",""
"Scripts/Content/Story/Missions/DIA_WRK_224_Igaraz.d:379","Zum einen das Haus der Erzbarone.","First, the house of the Ore Barons.","","True","Wrk_224_CASTLE_02_02","",""
"Scripts/Content/Story/Missions/DIA_WRK_224_Igaraz.d:380","Als hier noch eine Kolonie der Gefangenen war, saßen dort die Männer die den Erzabbau und das Lager kontrollierten.","When there was still a colony of prisoners here, the men who controlled the ore mine and the camp sat there.","","True","Wrk_224_CASTLE_02_03","",""
"Scripts/Content/Story/Missions/DIA_WRK_224_Igaraz.d:381","Jetzt hat sich Diego dort niedergelassen.","Now Diego has settled down there.","","True","Wrk_224_CASTLE_02_04","",""
"Scripts/Content/Story/Missions/DIA_WRK_224_Igaraz.d:382","Ansonsten hat sich die Miliz in der Burg breitgemacht. Sie schlafen dort, haben eine eigene Schmiede und Küche.","Besides, the militia has spread out in the castle. They sleep there, have their own smithy and kitchen.","","True","Wrk_224_CASTLE_02_05","",""
"Scripts/Content/Story/Missions/DIA_WRK_224_Igaraz.d:383","Und dann gibt es noch das Haus der Magier. Die Magier sind alle dort gestorben . Und ich kenne die Wahrheit darüber...","And then there's the house of the magicians. The magicians all died there. And I know the truth about that ...","","True","Wrk_224_CASTLE_02_06","",""
"Scripts/Content/Story/Missions/DIA_WRK_224_Igaraz.d:395","Erzähl mir über die Feuermagier","Tell me about the Fire Magicians.","","True","Wrk_224_Igaraz_MAGE.description","",""
"Scripts/Content/Story/Missions/DIA_WRK_224_Igaraz.d:410","Erzähl mir über die Feuermagier.","Tell me about the Fire Magicians.","","True","Wrk_224_MAGE_15_01","",""
"Scripts/Content/Story/Missions/DIA_WRK_224_Igaraz.d:411","Die Feuermagier haben einst eine magische Barriere um das gesamte Tal errichtet, damit die Minenarbeiter nicht fliehen konnten.","The Fire Mages once erected a magic barrier around the entire valley so that the miners couldn't escape.","","True","Wrk_224_MAGE_02_02","",""
"Scripts/Content/Story/Missions/DIA_WRK_224_Igaraz.d:412","Sie unterstanden Gomez, dem stärksten Kämpfer und mächtigsten Mann innerhalb der Barriere.","They stood up to Gomez, the strongest fighter and most powerful man within the Barrier.","","True","Wrk_224_MAGE_02_03","",""
"Scripts/Content/Story/Missions/DIA_WRK_224_Igaraz.d:413","Gomez forschte nach einem Weg, die Barriere zu sprengen, denn er wollte seine Freiheit zurück.","Gomez was looking for a way to blow up the Barrier, because he wanted his freedom back.","","True","Wrk_224_MAGE_02_04","",""
"Scripts/Content/Story/Missions/DIA_WRK_224_Igaraz.d:414","Aber die Feuermagier waren dagegen. Deshalb erließ Gomez den Befehl, sie alle... umzubringen.","But the Magicians of Fire were against it. That's why Gomez gave the order to kill them all...","","True","Wrk_224_MAGE_02_05","",""
"Scripts/Content/Story/Missions/DIA_WRK_224_Igaraz.d:415","Seine Handlanger warteten also bis die Magier schliefen und erschlugen sie.","So his henchmen waited until the magicians fell asleep and killed them.","","True","Wrk_224_MAGE_02_06","",""
"Scripts/Content/Story/Missions/DIA_WRK_224_Igaraz.d:416","Schließlich wurde die Barriere gesprengt, doch an diesem Tag sind alle, die an der Ermordung der Magier beteiligt waren, gestorben.","Finally the Barrier was blown up, but on that day all those involved in the murder of the magicians died.","","True","Wrk_224_MAGE_02_07","",""
"Scripts/Content/Story/Missions/DIA_WRK_224_Igaraz.d:417","Nur Gomez selber, wurde seit diesem Tag nie wieder gesehen.","Only Gomez himself has not been seen since.","","True","Wrk_224_MAGE_02_08","",""
"Scripts/Content/Story/Missions/DIA_WRK_225_Agon.d:48","Willkommen. Ich bin Agon. DER Agon. Was auch immer du suchst, ich kann es dir besorgen.","Welcome. I'm Agon. THAT Agon. Whatever you're looking for, I can get it for you.","","True","WRK_225_WELCOME_00_01","",""
"Scripts/Content/Story/Missions/DIA_WRK_225_Agon.d:120","Zeig mir deine Ware","Show me your goods.","","True","WRK_225_Agon_TRADE.description","",""
"Scripts/Content/Story/Missions/DIA_WRK_225_Agon.d:130","Zeig mir deine Ware.","Show me your goods.","","True","WRK_225_TRADE_15_01","",""
"Scripts/Content/Story/Missions/DIA_WRK_225_Agon.d:142","Du wurdest bestohlen?","You were robbed?","","True","WRK_225_Agon_STOLEN.description","",""
"Scripts/Content/Story/Missions/DIA_WRK_225_Agon.d:157","Du wurdest bestohlen?","You were robbed?","","True","WRK_225_STOLEN_15_01","",""
"Scripts/Content/Story/Missions/DIA_WRK_225_Agon.d:158","Ja das richtig. Aber was hast du damit zu tun?","Yes, that's right. But what's that got to do with you?","","True","WRK_225_STOLEN_00_02","",""
"Scripts/Content/Story/Missions/DIA_WRK_225_Agon.d:159","Cassian schickt mich. Ich bin der, der deine Sachen zurückholt","Cassian sent me. I'm the one who's got your stuff back.","","True","WRK_225_STOLEN_15_03","",""
"Scripts/Content/Story/Missions/DIA_WRK_225_Agon.d:160","Das wurde ja auch Zeit, das sich endlich mal jemand der Sache annimmt.","It was high time someone finally took over the business.","","True","WRK_225_STOLEN_00_04","",""
"Scripts/Content/Story/Missions/DIA_WRK_225_Agon.d:161","Es war Huldrych! Er hat mich bestohlen! Mich! Ich habe ihn gesehen! Mit meinen eigenen Augen!","It was Huldrych! He stole from me! Me! I saw him! With my own eyes!","","True","WRK_225_STOLEN_00_05","",""
"Scripts/Content/Story/Missions/DIA_WRK_225_Agon.d:173","Was ist dir gestohlen worden?","What did they steal from you?","","True","WRK_225_Agon_WAREZ.description","",""
"Scripts/Content/Story/Missions/DIA_WRK_225_Agon.d:188","Was ist dir gestohlen worden?","What did they steal from you?","","True","WRK_225_WAREZ_15_01","",""
"Scripts/Content/Story/Missions/DIA_WRK_225_Agon.d:189","Mein Silber! Mein gesamtes Silber hat er gestohlen!","My silver! He stole all my silver!","","True","WRK_225_WAREZ_00_02","",""
"Scripts/Content/Story/Missions/DIA_WRK_225_Agon.d:190","Und wieviel Silber war das so?","And how much silver was that?","","True","WRK_225_WAREZ_15_03","",""
"Scripts/Content/Story/Missions/DIA_WRK_225_Agon.d:191","100 Silberstücke! Jeden Taler habe ich mir mühsam zusammengespart! Dieser dreckige Langfinger muss bestraft werden!","100 pieces of silver! I've worked hard to save every single valley! That filthy longfinger must be punished!","","True","WRK_225_WAREZ_00_04","",""
"Scripts/Content/Story/Missions/DIA_WRK_225_Agon.d:192","Diese Herumtreiber machen was sie wollen. Und wir, die EHRLICHEN Händler, die SCHUFTEN und ARBEITEN, wir sind die Opfer.","These scoundrels do what they like. And we, the HONEST traders, who SHOULD and WORK, are the victims.","","True","WRK_225_WAREZ_00_05","",""
"Scripts/Content/Story/Missions/DIA_WRK_225_Agon.d:193","Jaja, schon gut. 100 Silberstücke. Alles klar. Ich nehme mir diesen Huldrych mal vor.","Yeah, all right. 100 pieces of silver. All right. I'll take this huldrych.","","True","WRK_225_WAREZ_15_06","",""
"Scripts/Content/Story/Missions/DIA_WRK_225_Agon.d:207","Wieviel Silber hat er dir gestohlen?","How much silver did he steal from you?","","True","WRK_225_Agon_AGAINSILVER.description","",""
"Scripts/Content/Story/Missions/DIA_WRK_225_Agon.d:224","Wieviel Silber hat er dir gestohlen?","How much silver did he steal from you?","","True","WRK_225_AGAINSILVER_15_01","",""
"Scripts/Content/Story/Missions/DIA_WRK_225_Agon.d:225","1 0 0.  Einhundert! Kannst du dir nicht mal eine einfache Zahl merken?","10 0. One hundred! Can't you even remember a simple number?","","True","WRK_225_AGAINSILVER_00_02","",""
"Scripts/Content/Story/Missions/DIA_WRK_225_Agon.d:226","Oh Mann! Da haben wir es. Keiner nimmt uns Händler ernst! Sie schicken mir den letzten Deppen!","Oh man! There we are. Nobody takes us merchants seriously! They're sending me the last of the morons!","","True","WRK_225_AGAINSILVER_00_03","",""
"Scripts/Content/Story/Missions/DIA_WRK_225_Agon.d:227","Huldrych war sein Name. Hattest du das etwa auch vergessen ??","Huldrych was his name. Did you forget that, too?","","True","WRK_225_AGAINSILVER_00_04","",""
"Scripts/Content/Story/Missions/DIA_WRK_225_Agon.d:231","Bleib ruhig, oder du kannst dir dein Silber selber holen!","Calm down, or you can get your own silver!","","True","WRK_225_Agon_AGAINSILVER_Info.WRK_225_Agon_AGAINSILVER.WRK_225_Agon_AGAINSILVER_SILVER","AI_AddChoice",""
"Scripts/Content/Story/Missions/DIA_WRK_225_Agon.d:232","Schon gut. Reg dich nicht auf!","All right. Don't get too nervous!","","True","WRK_225_Agon_AGAINSILVER_Info.WRK_225_Agon_AGAINSILVER.WRK_225_Agon_AGAINSILVER_CALMDOWN","AI_AddChoice",""
"Scripts/Content/Story/Missions/DIA_WRK_225_Agon.d:233","Ich geh mal zu Huldrych","I'm going to see Huldrych.","","True","WRK_225_Agon_AGAINSILVER_Info.WRK_225_Agon_AGAINSILVER.WRK_225_Agon_AGAINSILVER_HULDRYCH","AI_AddChoice",""
"Scripts/Content/Story/Missions/DIA_WRK_225_Agon.d:234","Tatsächlich, sein Name war mir entfallen","Indeed, I had forgotten his name.","","True","WRK_225_Agon_AGAINSILVER_Info.WRK_225_Agon_AGAINSILVER.WRK_225_Agon_AGAINSILVER_NAME","AI_AddChoice",""
"Scripts/Content/Story/Missions/DIA_WRK_225_Agon.d:239","Tatsächlich, sein Name war mir entfallen.","Indeed, I had forgotten his name.","","True","WRK_225_AGAINSILVER_NAME_15_01","",""
"Scripts/Content/Story/Missions/DIA_WRK_225_Agon.d:240","Unglaublich! Warum hat Cassian mir nicht direkt einen von den Kranken geschickt?","Incredible! Why didn't Cassian send me one of the sick people right away?","","True","WRK_225_AGAINSILVER_NAME_00_02","",""
"Scripts/Content/Story/Missions/DIA_WRK_225_Agon.d:241","Jeder Scavenger hat mehr Verstand im Kopf als du!","Any scavenger has more sense in his head than you do!","","True","WRK_225_AGAINSILVER_NAME_00_03","",""
"Scripts/Content/Story/Missions/DIA_WRK_225_Agon.d:244","Bleib ruhig, oder du kannst dir dein Silber selber holen!","Calm down, or you can get your own silver!","","True","WRK_225_Agon_AGAINSILVER_NAME.WRK_225_Agon_AGAINSILVER.WRK_225_Agon_AGAINSILVER_SILVER","AI_AddChoice",""
"Scripts/Content/Story/Missions/DIA_WRK_225_Agon.d:245","Schon gut. Reg dich nicht auf!","All right. Don't get too nervous!","","True","WRK_225_Agon_AGAINSILVER_NAME.WRK_225_Agon_AGAINSILVER.WRK_225_Agon_AGAINSILVER_CALMDOWN","AI_AddChoice",""
"Scripts/Content/Story/Missions/DIA_WRK_225_Agon.d:246","Ich geh mal zu Huldrych","I'm going to see Huldrych.","","True","WRK_225_Agon_AGAINSILVER_NAME.WRK_225_Agon_AGAINSILVER.WRK_225_Agon_AGAINSILVER_HULDRYCH","AI_AddChoice",""
"Scripts/Content/Story/Missions/DIA_WRK_225_Agon.d:251","Bleib ruhig, oder du kannst dir dein Silber selber holen!","Calm down, or you can get your own silver!","","True","WRK_225_AGAINSILVER_SILVER_15_01","",""
"Scripts/Content/Story/Missions/DIA_WRK_225_Agon.d:252","Das wird ja immer besser! Jetzt willst du mir drohen? Das ist ja wohl das letzte!","It's getting better and better! Now you're threatening me? This must be the last time!","","True","WRK_225_AGAINSILVER_SILVER_00_02","",""
"Scripts/Content/Story/Missions/DIA_WRK_225_Agon.d:253","Ich glaube ich rede mal ein paar Takte mit Cassian!","I think I'll talk to Cassian for a while!","","True","WRK_225_AGAINSILVER_SILVER_00_03","",""
"Scripts/Content/Story/Missions/DIA_WRK_225_Agon.d:256","Schon gut. Reg dich nicht auf!","All right. Don't get too nervous!","","True","WRK_225_Agon_AGAINSILVER_SILVER.WRK_225_Agon_AGAINSILVER.WRK_225_Agon_AGAINSILVER_CALMDOWN","AI_AddChoice",""
"Scripts/Content/Story/Missions/DIA_WRK_225_Agon.d:257","Ich geh mal zu Huldrych","I'm going to see Huldrych.","","True","WRK_225_Agon_AGAINSILVER_SILVER.WRK_225_Agon_AGAINSILVER.WRK_225_Agon_AGAINSILVER_HULDRYCH","AI_AddChoice",""
"Scripts/Content/Story/Missions/DIA_WRK_225_Agon.d:262","Ich geh mal zu Huldrych","I'm going to see Huldrych.","","True","WRK_225_AGAINSILVER_HULDRYCH_15_01","",""
"Scripts/Content/Story/Missions/DIA_WRK_225_Agon.d:263","Ja mach das. Bevor du das auch wieder vergisst! HAHAHA","Yes, do that. Before you forget it again! HAHAHA","","True","WRK_225_AGAINSILVER_HULDRYCH_00_02","",""
"Scripts/Content/Story/Missions/DIA_WRK_225_Agon.d:270","Schon gut. Reg dich nicht auf!","All right. Don't get too nervous!","","True","WRK_225_AGAINSILVER_CALMDOWN_15_01","",""
"Scripts/Content/Story/Missions/DIA_WRK_225_Agon.d:271","Beschwichtige mich nicht, als wäre ich ein altes Waschweib!","Don't make me quiet like I'm an old whore!","","True","WRK_225_AGAINSILVER_CALMDOWN_00_02","",""
"Scripts/Content/Story/Missions/DIA_WRK_225_Agon.d:272","Sieh lieber zu das ich mein Silber wiederbekomme! Was stehst du hier noch rum? Hast du vergessen wie man geht?","You'd better see to it that I get my silver back! Why are you still standing around here? Have you forgotten how to go about it?","","True","WRK_225_AGAINSILVER_CALMDOWN_00_03","",""
"Scripts/Content/Story/Missions/DIA_WRK_225_Agon.d:275","Bleib ruhig, oder du kannst dir dein Silber selber holen!","Calm down, or you can get your own silver!","","True","WRK_225_Agon_AGAINSILVER_CALMDOWN.WRK_225_Agon_AGAINSILVER.WRK_225_Agon_AGAINSILVER_SILVER","AI_AddChoice",""
"Scripts/Content/Story/Missions/DIA_WRK_225_Agon.d:276","Ich geh mal zu Huldrych","I'm going to see Huldrych.","","True","WRK_225_Agon_AGAINSILVER_CALMDOWN.WRK_225_Agon_AGAINSILVER.WRK_225_Agon_AGAINSILVER_HULDRYCH","AI_AddChoice",""
"Scripts/Content/Story/Missions/DIA_WRK_225_Agon.d:289","Weißt du, wo ich Huldrych finden kann?","Do you know where I can find Huldrych?","","True","WRK_225_Agon_WHERE.description","",""
"Scripts/Content/Story/Missions/DIA_WRK_225_Agon.d:306","Weißt du, wo ich Huldrych finden kann?","Do you know where I can find Huldrych?","","True","WRK_225_WHERE_15_01","",""
"Scripts/Content/Story/Missions/DIA_WRK_225_Agon.d:307","Ich glaube, er treibt sich irgendwo am hinteren Tor rum!","I think he's wandering around the back gate somewhere!","","True","WRK_225_WHERE_00_02","",""
"Scripts/Content/Story/Missions/DIA_WRK_225_Agon.d:319","Hier sind deine 100 Silberstücke","Here's your 100 pieces of silver.","","True","WRK_225_Agon_100.description","",""
"Scripts/Content/Story/Missions/DIA_WRK_225_Agon.d:337","Hier sind deine 100 Silberstücke.","Here's your 100 pieces of silver.","","True","WRK_225_100_15_01","",""
"Scripts/Content/Story/Missions/DIA_WRK_225_Agon.d:339","Ausgezeichnet. Vielen Dank. Ich hoffe das Huldrych das bekommen hat, was er verdient. Na, ist nicht wichtig, Hauptsache ich habe mein Geld wieder!","Excellent. Thank you very much. I hope Huldrych got what he deserved. Well, it doesn't matter, as long as I have my money back!","","True","WRK_225_100_00_02","",""
"Scripts/Content/Story/Missions/DIA_WRK_225_Agon.d:345","Ach und übrigens, entschuldige meine Aufgebrachtheit vorhin, aber ich war etwas in Rage.","Oh, and by the way, forgive my annoyance earlier, but I was a little angry.","","True","WRK_225_100_00_03","",""
"Scripts/Content/Story/Missions/DIA_WRK_225_Agon.d:348","Wenn du mal wieder irgendwas brauchst, dann komme zu mir. Ich habe die günstigsten Angebote und die besten Waren!","If you ever need anything again, come to me. I have the cheapest offers and the best goods!","","True","WRK_225_100_00_04","",""
"Scripts/Content/Story/Missions/DIA_WRK_225_Agon.d:370","Ich habe gehört, du bist im Besitz einer bestimmten Rezeptur!","I've heard that you have a certain recipe!","","True","WRK_225_Agon_HAVERECIPE.description","",""
"Scripts/Content/Story/Missions/DIA_WRK_225_Agon.d:385","Ich habe gehört, du bist im Besitz einer bestimmten Rezeptur!","I've heard that you have a certain recipe!","","True","WRK_225_HAVERECIPE_15_01","",""
"Scripts/Content/Story/Missions/DIA_WRK_225_Agon.d:386","Ich habe vieles, nach was für einer Rezeptur suchst du?","I've got a lot. What kind of recipe are you looking for?","","True","WRK_225_HAVERECIPE_09_02","",""
"Scripts/Content/Story/Missions/DIA_WRK_225_Agon.d:387","Lester verkaufte dir vor einiger Zeit eine Rezeptur für ein Mittel gegen Wahnsinn.","Lester sold you a recipe for a cure for madness some time ago.","","True","WRK_225_HAVERECIPE_15_03","",""
"Scripts/Content/Story/Missions/DIA_WRK_225_Agon.d:388","Ahhh... du willst diese Rezeptur wohl haben was? Das wird dich eine Kleinigkeit kosten.","Ahhh... you want this recipe, don't you? It'll cost you a bit.","","True","WRK_225_HAVERECIPE_09_04","",""
"Scripts/Content/Story/Missions/DIA_WRK_225_Agon.d:389","Sagen wir 500 Silber!","Let's say 500 pieces of silver!","","True","WRK_225_HAVERECIPE_09_05","",""
"Scripts/Content/Story/Missions/DIA_WRK_225_Agon.d:392","Wer trägt schon soviel Silber mit sich herum?","Who carries so much silver around?","","True","WRK_225_Agon_HAVERECIPE_Info.WRK_225_Agon_HAVERECIPE.WRK_225_Agon_HAVERECIPE_NOTNOW","AI_AddChoice",""
"Scripts/Content/Story/Missions/DIA_WRK_225_Agon.d:393","Hier ist das Silber.","Here's the silver.","","True","WRK_225_Agon_HAVERECIPE_Info.WRK_225_Agon_HAVERECIPE.WRK_225_Agon_HAVERECIPE_GIVE","AI_AddChoice",""
"Scripts/Content/Story/Missions/DIA_WRK_225_Agon.d:394","Das ist Wucher. Diese Rezeptur ist niemals soviel Wert!","That's a good one. This recipe is never worth so much!","","True","WRK_225_Agon_HAVERECIPE_Info.WRK_225_Agon_HAVERECIPE.WRK_225_Agon_HAVERECIPE_PROFITEERING","AI_AddChoice",""
"Scripts/Content/Story/Missions/DIA_WRK_225_Agon.d:402","Das ist Wucher. Diese Rezeptur ist niemals soviel Wert!","That's a good one. This recipe is never worth so much!","","True","WRK_225_HAVERECIPE_PROFITEERING_15_01","",""
