"location","source","target","id","fuzzy","context","translator_comments","developer_comments"
"Scripts/Content/Story/Missions/DIA_HLR_503_Odo.d:71","Wie geht es euren Kranken?","How are the sick doing?","","False","HLR_503_Odo_HOWDY.description","",""
"Scripts/Content/Story/Missions/DIA_HLR_503_Odo.d:86","Wie geht es euren Kranken?","How are the sick doing?","","False","HLR_503_HOWDY_15_01","",""
"Scripts/Content/Story/Missions/DIA_HLR_503_Odo.d:87","Ständig muss man auf diese Irren aufpassen.","You always have to watch out for those crazy people.","","False","HLR_503_HOWDY_08_02","",""
"Scripts/Content/Story/Missions/DIA_HLR_503_Odo.d:88","Das ist mehr Herausforderung als jeder Arenakampf.","That's a bigger challenge than a fight in the arena.","","False","HLR_503_HOWDY_08_03","",""
"Scripts/Content/Story/Missions/DIA_HLR_503_Odo.d:117","Völlig Irre, was? Paß auf, daß er dich nicht beißt!","Truly crazy, right? Make sure you won't get bitten!","","False","Info_Odo_DONTBOTHER_00_01","",""
"Scripts/Content/Story/Missions/DIA_HLR_503_Odo.d:129","Bartok muß einen Schlüssel bei sich gehabt haben.","Bartok must have had a key on him.","","False","Info_Odo_KEY.description","",""
"Scripts/Content/Story/Missions/DIA_HLR_503_Odo.d:144","Bartok muß einen Schlüssel bei sich gehabt haben.","Bartok must have had a key on him.","","False","Info_Odo_KEY_15_01","",""
"Scripts/Content/Story/Missions/DIA_HLR_503_Odo.d:145","Ich hab heute meinen großzügigen Tag. Hier hast du ihn.","I'm feeling generous today. Here it is.","","False","Info_Odo_KEY_00_02","",""
"Scripts/Content/Story/Missions/DIA_HLR_503_Odo.d:147","Bartok wird keine Verwendung mehr dafür haben.","Bartok won't need it anymore.","","False","Info_Odo_KEY_00_03","",""
"Scripts/Content/Story/Missions/DIA_HLR_504_Otmar.d:33","Was ist deine Aufgabe hier?","What is your role here?","","False","HLR_504_Otmar_JOB.description","",""
"Scripts/Content/Story/Missions/DIA_HLR_504_Otmar.d:43","Was ist deine Aufgabe hier?","What is your role here?","","False","HLR_504_JOB_15_01","",""
"Scripts/Content/Story/Missions/DIA_HLR_504_Otmar.d:44","Ich sorge dafür, daß die Bekloppten ruhig bleiben.","I make sure the mad ones won't get too mad.","","False","HLR_504_JOB_00_02","",""
"Scripts/Content/Story/Missions/DIA_HLR_504_Otmar.d:56","Wie bekommt man sie ruhig?","How do you keep them calm?","","False","HLR_504_Otmar_CALM.description","",""
"Scripts/Content/Story/Missions/DIA_HLR_504_Otmar.d:71","Wie bekommt man sie ruhig?","How do you keep them calm?","","False","HLR_504_CALM_15_01","",""
"Scripts/Content/Story/Missions/DIA_HLR_504_Otmar.d:72","Die Heiler haben schon alles mögliche ausprobiert, ohne Erfolg. Jetzt geben wir ihnen Sumpfkraut. Das beruhigt sie.","The healers have tried everything already, but without success. Now we give them swampweed, that keeps them calm.","","False","HLR_504_CALM_00_02","",""
"Scripts/Content/Story/Missions/DIA_HLR_504_Otmar.d:73","Macht mir auch die Arbeit leichter. Das Sumpfkraut ist wirklich gut Mann, wirklich gut!","It also makes my work a bit easier. The swampweed is really good, man, really good!","","False","HLR_504_CALM_00_03","",""
"Scripts/Content/Story/Missions/DIA_HLR_504_Otmar.d:86","Kann man mit den Kranken reden?","Is it possible to talk to the sick?","","False","HLR_504_Otmar_HOWCALM.description","",""
"Scripts/Content/Story/Missions/DIA_HLR_504_Otmar.d:101","Kann man mit den Kranken reden?","Is it possible to talk to the sick?","","False","HLR_504_HOWCALM_15_01","",""
"Scripts/Content/Story/Missions/DIA_HLR_504_Otmar.d:102","Wozu? Die reden nur wirres Zeug. Arme Irre.","Why? They only talk nonsense. Poor fools.","","False","HLR_504_HOWCALM_00_02","",""
