"location","source","target","id","fuzzy","context","translator_comments","developer_comments"
"Scripts/Content/Story/Log_Constants.d:14","Wissen der Tierverwertung","Exploitation of the Prey","","True","GE_AnimalTrophies","",""
"Scripts/Content/Story/Log_Constants.d:15","Wissen vom Waffenschmieden","Knowledge of weapons smithy","","True","GE_SmithWeapons","",""
"Scripts/Content/Story/Log_Constants.d:16","KURZSCHWERT: Eine kurze Klinge eine Elle lang und doppelschneidig. Die Parierstange ist kurz und rundlich. Die Waffe selbst ist bei Dieben und Mördern sehr beliebt, da sie leicht zu verbergen ist und auch im dichtesten Handgemenge nicht behindert.","SHORT: A short blade one elbow long and double-edged. The barrel is short and round. The weapon itself is very popular with thieves and murderers, as it is easy to hide and not hindered even in the densest handshake.","","True","GE_SmithWeapons_1","",""
"Scripts/Content/Story/Log_Constants.d:17","LANGSCHWERT: Die ideale Waffe für die Verteidigung des Heims ebenso wie für den fahrenden Wanderer. Die drei Fuß messende, doppelschneidige Klinge wird mit einem Quereisen als Parierstange sowie einem Lederumwickelten Griff abgesetzt. Mit wenig Kraft zu schwingen, kann diese Waffe doch heftige Wunden in Mensch wie Tier reissen.","LONG SWEED: The ideal weapon for the defense of the home as well as for the traveling wanderer. The three-foot measuring double-edged blade is cut with a cross-iron for a pair of bars and a leather-wrapped handle. With little swinging power, this weapon can cut off severe wounds in humans and animals.","","True","GE_SmithWeapons_2","",""
"Scripts/Content/Story/Log_Constants.d:18","BREITSCHWERT: Drei Fuß messender Stahl, dessen gewaltige Wucht von der breiten doppelschneidigen Klinge herrührt. Dies ist die Waffe von Kriegern und Söldnern und nichts für Anfänger. Die ein Fuß messende Parierstange kann auch die stärksten Attacken abwehren und der Griff aus kreuzweise umwundenen Draht gibt der Hand, die diese schwere Waffe in den Kampf führt, optimalen Halt.","BREEDSWORD: Three-foot-long steel with a heavy weight derived from the wide double-edged blade. This is the weapon of warriors and mercenaries, not for beginners. The one-foot-long barrel can withstand even the strongest attacks, and the handle of a cross-circled wire gives the hand that guides this heavy weapon into battle the optimal grip.","","True","GE_SmithWeapons_3","",""
"Scripts/Content/Story/Log_Constants.d:19","BASTARDSCHWERT: Wer diese vier Fuß lange, gewaltige Klinge einhändig in den Kampf führen kann, gehört zur Elite unter den Schwertkämpfern. Die Verbindung von Klinge, Parierstange und Griff muß besonders robust ausgeführt werden, um die Wucht der Schläge auch dauerhaft unbeschadet zu überstehen.","BASTARD SWEED: If you can wield this four-foot-long, mighty blade with one hand, you're one of the elite swordsmen. The combination of blade, pairbar and grip must be particularly robust in order to withstand the force of the blows without suffering any permanent damage.","","True","GE_SmithWeapons_4","",""
"Scripts/Content/Story/Log_Constants.d:20","ZWEIHÄNDER: Dies ist die Köngisklasse unter den Schwertern. die fast fünf Fuß messende, zweischneidige Klinge muß auch von den stärksten Kriegern beidhändig geführt werden. Trifft sie dann aber ihr Ziel, so läßt sie meist nur den Tod zurück. Während das obere Ende der Klinge mit herausgeschliffenen Wellen versehen ist, um mehr Schaden anzurichten, so wurde das  Ende vor der Parierstange mit wehrhaften Stacheln versehen, um auch im Handgemenge den Gegner verletzen zu können.","TWO-HANDED: This is the king class of swords. The two-handed blade measuring almost five feet must be wielded with two-handed hands even by the strongest warriors. But when it hits its target, it usually leaves nothing but death behind. While the upper end of the blade is provided with sharpened waves to cause more damage, the end in front of the barrel was provided with defensive stings to be able to injure the opponent in the hand.","","True","GE_SmithWeapons_5","",""
"Scripts/Content/Story/Log_Constants.d:21","KRUSH VARROK: Diese Orkwaffe ein Schwert zu nennen wäre Ketzerei. Es ist ein Vernichter. Diese fünf Fuß lange, axtförmig gebogene Schwertklinge, wird an einer Griffstange geführt, die hinter der Schneide auf fast der gesamten Waffenlänge verläuft. Dieses Schwert muß aus dem seltenen Bluterz gefertig werden und ist zwar die leichteste Orkwaffe, aber dennoch tödlicher, als jede von Menschen hergestellte Klinge.","KRUSH VARROK: To call this Orc weapon a sword would be heresy. It is a destroyer. This five-foot long, axe-shaped sword blade is driven by a handlebar which runs behind the cutting for almost the entire length of the weapon. This sword must be made from the rare blood and is the lightest Orc weapon, but still more deadly than any blade made by humans.","","True","GE_SmithWeapons_6","",""
"Scripts/Content/Story/Log_Constants.d:22","BEIL: Ein kleines Axtblatt und ein anderthalb Fuß messender Schaft bilden das ideale Werkzeug des Waldläufers. Ob Brennholz geschlagen oder die kleineren Raubtiere des Waldes abgewehrt werden sollen, das Beil ist ein zuverlässiger Begleiter.","A BACK: A small axe blade and a one-and-a-half-foot broom shaft are the ideal tools for a forestbeast. Whether it's for cutting wood or defending the smaller predators of the forest, the beak is a reliable companion.","","True","GE_SmithWeapons_7","",""
"Scripts/Content/Story/Log_Constants.d:23","STREITAXT: Die Waffe für den ungestümen Krieger. Das wuchtige Axtblatt kann von starken Kämpfern noch einhändig geführt werden und so sowohl Mensch wie auch Tier schmerzhafte Wunden zufügen.","STREITAXT: The weapon for the unruly warrior. The mighty axe blade can be wielded by strong fighters with one hand, causing painful wounds to both humans and animals.","","True","GE_SmithWeapons_8","",""
"Scripts/Content/Story/Log_Constants.d:24","DOPPELBLATT-AXT: Der zwei Fuß durchmessende, zweischneidige  Axtkopf sitzt auf einem mit Metallringen verstärktem extralangen Schaft der es erlaubt, diese verherende Waffe mit beiden Händen zu führen. Falls der Kämpfer über ausreichend Kraft verfügt, so kann er mit diesem Werkzeug der Zerstörung nicht nur Bäume fällen... .","DOPPELBLATT-AXT: The two-foot-wide, two-edged axehead is mounted on an extraneous shaft reinforced with metal rings which allows the weapon to be carried with both hands. If the warrior has enough strength, he can use this tool to cut down more than just trees ...","","True","GE_SmithWeapons_9","",""
"Scripts/Content/Story/Log_Constants.d:25","BERSERKERAXT: Noch größer und wuchtiger als die Doppelblättrige Axt ist diese Waffe schon kaum mehr als Axt zu bezeichnen. Ein einzelner Krieger kann mit diesem Monster aus Stahl Breschen in ganze Infantrieformationen schlagen. Sollte bei keinem Feldzug fehlen!","BERSERKERAXT: Even bigger and more powerful than the double-blade axe, this weapon is hardly more than an axe. A single warrior can use it to smash steel cracks into entire infantry formations. Shouldn't be missing in any campaign!","","True","GE_SmithWeapons_10","",""
"Scripts/Content/Story/Log_Constants.d:26","KRUSH BROKDAR: Endlich ist klar, wie die Orks ihre menschlichen Wiedersacher in derart vernichtenden Schlachten immer wieder in die Flucht schlagen konnten. Nur aus dem seltenen Bluterz herzustellen ist diese orkische Axt der Gipfel der Vernichtung. Sie kann nur von den allerstärksten Menschen geführt werden kann, mäht aber Gegner nieder wie die Sense das Gras. Eine hässliche Waffe, die hässliche Wunden schlägt.","KRUSH BROKDAR: It is finally clear how the orcs managed to beat their human reptiles in such devastating battles. This orcish axe is the pinnacle of destruction, made only of the rare blood. It can only be led by the most powerful humans, but it can cut down opponents like the sense grass. An ugly weapon that can strike ugly wounds.","","True","GE_SmithWeapons_11","",""
"Scripts/Content/Story/Log_Constants.d:27","EISENKEULE: Ein eiserner Schaft, der an seinem Ende etwas verdickt ist, um mehr Wucht hinter den Schlag zu setzen. Diese metallene Variante des Holzknüppels ist die ideale Ergänzung für eine Kneipenschlägerei und das blose Tragen eines solchen Gegenstandes vermeidet oft unangenehme nächtliche Begegnungen.","ICE COOL: A steel shaft that is slightly thicker at the end to give more force behind the blow. This metallic version of the wooden knob is the ideal complement for a bar fight, and wearing such an object will often prevent unpleasant nighttime encounters.","","True","GE_SmithWeapons_12","",""
"Scripts/Content/Story/Log_Constants.d:28","STREITKOLBEN: Auf einem metallenen Waffenstumpf sitzt ein etwa kindskopfgroßes Gebilde aus pilzartig angeordneten Eisenlamellen. Diese wehrhafte Waffe ist schnell und besitzt doch ausreichend Wucht, um auch schwere Rüstungen ordentlich zu verbeulen. Sehr beliebt bei religiösen Fanatikern und als Zweitwaffe auch bei königlichen Paladinen stark im Kommen.","POWER COOLS: A structure made of iron blades arranged like mushrooms, about the size of a child's head, is mounted on a metal stump of weapons. This defensive weapon is fast and yet powerful enough to wield even heavy armor. It is very popular with religious fanatics and as a secondary weapon with royal paladins.","","True","GE_SmithWeapons_13","",""
"Scripts/Content/Story/Log_Constants.d:29","MORGENSTERN: Dies ist die unhöfliche Variante des Streitkolbens. Ein massiver, mit hässlichen Dornen gespickter Eisenkopf sitzt auf einem verstärkten Schaft. Diese Waffe ist nicht nur bei Rittern weithin gefürchtet, sondern kann auch gut geschützte Monsterpanzer mit Leichtigkeit knacken.","Morning Star: This is the rude version of the fighting spark. A massive iron head with ugly thorns sits on a reinforced shaft. This weapon is not only feared by knights, but can also easily crack well-protected monster armor.","","True","GE_SmithWeapons_14","",""
"Scripts/Content/Story/Log_Constants.d:30","KRIEGSHAMMER: Was aus einem glühenden Stück Eisen ein Schwertklinge formen kann, zermalmt auch den härtesten Gegner. Der große Bruder des Schmiedehammers muß allerdings beidhändig geführt werden, wiegt doch alleine der massive Hammerkopf mehr als ein ganzer Kochkessel. Die größte Genugtung bereitet aber immer noch das Zerbersten der Steingolems, die das Unglück haben, mit diesem Erdbeben von Waffe Bekanntschaft zu machen.","WARMAMBER: What a blade of iron can form from a blade of iron will crush even the toughest opponent. But the big brother of the smith must be led with two hands, the massive hammer head alone weighs more than a whole cookbowl. But the greatest satisfaction still prepares the crumbling stone golems who have the misfortune of becoming familiar with this earthquake weapon.","","True","GE_SmithWeapons_15","",""
"Scripts/Content/Story/Log_Constants.d:31","KRUSH KARROK: Bisher war nicht bekannt, daß Orks auch mit riesigen Hämmern kämpfen, doch scheint dies vor vielen Jahrhunderten tatsächlich der Fall gewesen zu sein. Diese Apokalypse von Waffe besteht aus einem mannsgroßen Eisenschaft, der von einem enorm wuchtigen und doch sehr scharfkantigen Hammerkopf gekrönt wird. Wo dieses Monstrum aufschlägt, wächst kein Gras mehr. Mit einer solchen Waffe werden die meisten gegnerischen Rüstungen reine Formsache.","KRUSH KARROK: It was not known until now that orcs also fight with huge hammers, but it seems that this was indeed the case many centuries ago. This apocalypse of weapon consists of a human-sized jungle crowned by an enormously powerful yet very sharp-edged hammerhead. Wherever this monster attacks, no grass grows. With such a weapon, most enemy armor becomes pure form.","","True","GE_SmithWeapons_16","",""
"Scripts/Content/Story/Log_Constants.d:34","Wissen über Kochrezepte","Knowledge of cook recipes","","True","GE_CookingRecipies","",""
"Scripts/Content/Story/Log_Constants.d:36","Wissen über Alchemieformeln","Knowledge of alchemy formulas","","True","GE_AlchemieRecipies","",""
"Scripts/Content/Story/Log_Constants.d:37","Wissen vom Bogenmachen","Knowledge of making bows","","True","GE_BowMaker","",""
"Scripts/Content/Story/Log_Constants.d:37","Wissen über Pflanzen","Knowledge of Plants","","True","GE_Plants","",""
"Scripts/Content/Story/Log_Constants.d:37","WALDBEEREN mögen kein helles Licht. Sie wachsen bevorzugt unter kleineren Büschen, aber manchmal auch in dichterem Wald.","WOODBERGES don't like bright light. They prefer to grow under smaller shrubs, but sometimes in dense forest.","","True","GE_Plants_1","",""
"Scripts/Content/Story/Log_Constants.d:38","FLAMMBEEREN sind eng mit den Waldbeeren verwandt, aber weitaus seltener. Auch sie wachsen im Dunkel von kleineren Büschen und im Wald. Häufig findet man Flammbeeren einzeln in einer grösseren Gruppe von Waldbeeren.","FLAMINGBERGES are closely related to the berries of the forest, but they are much rarer. They also grow in the darkness of smaller shrubs and in the woods. Often, they are found singly in a larger group of berries.","","True","GE_Plants_2","",""
"Scripts/Content/Story/Log_Constants.d:39","TROLLKIRSCHEN sind eine extrem seltene Unterart der Waldbeeren. Sie scheinen im Gegensatz zu ihren Verwandten äusserst giftig zu sein und wachsen ausschliesslich in Trollhorten.","TROLKIRSHEN are an extremely rare subspecies of the berries. They seem to be extremely poisonous, unlike their relatives, and grow exclusively in troll's gardens.","","True","GE_Plants_3","",""
"Scripts/Content/Story/Log_Constants.d:40","HÖHLENPILZE brauchen die feuchte Dunkelheit. In alten muffigen Kellern und Verliessen aber auch in vielen natürlichen Höhlen stolpert man oft über ganze Teppiche dieser Pflanzen.","HUMID darkness is required for CAVENTS. In old, smooth cellars and lofts, but also in many natural caves, you often stumble across entire carpets of these plants.","","True","GE_Plants_4","",""
"Scripts/Content/Story/Log_Constants.d:41","BERGMOOS mag die dünne Luft hoch in den Bergen oder Felsen. Oft muss ein Fundort mühevoll erklettert werden.","BERGMOOS likes the thin air high in the mountains or the cliffs. A place to be found often has to be climbed with difficulty.","","True","GE_Plants_5","",""
"Scripts/Content/Story/Log_Constants.d:42","Die STEINWURZEL bevorzugt erdige Böden, man findet sie am Waldrand und  auf erdigen Feldern. Oft wachsen sie dort auf kleinen Felsfindlingen.","The stone ROOT prefers the soil, you can find it at the edge of the forest and on the fields. They often grow on small rock finds there.","","True","GE_Plants_6","",""
"Scripts/Content/Story/Log_Constants.d:43","Die BLUTDISTEL mag das Ufer von Seen und Flüssen. Sie wächst häufig in ganzen Gruppen und ist oft in der Nähe von grossen Schilfpflanzen zu finden.","The BLOODDISTEL likes the shores of lakes and rivers. It grows in whole groups and is often found near large scallops.","","True","GE_Plants_7","",""
"Scripts/Content/Story/Log_Constants.d:45","ORKBLATT wächss bevorzugt auf niedrigen Felsvorsprüngen, oder direkt am Fusse von Felsen und Bergen.","ORC BLOATT grows preferably on low rock promontories, or directly at the foot of cliffs and mountains.","","True","GE_Plants_8","",""
"Scripts/Content/Story/Log_Constants.d:46","RABENKRAUT mag die Nachbarschaft zum Wasser, sei es Meer oder ein Binnengewässer.","Ravenweed likes the water nearby, whether it's the sea or an inland body of water.","","True","GE_Plants_9","",""
"Scripts/Content/Story/Log_Constants.d:46","NACHTSCHATTEN sucht, wie der Name schon andeutet, die Dunkelheit. Er sollte in Höhlen und Räumen oder den finstersten Ecken des Waldes zu finden sein.","NIGHT SHOTING, as its name suggests, seeks darkness. It should be found in caves and rooms or the darkest corners of the forest.","","True","GE_Plants_10","",""
"Scripts/Content/Story/Log_Constants.d:52","Händler im Alten Lager","Merchant in the Old Camp","","True","GE_TraderOC","",""
"Scripts/Content/Story/Log_Constants.d:53","Einer der Bettler mit Namen Lakarus verkauft SUMPFKRAUT auf dem Arenaplatz.","One of the beggars named Lakarus sells SUMMER GRAVE in the arena square.","","True","GE_TraderOC_1","",""
"Scripts/Content/Story/Log_Constants.d:54","Isgar, einer der Heiler verkauft TRÄNKE aller Art, im Händlerviertel.","Isgar, one of the healers, sells ALL sorts of potions in the merchant district.","","True","GE_TraderOC_2","",""
"Scripts/Content/Story/Log_Constants.d:55","Halvor betreibt die Burgküche. Er scheint sich auf FLEISCHEINTOPF 'spezialisiert' zu haben.","Halvor runs the castle kitchen. He seems to have 'specialized' in Blade Top.","","True","GE_TraderOC_3","",""
"Scripts/Content/Story/Log_Constants.d:56","Helvegor, der Bogenmacher verkauft seine Waren am Marktplatz","Helvegor, the bowmaker, sells his goods in the marketplace.","","True","GE_TraderOC_4","",""
"Scripts/Content/Story/Log_Constants.d:57","Gerion kauft HEHLERWARE aller Art ab. Er treibt sich am hinteren Tor herum.","Gerion buys ALL sorts of HEALTH. He's hanging around the back gate.","","True","GE_TraderOC_5","",""
"Scripts/Content/Story/Log_Constants.d:58","Gotmar der Schmied verkauft allerlei SCHMIEDEZUBEHÖR. Er hat seine Schmiede direkt neben dem Haupttor.","Gotmar the smith sells all kinds of smithy equipment. His smithy is right next to the main gate.","","True","GE_TraderOC_6","",""
"Scripts/Content/Story/Log_Constants.d:58","Helvegor stellt BÖGEN her und verkauft sie zusammen mit den PFEILEN von Osric. Dieses seltsame 'Paar' hat seinen Stand im Händlerviertel.","Helvegor makes BOWS and sells them together with Osric'S ARSES. This strange 'paar' has his booth in the merchant district.","","True","GE_TraderOC_7","",""
"Scripts/Content/Story/Log_Constants.d:60","Ruga verkauft RÜSTUNGEN. Er hat sein Geschäft im Händlerviertel.","Ruga sells ARMURES. He has his business in the merchant district.","","True","GE_TraderOC_8","",""
"Scripts/Content/Story/Log_Constants.d:62","Agon prahlt damit, ALLES besorgen zu können, was man sucht. Er hat einen Stand im Händlerviertel.","Agon boasts of being able to get EVERYTHING you want. He has a booth in the merchant district.","","True","GE_TraderOC_9","",""
"Scripts/Content/Story/Log_Constants.d:64","Händler im Neuen Lager","Merchant in the New Camp","","True","GE_TraderNC","",""
"Scripts/Content/Story/Log_Constants.d:66","Händler im Sumpflager","Merchant in the Swamp Camp","","True","GE_TraderPSI","",""
"Scripts/Content/Story/Log_Constants.d:67","Händler ausserhalb der Lager","Merchant outside the Camps","","True","GE_TraderOW","",""
"Scripts/Content/Story/Log_Constants.d:67","Lehrer im Alten Lager","Teacher in the Old Camp","","True","GE_TeacherOC","",""
"Scripts/Content/Story/Log_Constants.d:68","Diego wird mir helfen, meine GESCHICKLICHKEIT und BOGENTALENTE zu trainieren. Ich kann ihn im Erzbaronhaus finden.","Diego will help me train my dexterity and my dexterity. I can find him in the Ore Barons' mansion.","","True","GE_TeacheroC_1","",""
"Scripts/Content/Story/Log_Constants.d:68","Lester wird mir helfen, meine MANA zu verbessern und neue ZAUBERSPRÜCHE zu erlernen. Er ist im alten Magierhaus in der Burg zu finden.","Lester will help me improve my MANA and learn new MAGICAL SPEAKS. He can be found in the old house of the magicians in the castle.","","True","GE_TeacheroC_2","",""
"Scripts/Content/Story/Log_Constants.d:70","Cassian wird mir helfen, meine STÄRKE sowie das Kampftalent EINHÄNDER zu trainieren. Er trainiert tagsüber Soldaten im Burginnenhof.","Cassian will help me train my STRENGTH and combat skills as well as the ONE-HANDED. During the day, he trains soldiers in the castle's courtyard.","","True","GE_TeacheroC_3","",""
"Scripts/Content/Story/Log_Constants.d:71","Gerion kann mir die Talente SCHLEICHEN, SCHLÖSSER KNACKEN und TASCHENDIEBSTAHL beibringen. Er hält sich irgendwo am hinteren Tor auf.","Gerion can teach me the skills of SLEEPING, LOCKING and SLAIMING. He's somewhere at the back gate.","","True","GE_TeacheroC_4","",""
"Scripts/Content/Story/Log_Constants.d:71","Gerion hat kann mir alles beigebracht, was er über die Diebeskünste weiss. Wenn ich noch mehr lernen will, muss ich mir einen anderen Lehrer suchen.","Gerion has taught me everything he knows about the art of theft. If I want to learn more, I'll have to find another teacher.","","True","GE_TeacheroC_5","",""
"Scripts/Content/Story/Log_Constants.d:77","Lehrer im Neuen Lager","Teacher in the New Camp","","True","GE_TeacherNC","",""
"Scripts/Content/Story/Log_Constants.d:77","Lehrer im Sumpflager","Tutor in Swamp Camp","","True","GE_TeacherPSI","",""
"Scripts/Content/Story/Log_Constants.d:79","Lehrer ausserhalb der Lager","Teacher outside the Camp","","True","GE_TeacherOW","",""
"Scripts/Content/Story/Log_Constants.d:81","Dämonische Bedrohung","Demon Threat","","True","CH1_DemonThreat","",""
"Scripts/Content/Story/Log_Constants.d:81","Ich konnte Thora dazu bringen, mich zur Bergfestung zu führen. Allerdings wird sie mich nur an den ersten Wachen vorbeibringen. Danach bin ich auf mich allein gestellt.","I was able to get Thora to lead me to the mountain fort. However, she will only let me pass the first guards. After that, I'll be on my own.","","True","CH1_DemonThreat_1","",""
"Scripts/Content/Story/Log_Constants.d:83","Sollte wir auf dem Weg in die Bergfestung getrennt werden, treffen wir uns an der Arena im Alten Lager wieder.","Should we be separated on the way to the mountain fort, we'll meet again at the arena in the Old Camp.","","True","CH1_DemonThreat_2","",""
"Scripts/Content/Story/Log_Constants.d:83","Der Schläfer versucht aus der Dämonenwelt in unsere Welt zurückzukommen. Er muss unter allen Umständen aufgehalten werden, sonst waren alle meine Bemühungen umsonst.","The Sleeper is trying to get back into our world from the demonic world. Under any circumstances, he must be stopped, otherwise all my efforts will be in vain.","","True","CH1_DemonThreat_3","",""
"Scripts/Content/Story/Log_Constants.d:84","Bevor ich der dämonischen Bedrohung begegnen kann, muss ich meine verlernten Fähigkeiten zurückerlernen und wieder in Form kommen. Das Alte Lager ist der geeignete Ort dafür.","Before I can face the demonic threat, I must regain my lost abilities and get back into shape. The Old Camp is the right place for that.","","True","CH1_DemonThreat_4","",""
"Scripts/Content/Story/Log_Constants.d:85","Xardas gab mir eine Botschaft für Diego. Mein alter Weggefährte ist mittlerweile der Anführer des Alten Lagers. Er wird mich beraten und weiss was zu tun ist.","Xardas gave me a message for Diego. My old companion is now the leader of the Old Camp. He will advise me and know what to do.","","True","CH1_DemonThreat_5","",""
"Scripts/Content/Story/Log_Constants.d:87","Diego hält mich noch nicht wieder für überlebensfähig. Ich muss im Lager meine Fähigkeiten trainiere und wieder fit werden.","Diego doesn't think I'm fit enough to survive any more. I need to train my abilities in the Camp and get back in shape.","","True","CH1_DemonThreat_6","",""
"Scripts/Content/Story/Log_Constants.d:87","Nach ausreichend Training werde ich nun zu Milten, meinem Weggefährten von früher, aufbrechen. Er ist einer der Feuermagier in der Bergfestung. Diego braucht seine Hilfe gegen die dämonische Bedrohung.","After getting enough training, I'm now headed for Milten, my old companion. He's one of the Fire Mages in the mountain fort. Diego needs his help against the demonic threat.","","True","CH1_DemonThreat_7","",""
"Scripts/Content/Story/Log_Constants.d:88","Die Bergfestung wird von den Paladinen des Königs abgeschottet. Thora arbeitet als Kundschafterin für die Paladine. Sie ist der einzige Weg für mich, in die Festung zu gelangen.","The mountain fort is guarded by the king's paladins. Thora works as an explorer for the paladins. It's the only way for me to get into the fort.","","True","CH1_DemonThreat_8","",""
"Scripts/Content/Story/Log_Constants.d:91","Huldrych's Lektion","Huldrych's lesson","","True","CH1_Train1h","",""
"Scripts/Content/Story/Log_Constants.d:91","Huldrych hat den Händler Agon bestohlen. Cassian hat mich nun beauftragt, zum einen Huldrych eine Lektion zu erteilen und zum anderen Agon sein Eigentum wiederzubringen. Dabei wäre es unklug, Huldrych zu töten!","Huldrych stole from the merchant Agon. Cassian has now asked me to teach Huldrych a lesson and to restore Agon's property to him. It would be unwise to kill Huldrych!","","True","CH1_Train1h_1","",""
"Scripts/Content/Story/Log_Constants.d:93","Vielleicht ist es besser, erst mit Agon zu reden, bevor ich zu Huldrych gehe, um einen besseren Überblick der Situation zu bekommen.","Maybe it's better to talk to Agon first before I go to Huldrych to get a better overview of the situation.","","True","CH1_Train1h_2","",""
"Scripts/Content/Story/Log_Constants.d:94","Ich habe die Aufgabe zu Cassian's Zufriedenheit erledigt. Huldrych hat seine Lektion erhalten.","I have done the task to Cassian's satisfaction. Huldrych has received his lesson.","","True","CH1_Train1h_3","",""
"Scripts/Content/Story/Log_Constants.d:95","Es wäre besser gewesen, ich hätte Huldrych nicht umgebracht. In Zukunft sollte ich vorsichtig sein, Mord wird von allen sehr ernst genommen","It would have been better if I hadn't killed Huldrych. In the future, I should be careful, murder is taken very seriously by everyone.","","True","CH1_Train1h_4","",""
