"location","source","target","id","fuzzy","context","translator_comments","developer_comments"
"Scripts/Content/Story/Log_Constants.d:198","Halvor scheint offensichtlich ein neues Rezept zu verwenden, dass bei den Lagerbewohnern sehr gut anzukommen scheint.","Halvor seems to be using a new recipe that the camp dwellers seem to be doing very well.","","True","CH1_LearnCooking_5","",""
"Scripts/Content/Story/Log_Constants.d:198","Halvor bewahrt sein neues Rezept in seiner gut verschlossenen Truhe auf.","Halvor keeps his new recipe in his well-sealed chest.","","True","CH1_LearnCooking_6","",""
"Scripts/Content/Story/Log_Constants.d:199","Snaf, der Koch im Aussenring des Alten Lagers hat eingewilligt, mir das Zubereiten von heilsamen Nahrungsmitteln beizubringen, wenn ich ihm bei seinem Problem helfe: In letzter Zeit sind viele seiner Stammkunden zu Halvor, dem Koch in der Burgküche übergelaufen.","Snaf, the cook in the Outer Ring of the Old Camp, has agreed to teach me how to prepare healing food if I help him with his problem: Lately, many of his regular customers have gone to Halvor, the cook in the castle kitchen.","","True","CH1_LearnCooking_7","",""
"Scripts/Content/Story/Log_Constants.d:200","Snaf ist stinksauer, weil ich Halvor getötet habe. Aus ihm werde ich nicht mehr herausbekommen. Meine Lösung seines Problems war wohl doch etwas zu extrem.","Snaf is really pissed off that I killed Halvor. I'm not getting any more information from him. My solution to his problem was probably a bit too extreme.","","True","CH1_LearnCooking_8","",""
"Scripts/Content/Story/Log_Constants.d:201","Snaf war ausser sich vor Freude über die zurückgewonnene Kundschaft. Besser er erfährt nie, wie ich das angestellt habe!","Snaf was delighted to have the customers back. He'd better never hear how I did it!","","True","CH1_LearnCooking_9","",""
"Scripts/Content/Story/Log_Constants.d:204","Ich weiss nun, wie ich aus Fleischwanzen eine Suppe herstellen kann. Um allerdings Eintöpfe und Ragouts zuzubereiten, brauche ich einen besseren Lehrer!","I know now how to make soup from meatbugs. But to prepare pot and ragouts, I need a better teacher!","","True","CH1_LearnCooking_10","",""
"Scripts/Content/Story/Log_Constants.d:208","Ruga besänftigen","Soften Ruga","","True","CH1_RugaWantsMeal","",""
"Scripts/Content/Story/Log_Constants.d:208","Wenn ich Ruga eine Meatbugsuppe besorge, handelt er wieder mit mir.","If I get Ruga some meatbug soup, he'll trade with me again.","","True","CH1_RugaWantsMeal_1","",""
"Scripts/Content/Story/Log_Constants.d:208","Ruga hat sich beruhigt, nachdem ich Ihm die Suppe gebracht habe.","Ruga calmed down after I brought him the soup.","","True","CH1_RugaWantsMeal_2","",""
"Scripts/Content/Story/Log_Constants.d:209","Der Weg zum Runenschmied","The way to the rune smith","","True","CH1_LearnRuneMaking","",""
"Scripts/Content/Story/Log_Constants.d:209","Lester will mir zeigen, wie man selbst Runen herstellt. Ausgangskomponenten sind ein leerer Runenstein, sowie eine Spruchrolle des Zaubers, der in die Rune gebunden werden soll.","Lester wants to show me how to create runes yourself. The starting components are an empty runestone, as well as a spell scroll that is supposed to be bound into the rune.","","True","CH1_LearnRuneMaking_1","",""
"Scripts/Content/Story/Log_Constants.d:210","Die Herstellung einer leeren Rune erfordert Erz, dass mit einer Schmiedezange in einen Runenschmelzer gehalten werden muss.","Creating an empty rune requires ore to be put into a rune melting machine with a smith's sword.","","True","CH1_LearnRuneMaking_2","",""
"Scripts/Content/Story/Log_Constants.d:212","Lester hat sein Erz bei Bartok dem Burgschmied gekauft. Doch dieser ist einer seltsamen Krankheit verfallen und vegetiert jetzt im Krankenviertel vor sich hin.","Lester bought his ore from Bartok the blacksmith. But he has suffered a strange illness and is now vegeting in the sick quarter in front of him.","","True","CH1_LearnRuneMaking_3","",""
"Scripts/Content/Story/Log_Constants.d:212","In der verlassenen Burgschmiede kann ich wahrscheinlich etwas Erz finden.","I can probably find some ore in the abandoned castle smithy.","","True","CH1_LearnRuneMaking_4","",""
"Scripts/Content/Story/Log_Constants.d:214","Der zweite Schritt in der Runenerschaffung findet am Runenkreisel statt. Der Zauber einer Spruchrolle wird in einen leeren Runenstein gebrannt. Dieser Vorgang kostet mich dauerhafte Mana!","The second step in the creation of runes takes place at the Circle of Runes. The spell of a spell scroll is burned in an empty runestone. This process will cost me permanent mana!","","True","CH1_LearnRuneMaking_5","",""
"Scripts/Content/Story/Log_Constants.d:215","Ich habe soeben meine erste Rune erschaffen! ","I just created my first rune!","","True","CH1_LearnRuneMaking_6","",""
"Scripts/Content/Story/Log_Constants.d:216","Lester und ich haben beschlossen, den einfachsten Zauber der Wassermagie in eine Rune zu bannen.","Lester and I have decided to banish the simplest magic of the magic of water into a rune.","","True","CH1_LearnRuneMaking_7","",""
"Scripts/Content/Story/Log_Constants.d:217","Horatio könnte womöglich etwas über den Verbleib der Wassermagier wissen. Er klopft Steine im Arbeiterviertel.","Horatio might know something about the Water Mages. He's knocking stones in the workers' quarter.","","True","CH1_LearnRuneMaking_8","",""
"Scripts/Content/Story/Log_Constants.d:218","Um die Spruchrolle HEILUNG in eine Rune binden zu können, muss ich den zweiten Kreis der Magie erlernen!","To bind the spell scroll HEALING into a rune, I need to learn the Second Circle of Magic!","","True","CH1_LearnRuneMaking_9","",""
"Scripts/Content/Story/Log_Constants.d:218","Um Zauber des dritten Kreises in Runen zu binden wird ein besonderes Erz, sogenanntes BLUTERZ benötigt.","A special ore called BLOODERZ is required to bind the Third Circle magic in runes.","","True","CH1_LearnRuneMaking_10","",""
"Scripts/Content/Story/Log_Constants.d:221","Ein Wassermagier namens Nefarius ist auf dem Weg vom Neuen Lager hierher verschollen. Der Weg zum Neuen Lager führt nach Westen durch eine Talsenke und vorbei an einer alten Hütte.","A Water Mage named Nefarius has got lost on the way from the New Camp. The road to the New Camp leads west through a valley sink and past an old hut.","","True","CH1_LearnRuneMaking_11","",""
"Scripts/Content/Story/Log_Constants.d:222","Die Suche nach Bluterz","The Search for Blood","","True","CH1_Bloodore","",""
"Scripts/Content/Story/Log_Constants.d:223","Sylvester ist im Besitz von Bluterz. Er überlässt es mir, wenn ich ihm ein Kurzschwert besorge.","Sylvester is in possession of Bluterz. He'll give it to me if I get him a short sword.","","True","CH1_Bloodore_1","",""
"Scripts/Content/Story/Log_Constants.d:223","Sylvester hat mir sein Bluterz überlassen. Er gab mir noch den Tip Wylfern auch auf Bluterz anzusprechen. Er ist Rekrut in der Miliz und war ebenfalls in der Mine.","Sylvester gave me his bloodstaff. He also told me to talk to Wylfern about bloodstaff. He's a recruit in the militia and was in the mine, too.","","True","CH1_Bloodore_2","",""
"Scripts/Content/Story/Log_Constants.d:226","Waffenschmiede und Minenarbeiter haben normalerweise mit Erz zu tun, vielleicht können mir diese Leute etwas über das sogenannte BLUTERZ erzählen.","Weapon smiths and miners usually deal with ore, so maybe those people can tell me something about the so-called BLOODERS.","","True","CH1_Bloodore_3","",""
"Scripts/Content/Story/Log_Constants.d:227","Auch Wylfern, ein Rekrut der Miliz könnte über etwas Bluterz verfügen. Er hält sich im Innenhof der Burg auf.","Also wolf, a recruit from the militia could have some blood. He's in the courtyard of the castle.","","True","CH1_Bloodore_4","",""
"Scripts/Content/Story/Log_Constants.d:228","Die Spur des Phoenix","The trail of the Phoenix","","True","CH1_Phoenix","",""
"Scripts/Content/Story/Log_Constants.d:228","Offensichtlich ahnte der oberste Feuermagier Corristo, dass ihm übles wiederfahren wird, und hat eine rätselhafte 'Spur des Phoenix' gelegt. Am Ende dieser Spur soll das 'Wissen des Feuers' zu finden sein, was immer der ermordete Zauberer auch damit meinte.","Apparently, the chief Fire Magician Corristo suspected that he would be hurt again, and he has laid a mysterious 'Trail of the Phoenix'. At the end of that trail is supposed to be the 'Knowledge of Fire', whatever the murdered magician meant by that.","","True","CH1_Phoenix_1","",""
"Scripts/Content/Story/Log_Constants.d:229","Ich habe das zweite Buch von der 'Spur des Phoenix' gefunden. Es spricht von einem Bruch, der etwas 'felsenfest Verbundenes durch die Macht des Sturmes entzweite'.","I found the second book of the 'Trail of the Phoenix'. It speaks of a fracture that 'separates something solidly joined by the power of the storm'.","","True","CH1_Phoenix_2","",""
"Scripts/Content/Story/Log_Constants.d:230","Das dritte Buch von der 'Spur des Phoenix' ist nicht minder rätselhaft. Ich soll nach einer Stelle suchen, an der 'die Macht des Wassers den Hort verlässt'.","The third book of The 'Trail of the Phoenix' is no less puzzling. I'm supposed to look for a place where 'the power of Water leaves the hole'.","","True","CH1_Phoenix_3","",""
"Scripts/Content/Story/Log_Constants.d:231","Das vierte Buch von der 'Spur des Phoenix' wird immer rätselhafter. Es spricht davon, dass man auf einem Damm Ausschau halten soll, um die 'Sehnsucht des Phoenix' erblicken zu können.","The fourth book of The 'Trail of the Phoenix' is getting more and more puzzling. It says that you have to look out for a dam to see the 'Search for the Phoenix'.","","True","CH1_Phoenix_4","",""
"Scripts/Content/Story/Log_Constants.d:233","Das fünfte Buch von der 'Spur des Phoenix' erzählt davon, dass Höhlen, die man nicht trockenen Fusses erreichen kann, der Alptraum eines jeden Phoenix sind.","The fifth book of 'The Trail of the Phoenix' tells us that caves that cannot be reached on dry feet are the nightmare of every Phoenix.","","True","CH1_Phoenix_5","",""
"Scripts/Content/Story/Log_Constants.d:234","Das sechste Buch von der 'Spur des Phoenix' spricht von einem 'brennenden Felsennest in luftiger Höhe', dem Nest des Phoenix.","The sixth book of 'The Trail of the Phoenix' speaks of a 'burning rock nest in the air', the nest of the Phoenix.","","True","CH1_Phoenix_6","",""
"Scripts/Content/Story/Log_Constants.d:235","Das siebente Buch beschreibt den Tod des Phoenix am höchsten Ort seines Hortes.","The seventh book describes the death of the Phoenix at the highest point of his horde.","","True","CH1_Phoenix_7","",""
"Scripts/Content/Story/Log_Constants.d:235","Das achte Buch klingt wie der Abschluss der 'Spur des Phoenix'. Nur ist dieser Hinweis der rätselhafteste von allen.","The eighth book sounds like the conclusion of the 'Trail of the Phoenix'. Only this hint is the most enigmatic of all.","","True","CH1_Phoenix_8","",""
"Scripts/Content/Story/Log_Constants.d:239","Ich habe die Geheime Kammer der Feuermagier gefunden. Doch Corristo warnte im letzten Buch davor, das Wissen zu verschwenden, denn es sei 'der letzte Hort des Feuers innerhalb der Barriere'.","I have found the Secret Chamber of the Magicians of Fire. But Corristo warned in the last book against wasting the knowledge, for it is 'the last chamber of fire within the Barrier'.","","True","CH1_Phoenix_9","",""
"Scripts/Content/Story/Log_Constants.d:244","Wiedergutmachungsauftrag von Gorn","Gorn's reparation order","","True","REP_GORN","",""
"Scripts/Content/Story/Log_Constants.d:244","Wiedergutmachungsauftrag von Diego","Diego's reparation order","","True","REP_DIEGO","",""
"Scripts/Content/Story/Log_Constants.d:244","Wiedergutmachungsauftrag von Milten","Milten's reparation order","","True","REP_MILTEN","",""
"Scripts/Content/Story/Log_Constants.d:244","Wiedergutmachungsauftrag von Lester","Lester's reparation order","","True","REP_LESTER","",""
