"location","source","target","id","fuzzy","context","translator_comments","developer_comments"
"Scripts/Content/Story/Log_Constants.d:96","Ich habe ein gutes Geschäft mit Huldrych gemacht. Und niemand hat etwas davon bemerkt. Vielleicht wird mir das noch einmal nützlich sein.","I made a good deal with Huldrych. And nobody noticed anything about it. Maybe that'll be useful to me again.","","True","CH1_Train1h_5","",""
"Scripts/Content/Story/Log_Constants.d:97","Vielleicht sollte ich mal mit Agon sprechen.","Maybe I should talk to Agon.","","True","CH1_Train1h_6","",""
"Scripts/Content/Story/Log_Constants.d:98","Ich fürchte Huldrych hat das Silber jetzt in Sicherheit gebracht. Bleibt mir nur noch, ihm aufs Maul... ähem ihm eine Lektion zu erteilen.","I'm afraid Huldrych has now brought the silver to safety. All I can do is punch him in the face... and teach him a lesson.","","True","CH1_Train1h_7","",""
"Scripts/Content/Story/Log_Constants.d:99","Huldrych hat Agon 100 Silberstücke gestohlen.","Huldrych stole 100 pieces of silver from Agon.","","True","CH1_Train1h_8","",""
"Scripts/Content/Story/Log_Constants.d:101","Agon hat seine 100 Silberstücke wieder. Aber ausser seinem Dank hat der Geizkragen keine Belohnung herausgerückt. Damit habe ich einen Teil von Cassians Auftrag erfüllt.","Agon has recovered his 100 pieces of silver. But apart from his thanks, the greedy thug has not given me any reward. I have fulfilled part of Cassian's task with it.","","True","CH1_Train1h_9","",""
"Scripts/Content/Story/Log_Constants.d:102","Der Weg zum Bogenschützen","The Way to the Bowman","","True","CH1_TrainBow_1","",""
"Scripts/Content/Story/Log_Constants.d:103","Auf dem unzugänglichen Stück Wehrgang an der Burgschmiede und auf dem Vordach sind ein paar Fleischwanzen. Davon soll ich mindestens fünf erledigen.","There are a few meatbugs on the inaccessible passage at the castle smithy and on the roof. I'm supposed to finish at least five of them.","","True","CH1_TrainBow_1_1","",""
"Scripts/Content/Story/Log_Constants.d:107","Die Fleischwanzen sind erledigt.","The meatbugs are done.","","True","CH1_TrainBow_1_2","",""
"Scripts/Content/Story/Log_Constants.d:107","Der Weg zum Bogenmeister","The Way to the Bowmaster","","True","CH1_TrainBow_2","",""
"Scripts/Content/Story/Log_Constants.d:109","Ich soll Diego das Fleisch von 5 Molerats bringen","I'm supposed to bring Diego the meat from 5 molars.","","True","CH1_TrainBow_2_1","",""
"Scripts/Content/Story/Log_Constants.d:110","Diego hat das Fleisch der Molerats. Damit habe ich alles über den Umgang mit dem Bogen gelernt.","Diego has the meat of the molerat. That's how I learned all about bow-whiping.","","True","CH1_TrainBow_2_2","",""
"Scripts/Content/Story/Log_Constants.d:111","Ein Schlüssel für Gerion","A key for Gerion","","True","CH1_TrainSneak","",""
"Scripts/Content/Story/Log_Constants.d:111","Verdammt, jetzt hat Osbert den Schlüssel. Ich sollte Gerion darüber informieren.","Damn, now Osbert has the key. I should tell Gerion about it.","","True","CH1_TrainSneak_1","",""
"Scripts/Content/Story/Log_Constants.d:112","Gerion will einen Schlüssel aus dem Obergeschoß des Erzbaronhauses haben. Ich muß mich an Osbert vorbeischleichen, der den Raum bewacht.","Gerion wants a key from the upper floor of the Ore Barons' house. I have to sneak past Osbert, who guards the room.","","True","CH1_TrainSneak_2","",""
"Scripts/Content/Story/Log_Constants.d:113","Ich habe Gerion den Schlüssel besorgt. Jetzt ist er bereit mir Grundkenntnisse in TASCHENDIEBSTAHL und SCHLÖSSER KNACKEN beizubringen.","I've got the key for Gerion. Now he's ready to teach me the basics of SLAYING and LOCKING.","","True","CH1_TrainSneak_3","",""
"Scripts/Content/Story/Log_Constants.d:114","Nachdem ich schon bei meiner ersten Aufgabe als Dieb gescheitert bin, ist es wohl besser, keine weitere Zeit und Mühe in die Diebeskunst zu investieren.","Since I failed my first task as a thief, it would be better not to invest any more time and effort in the art of theft.","","True","CH1_TrainSneak_4","",""
"Scripts/Content/Story/Log_Constants.d:115","Gerion hat mir das Talent des Taschendiebstahls gezeigt. Jetzt kann ich Osbert den Schlüssel unbemerkt abnehmen","Gerion has taught me the art of pickpocketing. Now I can take the key from Osbert without anyone noticing.","","True","CH1_TrainSneak_5","",""
"Scripts/Content/Story/Log_Constants.d:116","Ich habe Osbert den Schlüssel unbemerkt abgenommen. Gerion ist nun auch bereit mir Grundkenntnisse über SCHLÖSSER KNACKEN beizubringen","I took the key from Osbert without noticing. Gerion is now willing to teach me the basics of LOCKED HUNTS.","","True","CH1_TrainSneak_6","",""
"Scripts/Content/Story/Log_Constants.d:118","Ich habe Osbert niedergeschlagen und Gerion den Schlüssel gebracht. Das war zwar nicht ganz im Sinn der Aufgabe, aber er wird mich weiterhin unterrichten","I knocked Osbert down and gave the key to Gerion. That wasn't exactly in the spirit of the job, but he'll continue to instruct me.","","True","CH1_TrainSneak_7","",""
"Scripts/Content/Story/Log_Constants.d:120","Akrobatik","Acrobatics","","True","CH1_TrainAcrobatic","",""
"Scripts/Content/Story/Log_Constants.d:121","Eine Kiste voller Kraut","A chest of weed","","True","CH1_TrainLockpick_1","",""
"Scripts/Content/Story/Log_Constants.d:122","Lakarus der Bettler verwahrt seinen Sumpfkrautvorrat in seiner Hütte. Gerion braucht 20 Stengel.","Lakarus the beggar keeps his swampweed supplies in his hut. Gerion needs 20 stalks.","","True","CH1_TrainLockpick_1_1","",""
"Scripts/Content/Story/Log_Constants.d:123","Die Hütte von Lakarus steht oberhalb der Arena.","Lakarus' hut is above the arena.","","True","CH1_TrainLockpick_1_2","",""
"Scripts/Content/Story/Log_Constants.d:125","Gerion will das ich das Sumpfkraut bei dem Heiler Isgar gegen einen 'Schlafwein' tausche.","Gerion wants me to trade the swampweed from the healer Isgar for a 'sleep wine'.","","True","CH1_TrainLockpick_1_3","",""
"Scripts/Content/Story/Log_Constants.d:127","Gerion hat den 'Schlafwein' bekommen.","Gerion has the 'Sleep Wine'.","","True","CH1_TrainLockpick_1_4","",""
"Scripts/Content/Story/Log_Constants.d:127","Schlösser öffnen Stufe 2","Open locks Level 2","","True","CH1_TrainLockpick_2","",""
"Scripts/Content/Story/Log_Constants.d:128","Taschendiebstahl Stufe 1","Pickpocketing Level 1","","True","CH1_TrainPickpocket_1","",""
"Scripts/Content/Story/Log_Constants.d:128","Wylfern, Rekrut der Miliz, besitzt einen Ring. Gerion würde mir 250 Silberstücke daür geben.","Wylfern, a recruit in the militia, owns a ring. Gerion would give me 250 pieces of silver for it.","","True","CH1_TrainPickpocket_1_1","",""
"Scripts/Content/Story/Log_Constants.d:132","Gerion hat den Ring und ich bin um einige Silberstücke reicher","Gerion has the ring, and I'm a few pieces of silver richer.","","True","CH1_TrainPickpocket_1_2","",""
"Scripts/Content/Story/Log_Constants.d:132","Taschendiebstahl Stufe 2","Pickpocketing Level 2","","True","CH1_TrainPickpocket_2","",""
"Scripts/Content/Story/Log_Constants.d:134","Der Soldat Hyglas","The soldier Hyglas","","True","CH1_Hyglas","",""
"Scripts/Content/Story/Log_Constants.d:135","Wenn sich der Weg der Magier mit meinem Weg kreuzt,werde ich herausfinden was sie vorhaben. Falls es Schwierigkeiten gibt, wird Hyglas mir beistehen.","If the path of the magicians crosses with mine, I shall find out what they are planning. If there are any problems, Hyglas will help me.","","True","CH1_Hyglas_1","",""
"Scripts/Content/Story/Log_Constants.d:136","Bartok's Werkzeuge","Bartok's Tools","","True","CH1_Bartok","",""
"Scripts/Content/Story/Log_Constants.d:136","Der Pfleger Odo gab mir den Schlüssel zu Bartok's Kiste. Einfach so!!! Es geschehen noch Zeichen und Wunder.","The nurse Odo gave me the key to Bartok's chest. Just like that!!! Signs and wonders will still happen.","","True","CH1_Bartok_1","",""
"Scripts/Content/Story/Log_Constants.d:137","Die rätselhafte Krankheit hat auch den ehemalige Burgschmied Bartok erwischt. Er wurde ins Viertel der Kranken gebracht. Den Schlüssel zu seiner Werkzeugkiste trug er stets bei sich.","The enigmatic disease also struck the former blacksmith Bartok. He was taken to the sick quarter. He always carried the key to his tool chest with him.","","True","CH1_Bartok_2","",""
"Scripts/Content/Story/Log_Constants.d:139","Ich habe Bartok im Krankenviertel getroffen. Er ist völlig durchgeknallt. Es ist unmöglich aus ihm etwas vernünftiges herauszubekommen. Vielleicht weiss einer der Pfleger etwas von dem Schlüssel.","I met Bartok in the infirmary. He's completely nuts. It's impossible to get anything sensible out of him. Maybe one of the nurses knows something about the key.","","True","CH1_Bartok_3","",""
"Scripts/Content/Story/Log_Constants.d:141","Der Weg zum Waffenschmied","The Way to the Weaponmaker","","True","CH1_LearnSmith","",""
"Scripts/Content/Story/Log_Constants.d:141","Sylvester war dankbar, dass ich ihn zur Erzader geführt habe. Ich kann mir ab heute täglich etwas Erz bei ihm abholen.","Sylvester was grateful that I led him to the ore vein. From now on, I can get some ore from him every day.","","True","CH1_LearnSmith_1","",""
"Scripts/Content/Story/Log_Constants.d:142","Gotmar, ist bereit mir das Waffenschmieden beizubringen, falls ich ihm 40 Brocken Erz besorge.","Gotmar is willing to teach me how to forge weapons if I get him 40 ore nuggets.","","True","CH1_LearnSmith_2","",""
"Scripts/Content/Story/Log_Constants.d:143","Ein Mann namens Edo soll seine Kisten mit geklautem Erz gefüllt haben. Er ist am Marktplatz zu finden.","A man named Edo is said to have filled his chests with stolen ore. He can be found in the marketplace.","","True","CH1_LearnSmith_3","",""
"Scripts/Content/Story/Log_Constants.d:144","Es soll eine kleine Erzader in einer Molerat-Höhle in der Nähe des Lager-Haupttores geben.","There is supposed to be a small ore vein in a molerat cave near the main gate of the Camp.","","True","CH1_LearnSmith_4","",""
"Scripts/Content/Story/Log_Constants.d:145","Für's Erzhacken brauche ich eine Spitzhacke. Der Schürfer Sylvester am Arenaplatz soll eine verkaufen.","I need a pickaxe to mine ore. Sylvester, the scraper at the arena, is supposed to sell one.","","True","CH1_LearnSmith_5","",""
"Scripts/Content/Story/Log_Constants.d:146","In der Schmiede im Burghof könnten noch Werkzeuge des letzten Schmiedes herumliegen.","There could still be tools from the last smith lying around in the smithy in the castle yard.","","True","CH1_LearnSmith_6","",""
"Scripts/Content/Story/Log_Constants.d:147","Zum Schmieden braucht man ein Roheisen. Das wird am Schmelzofen gemacht. Man braucht dazu Erzbrocken und eine Zange.","Forging requires a raw iron. This is done at the smelting furnace. You need a nugget of ore and a mandible.","","True","CH1_LearnSmith_7","",""
"Scripts/Content/Story/Log_Constants.d:148","Nun muss das Roheisen in ein Schmiedefeuer gehalten und zum Glühen gebracht werden.","Now the raw iron must be kept in a smithy fire and ignited.","","True","CH1_LearnSmith_8","",""
"Scripts/Content/Story/Log_Constants.d:149","Das glühende Roheisen muss nun auf dem Amboss zu einer Schwertklinge geschmiedet werden. Allerdings brauche ich dazu einen Schmiedehammer.","The glowing raw iron must now be forged on the stake to become a sword blade. However, I need a blacksmith's hammer to do so.","","True","CH1_LearnSmith_9","",""
"Scripts/Content/Story/Log_Constants.d:150","Die glühende Schwertklinge muss in einem Wassereimer abgekühlt und gehärtet werden. Wenigstens brauche ich dafür nicht wieder ein neues Werkzeug.","The glowing sword blade needs to be cooled and hardened in a bucket of water. At least I don't need a new tool to do that.","","True","CH1_LearnSmith_10","",""
"Scripts/Content/Story/Log_Constants.d:152","Zuletzt muss die abgekühlte Klinge am Schleifstein geschliffen werden.","Finally, the cooled blade must be sharpened on the millstone.","","True","CH1_LearnSmith_11","",""
"Scripts/Content/Story/Log_Constants.d:152","Unglaublich, ich habe meine erste Waffe geschmiedet!","Incredible, I've forged my first weapon!","","True","CH1_LearnSmith_12","",""
"Scripts/Content/Story/Log_Constants.d:153","Gotmar hat heute keine Zeit, mir die Herstellung eines besseren Schwertes beizubringen. Ich sollte ihn an einem anderen Tag nochmal aufsuchen.!","Gotmar doesn't have time today to teach me how to make a better sword. I should go see him again some other day!","","True","CH1_LearnSmith_13","",""
"Scripts/Content/Story/Log_Constants.d:154","Gotmar will mir die Herstellung von Langschwertern zeigen, wenn ich ihm etwas zur Hand gehe. Er will 5 Kurzschwerter von mir haben.","Gotmar wants to show me how to make long swords if I give him a hand. He wants 5 short swords from me.","","True","CH1_LearnSmith_14","",""
"Scripts/Content/Story/Log_Constants.d:155","Gerne würde ich das Schmieden von noch besseren Schwertern lernen, aber Gotmar hat heute zu viel zu tun. Ich sollte ihn an einem späteren Tag nochmal aufsuchen!","I'd like to learn how to forge even better swords, but Gotmar is too busy today. I should go see him again later!","","True","CH1_LearnSmith_15","",""
"Scripts/Content/Story/Log_Constants.d:156","Gotmar hat eingewilligt, mir zu zeigen, wie man Breitschwerter herstellt. Allerdings soll ich ihm einen Gefallen tun und seinen ehemaligen Schmiedegehilfen Goliath dazu überreden, die Arbeit in der Schmiede wieder aufzunehmen!","Gotmar has agreed to show me how to make broad swords. However, I should do him a favor and convince his former assistant, Goliath, to resume work in the smithy!","","True","CH1_LearnSmith_16","",""
"Scripts/Content/Story/Log_Constants.d:157","Der Schmied war sehr erfreut darüber, dass sein Gehilfe Goliath die Arbeit wieder aufgenommen hat. Er will mir jetzt das Schmieden eines noch besseren Schwertes zeigen.","The smith was very pleased that his assistant Goliath has taken up work again. Now he wants to show me how to forge an even better sword.","","True","CH1_LearnSmith_17","",""
"Scripts/Content/Story/Log_Constants.d:158","Ich habe alles gelernt, was Gotmar mir beibringen kann. Um bessere Waffen herzustellen, muß ich den Schmied in der Felsenfestung aufsuchen.","I've learned everything Gotmar can teach me. To make better weapons, I have to go to the smith in the rock fort.","","True","CH1_LearnSmith_18","",""
"Scripts/Content/Story/Log_Constants.d:159","Goliath lässt sich nicht von seinem neuen Lebensweg abbringen. Zumindest nicht, solange er als Gladiator erfolgreich ist... .","Goliath cannot be deterred from his new path of life. At least not as long as he is successful as a gladiator ...","","True","CH1_LearnSmith_19","",""
"Scripts/Content/Story/Log_Constants.d:162","Ich konnte Goliath doch tatsächlich davon überzeugen, dass seine Zukunft nicht in der Arena liegt. Ich bin gespannt, was Gotmar dazu sagen wird.","I was able to convince Goliath that his future wasn't in the arena. I can't wait to see what Gotmar will say about that.","","True","CH1_LearnSmith_20","",""
"Scripts/Content/Story/Log_Constants.d:163","Die Arena","The Arena","","True","CH1_Arena","",""
"Scripts/Content/Story/Log_Constants.d:163","Wenn ich als Gladiator	kämpfen	will, muß ich einen	der	anderen	Kämpfer	herausfordern und dann zum Arenameister	zurückkehren!","If I want to fight as a gladiator, I have to challenge one of the other fighters and then return to the master of the arena!","","True","CH1_Arena_1","",""
"Scripts/Content/Story/Log_Constants.d:164","Wenn ich als Gladiator	etwas Silber verdienen will, soll ich einen	der	anderen	Kämpfer	herausfordern und dann wieder mit dem Arenameister sprechen!","If I want to earn some silver as a gladiator, I'm supposed to challenge one of the other fighters and then talk to the master of the arena again!","","True","CH1_Arena_2","",""
"Scripts/Content/Story/Log_Constants.d:165","Ich habe das Angebot des Arenameisters, Gladiator zu werden, abgelehnt! Er	bot	mir	an,	es mir nochmal zu überlegen.","I turned down the offer from the master of the arena to become a gladiator! He offered to change my mind.","","True","CH1_Arena_3","",""
"Scripts/Content/Story/Log_Constants.d:167","Der Arenameister wollte irgendeine	Bauernfängerei mit mir abziehen. Ich habe ihm eine Abfuhr erteilt!","The arena master wanted to take some farmhouse with me. I gave him a lift!","","True","CH1_Arena_4","",""
"Scripts/Content/Story/Log_Constants.d:167","Wenn ich selbst als Gladiator kämpfen will, muß ich abends	während	eines Arenakampfes mit dem Arenameister	reden.","If I want to fight as a gladiator myself, I have to talk to the master of the arena during an arena fight in the evening.","","True","CH1_Arena_5","",""
"Scripts/Content/Story/Log_Constants.d:168","Der Arenameister hat mich nun doch noch als Gladiator angenommen. Ich soll einen der anderen Kämpfer herausfordern und dann wieder mit ihm sprechen!","The master of the arena has accepted me as a gladiator after all. I'm supposed to challenge one of the other fighters and then talk to him again!","","True","CH1_Arena_6","",""
"Scripts/Content/Story/Log_Constants.d:168","Es	gibt strenge Regeln	für	den	Arenakampf.	Regel 1: Kein Töten	in der Arena,	Regel 2: Weder Bögen, noch Armbrüste in	der	Arena,	 Regel 3: Finger weg von der Waffe des anderen Gladiators,	 Regel 4: Wer die Regeln verletzt verliert den Kampf und das Preisgeld!","There are strict rules for the arena fight. Rule 1: No killing in the arena, Rule 2: No bows, no crossbow in the arena, Rule 3: Keep your fingers off the other gladiator's weapon, Rule 4: Whoever violates the rules loses the fight and the prize money!","","True","CH1_Arena_7","",""
"Scripts/Content/Story/Log_Constants.d:169","Ein Kampf läuft folgendermassen ab: Es	wird solange gekämpft, bis einer der Gladiatoren zu	Boden geht und damit einen Punkt macht.	Wer	zuerst 5 Punkte hat, hat gewonnen.	Erreicht niemand 5 Punkte,	behält der Arenameister	beide Preisgelder und der Kampf	ist	unentschieden!","A fight is fought as follows: It is fought until one of the gladiators lands and scores a point. Whoever gets 5 points first wins. If no one gets 5 points, the master of the arena keeps both prizes and the fight is undecided!","","True","CH1_Arena_8","",""
"Scripts/Content/Story/Log_Constants.d:171","Heute habe	ich	den	ersten Sieg	in einem Arenakampf	errungen. Um in	der	Rangliste weiter aufzusteigen brauche ich allerdings noch mehr Siege.","Today I won my first battle in an arena. However, I need more victories to get my rank.","","True","CH1_Arena_9","",""
"Scripts/Content/Story/Log_Constants.d:172","Mein heutiger Sieg	brachte	mich auf Platz 4 der Rangliste.	Bisher ist mir der Erfolg treu geblieben, hoffentlich ist das auch weiterhin der Fall.","My victory today put me on the fourth place in the rankings. So far, my success has been faithful, and I hope it will continue to be so.","","True","CH1_Arena_10","",""
"Scripts/Content/Story/Log_Constants.d:174","Der letzte	Kampf hat mich auf den dritten Platz der Rangliste vorgeschoben. Es	geht voran!","The last fight put me on the third place in the rankings. It's up!","","True","CH1_Arena_11","",""
"Scripts/Content/Story/Log_Constants.d:174","Ab	heute bin ich die Nummer 2 unter den Gladiatoren. Nur noch wenige Siege	trennen	mich vom Titel des Champions!","From now on, I'm the number 2 among the gladiators. Only a few victories will separate me from the title of champion!","","True","CH1_Arena_12","",""
"Scripts/Content/Story/Log_Constants.d:177","Ich habe einen	der	Gladiatoren	zu meinem ersten Arenakampf	herausgefordert. Heute abend wird sich zeigen, wie gut ich wirklich	bin!","I challenged one of the gladiators to my first arena fight. Tonight it will show how good I really am!","","True","CH1_Arena_13","",""
"Scripts/Content/Story/Log_Constants.d:178","Der Weg zum Alchemisten","The Way to the Alchemist","","True","CH1_LearnAlchemy","",""
"Scripts/Content/Story/Log_Constants.d:178","Talamon, einer der Heiler im Krankenviertel scheint sich mit magischen Tränken zu beschäftigen. Er will sich allerdings nicht die Zeit nehmen, um mir seine Kunst zu vermitteln.","Talamon, one of the healers in the sick quarter, seems to be busy with magic potions. However, he won't take the time to teach me his art.","","True","CH1_LearnAlchemy_1","",""
"Scripts/Content/Story/Log_Constants.d:179","Ich habe Talamon zugesagt, die Rezeptur für ein Mittel zu suchen, dass den Verstand der Kranken für kurze Zeit aufklärt. Er versprach mir, danach hilfsbereit zu sein!","I agreed to Talamon to find the recipe for a remedy that would briefly illuminate the minds of the sick. He promised to be of service afterwards!","","True","CH1_LearnAlchemy_2","",""
"Scripts/Content/Story/Log_Constants.d:181","Gordian könnte etwas über diese Rezeptur wissen. Er hat eine Hütte am Marktplatz.","Gordian might know something about this recipe. He has a hut on the marketplace.","","True","CH1_LearnAlchemy_3","",""
"Scripts/Content/Story/Log_Constants.d:181","Talamon war sehr erfreut, daß ich die Rezeptur gefunden habe. Er wird sich jetzt Zeit für mich nehmen, so wie er es versprochen hatte.","Talamon was very pleased that I found the recipe. He will now take time for me, just as he promised.","","True","CH1_LearnAlchemy_4","",""
"Scripts/Content/Story/Log_Constants.d:182","Ich benötige zuerst eine Abschrift von Talamons Alchemiebuch. Gordian, der Schreiber im Händlerviertel kann diese anfertigen.","First I need a copy of Talamon's alchemy book. Gordian, the scribe in the merchant district, can make it.","","True","CH1_LearnAlchemy_5","",""
"Scripts/Content/Story/Log_Constants.d:184","Die nötigen Reagenzien für den einfachen Heiltrank sind reiner Alkohol, Bergmoos und Orkblatt. All das kann ich beim Heiler Isgar im Händlerviertel erwerben.","The reagents needed for the simple healing potion are pure alcohol, mountain moss and orcish leaf. I can buy all of these from the healer Isgar in the merchant district.","","True","CH1_LearnAlchemy_6","",""
"Scripts/Content/Story/Log_Constants.d:185","Ich weiss nun, wie man einfache Heiltränken herstellt!","I know how to make simple healing potions now!","","True","CH1_LearnAlchemy_7","",""
"Scripts/Content/Story/Log_Constants.d:186","Talamon kann mir nichts mehr beibringen, ich muss mir einen anderen Lehrer suchen!","Talamon can't teach me anything else. I'll have to find another teacher!","","True","CH1_LearnAlchemy_8","",""
"Scripts/Content/Story/Log_Constants.d:186","Ich komme auf der Suche nach der Rezeptur für Talamon langsam weiter. Lester hat sie an Agon im Händlerviertel verkauft.","I'm slowly moving on in my search for the recipe for Talamon. Lester sold it to Agon in the merchant district.","","True","CH1_LearnAlchemy_9","",""
"Scripts/Content/Story/Log_Constants.d:187","Gordian war keine grosse Hilfe. Er suchte erfolglos nach Hinweisen in der Bibliothek des Magierhauses. Aber vielleicht hat er etwas übersehen.","Gordian wasn't much help. He searched the library of the house of the magicians for clues, but he couldn't find any. But maybe he overlooked something.","","True","CH1_LearnAlchemy_10","",""
"Scripts/Content/Story/Log_Constants.d:189","Agon hat mir die Rezeptur für 500 Silber zum Kauf angeboten. Das ist Wucher. Ich sollte Talamon davon berichten.","Agon offered to buy the recipe for 500 pieces of silver. That's a good thing. I should tell Talamon about it.","","True","CH1_LearnAlchemy_11","",""
"Scripts/Content/Story/Log_Constants.d:191","Ich konnte die Rezeptur dem Händler Agon für sehr viel Silber abkaufen. Ich hoffe sie ist es wert.","I was able to buy the recipe from the merchant Agon for a lot of silver. I hope it's worth it.","","True","CH1_LearnAlchemy_12","",""
"Scripts/Content/Story/Log_Constants.d:192","Agon verlangt einen sehr hohen Preis für die Rezeptur. Ich habe ihn vertröstet und sollte am besten nochmal mit Talamon sprechen.","Agon demands a very high price for the recipe. I trusted him and I should talk to Talamon again.","","True","CH1_LearnAlchemy_13","",""
"Scripts/Content/Story/Log_Constants.d:193","Der Weg zum Koch","The Way to the Chef","","True","CH1_LearnCooking","",""
"Scripts/Content/Story/Log_Constants.d:194","Ich glaube, jetzt habe ich wirklich genug Unruhe unter Halvor's Kundschaft gestiftet. Die ersten Milizsoldaten gehen schon.","I think I've stirred up enough trouble among Halvor's customers now. The first militia soldiers are already leaving.","","True","CH1_LearnCooking_1","",""
"Scripts/Content/Story/Log_Constants.d:195","Mit dem neuen Rezept werden bei Snaf schon bald wieder die Leute Schlange stehen.","Snaf will soon have people waiting for the new recipe.","","True","CH1_LearnCooking_2","",""
"Scripts/Content/Story/Log_Constants.d:195","Ich fürchte Halvor's Eintopf wird heute nicht besonders gut schmecken... . Die Leute werden in Scharen zu Snaf überlaufen.","I'm afraid Halvor's stew won't taste very good today ... . People will flock to Snaf in crowds.","","True","CH1_LearnCooking_3","",""
"Scripts/Content/Story/Log_Constants.d:196","Es ist schon einmal vorgekommen, dass ein Milizsoldat Halvor's Fleischeintopf aus Spass ungeniesbar machte. Talamon der Alchemist, hat offensichtlich eine ganze Auswahl an Pülverchen für alle möglichen Zwecke!","It has happened before that a militia soldier made Halvor's stew unfit for pleasure. Talamon the alchemist obviously has a whole range of pickpockets for all sorts of purposes!","","True","CH1_LearnCooking_4","",""
