"location","source","target","id","fuzzy","context","translator_comments","developer_comments"
"Scripts/Content/Story/Missions/DIA_POS_600_Jurgi.d:48","Wohl denen die da gehen und sehen, denn sie sind es...äh..sie sind es...die sehen!","Cieszą się, że tam idą i widzą, bo to oni... hej... to oni... widzą!","","True","POS_600_CRAZY_00_01","",""
"Scripts/Content/Story/Missions/DIA_POS_600_Jurgi.d:56","Wahrlich ich sage dir ein Mann der ein Haus baut  ist ein Mann der...äh...Dinge hat,","Mówię ci prawdę: człowiek budujący dom to człowiek, który... hej...","","True","POS_600_CRAZY_00_02","",""
"Scripts/Content/Story/Missions/DIA_POS_600_Jurgi.d:57","die er braucht, er braucht diese Dinge, denn ohne diese Dinge äh...hat er sie nicht.","potrzebuje tych rzeczy, bo bez nich... nie ma ich.","","True","POS_600_CRAZY_00_03","",""
"Scripts/Content/Story/Missions/DIA_POS_600_Jurgi.d:65","Denn der Himmel öffnete sich und das Wasser ergoss sich über die Häupter von...","Niebo się otworzyło, a woda rozpłynęła się nad głowy...","","True","POS_600_CRAZY_00_04","",""
"Scripts/Content/Story/Missions/DIA_POS_600_Jurgi.d:66","äh...allen die gesehen hatten...äh,...wie sie gingen und woher sie kamen.","Eee... wszyscy, którzy widzieli... Eee... jak się stąd wydostali i skąd przybyli.","","True","POS_600_CRAZY_00_05","",""
"Scripts/Content/Story/Missions/DIA_POS_600_Jurgi.d:74","Und sie hatten kleine Truhen mit noch kleineren Schachteln, in denen die winzigkleinen ...","A mieli też małe skrzynie z jeszcze mniejszymi skrzyniami, w których te małe...","","True","POS_600_CRAZY_00_06","",""
"Scripts/Content/Story/Missions/DIA_POS_600_Jurgi.d:75","wirklich wirklich winzigkleinen Dinge lagen, mit denen eigentlich niemand so recht wußte...","rzeczy, które nikt nie znał...","","True","POS_600_CRAZY_00_07","",""
"Scripts/Content/Story/Missions/DIA_POS_600_Jurgi.d:76","was er sagen wollte...äh...sie waren sehr klein - Winzig.","co chciał powiedzieć... Eee... Były bardzo małe - bardzo drobne.","","True","POS_600_CRAZY_00_08","",""
"Scripts/Content/Story/Missions/DIA_POS_600_Jurgi.d:84","Und der Himmel wird sich blutrot färben und die Herrscharen werden kommen auf Rössern die schwarz wie die Nacht sind!","A niebo będzie czerwone, a rządzący będą przychodzić na szatach, czarnych jak noc!","","True","POS_600_CRAZY_00_09","",""
"Scripts/Content/Story/Missions/DIA_POS_600_Jurgi.d:85","Und es wird eine große Not unter denen geben die nicht ...äh... diese kleinen Truhen haben.","A będzie wielki problem z tymi, którzy nie mają... no... tych małych skrzyń.","","True","POS_600_CRAZY_00_10","",""
"Scripts/Content/Story/Missions/DIA_POS_600_Jurgi.d:93","Wahrlich ich frage dich : Was nützt ein Brunnen ohne Wasser? Was ist ein Vogel der nicht fliegt?","Naprawdę cię pytam: co z tego, że brzina bez wody? Co to za ptaszek, który nie lata?","","True","POS_600_CRAZY_00_11","",""
"Scripts/Content/Story/Missions/DIA_POS_600_Jurgi.d:94","Aha! Also frage dich selber warum und vor allem  WAS in diesen kleinen Truhen ist...äh....","Aha! Zapytaj siebie, dlaczego i co jest w tych skrzyńcach... Eee...","","True","POS_600_CRAZY_00_12","",""
"Scripts/Content/Story/Missions/DIA_POS_601_Paskara.d:50","Ist das Leben nicht beschissen?","Czyż to nie jest życie gorsze?","","True","POS_601_CRAZY_00_01","",""
"Scripts/Content/Story/Missions/DIA_POS_601_Paskara.d:58","Das Leben ist nur eine Qual bis zum Tod. Und danach kommt nichts mehr.","Życie to tylko męczarnia, która prowadzi do śmierci. A po tym nic nie ma.","","True","POS_601_CRAZY_00_02","",""
"Scripts/Content/Story/Missions/DIA_POS_601_Paskara.d:66","Alles vergeht. Alles verschimmelt. Alles verdorrt. Alles leidet. Alles stirbt.","Wszystko się znika. Wszystko się zgubi. Wszystko się wysusza. Wszystko cierpi. Wszystko umiera.","","True","POS_601_CRAZY_00_03","",""
"Scripts/Content/Story/Missions/DIA_POS_601_Paskara.d:74","Dasein des Schmerzes    Tot geborener Mensch","Istnienie bólu z martwego urodzenia","","True","POS_601_CRAZY_00_04","",""
"Scripts/Content/Story/Missions/DIA_POS_601_Paskara.d:82","Kaltes Fleisch         Geqäulter Geist       Tote Seele","Mroźne mięso, zmęczony duch, martwa dusza","","True","POS_601_CRAZY_00_05","",""
"Scripts/Content/Story/Missions/DIA_POS_602_Halbert.d:51","Des Tages Licht ist meine Agonie.","Światło dnia to moja agonia.","","True","POS_602_CRAZY_00_01","",""
"Scripts/Content/Story/Missions/DIA_POS_602_Halbert.d:60","Der Tag ist eine ewige Qual.","To wieczny tortur.","","True","POS_602_CRAZY_00_02","",""
"Scripts/Content/Story/Missions/DIA_POS_602_Halbert.d:69","Stunde um Stunde Schmerz um Schmerz.","Główną godzinę, ból za bólem.","","True","POS_602_CRAZY_00_03","",""
"Scripts/Content/Story/Missions/DIA_POS_602_Halbert.d:78","Siehst du die Sternbilder?","Widzisz te gwiazdy?","","True","POS_602_CRAZY_00_04","",""
"Scripts/Content/Story/Missions/DIA_POS_602_Halbert.d:79","Sie waren schon da bevor wir waren und sie werden immer sein, wenn wir längst vergangen sind","Byli tam już przed nami i będą, kiedy już dawno nam się nie udało.","","True","POS_602_CRAZY_00_05","",""
"Scripts/Content/Story/Missions/DIA_POS_602_Halbert.d:88","Spürst du die Nacht? Sie währt bereits ewig und sieht niemals das Licht der Sonne.","Czujesz noc? Trwa już wieczność i nigdy nie widzi światła słońca.","","True","POS_602_CRAZY_00_06","",""
"Scripts/Content/Story/Missions/DIA_POS_602_Halbert.d:97","Fühlst du die Dunkelheit?","Czujesz ciemność?","","True","POS_602_CRAZY_00_07","",""
"Scripts/Content/Story/Missions/DIA_POS_602_Halbert.d:98","Sie ist überall, schön und friedlich. Aber die Dunkelheit in dir, nennst du Angst und Zweifel.","Jest wszędzie, piękna i spokojna. Ale ciemność w tobie nazywa się strachem i wątpliwością.","","True","POS_602_CRAZY_00_08","",""
"Scripts/Content/Story/Missions/DIA_POS_603_Gonker.d:50","Ist dir einer gefolgt?","Czy ktoś cię śledził?","","True","Pos_603_CRAZY_00_01","",""
"Scripts/Content/Story/Missions/DIA_POS_603_Gonker.d:59","Haben sie dich geschickt?","Przysyłali cię?","","True","Pos_603_CRAZY_00_02","",""
"Scripts/Content/Story/Missions/DIA_POS_603_Gonker.d:68","Sie sind hinter mir her, ich weiß es.","Szukają mnie, wiem.","","True","Pos_603_CRAZY_00_03","",""
"Scripts/Content/Story/Missions/DIA_POS_603_Gonker.d:77","Sie werden mich finden, sie finden jeden.","Znajdą mnie, znajdą każdego.","","True","Pos_603_CRAZY_00_04","",""
"Scripts/Content/Story/Missions/DIA_POS_603_Gonker.d:86","Hast du sie gesehen? Ich habe sie schon oft gesehen.","Widziałeś ich? Widziałem ich już wiele razy.","","True","Pos_603_CRAZY_00_05","",""
"Scripts/Content/Story/Missions/DIA_POS_603_Gonker.d:95","Sie kommen in der Nacht, wenn wir schlafen","Przychodzą w nocy, kiedy my śpiemy.","","True","Pos_603_CRAZY_00_06","",""
"Scripts/Content/Story/Missions/DIA_POS_603_Gonker.d:104","Irgendwann kriegen sie dich und dann nehmen sie dich mit.","Pewnego dnia cię złapią, a potem zabiorą.","","True","Pos_603_CRAZY_00_07","",""
"Scripts/Content/Story/Missions/DIA_POS_603_Gonker.d:113","Sie stecken dich in einen Käfig und fügen dir Schmerzen zu.","Wsadzą cię w klatkę i zadają ci ból.","","True","Pos_603_CRAZY_00_08","",""
"Scripts/Content/Story/Missions/DIA_POS_603_Gonker.d:122","Sie machen schreckliche Dinge mit dir. Sie qäulen dich.","Zdziałają z tobą straszliwe rzeczy. Złapią cię.","","True","Pos_603_CRAZY_00_09","",""
"Scripts/Content/Story/Missions/DIA_POS_603_Gonker.d:129","Ich war schon bei ihnen, aber ich bin ihnen entkommen!","Byłem już z nimi, ale uciekłem!","","True","Pos_603_CRAZY_00_10","",""
"Scripts/Content/Story/Missions/DIA_POS_603_Gonker.d:138","Wenn sie mich noch einmal erwischen, werden sie mich töten.","Jeśli mnie jeszcze raz złapią, zabiją mnie.","","True","Pos_603_CRAZY_00_11","",""
"Scripts/Content/Story/Missions/DIA_POS_603_Gonker.d:147","Es sind viele. sie sind überall und sie beobachten alles.","Jest ich wielu. Są wszędzie i obserwują wszystko.","","True","Pos_603_CRAZY_00_12","",""
"Scripts/Content/Story/Missions/DIA_POS_604_Possessed.d:51","Nein, nein geht weg, geht alle weg!","Nie, nie, wynocha, wynocha!","","True","POS_604_CRAZY_00_01","",""
"Scripts/Content/Story/Missions/DIA_POS_604_Possessed.d:59","Lasst mich in Ruhe, verschwindet!","Zostaw mnie w spokoju, wynoś się!","","True","POS_604_CRAZY_00_02","",""
"Scripts/Content/Story/Missions/DIA_POS_604_Possessed.d:67","AUUUUUUUUUU !!!!","Aaaah!","","True","POS_604_CRAZY_00_03","",""
"Scripts/Content/Story/Missions/DIA_POS_604_Possessed.d:75","Was wollt ihr denn, ich habe euch nichts getan!","Czego chcecie? Nic wam nie zrobiłem!","","True","POS_604_CRAZY_00_04","",""
"Scripts/Content/Story/Missions/DIA_POS_604_Possessed.d:83","Seid still, oh dieser schreckliche Lärm!","Zamknij się, ty straszny hałas!","","True","POS_604_CRAZY_00_05","",""
"Scripts/Content/Story/Missions/DIA_POS_604_Possessed.d:91","(schreit)  RUHE RUHE ICH SAGTE RUUUUUUUHHÄÄÄÄÄÄÄÄ !!!!","RUUUUUUUUUUUUUUUUUUUUUUUUUUUUUUUUUUUUUUUUUUUUUUUUUUUUUUUUUUUUUUUUUUUUUUUUUUUUUUUUUUUUUUUUUUUUUUUUUUUUUUUUUUUUUUUUUUUUUUUUUUUUUUUUUUUUUUUUUUUUUUUUUUUUUUUUUUUUUUUUUUUUUUUUUUUUUUUUUUUUUUUUUUUUUUUUUUUUUUUUUUUUUUUUUUUUUUUUUUUUUUUUUUUUUUUUUUUUUUUUUUUUUUUUUU","","True","POS_604_CRAZY_00_06","",""
"Scripts/Content/Story/Missions/DIA_POS_605_Bartok.d:52","Glühende Funkengischt erhellt die Nacht, die Funken tanzen in den Himmel,","Jasna żarnia rozświetla noc, żarcie tańczą w niebie,","","True","POS_605_CRAZY_02_01","",""
"Scripts/Content/Story/Missions/DIA_POS_605_Bartok.d:53","stählerner Stab zu tödlichen Instrument geformt im Feuer des Lebens.","stalku stalowego, który stał się śmiertelnym narzędziem w ogniu życia.","","True","POS_605_CRAZY_02_02","",""
"Scripts/Content/Story/Missions/DIA_POS_605_Bartok.d:61","Blitzende Klinge schlitzt Bäuche, trennt Köpfe, zerteilt Leiber. Im Namen eines Grafen, eines Hauptmanns, eines Rates.","Mieć błyskawiczne wyciąga brzuchy, rozdziela głowy, rozdziela ciała. W imię hrabiego, kapitana, rady.","","True","POS_605_CRAZY_02_03","",""
"Scripts/Content/Story/Missions/DIA_POS_605_Bartok.d:62","Im Namen eines Gottes...","W imię boga...","","True","POS_605_CRAZY_02_04","",""
"Scripts/Content/Story/Missions/DIA_POS_605_Bartok.d:70","Faulender Körper tausendfach Gestank. Würmer kriechen durch knochige Höhlen,","Łajdak śmierdzi tysiąc razy gorzej. Cwury pełzają się przez jaskinie,","","True","POS_605_CRAZY_02_05","",""
"Scripts/Content/Story/Missions/DIA_POS_605_Bartok.d:71","wo Geier die leckeren Augen stibizt haben, mit ihren krummen Schnäbeln.","gdzie zębały zęby z zakręconymi brzytwami.","","True","POS_605_CRAZY_02_06","",""
"Scripts/Content/Story/Missions/DIA_POS_605_Bartok.d:79","Siegesfeier ohne Freude. Gelächter hohl und leer. Der Wein schmeckt nach geronnenem Blut.","Zwycięstwo bez radości. Śmiech pusty i pusty. Wino smakuje jak krwi z krwiopijców.","","True","POS_605_CRAZY_02_07","",""
"Scripts/Content/Story/Missions/DIA_POS_605_Bartok.d:80","Wenn der Hass triumphiert, ertrinkt die Liebe in ihren eigenen Tränen.","Kiedy nienawiść zwycięża, miłość zatopi się w swoich łzach.","","True","POS_605_CRAZY_02_08","",""
"Scripts/Content/Story/Missions/DIA_POS_605_Bartok.d:104","Wie geht es dir, Schmied?","Jak się masz, kowalzu?","","True","Info_Bartok_HOWDY.description","",""
"Scripts/Content/Story/Missions/DIA_POS_605_Bartok.d:119","Wie geht es dir, Schmied?","Jak się masz, kowalzu?","","True","Info_Bartok_HOWDY_15_01","",""
"Scripts/Content/Story/Missions/DIA_POS_605_Bartok.d:120","(verrückt) SIE werden uns alle holen.. aieehhhhh","Oni nas wszystkich przyjmą... Aaaahhhhh","","True","Info_Bartok_HOWDY_02_02","",""
"Scripts/Content/Story/Missions/DIA_POS_605_Bartok.d:121","Ähh... ja, natürlich!","Eee... tak, oczywiście!","","True","Info_Bartok_HOWDY_15_03","",""
"Scripts/Content/Story/Missions/DIA_POS_605_Bartok.d:122","(verrückt) SIE werden uns mit ihrer Unreitheit überziehen... ouhhlll","Oni nas załapią swoją niegrzecznością... oughhhh","","True","Info_Bartok_HOWDY_02_04","",""
"Scripts/Content/Story/Missions/DIA_POS_605_Bartok.d:123","Völlig...ahem... logisch!","Całkiem... Aem... logicznie!","","True","Info_Bartok_HOWDY_15_05","",""
"Scripts/Content/Story/Missions/DIA_POS_605_Bartok.d:135","Wen meinst du mit SIE?","Kogo masz na myśli?","","True","Info_Bartok_WHO.description","",""
"Scripts/Content/Story/Missions/DIA_POS_605_Bartok.d:150","Wen meinst du mit SIE?","Kogo masz na myśli?","","True","Info_Bartok_WHO_15_01","",""
"Scripts/Content/Story/Missions/DIA_POS_605_Bartok.d:151","(verrückt) SIE jagen mich in meinen Träumen... arghhhh","Oni mnie ścigają w moich snach... arghhhh","","True","Info_Bartok_WHO_02_02","",""
"Scripts/Content/Story/Missions/DIA_POS_605_Bartok.d:152","WER, verdammt nochmal? WER???","KTO, do diabła? KTO???","","True","Info_Bartok_WHO_15_03","",""
"Scripts/Content/Story/Missions/DIA_POS_605_Bartok.d:153","(verrückt) Bald werden SIE überall sein.... (sabbel)","Wkrótce będą wszędzie... (głupie)","","True","Info_Bartok_WHO_02_04","",""
"Scripts/Content/Story/Missions/DIA_POS_605_Bartok.d:165","Du hast einen Schlüssel, den ich gerne haben würde!","Masz klucz, który chciałbym mieć!","","True","Info_Bartok_KEY.description","",""
"Scripts/Content/Story/Missions/DIA_POS_605_Bartok.d:180","Du hast einen Schlüssel, den ich gerne haben würde!","Masz klucz, który chciałbym mieć!","","True","Info_Bartok_KEY_15_01","",""
"Scripts/Content/Story/Missions/DIA_POS_605_Bartok.d:181","(verrückt) SIE kommen... dlblgldl... hörst du SIE auch, hörst du SIE kommen?","Oni przychodzą... Dlblgldl... Słyszycie ich też?","","True","Info_Bartok_KEY_02_02","",""
"Scripts/Content/Story/Missions/DIA_POS_605_Bartok.d:182","Nochmal zurück zum Schlüssel...","Wróćmy do klucza...","","True","Info_Bartok_KEY_15_03","",""
"Scripts/Content/Story/Missions/DIA_POS_605_Bartok.d:183","(nachdenklich) Schlüssel ?","Klucz?","","True","Info_Bartok_KEY_02_04","",""
"Scripts/Content/Story/Missions/DIA_POS_605_Bartok.d:184","(hoffnungsvoll) JA... Genau... der Schlüssel!!!","Tak... Dokładnie... klucz!!!","","True","Info_Bartok_KEY_15_05","",""
"Scripts/Content/Story/Missions/DIA_POS_605_Bartok.d:185","(verrückt) SIE werden uns in ein tiefes Verlies sperren und den Schlüssel wegwerfen... ich weiss es, ich weiss es...","Oni zamkną nas w głębokim ślepku i wrzucą klucz... Wiem, wiem...","","True","Info_Bartok_KEY_02_06","",""
"Scripts/Content/Story/Missions/DIA_POS_605_Bartok.d:186","(zu sich selbst) Ich geb's auf, der ist ja völlig durchgeknallt.","Nie chcę się wtrącać, to jeden z największych szalonych.","","True","Info_Bartok_KEY_15_07","",""
