"location","source","target","id","fuzzy","context","translator_comments","developer_comments"
"Scripts/Content/Story/Missions/DIA_THF_403_Gerion.d:216","Das wichtigste ist, sein Körpergewicht optimal zu verteilen.","La cosa più importante è distribuire il peso del corpo in modo ottimale.","","True","THF_403_LEARNSNEAK_11_02","",""
"Scripts/Content/Story/Missions/DIA_THF_403_Gerion.d:217","Dann hast du den Boden besser im Blick und deinen Körper besser unter Kontrolle.","Così avrai meglio la vista nel terreno e il controllo del tuo corpo.","","True","THF_403_LEARNSNEAK_11_03","",""
"Scripts/Content/Story/Missions/DIA_THF_403_Gerion.d:218","Wenn du schleichst hört dich zwar niemand, aber du bist nicht unsichtbar. Paß auf, daß dich keiner beobachtet.","Se ti fai a sgattersi, nessuno ti sente, ma non sei invisibile. Fai attenzione a non farti sorvegliare.","","True","THF_403_LEARNSNEAK_11_04","",""
"Scripts/Content/Story/Missions/DIA_THF_403_Gerion.d:219","Wenn jemand dich herumschleichen sieht, wird er dich im Auge behalten!","Se qualcuno ti vede furtivamente, ti terrà d'occhio!","","True","THF_403_LEARNSNEAK_11_05","",""
"Scripts/Content/Story/Missions/DIA_THF_403_Gerion.d:220","Ich hab 'ne kleine Aufgabe für dich.","Ho un piccolo compito per te.","","True","THF_403_LEARNSNEAK_11_06","",""
"Scripts/Content/Story/Missions/DIA_THF_403_Gerion.d:221","Im Haus der Erzbarone, im Obergeschoß gibt es einen Schlafraum. Dort liegt irgendwo ein Schlüssel. Den brauche ich.","C'è una camera da letto nella casa dei baroni delle miniere, al piano superiore. C'è una chiave da qualche parte lì. Mi serve.","","True","THF_403_LEARNSNEAK_11_07","",""
"Scripts/Content/Story/Missions/DIA_THF_403_Gerion.d:222","Klingt einfach.","Sembra semplice.","","True","THF_403_LEARNSNEAK_15_08","",""
"Scripts/Content/Story/Missions/DIA_THF_403_Gerion.d:223","Ist es auch! Osbert bewacht zwar den Raum, aber du weisst ja jetzt, wie du unbemerkt an ihm vorbeikommst.","È vero! Osbert sorveglia la stanza, ma ora sai come passare da lui senza che qualcuno lo sappia.","","True","THF_403_LEARNSNEAK_11_09","",""
"Scripts/Content/Story/Missions/DIA_THF_403_Gerion.d:266","Hast du den Schlüssel schon?","Hai già la chiave?","","True","THF_403_KEYRUNNING_11_01","",""
"Scripts/Content/Story/Missions/DIA_THF_403_Gerion.d:267","Wenn du an Osbert vorbeischleichst, sollte das kein Problem sein.","Se ti avvicini a Osbert, non dovrebbe esserci alcun problema.","","True","THF_403_KEYRUNNING_11_02","",""
"Scripts/Content/Story/Missions/DIA_THF_403_Gerion.d:279","Ich habe den Schlüssel","Ho la chiave.","","True","THF_403_Gerion_GOTKEY.description","",""
"Scripts/Content/Story/Missions/DIA_THF_403_Gerion.d:295","Ich habe den Schlüssel.","Ho la chiave.","","True","THF_403_GOTKEY_15_01","",""
"Scripts/Content/Story/Missions/DIA_THF_403_Gerion.d:297","Gute Arbeit! Vielleicht wird aus dir noch ein richtig guter Dieb.","Bel lavoro! Forse diventerai un buon ladro.","","True","THF_403_GOTKEY_11_02","",""
"Scripts/Content/Story/Missions/DIA_THF_403_Gerion.d:298","Ich kann dir noch etwas über TASCHENDIEBSTAHL und SCHLÖSSER KNACKEN beibringen.","Posso insegnarti qualcos'altro su STAGGI e STAGGI DI SCHIE.","","True","THF_403_GOTKEY_11_03","",""
"Scripts/Content/Story/Missions/DIA_THF_403_Gerion.d:316","Wegen dem Schlüssel...","Riguardo alla chiave...","","True","THF_403_Gerion_SNEAKFAILED.description","",""
"Scripts/Content/Story/Missions/DIA_THF_403_Gerion.d:332","Wegen dem Schlüssel...","Riguardo alla chiave...","","True","THF_403_SNEAKFAILED_15_01","",""
"Scripts/Content/Story/Missions/DIA_THF_403_Gerion.d:333","Hast du ihn?","L'hai preso?","","True","THF_403_SNEAKFAILED_11_02","",""
"Scripts/Content/Story/Missions/DIA_THF_403_Gerion.d:334","Osbert hat ihn mir abgenommen.","Osbert me l'ha preso.","","True","THF_403_SNEAKFAILED_15_03","",""
"Scripts/Content/Story/Missions/DIA_THF_403_Gerion.d:335","Dann sehe ich jetzt drei Möglichkeiten.","Allora vedo tre possibilità.","","True","THF_403_SNEAKFAILED_11_04","",""
"Scripts/Content/Story/Missions/DIA_THF_403_Gerion.d:336","Und welche?","E quali?","","True","THF_403_SNEAKFAILED_15_05","",""
"Scripts/Content/Story/Missions/DIA_THF_403_Gerion.d:337","Wir könnten die ganze Sache einfach vergessen und Du schminkst dir ab, weitere Diebestalente zu lernen.","Potremmo dimenticarci tutto e tu ti fai da parte per imparare altre abilità di ladro.","","True","THF_403_SNEAKFAILED_11_06","",""
"Scripts/Content/Story/Missions/DIA_THF_403_Gerion.d:338","Du könntest Osbert auch niederschlagen und ihm den Schlüssel abnehmen. Das dürfte aber sehr schwierig werden!","Potresti anche picchiare Osbert e togliergli la chiave. Ma questo dovrebbe essere molto difficile!","","True","THF_403_SNEAKFAILED_11_07","",""
"Scripts/Content/Story/Missions/DIA_THF_403_Gerion.d:339","...oder?","...o no?","","True","THF_403_SNEAKFAILED_15_08","",""
"Scripts/Content/Story/Missions/DIA_THF_403_Gerion.d:340","Oder ich zeige dir den TASCHENDIEBSTAHL und du nimmst ihm den Schlüssel heimlich ab!","Oppure ti mostrerò il taschino e tu gli prenderai la chiave in segreto!","","True","THF_403_SNEAKFAILED_11_09","",""
"Scripts/Content/Story/Missions/DIA_THF_403_Gerion.d:342","Zeige mir den Taschendiebstahl","Mostrami come si fa a rubare tascabile.","","True","THF_403_Gerion_SNEAKFAILED_Info.THF_403_Gerion_SNEAKFAILED.THF_403_Gerion_SNEAKFAILED_PICKPOCK","AI_AddChoice",""
"Scripts/Content/Story/Missions/DIA_THF_403_Gerion.d:343","Ich werde Osbert niederschlagen","Sto per picchiare Osbert.","","True","THF_403_Gerion_SNEAKFAILED_Info.THF_403_Gerion_SNEAKFAILED.THF_403_Gerion_SNEAKFAILED_FIGHT","AI_AddChoice",""
"Scripts/Content/Story/Missions/DIA_THF_403_Gerion.d:344","Gut, vergessen wir die Sache","D'accordo, dimentichiamoci.","","True","THF_403_Gerion_SNEAKFAILED_Info.THF_403_Gerion_SNEAKFAILED.THF_403_Gerion_SNEAKFAILED_NEVERTHF","AI_AddChoice",""
"Scripts/Content/Story/Missions/DIA_THF_403_Gerion.d:349","Gut, vergessen wir die Sache.","D'accordo, dimentichiamoci.","","True","THF_403_SNEAKFAILED_NEVERTHF_15_01","",""
"Scripts/Content/Story/Missions/DIA_THF_403_Gerion.d:350","Als Dieb taugst du wirklich nicht viel! Besser du lernst etwas anderes.","Non sei molto bravo come ladro! Faresti meglio a imparare qualcos'altro.","","True","THF_403_SNEAKFAILED_NEVERTHF_11_02","",""
"Scripts/Content/Story/Missions/DIA_THF_403_Gerion.d:361","Ich werde Osbert niederschlagen","Sto per picchiare Osbert.","","True","THF_403_SNEAKFAILED_FIGHT_15_01","",""
"Scripts/Content/Story/Missions/DIA_THF_403_Gerion.d:362","Oder er Dich! Viel Glück! Wenn du es dir anders überlegst, sag mir Bescheid.","O lui a te! Buona fortuna! Se cambi idea, fammelo sapere.","","True","THF_403_SNEAKFAILED_FIGHT_11_02","",""
"Scripts/Content/Story/Missions/DIA_THF_403_Gerion.d:370","Zeig mir den Taschendiebstahl.","Mostrami come si fa a rubare tascabile.","","True","THF_403_SNEAKFAILED_PICKPOCK_15_01","",""
"Scripts/Content/Story/Missions/DIA_THF_403_Gerion.d:371","Das ist die Antwort eines Diebes! Wir können sofort anfangen, wenn du bereit bist.","È la risposta di un ladro! Possiamo cominciare subito quando sarai pronto.","","True","THF_403_SNEAKFAILED_PICKPOCK_11_02","",""
"Scripts/Content/Story/Missions/DIA_THF_403_Gerion.d:384","Ach... und nochwas!","Oh... e un'altra cosa!","","True","THF_403_BUYSWAREZ_1_11_01","",""
"Scripts/Content/Story/Missions/DIA_THF_403_Gerion.d:385","Was?","Cosa?","","True","THF_403_BUYSWAREZ_1_15_02","",""
"Scripts/Content/Story/Missions/DIA_THF_403_Gerion.d:386","Wenn du jemanden suchst, der dir organisierte Waren abnimmt... sprich mich an!","Se stai cercando qualcuno che ti prenda le merci... parla con me!","","True","THF_403_BUYSWAREZ_1_11_03","",""
"Scripts/Content/Story/Missions/DIA_THF_403_Gerion.d:387","Werde es im Hinterkopf behalten.","Lo terrò nella mia mente.","","True","THF_403_BUYSWAREZ_1_15_04","",""
"Scripts/Content/Story/Missions/DIA_THF_403_Gerion.d:426","Zeig mir den Taschendiebstahl.","Mostrami come si fa a rubare tascabile.","","True","THF_403_PICKPOCKET_1_15_01","",""
"Scripts/Content/Story/Missions/DIA_THF_403_Gerion.d:427","Die hohe Kunst der Diebe! Es ist viel riskanter einen Menschen zu bestehlen, als eine Truhe zu knacken.","L'alta arte dei ladri! Ripare un essere umano è molto più rischioso che aprire un forziere.","","True","THF_403_PICKPOCKET_1_11_02","",""
"Scripts/Content/Story/Missions/DIA_THF_403_Gerion.d:428","Du musst dich anschleichen, damit dein Opfer dich nicht bemerkt.","Devi avvicinarti per evitare che la tua vittima ti notasse.","","True","THF_403_PICKPOCKET_1_11_03","",""
"Scripts/Content/Story/Missions/DIA_THF_403_Gerion.d:429","Und paß auf, daß dich niemand beobachtet! Such dir jemanden aus, der alleine ist oder schläft.","E fai attenzione a non farti sorvegliare! Scegli qualcuno che sia solo o che dorma.","","True","THF_403_PICKPOCKET_1_11_04","",""
"Scripts/Content/Story/Missions/DIA_THF_403_Gerion.d:437","jetzt kannst du ja versuchen, Osbert den Schlüssel aus der Tasche zu nehmen.","Ora puoi cercare di prendere la chiave dalla tasca di Osbert.","","True","THF_403_PICKPOCKET_1_11_05","",""
"Scripts/Content/Story/Missions/DIA_THF_403_Gerion.d:438","Es wäre schlau es bei dem Schlüssel zu belassen. Je mehr du ihm wegnimmst, desto größer ist die Wahrscheinlichkeit, daß er dich erwischt!","Sarebbe saggio lasciarla con la chiave. Più gliela prendi, più probabilità ha di prenderti!","","True","THF_403_PICKPOCKET_1_11_06","",""
"Scripts/Content/Story/Missions/DIA_THF_403_Gerion.d:445","Wenn du dir noch was verdienen willst, hätte ich noch was zu tun für dich.","Se vuoi guadagnare qualcosa, ho un'altra cosa da fare per te.","","True","THF_403_PICKPOCKET_1_11_07","",""
"Scripts/Content/Story/Missions/DIA_THF_403_Gerion.d:446","Lass hören.","Fammi sentire.","","True","THF_403_PICKPOCKET_1_15_08","",""
"Scripts/Content/Story/Missions/DIA_THF_403_Gerion.d:447","Wylfern, ein Rekrut der Miliz, besitzt einen Ring. Der ist mir 250 Silberstücke wert.","Wylfern, un recluta della guardia cittadina, possiede un anello. Vale 250 pezzi d'argento.","","True","THF_403_PICKPOCKET_1_11_09","",""
"Scripts/Content/Story/Missions/DIA_THF_403_Gerion.d:448","Du solltest es versuchen, wenn Wylfern alleine ist!","Dovresti provarci quando Wolffern è solo!","","True","THF_403_PICKPOCKET_1_11_10","",""
"Scripts/Content/Story/Missions/DIA_THF_403_Gerion.d:472","Ich habe den Schlüssel!","Ho la chiave!","","True","THF_403_Gerion_SECONDCHANCE.description","",""
"Scripts/Content/Story/Missions/DIA_THF_403_Gerion.d:486","Ich habe den Schlüssel!","Ho la chiave!","","True","THF_403_SECONDCHANCE_15_01","",""
"Scripts/Content/Story/Missions/DIA_THF_403_Gerion.d:488","Na also. Du bist ja doch zu gebrauchen. Wenn du noch SCHLÖSSER KNACKEN lernen willst, bin ich dein Mann.","Beh, sei utile. Se vuoi imparare a FORMARE le serrature, io sono il tuo uomo.","","True","THF_403_SECONDCHANCE_11_02","",""
"Scripts/Content/Story/Missions/DIA_THF_403_Gerion.d:504","Ich habe Osbert niedergeschlagen. Hier ist der Schlüssel.","Ho battuto Osbert. Ecco la chiave.","","True","THF_403_Gerion_OSBERTDOWN.description","",""
"Scripts/Content/Story/Missions/DIA_THF_403_Gerion.d:522","Ich habe Osbert niedergeschlagen.","Ho battuto Osbert.","","True","THF_403_OSBERTDOWN_15_01","",""
"Scripts/Content/Story/Missions/DIA_THF_403_Gerion.d:524","Tatsächlich? Dir scheint ja der direkte Weg besser zu liegen als der elegante.","Davvero? Sembra che la via diretta sia più facile che quella elegante.","","True","THF_403_OSBERTDOWN_11_02","",""
"Scripts/Content/Story/Missions/DIA_THF_403_Gerion.d:525","Ich löse Probleme auf andere Art. Mit dem Kopf, nicht mit der Waffe.","Risolvo i problemi con un altro modo. Con la testa, non con l'arma.","","True","THF_403_OSBERTDOWN_11_03","",""
"Scripts/Content/Story/Missions/DIA_THF_403_Gerion.d:526","Zu einem guten Dieb gehört mehr, als nur das Aneignen von Besitz.","Un buon ladro non consiste solo nel possedere.","","True","THF_403_OSBERTDOWN_11_04","",""
"Scripts/Content/Story/Missions/DIA_THF_403_Gerion.d:561","Zeige mir, wie ich Schlösser öffnen kann.","Mostrami come aprire le serrature.","","True","THF_403_LOCKPICK_1_15_01","",""
"Scripts/Content/Story/Missions/DIA_THF_403_Gerion.d:562","Du brauchst auf jeden Fall Dietriche dazu.","In ogni caso, ti servono delle grimaldelli.","","True","THF_403_LOCKPICK_1_11_02","",""
"Scripts/Content/Story/Missions/DIA_THF_403_Gerion.d:563","Wenn du vorsichtig bist, wirst du weniger davon verbrauchen.","Se fai attenzione, ne consumerai meno.","","True","THF_403_LOCKPICK_1_11_03","",""
"Scripts/Content/Story/Missions/DIA_THF_403_Gerion.d:564","Bewege den Dietrich nach links oder rechts bis das Schloß aufgeht.","Muovi il grimaldello a sinistra o a destra fino a quando la serratura non si apre.","","True","THF_403_LOCKPICK_1_11_04","",""
"Scripts/Content/Story/Missions/DIA_THF_403_Gerion.d:565","Bevor ich dir mehr beibringe, habe ich eine Aufgabe für dich.","Prima di insegnarti di più, ho un compito da farti.","","True","THF_403_LOCKPICK_1_11_05","",""
"Scripts/Content/Story/Missions/DIA_THF_403_Gerion.d:567","Wer hätte das gedacht?","Chi lo avrebbe mai pensato?","","True","THF_403_LOCKPICK_1_15_06","",""
"Scripts/Content/Story/Missions/DIA_THF_403_Gerion.d:567","Ich brauche 20 Stengel Sumpfkraut. Einer der Bettler, Lakarus, handelt damit. Er hat einen Vorrat in seiner Hütte.","Mi servono 20 bacchetti di erba di palude. Uno dei mendicanti, Larus, ne vende. Ha un rifornimento nella sua capanna.","","True","THF_403_LOCKPICK_1_11_07","",""
"Scripts/Content/Story/Missions/DIA_THF_403_Gerion.d:568","Warte auf einen günstigen Augenblick und besorge dir das Kraut.","Aspetta il momento giusto e procurati l'erba.","","True","THF_403_LOCKPICK_1_11_08","",""
"Scripts/Content/Story/Missions/DIA_THF_403_Gerion.d:590","Wo hat Lakarus seine Hütte?","Dove si trova la capanna di Larkas?","","True","THF_403_Gerion_WHEREHUT.description","",""
"Scripts/Content/Story/Missions/DIA_THF_403_Gerion.d:603","Wo hat Lakarus seine Hütte?","Dove si trova la capanna di Larkas?","","True","THF_403_WHEREHUT_15_01","",""
"Scripts/Content/Story/Missions/DIA_THF_403_Gerion.d:603","Oberhalb der Arena. Er sitzt die meiste Zeit davor...","Sopra l'arena. La maggior parte del tempo passa davanti a essa...","","True","THF_403_WHEREHUT_11_02","",""
"Scripts/Content/Story/Missions/DIA_THF_403_Gerion.d:620","Was willst du mit dem Sumpfkraut?","Cosa vuoi con l'erba di palude?","","True","THF_403_Gerion_HERB.description","",""
"Scripts/Content/Story/Missions/DIA_THF_403_Gerion.d:633","Was willst du mit dem Sumpfkraut?","Cosa vuoi con l'erba di palude?","","True","THF_403_HERB_15_01","",""
"Scripts/Content/Story/Missions/DIA_THF_403_Gerion.d:633","Das sage ich dir, wenn du mir das Kraut gebracht hast.","Te lo dirò quando mi avrai portato l'erba.","","True","THF_403_HERB_11_02","",""
"Scripts/Content/Story/Missions/DIA_THF_403_Gerion.d:648","Woher bekomme ich Dietriche?","Dove posso trovare dei grimaldelli?","","True","THF_403_Gerion_LOCKPICKER.description","",""
"Scripts/Content/Story/Missions/DIA_THF_403_Gerion.d:660","Woher bekomme ich Dietriche?","Dove posso trovare dei grimaldelli?","","True","THF_403_LOCKPICKER_15_01","",""
"Scripts/Content/Story/Missions/DIA_THF_403_Gerion.d:661","Die sind sehr schwer zu kriegen.","Sono molto difficili da ottenere.","","True","THF_403_LOCKPICKER_11_02","",""
"Scripts/Content/Story/Missions/DIA_THF_403_Gerion.d:662","Ich gebe dir zwei Stück. Alle weiteren musst du dir selber besorgen.","Ti darò due pezzi. Il resto devi procurartela da solo.","","True","THF_403_LOCKPICKER_11_03","",""
"Scripts/Content/Story/Missions/DIA_THF_403_Gerion.d:664","Ich kann dir natürlich auch noch weitere Dietriche geben, aber das kostet dich dann eine Kleinigkeit.","Naturalmente, posso darti altre grimaldelli, ma ti costerà un po'.","","True","THF_403_LOCKPICKER_11_04","",""
"Scripts/Content/Story/Missions/DIA_THF_403_Gerion.d:667","Verstehe!","Capisco!","","True","THF_403_LOCKPICKER_15_05","",""
"Scripts/Content/Story/Missions/DIA_THF_403_Gerion.d:682","Ich habe das Sumpfkraut!","Ho l'erba di palude!","","True","THF_403_Gerion_GOTHERB.description","",""
"Scripts/Content/Story/Missions/DIA_THF_403_Gerion.d:696","Ich habe das Sumpfkraut!","Ho l'erba di palude!","","True","THF_403_GOTHERB_15_01","",""
"Scripts/Content/Story/Missions/DIA_THF_403_Gerion.d:696","Gut gemacht! Bring es zu Isgar, dem Heiler.","Ben fatto! Portalo a Isgar il guaritore.","","True","THF_403_GOTHERB_11_02","",""
"Scripts/Content/Story/Missions/DIA_THF_403_Gerion.d:697","Sag ihm du willst den Wein abholen. Diesen Wein bringst du mir. Verstanden?","Digli che vuoi prendere il vino. Portami questo. Capito?","","True","THF_403_GOTHERB_11_03","",""
"Scripts/Content/Story/Missions/DIA_THF_403_Gerion.d:698","Klar. Was ist das besondere an dem Wein?","Certo. Qual è la sua particolare caratteristica?","","True","THF_403_GOTHERB_15_04","",""
"Scripts/Content/Story/Missions/DIA_THF_403_Gerion.d:699","Es ist eine spezielle Mischung mit einer...einschläfernden Wirkung...","È una miscela speciale con un... effetto addormentante...","","True","THF_403_GOTHERB_11_05","",""
"Scripts/Content/Story/Missions/DIA_THF_403_Gerion.d:716","Ich habe den Wein","Ho il vino.","","True","THF_403_Gerion_SLEEPWINE.description","",""
"Scripts/Content/Story/Missions/DIA_THF_403_Gerion.d:730","Ich habe den Wein.","Ho il vino.","","True","THF_403_SLEEPWINE_15_01","",""
"Scripts/Content/Story/Missions/DIA_THF_403_Gerion.d:730","Ausgezeichnet. Der wird uns später noch nützlich sein.","Eccellente. Ci sarà utile più tardi.","","True","THF_403_SLEEPWINE_11_02","",""
"Scripts/Content/Story/Missions/DIA_THF_403_Gerion.d:752","Ich habe den Ring","Ho l'anello.","","True","THF_403_Gerion_GOTRING.description","",""
"Scripts/Content/Story/Missions/DIA_THF_403_Gerion.d:764","Ich habe den Ring.","Ho l'anello.","","True","THF_403_GOTRING_15_01","",""
"Scripts/Content/Story/Missions/DIA_THF_403_Gerion.d:765","Und ich habe hier 250 Silberstücke für dich!","E ho 250 monete d'argento per te!","","True","THF_403_GOTRING_11_02","",""
"Scripts/Content/Story/Missions/DIA_THF_403_Gerion.d:786","Ich möchte meine Diebeskünste verbessern!","Voglio migliorare le mie abilità nel furto!","","True","THF_403_Gerion_ALLIKNOW.description","",""
"Scripts/Content/Story/Missions/DIA_THF_403_Gerion.d:803","Ich möchte meine Diebeskünste verbessern!","Voglio migliorare le mie abilità nel furto!","","True","THF_403_ALLIKNOW_15_01","",""
"Scripts/Content/Story/Missions/DIA_THF_403_Gerion.d:804","Ich habe dir alles beigebracht, was sich weiß.","Ti ho insegnato tutto ciò che è necessario.","","True","THF_403_ALLIKNOW_11_02","",""
"Scripts/Content/Story/Missions/DIA_THF_403_Gerion.d:805","Wenn du mehr lernen willst, musst du dir einen anderen Lehrer suchen.","Se vuoi imparare di più, dovrai trovare un altro insegnante.","","True","THF_403_ALLIKNOW_11_03","",""
"Scripts/Content/Story/Missions/DIA_THF_403_Gerion.d:824","Ich hab' da ein paar Dinge...","Ho alcune cose qui...","","True","THF_403_Gerion_TRADE.description","",""
"Scripts/Content/Story/Missions/DIA_THF_403_Gerion.d:838","Ich hab' da ein paar Dinge...","Ho alcune cose qui...","","True","THF_403_TRADE_15_01","",""
"Scripts/Content/Story/Missions/DIA_THF_403_Gerion.d:839","OK, aber nicht hier.","D'accordo, ma non qui.","","True","THF_403_TRADE_11_02","",""
"Scripts/Content/Story/Missions/DIA_THF_403_Gerion.d:842","Komm mit.","Vieni con me.","","True","THF_403_TRADE_11_03","",""
"Scripts/Content/Story/Missions/DIA_THF_403_Gerion.d:861","Nun lass uns zum Geschäft kommen!","Ora facciamo affari!","","True","THF_403_Gerion_TRADENOW.description","",""
"Scripts/Content/Story/Missions/DIA_THF_403_Gerion.d:875","Nun lass uns zum Geschäft kommen!","Ora facciamo affari!","","True","THF_403_TRADENOW_15_01","",""
"Scripts/Content/Story/Missions/DIA_THF_403_Gerion.d:877","Nichts lieber als das (hehe)","Non mi piacerebbe (hehe)","","True","THF_403_TRADENOW_11_02","",""
"Scripts/Content/Story/Missions/DIA_THF_409_Pyro.d:34","Was machst du den ganzen Tag?","Cosa fai tutto il giorno?","","True","THF_409_Pyro_WHATSUP.description","",""
"Scripts/Content/Story/Missions/DIA_THF_409_Pyro.d:50","Was machst du den ganzen Tag?","Cosa fai tutto il giorno?","","True","THF_409_WHATSUP_15_01","",""
"Scripts/Content/Story/Missions/DIA_THF_409_Pyro.d:51","Ich warte darauf, dass das Vorprogramm der Arenakämpfe anfängt.","Aspetto che il programma dei combattimenti dell'arena comincerà.","","True","THF_409_WHATSUP_05_02","",""
"Scripts/Content/Story/Missions/DIA_THF_409_Pyro.d:52","Dort unterhalte ich die Arenabesucher mit etwas Feuerspuckerei.","Lì, io ammorbido i visitatori dell'arena con un po' di chiacchierone.","","True","THF_409_WHATSUP_05_03","",""
"Scripts/Content/Story/Missions/DIA_THF_409_Pyro.d:53","Besuch mich doch mal während des Vorprogramms, wenn dich das interessiert.","Se sei interessato, vieni a trovarmi durante il programma.","","True","THF_409_WHATSUP_05_04","",""
"Scripts/Content/Story/Missions/DIA_THF_409_Pyro.d:67","Sieht gefährlich aus, was du da machst!","Sembra pericoloso quello che stai facendo!","","True","THF_409_Pyro_PRETTYHOT.description","",""
"Scripts/Content/Story/Missions/DIA_THF_409_Pyro.d:82","Sieht gefährlich aus, was du da machst!","Sembra pericoloso quello che stai facendo!","","True","THF_409_PRETTYHOT_15_01","",""
"Scripts/Content/Story/Missions/DIA_THF_409_Pyro.d:83","Ist halb so schlimm wie es aussieht. Hab mir bisher erst einmal die Haare versengt!","Non è tanto male quanto sembra. Ho fatto un giro fino ad ora!","","True","THF_409_PRETTYHOT_05_02","",""
"Scripts/Content/Story/Missions/DIA_THF_409_Pyro.d:84","Die akrobatischen Tricks waren mir allerdings lieber.","Ma preferisco i trucchi acrobatici.","","True","THF_409_PRETTYHOT_05_03","",""
"Scripts/Content/Story/Missions/DIA_THF_409_Pyro.d:85","Akrobatische Tricks?","Tratti acrobatici?","","True","THF_409_PRETTYHOT_15_04","",""
"Scripts/Content/Story/Missions/DIA_THF_409_Pyro.d:86","Früher habe ich hier während des Vorprogramms etwas Artistik vorgeführt, aber das war den Zuschauern zu langweilig.","Un tempo, durante il programma iniziale, ho mostrato un po' di arte, ma era troppo noioso per i spettatori.","","True","THF_409_PRETTYHOT_05_05","",""
"Scripts/Content/Story/Missions/DIA_THF_409_Pyro.d:87","Feuerspucken ist einfach dramatischer!","Spargere il fuoco è più drammatico!","","True","THF_409_PRETTYHOT_05_06","",""
"Scripts/Content/Story/Missions/DIA_THF_409_Pyro.d:99","Welche akrobatischen Tricks hast du vorgeführt?","Quali trucchi acrobazie hai combinato?","","True","THF_409_Pyro_WHATACROBAT.description","",""
"Scripts/Content/Story/Missions/DIA_THF_409_Pyro.d:114","Welche akrobatischen Tricks hast du vorgeführt?","Quali trucchi acrobazie hai combinato?","","True","THF_409_WHATACROBAT_15_01","",""
"Scripts/Content/Story/Missions/DIA_THF_409_Pyro.d:115","Hechtrollen, Saltos und dergleichen...","Trolli di magia, saltos e simili...","","True","THF_409_WHATACROBAT_05_02","",""
"Scripts/Content/Story/Missions/DIA_THF_409_Pyro.d:127","Kannst du mir diese akrobatischen Tricks auch beibringen?","Puoi insegnarmi anche questi trucchi acrobazie?","","True","THF_409_Pyro_SHOWME.description","",""
"Scripts/Content/Story/Missions/DIA_THF_409_Pyro.d:142","Kannst du mir diese akrobatischen Tricks auch beibringen?","Puoi insegnarmi anche questi trucchi acrobazie?","","True","THF_409_SHOWME_15_01","",""
"Scripts/Content/Story/Missions/DIA_THF_409_Pyro.d:143","Ich muss für meinen Lebensunterhalt arbeiten. Also wenn du willst, dass ich dir meine alten Tricks zeige, dann kostet dich das Silber!","Devo lavorare per vivere. Se vuoi che ti mostri i miei vecchi trucchi, allora ti costerà l'argento!","","True","THF_409_SHOWME_05_02","",""
"Scripts/Content/Story/Missions/DIA_THF_409_Pyro.d:144","Wieviel?","Quanto?","","True","THF_409_SHOWME_15_03","",""
"Scripts/Content/Story/Missions/DIA_THF_409_Pyro.d:173","Zeig mir deine Akrobatischen Tricks!","Mostrami i tuoi trucchi acrobatici!","","True","THF_409_LEARNACROBAT_15_01","",""
"Scripts/Content/Story/Missions/DIA_THF_409_Pyro.d:184","Akrobatik ist äußerst vielseitig einsetzbar. Du kannst weiter springen und so Orte erreichen, die andere nicht erreichen können.","L'acrobazia è molto versatile. Puoi salta e raggiungere luoghi impossibili per gli altri.","","True","THF_409_LEARNACROBAT_05_02","",""
"Scripts/Content/Story/Missions/DIA_THF_409_Pyro.d:185","Es hilft dir auch aus einem Kampf schnell weg zu kommen oder die Stellung zu wechseln. So ein Sprung kann dir den Arsch retten.","Ti aiuterà anche a uscire velocemente da un combattimento o a cambiare posizione. Un salto come questo può salvarti il culo.","","True","THF_409_LEARNACROBAT_05_03","",""
"Scripts/Content/Story/Missions/DIA_THF_409_Pyro.d:186","Du kannst dich auch bei einem tiefen Sturz besser abfedern und nimmst so weniger Schaden.","Puoi anche scuoiarti meglio in caso di caduta profonda, riducendo così i danni.","","True","THF_409_LEARNACROBAT_05_04","",""
"Scripts/Content/Story/Missions/DIA_THF_409_Pyro.d:187","Aber vergiss nicht, wer hoch springt, kann auch tief fallen und unverwundbar macht dich Akrobatik nicht!","Ma non dimenticare che chi salta in alto può cadere anche in profondità e l'acrobazia non ti rende invulnerabile!","","True","THF_409_LEARNACROBAT_05_05","",""
"Scripts/Content/Story/Missions/DIA_THF_409_Pyro.d:201","Welche Orte meinst du damit?","A quali luoghi intende?","","True","THF_409_Pyro_WHATPLACES.description","",""
"Scripts/Content/Story/Missions/DIA_THF_409_Pyro.d:217","Welche Orte meinst du damit?","A quali luoghi intende?","","True","THF_409_WHATPLACES_15_01","",""
