"location","source","target","id","fuzzy","context","translator_comments","developer_comments"
"Scripts/Content/Story/Missions/DIA_THF_400_Edo.d:42","Was tust du den ganzen Tag?","Cosa fai tutto il giorno?","","True","THF_400_Edo_HOWDY.description","",""
"Scripts/Content/Story/Missions/DIA_THF_400_Edo.d:57","Was tust du den ganzen Tag?","Cosa fai tutto il giorno?","","True","THF_400_HOWDY_15_01","",""
"Scripts/Content/Story/Missions/DIA_THF_400_Edo.d:58","Ich geniese die Sonne, wenn sie dann mal schient!","Mi piacerà il sole quando risplenderà!","","True","THF_400_HOWDY_00_02","",""
"Scripts/Content/Story/Missions/DIA_THF_400_Edo.d:59","Ansonsten bin ich bemüht, mich nicht zu überanstrengen!","Altrimenti cerco di non fare troppo!","","True","THF_400_HOWDY_00_03","",""
"Scripts/Content/Story/Missions/DIA_THF_400_Edo.d:60","Ja das sehe ich!","Sì, lo vedo!","","True","THF_400_HOWDY_15_04","",""
"Scripts/Content/Story/Missions/DIA_THF_400_Edo.d:73","Ich komme gerade von Gotmar...","Sono appena arrivato da Gotmar...","","True","Info_Edo_ORE.description","",""
"Scripts/Content/Story/Missions/DIA_THF_400_Edo.d:88","Ich komme gerade von Gotmar...","Sono appena arrivato da Gotmar...","","True","Info_Edo_ORE_15_01","",""
"Scripts/Content/Story/Missions/DIA_THF_400_Edo.d:89","So? Was will denn dieser Wichtigtuer von einem Schmied?","Davvero? Che cosa vuole quel bastardo da un fabbro?","","True","Info_Edo_ORE_00_02","",""
"Scripts/Content/Story/Missions/DIA_THF_400_Edo.d:90","Er sagt, du hättest Erz von ihm gestohlen!","Dice che gli hai rubato del metallo!","","True","Info_Edo_ORE_15_03","",""
"Scripts/Content/Story/Missions/DIA_THF_400_Edo.d:94","WAAAS??? Du nennst mich eine Dieb???","COSA??? Mi chiami ladro???","","True","Info_Edo_ORE_00_04","",""
"Scripts/Content/Story/Missions/DIA_THF_400_Edo.d:97","Bist Du denn einer?","Sei uno di loro?","","True","Info_Edo_ORE_Info.Info_Edo_ORE.Info_Edo_ORESTOLENYOU","AI_AddChoice",""
"Scripts/Content/Story/Missions/DIA_THF_400_Edo.d:98","Nein, Gotmar tut das!","No, è Gotmar!","","True","Info_Edo_ORE_Info.Info_Edo_ORE.Info_Edo_ORESTOLENNO","AI_AddChoice",""
"Scripts/Content/Story/Missions/DIA_THF_400_Edo.d:99","Ja! Was dagegen?","Sì! Cosa vuoi?","","True","Info_Edo_ORE_Info.Info_Edo_ORE.Info_Edo_ORESTOLENYES","AI_AddChoice",""
"Scripts/Content/Story/Missions/DIA_THF_400_Edo.d:104","Bist Du denn einer?","Sei uno di loro?","","True","Info_Edo_ORESTOLENYOU_15_01","",""
"Scripts/Content/Story/Missions/DIA_THF_400_Edo.d:105","HUA, HUA, HUA,...... du gefällst mir. Bist nicht auf den Kopf gefallen.","HUA, HUA, HUA... mi piaci. Non sei caduto in testa.","","True","Info_Edo_ORESTOLENYOU_00_02","",""
"Scripts/Content/Story/Missions/DIA_THF_400_Edo.d:107","(leiser) So ganz unter uns: Dieb zu sein ist eine Ehre, nur reagieren die anderen hier etwas allergisch auf dieses Thema.","(calmo) Solo tra di noi: essere ladro è un onore, solo che gli altri qui hanno un po' di allergia.","","True","Info_Edo_ORESTOLENYOU_00_03","",""
"Scripts/Content/Story/Missions/DIA_THF_400_Edo.d:108","Also behalt ich das lieber für mich. Die meisten streberhaften Handwerker hier verstehen einfach nicht, wie man WIRKLICH lebt.","Quindi preferisco tenerlo per me. La maggior parte degli artigiani ambiziosi non capisce come si vive REALLEMENTE.","","True","Info_Edo_ORESTOLENYOU_00_04","",""
"Scripts/Content/Story/Missions/DIA_THF_400_Edo.d:109","Haben immer nur arbeiten im Kopf.","Hai sempre solo lavoro nella mente.","","True","Info_Edo_ORESTOLENYOU_00_05","",""
"Scripts/Content/Story/Missions/DIA_THF_400_Edo.d:110","Ich verrat dir was: Wenn Du an billige Waren kommen willst, dann frage mich danach. Ich habe eine große Auswahl an Dingen aller Art.","Ti dirò una cosa: se vuoi avere dei beni a buon mercato, chiedi a me. Ho una grande scelta di cose di ogni tipo.","","True","Info_Edo_ORESTOLENYOU_00_06","",""
"Scripts/Content/Story/Missions/DIA_THF_400_Edo.d:111","(unschuldig) Sind ähem... gebrauchte Dinge. Ihre Vorbesitzter haben sie irgendwann mal... verloren.","(innocente) Sono... cose utili. I loro predecessori li hanno persi... a un certo punto.","","True","Info_Edo_ORESTOLENYOU_00_07","",""
"Scripts/Content/Story/Missions/DIA_THF_400_Edo.d:112","Also dachte ich mir, bevor sie keiner haben will...","Così ho pensato che prima che nessuno la avesse...","","True","Info_Edo_ORESTOLENYOU_00_08","",""
"Scripts/Content/Story/Missions/DIA_THF_400_Edo.d:122","Nein, Gotmar tut das!","No, è Gotmar!","","True","Info_Edo_ORESTOLENNO_15_01","",""
"Scripts/Content/Story/Missions/DIA_THF_400_Edo.d:123","Sooooo. Dann richte Gotmar aus, dass er besser aufpassen soll, was er herumerzählt. Hier im Lager können schreckliche Unfälle passiere, vor allem nachts...","Sooooo. Allora consiglia a Gotmar di stare più attento a ciò che dice. Ci possono essere terribili incidenti qui nel campo, specialmente di notte...","","True","Info_Edo_ORESTOLENNO_00_02","",""
"Scripts/Content/Story/Missions/DIA_THF_400_Edo.d:132","Ja! Was dagegen?","Sì! Cosa vuoi?","","True","Info_Edo_ORESTOLENYES_15_01","",""
"Scripts/Content/Story/Missions/DIA_THF_400_Edo.d:133","Na warte, dir werde ich deine Beleidigungen aus der Birne prügeln.","Aspetta, ti farò uscire dalle tue insulte.","","True","Info_Edo_ORESTOLENYES_00_02","",""
"Scripts/Content/Story/Missions/DIA_THF_400_Edo.d:153","Ich bin an deinen... gefundenen... Sachen interessiert.","Sono interessato a... cose che hai trovato.","","True","Info_Edo_DEALOUTSIDE.description","",""
"Scripts/Content/Story/Missions/DIA_THF_400_Edo.d:169","Ich bin an deinen... gefundenen... Sachen interessiert.","Sono interessato a... cose che hai trovato.","","True","Info_Edo_DEALOUTSIDE_15_01","",""
"Scripts/Content/Story/Missions/DIA_THF_400_Edo.d:170","PSSST, nicht so laut!!!","PSSST, non fare così rumore!!!","","True","Info_Edo_DEALOUTSIDE_00_02","",""
"Scripts/Content/Story/Missions/DIA_THF_400_Edo.d:171","Los komm mit!","Andiamo!","","True","Info_Edo_DEALOUTSIDE_00_03","",""
"Scripts/Content/Story/Missions/DIA_THF_400_Edo.d:192","OK, nun zeig mir deine... gefundenen... Sachen.","D'accordo, fammi vedere le tue... cose trovate.","","True","Info_Edo_DEALINSIDE.description","",""
"Scripts/Content/Story/Missions/DIA_THF_400_Edo.d:208","OK, nun zeig mir deine... gefundenen... Sachen.","D'accordo, fammi vedere le tue... cose trovate.","","True","Info_Edo_DEALINSIDE_15_01","",""
"Scripts/Content/Story/Missions/DIA_THF_400_Edo.d:209","Klar, aber halt da draußen die Klappe darüber!","Certo, ma stai zitto!","","True","Info_Edo_DEALINSIDE_00_02","",""
"Scripts/Content/Story/Missions/DIA_THF_400_Edo.d:223","JETZT was dagegen, dass ich dich einen Dieb nenne?","AVEI problemi a chiamarti un ladro?","","True","Info_Edo_VICTORY.description","",""
"Scripts/Content/Story/Missions/DIA_THF_400_Edo.d:239","JETZT was dagegen, dass ich dich einen Dieb nenne?","AVEI problemi a chiamarti un ladro?","","True","Info_Edo_VICTORY_15_01","",""
"Scripts/Content/Story/Missions/DIA_THF_400_Edo.d:240","(ängstlich) Beruhig dich! Das war doch nur wegen der anderen hier?","(intimo) Calmati! Non è stato solo per gli altri, vero?","","True","Info_Edo_VICTORY_00_02","",""
"Scripts/Content/Story/Missions/DIA_THF_400_Edo.d:241","Hast du nun Gotmars Erz oder nicht?","Hai il metallo di Gotmar o no?","","True","Info_Edo_VICTORY_15_03","",""
"Scripts/Content/Story/Missions/DIA_THF_400_Edo.d:242","(ängstlich) Hier nimm es! Ich wusste von Anfang an, dass es mir Unglück bringen würde.","(intimorato) Ecco, prendila! Sapevo fin dall'inizio che sarebbe stata una buona fortuna.","","True","Info_Edo_VICTORY_00_04","",""
"Scripts/Content/Story/Missions/DIA_THF_400_Edo.d:257","Kann ich denn Erz von dir ...KAUFEN?","Posso...comprare del metallo da te?","","True","Info_Edo_DEFEAT.description","",""
"Scripts/Content/Story/Missions/DIA_THF_400_Edo.d:273","Kann ich denn Erz von dir ...KAUFEN?","Posso...comprare del metallo da te?","","True","Info_Edo_DEFEAT_15_01","",""
"Scripts/Content/Story/Missions/DIA_THF_400_Edo.d:274","Du hast ganz schön Mut mich DA-nach wieder anzusprechen, ha, ha, ha!","Hai proprio il coraggio di rivolgerti a me DALLA, ha, ha, ha!","","True","Info_Edo_DEFEAT_00_02","",""
"Scripts/Content/Story/Missions/DIA_THF_400_Edo.d:275","(leiser) Pass auf, ich kann dir alle möglichen Waren verkaufen.","(calmo) Ascolta, posso venderti qualsiasi tipo di merce.","","True","Info_Edo_DEFEAT_00_03","",""
"Scripts/Content/Story/Missions/DIA_THF_400_Edo.d:276","Hab sozusagen ein gutes Sortiment auf Lager.","Ho un buon assortimento di cibo in magazzino, per così dire.","","True","Info_Edo_DEFEAT_00_04","",""
"Scripts/Content/Story/Missions/DIA_THF_400_Edo.d:277","Alles Dinge, die ich irgendwo mal ...gefunden... habe. Deshalb sind sie auch so preiswert.","Tutto quello che ho trovato da qualche parte... ho... trovato. Ecco perché sono così a buon mercato.","","True","Info_Edo_DEFEAT_00_05","",""
"Scripts/Content/Story/Missions/DIA_THF_401_Huldrych.d:34","Was machst du hier?","Cosa ci fai qui?","","True","THF_401_Huldrych_HI.description","",""
"Scripts/Content/Story/Missions/DIA_THF_401_Huldrych.d:49","Was machst du hier?","Cosa ci fai qui?","","True","THF_401_HI_15_01","",""
"Scripts/Content/Story/Missions/DIA_THF_401_Huldrych.d:50","Ich sorge dafür, daß ich am Leben bleibe und was warmes zu Essen bekomme.","Mi assicuro che io resti vivo e che mi dia qualcosa di caldo da mangiare.","","True","THF_401_HI_05_02","",""
"Scripts/Content/Story/Missions/DIA_THF_401_Huldrych.d:51","Warum arbeitest du nicht mit am Aussenwall?","Perché non lavori con me sulla parete esterna?","","True","THF_401_HI_15_03","",""
"Scripts/Content/Story/Missions/DIA_THF_401_Huldrych.d:52","Warum sollte ich? Ich habe den Wall nicht kaputtgemacht.","Perché dovrei? Non ho abbattuto il muro.","","True","THF_401_HI_05_04","",""
"Scripts/Content/Story/Missions/DIA_THF_401_Huldrych.d:53","Ausserdem was bringt das? Falls die Orks wirklich angreifen, wird der Wall sie nicht aufhalten.","E poi, a cosa serve? Se gli orchi attaccano davvero, il muro non li fermerà.","","True","THF_401_HI_05_05","",""
"Scripts/Content/Story/Missions/DIA_THF_401_Huldrych.d:65","Du hast Agon bestohlen!","Hai derubato Agon!","","True","THF_401_Huldrych_YOUTHF.description","",""
"Scripts/Content/Story/Missions/DIA_THF_401_Huldrych.d:81","Du hast Agon bestohlen!","Hai derubato Agon!","","True","THF_401_YOUTHF_15_01","",""
"Scripts/Content/Story/Missions/DIA_THF_401_Huldrych.d:82","Tatsächlich? Und was habe ich ihm gestohlen?","Davvero? E cosa gli ho rubato?","","True","THF_401_YOUTHF_05_02","",""
"Scripts/Content/Story/Missions/DIA_THF_401_Huldrych.d:84","Das werde ich noch herausfinden!","Lo scoprirò!","","True","THF_401_Huldrych_YOUTHF_Info.THF_401_Huldrych_YOUTHF.THF_401_Huldrych_YOUTHF_LATER","AI_AddChoice",""
"Scripts/Content/Story/Missions/DIA_THF_401_Huldrych.d:85","Sein Schwert!","La sua spada!","","True","THF_401_Huldrych_YOUTHF_Info.THF_401_Huldrych_YOUTHF.THF_401_Huldrych_YOUTHF_SWORD","AI_AddChoice",""
"Scripts/Content/Story/Missions/DIA_THF_401_Huldrych.d:86","Einen Schinken!","Un prosciutto!","","True","THF_401_Huldrych_YOUTHF_Info.THF_401_Huldrych_YOUTHF.THF_401_Huldrych_YOUTHF_HAM","AI_AddChoice",""
"Scripts/Content/Story/Missions/DIA_THF_401_Huldrych.d:91","Einen Schinken!","Un prosciutto!","","True","THF_401_YOUTHF_HAM_15_01","",""
"Scripts/Content/Story/Missions/DIA_THF_401_Huldrych.d:92","HAHAHA einen Schinken? Das ist gut! Du bist echt witzig!","HAHAHA un prosciutto? Molto bene! Sei davvero divertente!","","True","THF_401_YOUTHF_HAM_05_02","",""
"Scripts/Content/Story/Missions/DIA_THF_401_Huldrych.d:106","Sein Schwert!","La sua spada!","","True","THF_401_YOUTHF_SWORD_15_01","",""
"Scripts/Content/Story/Missions/DIA_THF_401_Huldrych.d:107","Warst du zu lange im Krankenviertel? Jeder hier weiß doch, das Agon kein Schwert besitzt.","Sei stato troppo a lungo nel distretto infermiere? Tutti sanno che Agon non possiede una spada.","","True","THF_401_YOUTHF_SWORD_05_02","",""
"Scripts/Content/Story/Missions/DIA_THF_401_Huldrych.d:121","Das werde ich noch herausfinden!","Lo scoprirò!","","True","THF_401_YOUTHF_LATER_15_01","",""
"Scripts/Content/Story/Missions/DIA_THF_401_Huldrych.d:122","Wenn du nichts besseres zu tun hast.","Se non hai niente di meglio da fare.","","True","THF_401_YOUTHF_LATER_05_02","",""
"Scripts/Content/Story/Missions/DIA_THF_401_Huldrych.d:143","Du hast Agon hundert Silberstücke gestohlen!","Hai rubato a Agon cento monete d'argento!","","True","THF_401_Huldrych_TOOSLOW.description","",""
"Scripts/Content/Story/Missions/DIA_THF_401_Huldrych.d:159","Du hast Agon hundert Silberstücke gestohlen!","Hai rubato a Agon cento monete d'argento!","","True","THF_401_TOOSLOW_15_01","",""
"Scripts/Content/Story/Missions/DIA_THF_401_Huldrych.d:160","Wie willst du das beweisen? Selbst wenn ich das Silber hätte, glaubst du ich trage es mit mir herum?","Come vuoi dimostrarlo? Anche se avessi l'argento, pensi che lo porterò con me?","","True","THF_401_TOOSLOW_05_02","",""
"Scripts/Content/Story/Missions/DIA_THF_401_Huldrych.d:161","Also geh mir nicht auf den Sack!","Dunque non farmi il culo!","","True","THF_401_TOOSLOW_05_03","",""
"Scripts/Content/Story/Missions/DIA_THF_401_Huldrych.d:163","Ich glaube mit Worten komme ich hier nicht weiter.","Non credo che con le parole possa arrivare fino qui.","","True","THF_401_TOOSLOW_15_04","",""
"Scripts/Content/Story/Missions/DIA_THF_401_Huldrych.d:197","Lass mich in Ruhe! Geh jemand anders auf'n Sack!","Lasciami in pace! Vai a uccidere qualcun altro!","","True","THF_401_AFTERBEAT_05_01","",""
"Scripts/Content/Story/Missions/DIA_THF_401_Huldrych.d:210","Sagst du mir jetzt wo das Silber ist?","Dimmi dove si trova l'argento, adesso?","","True","THF_401_Huldrych_GIVEMESILVER.description","",""
"Scripts/Content/Story/Missions/DIA_THF_401_Huldrych.d:229","Sagst du mir jetzt wo das Silber ist?","Dimmi dove si trova l'argento, adesso?","","True","THF_401_GIVEMESILVER_15_01","",""
"Scripts/Content/Story/Missions/DIA_THF_401_Huldrych.d:230","ICH HAB ES NICHT MEHR!","Non ce l'ho più!","","True","THF_401_GIVEMESILVER_05_02","",""
"Scripts/Content/Story/Missions/DIA_THF_401_Huldrych.d:231","Was hast du damit gemacht?","Cosa ne hai fatto?","","True","THF_401_GIVEMESILVER_15_03","",""
"Scripts/Content/Story/Missions/DIA_THF_401_Huldrych.d:232","Meine Schulden bei verschiedenen Leuten bezahlt. Willst du mich jetzt nochmal schlagen?","Ho pagato i miei debiti con persone diverse. Vuoi battermi di nuovo?","","True","THF_401_GIVEMESILVER_05_04","",""
"Scripts/Content/Story/Missions/DIA_THF_401_Huldrych.d:233","Wenn du noch mal jemanden beklaust, komme ich wieder.","Se deruberai di nuovo qualcuno, tornerò.","","True","THF_401_GIVEMESILVER_15_05","",""
"Scripts/Content/Story/Missions/DIA_THF_401_Huldrych.d:234","OK, OK. Ich habs kapiert! Aber lass mich jetzt bitte in Ruhe.","D'accordo, d'accordo. Capisco! Ma lasciami in pace, per favore.","","True","THF_401_GIVEMESILVER_05_06","",""
"Scripts/Content/Story/Missions/DIA_THF_401_Huldrych.d:246","Agon wurden hundert Silberstücke gestohlen!","Agon ha avuto 100 monete d'argento rubate!","","True","THF_401_Huldrych_INSPECTOR.description","",""
"Scripts/Content/Story/Missions/DIA_THF_401_Huldrych.d:267","Agon wurden hundert Silberstücke gestohlen!","Agon ha avuto 100 monete d'argento rubate!","","True","THF_401_INSPECTOR_15_01","",""
"Scripts/Content/Story/Missions/DIA_THF_401_Huldrych.d:268","Was habe ich damit zu tun?","Che c'entro io con questo?","","True","THF_401_INSPECTOR_05_02","",""
"Scripts/Content/Story/Missions/DIA_THF_401_Huldrych.d:269","DU hast sie gestohlen.","L'hai rubata TU.","","True","THF_401_INSPECTOR_15_03","",""
"Scripts/Content/Story/Missions/DIA_THF_401_Huldrych.d:270","Woher willst du das wissen?","Come fai a saperlo?","","True","THF_401_INSPECTOR_05_04","",""
"Scripts/Content/Story/Missions/DIA_THF_401_Huldrych.d:271","Agon hat dich gesehen. Und ich möchte wetten, du trägst das Silber noch mit dir herum.","Agon ti ha visto. E scommetto che hai ancora l'argento con te.","","True","THF_401_INSPECTOR_15_05","",""
"Scripts/Content/Story/Missions/DIA_THF_401_Huldrych.d:272","Und was hast du jetzt vor?","E cosa hai in mente adesso?","","True","THF_401_INSPECTOR_05_06","",""
"Scripts/Content/Story/Missions/DIA_THF_401_Huldrych.d:274","Ganz einfach, wir teilen","Molto semplice, dividiamo","","True","THF_401_Huldrych_INSPECTOR_Info.THF_401_Huldrych_INSPECTOR.THF_401_Huldrych_INSPECTOR_SHARE","AI_AddChoice",""
"Scripts/Content/Story/Missions/DIA_THF_401_Huldrych.d:275","Ich werde dir eine Lektion erteilen","Ti darò una lezione.","","True","THF_401_Huldrych_INSPECTOR_Info.THF_401_Huldrych_INSPECTOR.THF_401_Huldrych_INSPECTOR_lesson","AI_AddChoice",""
"Scripts/Content/Story/Missions/DIA_THF_401_Huldrych.d:280","Ich werde dir eine Lektion erteilen!","Ti darò una lezione!","","True","THF_401_INSPECTOR_lesson_15_01","",""
"Scripts/Content/Story/Missions/DIA_THF_401_Huldrych.d:281","Versuch es, wenn du kannst!","Provaci, se puoi!","","True","THF_401_INSPECTOR_lesson_05_02","",""
"Scripts/Content/Story/Missions/DIA_THF_401_Huldrych.d:290","Ganz einfach, wir teilen","Molto semplice, dividiamo","","True","THF_401_INSPECTOR_SHARE_15_01","",""
"Scripts/Content/Story/Missions/DIA_THF_401_Huldrych.d:291","hmm...verstehe. Aber woher weiß ich, daß du es ernst meinst?","Mmmh... Capisco. Ma come faccio a sapere che parli sul serio?","","True","THF_401_INSPECTOR_SHARE_05_02","",""
"Scripts/Content/Story/Missions/DIA_THF_401_Huldrych.d:292","Du musst mir vertrauen.","Devi fidarti di me.","","True","THF_401_INSPECTOR_SHARE_15_03","",""
"Scripts/Content/Story/Missions/DIA_THF_401_Huldrych.d:296","hmm...fünfzig Silberstücke für dich...","Mmmh... 50 monete d'argento per te...","","True","THF_401_INSPECTOR_SHARE_05_04","",""
"Scripts/Content/Story/Missions/DIA_THF_401_Huldrych.d:298","Und du sorgst dafür, das Agon und die Miliz mich nicht mehr belästigen!","E ti assicurerai che Agon e la guardia cittadina non mi disturbiano più!","","True","THF_401_INSPECTOR_SHARE_05_05","",""
"Scripts/Content/Story/Missions/DIA_THF_401_Huldrych.d:299","Abgemacht!","Affare fatto!","","True","THF_401_INSPECTOR_SHARE_15_06","",""
"Scripts/Content/Story/Missions/DIA_THF_401_Huldrych.d:306","Ich habe das Silber nicht mehr! Es ist mir abgenommen worden.","Non ho più l'argento! Me l'hanno preso.","","True","THF_401_INSPECTOR_SHARE_05_07","",""
"Scripts/Content/Story/Missions/DIA_THF_401_Huldrych.d:307","Warte mal, habe ich dich nicht schon irgendwo gesehen...? Du warst das! Du hast mir das Silber abgenommen!","Aspetta, non ti ho visto da qualche parte? Sei stato tu! Mi hai preso l'argento!","","True","THF_401_INSPECTOR_SHARE_05_08","",""
"Scripts/Content/Story/Missions/DIA_THF_401_Huldrych.d:308","Ich glaube, ich geh mal wieder.","Penso che dovrei andare.","","True","THF_401_INSPECTOR_SHARE_15_09","",""
"Scripts/Content/Story/Missions/DIA_THF_401_Huldrych.d:309","Nicht so schnell, Freundchen!","Non così in fretta, amico!","","True","THF_401_INSPECTOR_SHARE_05_10","",""
"Scripts/Content/Story/Missions/DIA_THF_401_Huldrych.d:348","Du hinterhältiger Drecksack! Ich habe dir vertraut!","Hai fatto il mio meglio, imbroglioso!","","True","THF_401_NOWFIGHT_05_01","",""
"Scripts/Content/Story/Missions/DIA_THF_401_Huldrych.d:349","Irgendwann, wenn du nicht damit rechnest, wenn du tief in der Scheisse sitzt, dann werde ich da sein!","Un giorno, se non ci pensi, quando sarai in profondità, io ci sarò!","","True","THF_401_NOWFIGHT_05_02","",""
"Scripts/Content/Story/Missions/DIA_THF_401_Huldrych.d:350","...und dann rechne ich mit dir ab!","...e poi mi occuperò di te!","","True","THF_401_NOWFIGHT_05_03","",""
"Scripts/Content/Story/Missions/DIA_THF_401_Huldrych.d:356","(bedrohlich) Lass dir das eine Lehre sein, andere Leute um ihre ehrlich verdienten Silberstücke zu bringen, du elender Dieb!","(minaccioso) Lascia che ti insegni a prendere le monete d'argento che gli altri meritano, miserabile ladro!","","True","THF_401_NOWFIGHT_15_04","",""
"Scripts/Content/Story/Missions/DIA_THF_401_Huldrych.d:357","Wenn ich nocheinmal von so einer Aktion höre, besuche ich dich wieder, hast du das verstanden?","Se dovessi sentire parlare di un'altra volta, tornerò a trovarti, hai capito?","","True","THF_401_NOWFIGHT_15_05","",""
"Scripts/Content/Story/Missions/DIA_THF_401_Huldrych.d:358","(ängstlich) Ja, ist klar, wird nicht wieder vorkommen. Ehrlich!","(intimorato) Sì, è ovvio, non tornerà mai più. Davvero!","","True","THF_401_NOWFIGHT_05_06","",""
"Scripts/Content/Story/Missions/DIA_THF_403_Gerion.d:34","Was machst du hier?","Cosa ci fai qui?","","True","THF_403_Gerion_23.description","",""
"Scripts/Content/Story/Missions/DIA_THF_403_Gerion.d:44","Was machst du hier?","Cosa ci fai qui?","","True","THF_403_23_15_01","",""
"Scripts/Content/Story/Missions/DIA_THF_403_Gerion.d:45","Ich bin Gerion aus Khorinis. Vor einigen Wochen habe ich die Stadt verlassen.","Io sono Gerion di Khorinis. Ho lasciato la città qualche settimana fa.","","True","THF_403_23_11_02","",""
"Scripts/Content/Story/Missions/DIA_THF_403_Gerion.d:46","Was eine gute Entscheidung war, denn kurz darauf kamen die Orks.","Una buona decisione, perché gli orchi sono arrivati poco dopo.","","True","THF_403_23_11_03","",""
"Scripts/Content/Story/Missions/DIA_THF_403_Gerion.d:47","Jetzt bin ich hier. Aber ich weiß nicht, ob das auch ne gute Entscheidung war, denn hier haben die Orks alles abgeriegelt.","Ora sono qui, ma non so se sia stata una buona decisione, perché gli orchi hanno sigillato tutto qui.","","True","THF_403_23_11_04","",""
"Scripts/Content/Story/Missions/DIA_THF_403_Gerion.d:59","Ich will die Kunst der Diebe lernen.","Voglio imparare l'arte dei ladri.","","True","THF_403_Gerion_DIEGO.description","",""
"Scripts/Content/Story/Missions/DIA_THF_403_Gerion.d:74","Ich will die Kunst der Diebe lernen.","Voglio imparare l'arte dei ladri.","","True","THF_403_DIEGO_15_01","",""
"Scripts/Content/Story/Missions/DIA_THF_403_Gerion.d:75","Warum schreist du nicht noch lauter, damit es auch wirklich JEDER mitkriegt!?","Perché non urli ancora più forte, così che tutti lo sentano?","","True","THF_403_DIEGO_11_02","",""
"Scripts/Content/Story/Missions/DIA_THF_403_Gerion.d:76","Ausserdem weiß ich gar nicht wovon du redest.","Inoltre, non so di cosa stai parlando.","","True","THF_403_DIEGO_11_03","",""
"Scripts/Content/Story/Missions/DIA_THF_403_Gerion.d:88","Dann kann ich also Diego von deinen Raubzügen erzählen?","Allora posso dire a Diego della tua rapina?","","True","THF_403_Gerion_TELLDIEGO.description","",""
"Scripts/Content/Story/Missions/DIA_THF_403_Gerion.d:106","Dann kann ich also Diego von deinen kleinen Raubzügen erzählen?","Allora posso raccontare a Diego delle tue piccole saccheggiature?","","True","THF_403_Gerion_TELLDIEGO_15_01","",""
"Scripts/Content/Story/Missions/DIA_THF_403_Gerion.d:107","Hey, nicht so laut! Laß uns woanders hingehen. Komm mit!","Ehi, non fare così rumore! Andiamo da qualche altra parte. Vieni con me!","","True","THF_403_Gerion_TELLDIEGO_11_02","",""
"Scripts/Content/Story/Missions/DIA_THF_403_Gerion.d:125","Ich könnte Diego von deinen Raubzügen erzählen!","Potrei raccontare a Diego dei tuoi saccheggi!","","True","THF_403_Gerion_TELLDIEGO2.description","",""
"Scripts/Content/Story/Missions/DIA_THF_403_Gerion.d:143","Ich könnte Diego von deinen kleinen Raubzügen erzählen!","Potrei raccontare a Diego dei tuoi piccoli saccheggi!","","True","THF_403_Gerion_TELLDIEGO2_15_01","",""
"Scripts/Content/Story/Missions/DIA_THF_403_Gerion.d:144","Ich schlag dir ein Geschäft vor!","Ti faccio un affare!","","True","THF_403_Gerion_TELLDIEGO2_11_02","",""
"Scripts/Content/Story/Missions/DIA_THF_403_Gerion.d:145","Du behältst das für dich und dafür zeige ich dir die Talente der Diebe.","Tieni questo per te e ti mostrerò le abilità dei ladri.","","True","THF_403_Gerion_TELLDIEGO2_11_03","",""
"Scripts/Content/Story/Missions/DIA_THF_403_Gerion.d:146","Ich wußte, das wir uns verstehen würden.","Sapevo che ci saremmo intesi.","","True","THF_403_Gerion_TELLDIEGO2_15_04","",""
"Scripts/Content/Story/Missions/DIA_THF_403_Gerion.d:147","Als erstes musst Du lernen, dich lautlos zu bewegen.","Prima devi imparare a muoverti in silenzio.","","True","THF_403_Gerion_TELLDIEGO2_11_05","",""
"Scripts/Content/Story/Missions/DIA_THF_403_Gerion.d:148","Sag mir Bescheid, wenn du bereit bist.","Fammi sapere quando sarai pronto.","","True","THF_403_Gerion_TELLDIEGO2_11_06","",""
"Scripts/Content/Story/Missions/DIA_THF_403_Gerion.d:176","Ich schlage dir ein Geschäft vor.","Ti faccio un affare.","","True","THF_403_INSIDER_11_01","",""
"Scripts/Content/Story/Missions/DIA_THF_403_Gerion.d:177","Nämlich?","Esattamente?","","True","THF_403_INSIDER_15_02","",""
"Scripts/Content/Story/Missions/DIA_THF_403_Gerion.d:178","Du verpfeifst mich nicht und dafür zeige ich dir die Talente der Diebe.","Non mi stuzzichi e ti mostrerò le abilità dei ladri.","","True","THF_403_INSIDER_11_03","",""
"Scripts/Content/Story/Missions/DIA_THF_403_Gerion.d:179","Ich wußte das wir uns verstehen würden.","Sapevo che ci saremmo fatti in accordo.","","True","THF_403_INSIDER_15_04","",""
"Scripts/Content/Story/Missions/DIA_THF_403_Gerion.d:180","Als erstes musst Du lernen, dich lautlos zu bewegen.","Prima devi imparare a muoverti in silenzio.","","True","THF_403_INSIDER_11_05","",""
"Scripts/Content/Story/Missions/DIA_THF_403_Gerion.d:181","Sag mir Bescheid, wenn du bereit bist.","Fammi sapere quando sarai pronto.","","True","THF_403_INSIDER_11_06","",""
"Scripts/Content/Story/Missions/DIA_THF_403_Gerion.d:215","Zeig mir, wie ich mich lautlos bewegen kann.","Mostrami come muovermi in silenzio.","","True","THF_403_LEARNSNEAK_15_01","",""
