"location","source","target","id","fuzzy","context","translator_comments","developer_comments"
"Scripts/Content/Story/Missions/DIA_THF_409_Pyro.d:218","Was ist dir diese Information wert?","Quanto vale questa informazione per te?","","True","THF_409_WHATPLACES_05_02","",""
"Scripts/Content/Story/Missions/DIA_THF_409_Pyro.d:221","Garnichts, du wirst es mir so sagen sonst...","Niente, altrimenti me lo diresti così...","","True","THF_409_Pyro_WHATPLACES_Info.THF_409_Pyro_WHATPLACES.THF_409_Pyro_WHATPLACES_THREAT","AI_AddChoice",""
"Scripts/Content/Story/Missions/DIA_THF_409_Pyro.d:222","100 Silber","100 pezzi d'argento","","True","THF_409_Pyro_WHATPLACES_Info.THF_409_Pyro_WHATPLACES.THF_409_Pyro_WHATPLACES_100","AI_AddChoice",""
"Scripts/Content/Story/Missions/DIA_THF_409_Pyro.d:223","50 Silber","50 pezzi d'argento","","True","THF_409_Pyro_WHATPLACES_Info.THF_409_Pyro_WHATPLACES.THF_409_Pyro_WHATPLACES_50","AI_AddChoice",""
"Scripts/Content/Story/Missions/DIA_THF_409_Pyro.d:228","Kennst du den Mauereinsturz bei der Burgschmiede?","Hai sentito parlare dell'incidente di mura vicino alla fabbrica?","","True","THF_409_WHATPLACES_Info1_05_01","",""
"Scripts/Content/Story/Missions/DIA_THF_409_Pyro.d:229","Ja!","Sì!","","True","THF_409_WHATPLACES_Info1_15_02","",""
"Scripts/Content/Story/Missions/DIA_THF_409_Pyro.d:230","Niemand kann ohne akrobatische Tricks auf den Mauerrest am Schmiedehaus gelangen.","Nessuno può raggiungere il resto della muraglia presso la fabbrica senza trucchi acrobatici.","","True","THF_409_WHATPLACES_Info1_05_03","",""
"Scripts/Content/Story/Missions/DIA_THF_409_Pyro.d:237","Treiben sich eine Menge Fleischwanzen dort herum, manchmal liegt dort auch anderer Krempel herum!","Ci sono un sacco di scarafaggi in giro, a volte ci sono anche altri scarafaggi!","","True","THF_409_WHATPLACES_Info2_05_01","",""
"Scripts/Content/Story/Missions/DIA_THF_409_Pyro.d:238","Gleichs gilt für die Dächer des Gardistenhauses und die Burgschmiede selbst.","Lo stesso vale per i tetti della casa delle guardie e per la fabbrica stessa.","","True","THF_409_WHATPLACES_Info2_05_02","",""
"Scripts/Content/Story/Missions/DIA_THF_409_Pyro.d:239","Ich begehe diese Dächer von Zeit zu Zeit, denn Elstern lassen dort oben ab und zu mal interessante Dinge fallen, die sie irgendwo stibitzt haben.","Di tanto in tanto, vado a vedere questi tetti, perché gli anziani di tanto in tanto cadono cose interessanti che hanno stabilito da qualche parte.","","True","THF_409_WHATPLACES_Info2_05_03","",""
"Scripts/Content/Story/Missions/DIA_THF_409_Pyro.d:246","50 Silber","50 pezzi d'argento","","True","THF_409_WHATPLACES_50_15_01","",""
"Scripts/Content/Story/Missions/DIA_THF_409_Pyro.d:263","100 Silber","100 pezzi d'argento","","True","THF_409_WHATPLACES_100_15_01","",""
"Scripts/Content/Story/Missions/DIA_THF_409_Pyro.d:284","Garnichts, du wirst es mir so sagen sonst...","Niente, altrimenti me lo diresti così...","","True","THF_409_WHATPLACES_THREAT_15_01","",""
"Scripts/Content/Story/Missions/DIA_THF_409_Pyro.d:285","OK, OK, werde nicht gleich ungemütlich! Ein Rüpel wie Brutus ist wirklich genug!","D'accordo, d'accordo, non essere così insensibile! Un brigante come Brutus è davvero abbastanza!","","True","THF_409_WHATPLACES_THREAT_05_02","",""
"Scripts/Content/Story/Missions/DIA_THF_409_Pyro.d:287","Warum nicht gleich so!","Perché non lo dici subito?","","True","THF_409_WHATPLACES_THREAT_15_03","",""
"Scripts/Content/Story/Missions/DIA_THF_409_Pyro.d:303","Was macht die Feuerspuckerei?","Come va la faccenda del fuoco?","","True","THF_409_Pyro_HOWDY.description","",""
"Scripts/Content/Story/Missions/DIA_THF_409_Pyro.d:318","Was macht die Feuerspuckerei?","Come va la faccenda del fuoco?","","True","THF_409_HOWDY_15_01","",""
"Scripts/Content/Story/Missions/DIA_THF_409_Pyro.d:319","Ich verdiene genug Silber mit einer einzigen Stunde Arbeit pro Tag. Da kann ich mich wirklich nicht beschweren!","Guadagno abbastanza soldi lavorando un'ora al giorno. Non posso lamentarmi!","","True","THF_409_HOWDY_05_02","",""
"Scripts/Content/Story/Missions/DIA_THF_410_Vito.d:47","Der arme Tassio ist etwas langsam... auch im Kopf, weisst du.","Il povero Tassio è un po' lento... anche nella mente, sai.","","True","THF_410_TASSIO_07_01","",""
"Scripts/Content/Story/Missions/DIA_THF_410_Vito.d:48","Verstehe.","Capisco.","","True","THF_410_TASSIO_15_02","",""
"Scripts/Content/Story/Missions/DIA_THF_410_Vito.d:49","Am besten du hälst dich an mich.","Farai meglio a venire da me.","","True","THF_410_TASSIO_07_03","",""
"Scripts/Content/Story/Missions/DIA_THF_410_Vito.d:61","Was macht ihr hier oben in den Bergen?","Cosa state facendo qui in montagna?","","True","THF_410_Vito_YOURJOB.description","",""
"Scripts/Content/Story/Missions/DIA_THF_410_Vito.d:71","Was macht ihr hier oben in den Bergen?","Cosa state facendo qui in montagna?","","True","THF_410_YOURJOB_15_01","",""
"Scripts/Content/Story/Missions/DIA_THF_410_Vito.d:72","Wir wollen Soldaten des Königs werden, doch das ist schwieriger als ich dachte.","Vogliamo diventare soldati del Re, ma è più difficile di quanto pensassi.","","True","THF_410_YOURJOB_07_02","",""
"Scripts/Content/Story/Missions/DIA_THF_410_Vito.d:84","Wieso?","Perché?","","True","THF_410_Vito_DIFFICULT.description","",""
"Scripts/Content/Story/Missions/DIA_THF_410_Vito.d:99","Wieso?","Perché?","","True","THF_410_DIFFICULT_15_01","",""
"Scripts/Content/Story/Missions/DIA_THF_410_Vito.d:100","Diese Torwachen da drüben sagen, wir müssten es erst mal zu den Hilfstruppen schaffen, bevor wir richtige Soldaten werden können.","Quelle guardie di quella porta dicono che prima di diventare dei veri soldati, dobbiamo raggiungere le forze di soccorso.","","True","THF_410_DIFFICULT_07_03","",""
"Scripts/Content/Story/Missions/DIA_THF_410_Vito.d:101","Aha.","Ah.","","True","THF_410_DIFFICULT_15_04","",""
"Scripts/Content/Story/Missions/DIA_THF_410_Vito.d:102","Und wenn wir gute Soldaten sind, dann könnten wir vielleicht sogar mal echte Paladine des Königs werden.","E se siamo dei bravi soldati, forse potremmo anche diventare dei veri paladini del re.","","True","THF_410_DIFFICULT_07_05","",""
"Scripts/Content/Story/Missions/DIA_THF_410_Vito.d:105","Ich verstehe.","Capisco.","","True","THF_410_DIFFICULT_15_06","",""
"Scripts/Content/Story/Missions/DIA_THF_410_Vito.d:104","Aber die wollen uns nicht mal bei den Hilfstruppen haben, weil sie sagen wir wären keine guten Kämpfer.","Ma non vogliono nemmeno che entriamo nelle truppe di aiuto, perché dicono che non siamo buoni combattenti.","","True","THF_410_DIFFICULT_07_02","",""
"Scripts/Content/Story/Missions/DIA_THF_410_Vito.d:105","Ich verstehe.","","","","THF_410_DIFFICULT_15_08","",""
"Scripts/Content/Story/Missions/DIA_THF_410_Vito.d:106","Willst du auch Soldat werden?","Vuoi diventare un soldato?","","True","THF_410_DIFFICULT_07_07","",""
"Scripts/Content/Story/Missions/DIA_THF_410_Vito.d:108","Das geht dich nichts an.","Non sono affari tuoi.","","True","THF_410_Vito_DIFFICULT_Info.THF_410_Vito_DIFFICULT.THF_410_Vito_DIFFICULT_NOBUSINESS","AI_AddChoice",""
"Scripts/Content/Story/Missions/DIA_THF_410_Vito.d:109","Nein, ich will nur in die Bergfestung.","No, voglio solo entrare nella fortezza sulla montagna.","","True","THF_410_Vito_DIFFICULT_Info.THF_410_Vito_DIFFICULT.THF_410_Vito_DIFFICULT_NO","AI_AddChoice",""
"Scripts/Content/Story/Missions/DIA_THF_410_Vito.d:110","Ja.","Sì.","","True","THF_410_Vito_DIFFICULT_Info.THF_410_Vito_DIFFICULT.THF_410_Vito_DIFFICULT_YES","AI_AddChoice",""
"Scripts/Content/Story/Missions/DIA_THF_410_Vito.d:116","Ja.","Sì.","","True","THF_410_DIFFICULT_YES_15_01","",""
"Scripts/Content/Story/Missions/DIA_THF_410_Vito.d:120","HEHH!!! Wir waren zuerst hier!","HEHH!!! Siamo arrivati qui per primi!","","True","THF_410_DIFFICULT_YES_07_02","",""
"Scripts/Content/Story/Missions/DIA_THF_410_Vito.d:121","Stell dich gefälligst hinten an, verstanden?","Ti prego, siediti dietro, capito?","","True","THF_410_DIFFICULT_YES_07_03","",""
"Scripts/Content/Story/Missions/DIA_THF_410_Vito.d:128","Nein, ich will nur in die Bergfestung.","No, voglio solo entrare nella fortezza sulla montagna.","","True","THF_410_DIFFICULT_NO_15_01","",""
"Scripts/Content/Story/Missions/DIA_THF_410_Vito.d:129","Haha, du kommst nie so einfach durch dieses Tor. Da wette ich meine letzte Buddel drauf.","Haha, non riuscirai mai a attraversare questo cancello così facilmente. Scommetto che è questo il mio ultimo pozzo.","","True","THF_410_DIFFICULT_NO_07_02","",""
"Scripts/Content/Story/Missions/DIA_THF_410_Vito.d:130","Ich werde mir dann nachher die Flasche abholen. Wir sehen uns!","Verrò a prendere la bottiglia dopo. Ci vediamo!","","True","THF_410_DIFFICULT_NO_15_03","",""
"Scripts/Content/Story/Missions/DIA_THF_410_Vito.d:137","Das geht dich nichts an.","Non sono affari tuoi.","","True","THF_410_DIFFICULT_NOBUSINESS_15_01","",""
"Scripts/Content/Story/Missions/DIA_THF_410_Vito.d:138","Pahh!! Du bist genauso arrogant wie diese Torwachen da drüben.","Pahh!! Sei arrogante come quelle guardie laggiù.","","True","THF_410_DIFFICULT_NOBUSINESS_07_02","",""
"Scripts/Content/Story/Missions/DIA_THF_410_Vito.d:139","Würdest gut zu diesen Paladinen passen. Die sind ihre Anführer und die Ausgeburt an Arroganz.","Potresti essere un buon compagno di quei paladini. Sono i loro capi e il nascituro dell'arroganza.","","True","THF_410_DIFFICULT_NOBUSINESS_07_03","",""
"Scripts/Content/Story/Missions/DIA_THF_410_Vito.d:140","Sprechen kaum ein Wort mit dir und schauen über dich hinweg als ob du Fliegenmist wärst.","Non ti parlano nemmeno una parola e ti guardano come se fossi un nemico.","","True","THF_410_DIFFICULT_NOBUSINESS_07_04","",""
"Scripts/Content/Story/Missions/DIA_THF_410_Vito.d:154","Na, immer noch hier draussen?","Sei ancora qui fuori?","","True","THF_410_Vito_HOWDY.description","",""
"Scripts/Content/Story/Missions/DIA_THF_410_Vito.d:169","Na, immer noch hier draussen?","Sei ancora qui fuori?","","True","THF_410_HOWDY_15_01","",""
"Scripts/Content/Story/Missions/DIA_THF_410_Vito.d:170","Noch! Bestimmt werden wir schon bald bei den Hilfstruppen sein, wart' nur ab.","Ancora! Sono sicuro che saremo presto con le truppe di soccorso, aspetta.","","True","THF_410_HOWDY_07_02","",""
"Scripts/Content/Story/Missions/DIA_THF_411_Tassio.d:33","Warum bist du hier draussen?","Perché sei qui fuori?","","True","THF_411_Tassio_YOURJOB.description","",""
"Scripts/Content/Story/Missions/DIA_THF_411_Tassio.d:43","Warum bist du hier draussen?","Perché sei qui fuori?","","True","THF_411_YOURJOB_15_01","",""
"Scripts/Content/Story/Missions/DIA_THF_411_Tassio.d:44","Iii...Iicc....Iiicchhhh... ICH!","IIIii...Iicc...Iicchhhh... Io!","","True","THF_411_YOURJOB_10_02","",""
"Scripts/Content/Story/Missions/DIA_THF_411_Tassio.d:45","Ww... www... wwwi... wwwiiil... WILL.","Ww... Ww... Wwwi... Wwiiil... WILL.","","True","THF_411_YOURJOB_10_03","",""
"Scripts/Content/Story/Missions/DIA_THF_411_Tassio.d:46","Ss... sss... sssool... sssoldddd. ddd. ddd... (schnauf)","Sss... sss... ssssool... sssoldddd. ddd. ddd... (sospira)","","True","THF_411_YOURJOB_10_04","",""
"Scripts/Content/Story/Missions/DIA_THF_411_Tassio.d:47","Soooooldaaat... SOLDAT werden.","Soooooldaaat... diventare un SOLDATO.","","True","THF_411_YOURJOB_10_05","",""
"Scripts/Content/Story/Missions/DIA_THF_411_Tassio.d:61","Wie geht es dir?","Come stai?","","True","THF_411_Tassio_HOWDY.description","",""
"Scripts/Content/Story/Missions/DIA_THF_411_Tassio.d:76","Wie geht es dir?","Come stai?","","True","THF_411_HOWDY_15_01","",""
"Scripts/Content/Story/Missions/DIA_THF_411_Tassio.d:77","Daa... daaann... daannnkk... daaannnnkkkee... DANKE!","Dadd... Dadd... Dadd... Dadd... Dadd... Grazie!","","True","THF_411_HOWDY_10_02","",""
"Scripts/Content/Story/Missions/DIA_THF_411_Tassio.d:78","Gg.. ggg... ggguu... gguuuhh... GUT!","Gg... ggg... ggggg... ggggg... GUT!","","True","THF_411_HOWDY_10_03","",""
"Scripts/Content/Story/Missions/DIA_THF_411_Tassio.d:79","Ww... www... wwwiii... wwwiiieeee... WIE!","Ww... Ww... Wwwiii... Wwwiiieeee... COME!","","True","THF_411_HOWDY_10_04","",""
"Scripts/Content/Story/Missions/DIA_THF_411_Tassio.d:80","Gg... ggg...","Gg... ggg...","","True","THF_411_HOWDY_10_05","",""
"Scripts/Content/Story/Missions/DIA_THF_411_Tassio.d:81","(voreilig) Äh! Oh danke, mir geht es auch gut!","(con insoddisfazione) Ehm! Oh grazie, anch'io sto bene!","","True","THF_411_HOWDY_15_06","",""
