"location","source","target","id","fuzzy","context","translator_comments","developer_comments"
"Scripts/Content/Story/Missions/DIA_MIN_300_Sylvester.d:42","Wie geht es so?","Come va?","","True","MIN_300_Sylvester_HOWDY.description","",""
"Scripts/Content/Story/Missions/DIA_MIN_300_Sylvester.d:52","Wie geht es so?","Come va?","","True","MIN_300_HOWDY_15_01","",""
"Scripts/Content/Story/Missions/DIA_MIN_300_Sylvester.d:58","Dank dir kann ich nun endlich wieder mein Essen selbst verdienen!","Grazie a te, posso finalmente guadagnare da solo il mio cibo!","","True","MIN_300_HOWDY_03_02","",""
"Scripts/Content/Story/Missions/DIA_MIN_300_Sylvester.d:62","Naja, ich kann jetzt weiss ich zwar wo eine neue Erzader ist, aber du hast mich ganz schön dafür bluten lassen!","Beh, ora so dove si trova una nuova vena di metallo, ma mi hai fatto sanguinare!","","True","MIN_300_HOWDY_03_03","",""
"Scripts/Content/Story/Missions/DIA_MIN_300_Sylvester.d:67","Schlecht! Ich habe zur Zeit keine Arbeit! Und jetzt lass mich in Ruhe!","Maledetto! Al momento non ho lavoro! E ora lasciami in pace!","","True","MIN_300_HOWDY_03_04","",""
"Scripts/Content/Story/Missions/DIA_MIN_300_Sylvester.d:81","Nette Spitzhacke, die du da hast!","Che piccone!","","True","Info_Sylvester_PICK.description","",""
"Scripts/Content/Story/Missions/DIA_MIN_300_Sylvester.d:97","Nette Spitzhacke, die du da hast!","Che piccone!","","True","Info_Sylvester_PICK_15_01","",""
"Scripts/Content/Story/Missions/DIA_MIN_300_Sylvester.d:98","Pah! Wenn ich blos Verwendung dafür hätte...","Bah! Se solo mi fosse servito...","","True","Info_Sylvester_PICK_03_02","",""
"Scripts/Content/Story/Missions/DIA_MIN_300_Sylvester.d:99","Wie meinst du das?","Cosa intendi?","","True","Info_Sylvester_PICK_15_03","",""
"Scripts/Content/Story/Missions/DIA_MIN_300_Sylvester.d:100","Der einzige Ort, wo ich meine Silber verdienen kann ist die Mine im Norden.","L'unico posto dove posso guadagnare l'argento è la miniera a nord.","","True","Info_Sylvester_PICK_03_04","",""
"Scripts/Content/Story/Missions/DIA_MIN_300_Sylvester.d:101","Aber meine Kumpels haben den Eingang verrammelt, wegen der Orks die sich da rumtreiben.","Ma i miei amici hanno bloccato l'entrata a causa degli orchi che si muovono lì intorno.","","True","Info_Sylvester_PICK_03_05","",""
"Scripts/Content/Story/Missions/DIA_MIN_300_Sylvester.d:102","Jetzt sitze ich hier und kann zusehen, wo ich mein Mittagessen herbekomme.","Ora sto seduto qui a guardare come posso recuperare il mio pranzo.","","True","Info_Sylvester_PICK_03_06","",""
"Scripts/Content/Story/Missions/DIA_MIN_300_Sylvester.d:105","Ich kenne einen anderen Ort, an dem du Erz finden kannst.","Conosco un altro posto dove puoi trovare il metallo.","","True","Info_Sylvester_PICK_Info.Info_Sylvester_PICK.Info_Sylvester_PICKCAVE","AI_AddChoice",""
"Scripts/Content/Story/Missions/DIA_MIN_300_Sylvester.d:106","Dann könntest du mir ja deine Spitzhacke überlassen.","Allora puoi lasciarmi il tuo piccone.","","True","Info_Sylvester_PICK_Info.Info_Sylvester_PICK.Info_Sylvester_PICKGIVE","AI_AddChoice",""
"Scripts/Content/Story/Missions/DIA_MIN_300_Sylvester.d:111","Dann könntest du mir ja deine Spitzhacke überlassen.","Allora puoi lasciarmi il tuo piccone.","","True","Info_Sylvester_PICKGIVE_15_01","",""
"Scripts/Content/Story/Missions/DIA_MIN_300_Sylvester.d:112","Ich bin zwar ohne Arbeit aber nicht ohne Verstand.","Non ho un lavoro, ma non sono senza la testa.","","True","Info_Sylvester_PICKGIVE_03_02","",""
"Scripts/Content/Story/Missions/DIA_MIN_300_Sylvester.d:113","Wenn du meine Spitzhacke haben willst, will ich Silber sehen!","Se vuoi il mio piccone, voglio vedere l'argento!","","True","Info_Sylvester_PICKGIVE_03_03","",""
"Scripts/Content/Story/Missions/DIA_MIN_300_Sylvester.d:122","Ich kenne einen anderen Ort, an dem du Erz finden kannst.","Conosco un altro posto dove puoi trovare il metallo.","","True","Info_Sylvester_PICKCAVE_15_01","",""
"Scripts/Content/Story/Missions/DIA_MIN_300_Sylvester.d:123","Was sagst du da? Eine neue Erzader? Wo kann ich sie finden?","Cosa dici? Una nuova vena minerale? Dove posso trovarla?","","True","Info_Sylvester_PICKCAVE_03_02","",""
"Scripts/Content/Story/Missions/DIA_MIN_300_Sylvester.d:126","Das kostet dich aber 'ne Kleinigkeit","Ti costerà un po'","","True","Info_Sylvester_PICKCAVE.Info_Sylvester_PICK.Info_Sylvester_PICKCOST","AI_AddChoice",""
"Scripts/Content/Story/Missions/DIA_MIN_300_Sylvester.d:127","Komm mit, ich führe dich hin.","Vieni con me, ti guiderò.","","True","Info_Sylvester_PICKCAVE.Info_Sylvester_PICK.Info_Sylvester_PICKCOME","AI_AddChoice",""
"Scripts/Content/Story/Missions/DIA_MIN_300_Sylvester.d:132","Komm mit, ich führe dich hin.","Vieni con me, ti guiderò.","","True","Info_Sylvester_PICKCOME_15_01","",""
"Scripts/Content/Story/Missions/DIA_MIN_300_Sylvester.d:133","Du bist echt in Ordnung. Nichts wie los!","Sei davvero bravo. Non c'è problema!","","True","Info_Sylvester_PICKCOME_03_02","",""
"Scripts/Content/Story/Missions/DIA_MIN_300_Sylvester.d:143","Das kostet dich aber 'ne Kleinigkeit","Ti costerà un po'","","True","Info_Sylvester_PICKCOST_15_01","",""
"Scripts/Content/Story/Missions/DIA_MIN_300_Sylvester.d:144","Du bist ein echt eigennütziger Kerl.","Sei davvero un tipo egoista.","","True","Info_Sylvester_PICKCOST_03_02","",""
"Scripts/Content/Story/Missions/DIA_MIN_300_Sylvester.d:145","Aber ich habe keine Wahl.","Ma non ho scelta.","","True","Info_Sylvester_PICKCOST_03_03","",""
"Scripts/Content/Story/Missions/DIA_MIN_300_Sylvester.d:146","Wenn ich nicht bald eine neue Erzader finde, kann ich mich zu dem bettelnden Lumpenpack gesellen.","Se non trovo presto una nuova vena di metallo, posso unirmi a quel bastardo che mi mendica.","","True","Info_Sylvester_PICKCOST_03_04","",""
"Scripts/Content/Story/Missions/DIA_MIN_300_Sylvester.d:147","Tja, jeder ist sich selbst der nächste!","Beh, ognuno è il prossimo a farlo!","","True","Info_Sylvester_PICKCOST_15_05","",""
"Scripts/Content/Story/Missions/DIA_MIN_300_Sylvester.d:148","OK. wenn du mir die Erzader zeigst, geb ich dir meine Spitzhacke.","D'accordo. Se mi mostri le vene di metallo, ti darò il mio piccone.","","True","Info_Sylvester_PICKCOST_03_06","",""
"Scripts/Content/Story/Missions/DIA_MIN_300_Sylvester.d:149","Hab' noch eine Reservehacke im Rucksack.","Ho ancora un'altra scaglia di riserva nella mia borsa.","","True","Info_Sylvester_PICKCOST_03_07","",""
"Scripts/Content/Story/Missions/DIA_MIN_300_Sylvester.d:152","Also wenn du keine Wahl hast, kannst du auch noch was drauflegen!","Quindi, se non hai scelta, puoi anche aggiungerle qualcosa!","","True","Info_Sylvester_PICKCOST.Info_Sylvester_PICK.Info_Sylvester_PICKCOSTNO","AI_AddChoice",""
"Scripts/Content/Story/Missions/DIA_MIN_300_Sylvester.d:153","Die Spitzhacke ist OK.","Il piccone è a posto.","","True","Info_Sylvester_PICKCOST.Info_Sylvester_PICK.Info_Sylvester_PICKCOSTYES","AI_AddChoice",""
"Scripts/Content/Story/Missions/DIA_MIN_300_Sylvester.d:158","Die Spitzhacke ist OK.","Il piccone è a posto.","","True","Info_Sylvester_PICKCOSTYES_15_01","",""
"Scripts/Content/Story/Missions/DIA_MIN_300_Sylvester.d:159","Hier, und nun zeig mir den Weg zur Ader.","Ecco, e ora mostrami la via per la vena.","","True","Info_Sylvester_PICKCOSTYES_03_02","",""
"Scripts/Content/Story/Missions/DIA_MIN_300_Sylvester.d:168","Also wenn du keine Wahl hast, kannst du auch noch was drauflegen!","Quindi, se non hai scelta, puoi anche aggiungerle qualcosa!","","True","Info_Sylvester_PICKCOSTNO_15_01","",""
"Scripts/Content/Story/Missions/DIA_MIN_300_Sylvester.d:173","Ich seh schon, du bist auch nicht besser als die anderen Halsabschneider hier.","Vedo che non sei meglio degli altri tagliagole qui.","","True","Info_Sylvester_PICKCOSTNO_03_02","",""
"Scripts/Content/Story/Missions/DIA_MIN_300_Sylvester.d:174","OK, OK, ich kann dir noch das bischen Silber dazugeben, dass ich habe.","D'accordo, d'accordo, posso darti anche quel pezzo d'argento che ho.","","True","Info_Sylvester_PICKCOSTNO_03_03","",""
"Scripts/Content/Story/Missions/DIA_MIN_300_Sylvester.d:187","Vergiss es. Ich bin nicht interessiert!","Scordatelo. Non mi interessa!","","True","Info_Sylvester_PICKCOSTNO.Info_Sylvester_PICK.Info_Sylvester_PICKCOSTNONO","AI_AddChoice",""
"Scripts/Content/Story/Missions/DIA_MIN_300_Sylvester.d:188","Die Spitzhacke ist OK. Ich führ dich zur Ader.","Il piccone è a posto. Ti porterò alla vena.","","True","Info_Sylvester_PICKCOSTNO.Info_Sylvester_PICK.Info_Sylvester_PICKCOSTYES","AI_AddChoice",""
"Scripts/Content/Story/Missions/DIA_MIN_300_Sylvester.d:179","OK, das Geschäft gilt!","D'accordo, il patto è valido!","","True","Info_Sylvester_PICKCOSTNO.Info_Sylvester_PICK.Info_Sylvester_PICKCOSTNOSILVER","AI_AddChoice",""
"Scripts/Content/Story/Missions/DIA_MIN_300_Sylvester.d:183","Ich besitzte sonst nichts von Wert.","Non ho altro valore.","","True","Info_Sylvester_PICKCOSTNO_03_04","",""
"Scripts/Content/Story/Missions/DIA_MIN_300_Sylvester.d:184","Zeigst du mir die Ader trotzdem?","Mi mostrerai comunque la vena?","","True","Info_Sylvester_PICKCOSTNO_03_05","",""
"Scripts/Content/Story/Missions/DIA_MIN_300_Sylvester.d:194","OK, das Geschäft gilt!","D'accordo, il patto è valido!","","True","Info_Sylvester_PICKCOSTNOSILVER_15_01","",""
"Scripts/Content/Story/Missions/DIA_MIN_300_Sylvester.d:195","Du bist ein übler Gauner! Ich sollte die anderen Leute hier vor dir warnen.","Sei un malvagio imbroglione! Dovrei avvertire gli altri di te.","","True","Info_Sylvester_PICKCOSTNOSILVER_03_02","",""
"Scripts/Content/Story/Missions/DIA_MIN_300_Sylvester.d:196","Hier ist meine Spitzhacke.","Ecco il mio piccone.","","True","Info_Sylvester_PICKCOSTNOSILVER_03_03","",""
"Scripts/Content/Story/Missions/DIA_MIN_300_Sylvester.d:198","Nun führe mich wie abgemacht zur Erzader, dort bekommst du dann das Silber.","Ora portami alla vena del metallo, come abbiamo convenuto. Lì avrai l'argento.","","True","Info_Sylvester_PICKCOSTNOSILVER_03_04","",""
"Scripts/Content/Story/Missions/DIA_MIN_300_Sylvester.d:209","Vergiss es. Ich bin nicht interessiert!","Scordatelo. Non mi interessa!","","True","Info_Sylvester_PICKCOSTNONO_15_01","",""
"Scripts/Content/Story/Missions/DIA_MIN_300_Sylvester.d:210","Immer diese Aufschneider. Wahrscheinlich gibt es die Ader überhaupt nicht.","Sempre quei briganti. Probabilmente non ci sono vene.","","True","Info_Sylvester_PICKCOSTNONO_03_02","",""
"Scripts/Content/Story/Missions/DIA_MIN_300_Sylvester.d:211","Ist wohl ohnehin besser, wenn ich meine Hacke behalte. Wer weiss wann die Orks sich von der Mine verziehen.","In ogni caso, sarà meglio se mi terrò la mia pelle. Chissà quando gli orchi se ne andranno dalla miniera.","","True","Info_Sylvester_PICKCOSTNONO_03_03","",""
"Scripts/Content/Story/Missions/DIA_MIN_300_Sylvester.d:243","OK, hier hast du die Hacke. Konnte die mühselige Schürferei eh nie leiden.","D'accordo, ecco il tuo grimaldello. Non sopporto la fatica della miniera.","","True","Info_Sylvester_BUYPICK_03_01","",""
"Scripts/Content/Story/Missions/DIA_MIN_300_Sylvester.d:251","Verarsch mich nicht! Besorg erst das Silber, dann kannst du auch die Hacke haben.","Non prendermi in giro! Prima porta l'argento e poi ti darò anche il grimaldello.","","True","Info_Sylvester_BUYPICK_03_02","",""
"Scripts/Content/Story/Missions/DIA_MIN_300_Sylvester.d:281","Unglaublich, hier gibt es tatsächlich Erz.","Non posso credere, qui c'è metallo.","","True","Info_Sylvester_CAVE_03_01","",""
"Scripts/Content/Story/Missions/DIA_MIN_300_Sylvester.d:285","Danke nochmal. Leute wie dich gibt es hier sehr wenige.","Grazie ancora. La gente come te è molto piccola qui.","","True","Info_Sylvester_CAVE_03_02","",""
"Scripts/Content/Story/Missions/DIA_MIN_300_Sylvester.d:286","Wenn du etwas Erz brauchst, komm vorbei. Ich kann bestimmt mal ein paar Brocken abzweigen.","Se ti serve del metallo, passa. Sono sicuro che posso allontanarmi un paio di pezzi.","","True","Info_Sylvester_CAVE_03_03","",""
"Scripts/Content/Story/Missions/DIA_MIN_300_Sylvester.d:298","Hier ist das Silber! Hoffentlich erstickst du daran, du Erpresser!","Ecco l'argento! Spero che tu lo stifo, ricattatore!","","True","Info_Sylvester_CAVE_03_04","",""
"Scripts/Content/Story/Missions/DIA_MIN_300_Sylvester.d:307","Dann werde ich mich mal gleich an die Arbeit machen.","Allora devo iniziare subito il lavoro.","","True","Info_Sylvester_CAVE_03_05","",""
"Scripts/Content/Story/Missions/DIA_MIN_300_Sylvester.d:311","Es ist schon spät. Ich werde mich noch etwas ausruhen und mich morgen früh dann an die Arbeit machen.","È già tardi. Devo riposarmi un po' e domani mattina mi metto al lavoro.","","True","Info_Sylvester_CAVE_03_06","",""
"Scripts/Content/Story/Missions/DIA_MIN_300_Sylvester.d:328","Hast du etwas Erz übrig?","Hai del metallo?","","True","Info_Sylvester_GIVEORE.description","",""
"Scripts/Content/Story/Missions/DIA_MIN_300_Sylvester.d:344","Hast du etwas Erz übrig?","Hai del metallo?","","True","Info_Sylvester_GIVEORE_15_01","",""
"Scripts/Content/Story/Missions/DIA_MIN_300_Sylvester.d:348","Klar. Kannst ein paar Brocken haben, hier!","Certo. Tieni, prendi un paio di pezzi!","","True","Info_Sylvester_GIVEORE_03_02","",""
"Scripts/Content/Story/Missions/DIA_MIN_300_Sylvester.d:355","Kann heute leider nichts mehr entbehren, aber vielleicht morgen wieder!","Sfortunatamente, non posso restare nulla oggi, ma forse domani!","","True","Info_Sylvester_GIVEORE_03_03","",""
"Scripts/Content/Story/Missions/DIA_MIN_300_Sylvester.d:368","Hast du eine Spitzhacke für mich?","Hai un piccone per me?","","True","Info_Sylvester_BUYPICKFRIEND.description","",""
"Scripts/Content/Story/Missions/DIA_MIN_300_Sylvester.d:384","Hast du eine Spitzhacke für mich?","Hai un piccone per me?","","True","Info_Sylvester_BUYPICKFRIEND_15_01","",""
"Scripts/Content/Story/Missions/DIA_MIN_300_Sylvester.d:388","Ich hab noch eine Reservehacke, die kannst du haben. Hier nimm!","Ho un altro pezzo di riserva, puoi prenderlo. Ecco!","","True","Info_Sylvester_BUYPICKFRIEND_03_02","",""
"Scripts/Content/Story/Missions/DIA_MIN_300_Sylvester.d:394","Ich habe nur noch diese eine Hacke. Tut mir leid!","Ho solo una di queste. Mi dispiace!","","True","Info_Sylvester_BUYPICKFRIEND_03_03","",""
"Scripts/Content/Story/Missions/DIA_MIN_300_Sylvester.d:407","Ich bin auf der Suche nach Bluterz!","Sto cercando la sanguisante!","","True","MIN_300_Sylvester_BLOODORE.description","",""
"Scripts/Content/Story/Missions/DIA_MIN_300_Sylvester.d:422","Ich bin auf der Suche nach Bluterz!","Sto cercando la sanguisante!","","True","MIL_101_BLOODORE_15_01","",""
"Scripts/Content/Story/Missions/DIA_MIN_300_Sylvester.d:423","In der Mine gibt es eine Bluterzader. Allerdings ist dieses besondere Erz sehr selten. Warum willst du das wissen?","C'è una vena sanguigna nella miniera. Tuttavia, questo particolare metallo è molto raro. Perché vuoi saperlo?","","True","MIL_101_BLOODORE_03_02","",""
"Scripts/Content/Story/Missions/DIA_MIN_300_Sylvester.d:424","Ich brauche Bluterz, um einen Runenstein zu gießen.","Ho bisogno di sangue per versare una pietra runica.","","True","MIL_101_BLOODORE_15_03","",""
"Scripts/Content/Story/Missions/DIA_MIN_300_Sylvester.d:425","Damit kenne ich mich nicht aus, aber ich besitze noch ein paar Brocken.","Non so niente di questo, ma ne ho ancora un paio.","","True","MIL_101_BLOODORE_03_04","",""
"Scripts/Content/Story/Missions/DIA_MIN_300_Sylvester.d:426","Ich schlage dir ein Geschäft vor.","Ti faccio un affare.","","True","MIL_101_BLOODORE_03_05","",""
"Scripts/Content/Story/Missions/DIA_MIN_300_Sylvester.d:427","Was für ein Geschäft?","Che tipo di affari?","","True","MIL_101_BLOODORE_15_06","",""
"Scripts/Content/Story/Missions/DIA_MIN_300_Sylvester.d:428","Ich brauche eine bessere Waffe, eines dieser handlichen Kurzschwerter!","Ho bisogno di un'arma migliore, una di quelle poche spade corte!","","True","MIL_101_BLOODORE_03_07","",""
"Scripts/Content/Story/Missions/DIA_MIN_300_Sylvester.d:429","Aber Gotmar verkauft seine Waffen nur an die Miliz.","Ma Gotmar vende le sue armi solo alla guardia cittadina.","","True","MIL_101_BLOODORE_03_08","",""
"Scripts/Content/Story/Missions/DIA_MIN_300_Sylvester.d:430","Wenn du mir ein Kurzschwert besorgst, bekommst du mein Bluterz.","Se mi porti una spada corta, avrai la mia sanguisonia.","","True","MIL_101_BLOODORE_03_09","",""
"Scripts/Content/Story/Missions/DIA_MIN_300_Sylvester.d:432","Vergiss es!","Scordatelo!","","True","MIN_300_Sylvester_BLOODORE_Info.MIN_300_Sylvester_BLOODORE.MIN_300_Sylvester_BLOODORE_NO","AI_AddChoice",""
"Scripts/Content/Story/Missions/DIA_MIN_300_Sylvester.d:433","Ich schau mal, ob ich ein Kurzschwert bekomme","Vedrò se posso avere una spada corta.","","True","MIN_300_Sylvester_BLOODORE_Info.MIN_300_Sylvester_BLOODORE.MIN_300_Sylvester_BLOODORE_YES","AI_AddChoice",""
"Scripts/Content/Story/Missions/DIA_MIN_300_Sylvester.d:434","Ich überlege es mir","Ci penserò.","","True","MIN_300_Sylvester_BLOODORE_Info.MIN_300_Sylvester_BLOODORE.MIN_300_Sylvester_BLOODORE_MAYBE","AI_AddChoice",""
"Scripts/Content/Story/Missions/DIA_MIN_300_Sylvester.d:439","Ich überlege es mir.","Ci penserò.","","True","MIL_101_BLOODORE_MAYBE_15_01","",""
"Scripts/Content/Story/Missions/DIA_MIN_300_Sylvester.d:440","Wenn du ein Kurzschwert hast, tausche ich es gegen mein Bluterz.","Se hai una spada corta, la cambio per la mia sanguisatura.","","True","MIL_101_BLOODORE_MAYBE_03_02","",""
"Scripts/Content/Story/Missions/DIA_MIN_300_Sylvester.d:451","Ich schau mal, ob ich ein Kurzschwert bekomme","Vedrò se posso avere una spada corta.","","True","MIL_101_BLOODORE_YES_15_01","",""
"Scripts/Content/Story/Missions/DIA_MIN_300_Sylvester.d:452","Gut, wenn du eins hast, bekommst du mein Bluterz.","Bene, se ne hai una, ti darò la mia emorragia.","","True","MIL_101_BLOODORE_YES_03_02","",""
"Scripts/Content/Story/Missions/DIA_MIN_300_Sylvester.d:463","Vergiss es!","Scordatelo!","","True","MIL_101_BLOODORE_NO_15_01","",""
"Scripts/Content/Story/Missions/DIA_MIN_300_Sylvester.d:464","Dann gibt's auch kein Bluterz!","Allora non c'è sangue!","","True","MIL_101_BLOODORE_NO_03_02","",""
"Scripts/Content/Story/Missions/DIA_MIN_300_Sylvester.d:480","Ich habe ein Kurzschwert für dich","Ho una spada corta per te.","","True","MIL_101_Sylvester_Sword.description","",""
"Scripts/Content/Story/Missions/DIA_MIN_300_Sylvester.d:496","Ich habe ein Kurzschwert für dich.","Ho una spada corta per te.","","True","MIL_101_SWORD_15_01","",""
"Scripts/Content/Story/Missions/DIA_MIN_300_Sylvester.d:507","Ausgezeichnet. Hier, nimm mein Bluterz. Wenn du noch mehr brauchst, dann sprich mal mit Wylfern.","Eccellente. Ecco, prendi la mia grimaldella. Se ti serve qualcos'altro, vai a parlare con le lucertola.","","True","MIL_101_SWORD_03_02","",""
"Scripts/Content/Story/Missions/DIA_MIN_300_Sylvester.d:508","Er ist Rekrut bei der Miliz und war vorher auch in der Mine.","È un recluta della guardia cittadina e era già stato nella miniera.","","True","MIL_101_SWORD_03_03","",""
"Scripts/Content/Story/Missions/DIA_MIN_306_Grim.d:70","Hey, du hast dir meine Spitzhacke gekrallt!","Ehi, hai preso il mio piccone!","","True","MIN_306_Grim_MYWEAPON_Info_10_01","",""
"Scripts/Content/Story/Missions/DIA_MIN_306_Grim.d:73","Du hast sie fallen gelassen, jetzt gehört sie mir!","L'hai lasciata cadere, ora è mia!","","True","MIN_306_Grim_MYWEAPON_Info.MIN_306_Grim_MYWEAPON.MIN_306_Grim_MYWEAPON_TAKEN","AI_AddChoice",""
"Scripts/Content/Story/Missions/DIA_MIN_306_Grim.d:74","Hier hast du sie zurück.","Ecco, riportatela.","","True","MIN_306_Grim_MYWEAPON_Info.MIN_306_Grim_MYWEAPON.MIN_306_Grim_MYWEAPON_GIVEBACK","AI_AddChoice",""
"Scripts/Content/Story/Missions/DIA_MIN_306_Grim.d:80","Hier hast du sie zurück.","Ecco, riportatela.","","True","MIN_306_Grim_MYWEAPON_GIVEBACK_15_01","",""
"Scripts/Content/Story/Missions/DIA_MIN_306_Grim.d:82","(säuerlich) Dann kann es ja weitergehen!","(agitato) Allora possiamo andare avanti!","","True","MIN_306_Grim_MYWEAPON_GIVEBACK_10_02","",""
"Scripts/Content/Story/Missions/DIA_MIN_306_Grim.d:90","Du hast sie fallen gelassen, jetzt gehört sie mir!","L'hai lasciata cadere, ora è mia!","","True","MIN_306_Grim_MYWEAPON_TAKEN_15_01","",""
"Scripts/Content/Story/Missions/DIA_MIN_306_Grim.d:91","Du kennst wohl Regel Nummer 3 nicht!","Non conosci la regola n. 3!","","True","MIN_306_Grim_MYWEAPON_TAKEN_10_02","",""
"Scripts/Content/Story/Missions/DIA_MIN_306_Grim.d:128","Wir sehen uns heute abend in der Arena!","Ci vediamo stanotte all'arena!","","True","Info_Grim_CHALLENGED_10_01","",""
"Scripts/Content/Story/Missions/DIA_MIN_306_Grim.d:132","Ich versuche mich auf den Kampf zu konzentrieren! Geh rüber in deinen Raum!","Sto cercando di concentrarmi sul combattimento! Vai nella tua stanza!","","True","Info_Grim_CHALLENGED_10_02","",""
"Scripts/Content/Story/Missions/DIA_MIN_306_Grim.d:141","Jetzt ist nicht die Zeit zum Reden!","Non è il momento giusto per parlare!","","True","Info_Grim_CHALLENGED_10_03","",""
"Scripts/Content/Story/Missions/DIA_MIN_306_Grim.d:147","Wir sehen uns morgen Abend in der Arena!","Ci vediamo all'arena domani sera!","","True","Info_Grim_CHALLENGED_10_04","",""
"Scripts/Content/Story/Missions/DIA_MIN_306_Grim.d:181","Stör mich jetzt nicht, ich muß mich auf den Kampf vorbereiten!","Non disturbarmi, devo prepararmi al combattimento!","","True","Info_Grim_PRENPC_10_01","",""
"Scripts/Content/Story/Missions/DIA_MIN_306_Grim.d:194","Dein Name kommt mir bekannt vor!","Il tuo nome mi sembra familiare!","","True","Info_Grim_KNOWYOU.description","",""
"Scripts/Content/Story/Missions/DIA_MIN_306_Grim.d:204","Dein Name kommt mir bekannt vor!","Il tuo nome mi sembra familiare!","","True","Info_Grim_KNOWYOU_15_01","",""
"Scripts/Content/Story/Missions/DIA_MIN_306_Grim.d:205","Na und? Ist ja auch kein seltener Name!","E allora? Non è un nome raro!","","True","Info_Grim_KNOWYOU_10_02","",""
"Scripts/Content/Story/Missions/DIA_MIN_306_Grim.d:217","Kämpfst du in der Arena?","Combatti nell'arena?","","True","Info_Grim_ARENA.description","",""
"Scripts/Content/Story/Missions/DIA_MIN_306_Grim.d:227","Kämpfst du in der Arena?","Combatti nell'arena?","","True","Info_Grim_ARENA_15_01","",""
"Scripts/Content/Story/Missions/DIA_MIN_306_Grim.d:228","Du bist neu hier, richtig?","Sei nuovo, vero?","","True","Info_Grim_ARENA_10_02","",""
"Scripts/Content/Story/Missions/DIA_MIN_306_Grim.d:231","Nicht wirklich!","Non proprio!","","True","Info_Grim_ARENA_Info.Info_Grim_ARENA.Info_Grim_ARENA_NO","AI_AddChoice",""
"Scripts/Content/Story/Missions/DIA_MIN_306_Grim.d:232","Sozusagen! Bin erst vor kurzem angekommen.","Per così dire! Sono appena arrivato.","","True","Info_Grim_ARENA_Info.Info_Grim_ARENA.Info_Grim_ARENA_YES","AI_AddChoice",""
"Scripts/Content/Story/Missions/DIA_MIN_306_Grim.d:239","Sozusagen! Bin erst vor kurzem angekommen.","Per così dire! Sono appena arrivato.","","True","Info_Grim_ARENA_YES_15_01","",""
"Scripts/Content/Story/Missions/DIA_MIN_306_Grim.d:250","Du bist nicht gerade gut in Form. Könntest ein bischen Training gebrauchen!","Non sei in forma. Ti servirebbe un po' di addestramento!","","True","OUMULTI_Training_10_00","",""
"Scripts/Content/Story/Missions/DIA_MIN_306_Grim.d:251","Wie wär's mit einem Freundschaftskämpfchen in der Arena!?","Che ne dici di un incontro d'amicizia in arena?","","True","OUMULTI_Freundschaftskampf_10_00","",""
"Scripts/Content/Story/Missions/DIA_MIN_306_Grim.d:248","Nicht wirklich!","Non proprio!","","True","Info_Grim_ARENA_NO_15_01","",""
"Scripts/Content/Story/Missions/DIA_MIN_306_Grim.d:249","(misstrauisch) Hab dich noch nie hier gesehen!","(sospettoso) Non ti ho mai visto qui!","","True","Info_Grim_ARENA_NO_10_02","",""
"Scripts/Content/Story/Missions/DIA_MIN_306_Grim.d:263","Na dann zeig mal was du drauf hast!","Allora fammi vedere come ti sei fatto!","","True","MIN_306_Grim_FRIENDFIGHT.description","",""
"Scripts/Content/Story/Missions/DIA_MIN_306_Grim.d:278","Na dann zeig mal was du drauf hast!","Allora fammi vedere come ti sei fatto!","","True","MIN_306_FRIENDFIGHT_15_01","",""
"Scripts/Content/Story/Missions/DIA_MIN_306_Grim.d:279","Moment, nicht so schnell!","Aspetta un attimo, non così in fretta!","","True","MIN_306_FRIENDFIGHT_10_02","",""
"Scripts/Content/Story/Missions/DIA_MIN_306_Grim.d:280","Hol dir erst vom Arenameister die Erlaubnis für einen Kampf. Du findest ihn oben am Arenaplatz.","Prima di chiedere il permesso per un combattimento al maestro dell'arena. Lo troverai lassù, nella piazza dell'arena.","","True","MIN_306_FRIENDFIGHT_10_03","",""
"Scripts/Content/Story/Missions/DIA_MIN_306_Grim.d:294","Ich will in der Arena gegen dich kämpfen!","Voglio combattere contro di te in arena!","","True","Info_Grim_CHALLENGE.description","",""
"Scripts/Content/Story/Missions/DIA_MIN_306_Grim.d:316","Ich will in der Arena gegen dich kämpfen!","Voglio combattere contro di te in arena!","","True","Info_Grim_CHALLENGE_15_01","",""
"Scripts/Content/Story/Missions/DIA_MIN_306_Grim.d:320","Ohne meine Spitzhacke trete ich nicht an.","Non posso entrare senza il mio piccone.","","True","Info_Grim_CHALLENGE_10_02","",""
"Scripts/Content/Story/Missions/DIA_MIN_306_Grim.d:325","Ich habe deine Waffe... ähem... gefunden! Hier!","Ho trovato la tua arma... ehm... Ecco!","","True","Info_Grim_CHALLENGE_Info.Info_Grim_CHALLENGE.Info_Grim_CHALLENGE_FOUND","AI_AddChoice",""
"Scripts/Content/Story/Missions/DIA_MIN_306_Grim.d:333","Der Arenameister ist stinksauer auf dich! Du musst ihn erst wieder besänftigen!","Il padrone dell'arena è molto arrabbiato con te! Prima devi calmarlo!","","True","Info_Grim_CHALLENGE_10_03","",""
"Scripts/Content/Story/Missions/DIA_MIN_306_Grim.d:339","Seeehr gut!","Merce bene!","","True","Info_Grim_CHALLENGE_10_04","",""
